contextID,citationID,CLEAN_CITATION_CONTEXT,UTILIZE_LABELS,USAGE_LABELS
201663791,239189708,"n this paper, an efficient computational scheme to compute the real (unstructured) stability radius of non-monic polynomial matrices has been presented. we adapted the numerical algorithm proposed in to deal with generalized state-space realizations. this enables us to consider both non-monic polynomials and polynomial matrices. the proposed approach can be extended immediately to deal with struc",UTILIZE,USE
202071715,239777632,"described in section 2. if the computational cell is contained completely inside one of the hyperbolic regions w a or w 3, we use characteristic decompositions (the eno-lf algorithm described in , 13 ). otherwise the component by component approximation described in section 2 is used. the splitting used is (2.3)-(2.5) with a 2.2. the time step at is restricted by a cfl number 0.6, i.e. at",UTILIZE,USE
37775091,36514875,"ng many proposed, or because he will have to browse through a deeper hierarchy. the method we have implemented is a variant of the ioi navigation algorithm proposed by uwe g hl 1 and thomas wolters for the design of natural language based interfaces and accelerated help systems. 2.2 the ioi algorithm first, we need our classi cation tree to be very deep and a branch factor as reduced as possibl",UTILIZE,USE
38463903,37101523,"pter 3, we discussed various extensions to the sb procedure to deal with practical job shops. this extended sb procedure is part of the commercial shop floor control system j p . heerma and lok use figure 7.1 to position j p in its environment. the production planning system, which is often an mrp ii system, informs j p which jobs need to be scheduled. the engineering database",NOTUTILIZE,MENTION
217805,231235,"uters (133,000 equations in 40,000 unknowns), so we will use an iterative method instead. the conjugate gradient method is a natural choice; our implementation combines svl and the algorithm package ( ), an independent library which expresses iterative algorithms. 34sproblem setup - data structures the first task in any such project is to define the key data structures, as datacontainer subclasses.",UTILIZE,USE
48911978,48764481,"ature selection. we base our approach on recent advancements in software-language engineering. as a technological basis, we integrate and extend a number of existing languages and tools including sdf and stratego 12 for language specification, spoofax for generating language tools 26 , and featurehouse for composing language features (i.e., the corresponding documents and specifications) 4 .",UTILIZE,EXTEND
49042820,48886378,"when a sequence type (st) could not be inferred from the spa type in the spa server (http: spaserver. ridom.de ) or from the literature. the genetic background of the isolates was determined by mlst . sts were attributed by submitting the dna sequences obtained to the online mlst database (http: www.mlst.net ). the goeburst algorithm was used to assign mlst clonal complexes, cc (http: goeburst.",NOTUTILIZE,NOTALGO
