contextID,citationID,CLEAN_CITATION_CONTEXT,UTILIZE_LABELS,USAGE_LABELS
12063882,12916305,"inserting c statements into production rules. another example is rete , a forward and backward chaining inference engine based on the famous rete pattern-matching algorithm for production systems ( ), developed as a fully encapsulated extension to c (haley enterprise, 1996). cafe rete, from the same manufacturer, is a java class library that seamlessly integrates a rules engine within java app",NOTUTILIZE,MENTION
61469089,60779665,"21, 65 and are directly related to the algorithms presented in this paper, whereas the second category contains algorithms that find subgraphs that occur frequently across a database of small graphs . between these two classes of algorithms, those developed for the latter problem are in general more mature as they have moderate computational requirements and scale to large datasets. in the rest o",NOTUTILIZE,MENTION
60233433,59629951,"ear systems having a backward pentadiagonal coefficient matrices. this kind of linear system arise in many fields of numerical computation 1, 2 . this article is a general case of the author article . the main goal of the current paper is to develop an efficient algorithms for solving a general backward pentadiagonal linear systems of the form: ax y (1.1) where a 0 0 0 1 a1 d1",NOTUTILIZE,MENTION
41816165,40211753,"e want to check is obtained from the elementary formula (equality of two algebraic terms) by using quantifiers that run over all real numbers. there exists an algorithm (proposed originally by tarski ) that checks, for each such formula, whether it is true or not (see also 29 and 2 ). thus, by applying tarski s algorithm to the resulting formula, we will be able to check whether the formulas f",NOTUTILIZE,MENTION
4932789,5099016,"f parallelism, without 18 or with 17 constraints. up to our knowledge, only one attempt has been made in order to exploit explicit data-(and-)parallelism in logic programming : our dp-log project . most of the works in parallel constraint satisfaction consist in parallelizing a specific algorithm, like backtracking search 21 , grobner basis computation 4 or arc-consistency 15 . only recent",NOTUTILIZE,MENTION
7234641,7570110,"type unification the key for type synthesis is unification. we give here a unification algorithm for the label-selective monotypes defined above. it can be expressed as a simple e-unification problem , where the equational theory is that deciding equality of record types. then, our type substitution operation using record-type concatenation constitutes a complete set of reduction for this theory.",NOTUTILIZE,NOTALGO
86389764,83189874,"like our two-view transductive svm is a better way to tackle the problem. 3 two-view transductive svm. 3.1 motivation. we extend the two-view supervised learning algorithm proposed by farquhar et al. by incorporating unlabeled data, making it a two-view semisupervised learning approach. the basic idea is to construct two transductive svm classifiers from both labeled and unlabeled data based on d",UTILIZE,EXTEND
116028742,105783313,"id based schemes 9, 10, 6, 13, 24 . the scheme that we introduced in the previous section can also be extended for id based threshold ring signatures. however, this extension was already done by wei . the construction of the signature provided by wei is based on boneh et al s 6 bilinear signature, and itsts the so called spontaneous anonymous groups. these groups 29 are ad-hoc groups without se",NOTUTILIZE,MENTION
31554455,32141098,"use an automated payloadbased classification to determine the true classes. the payloadbased classification algorithm and signatures we used is very similar to those described by karagiannis et al. . we augmented their signatures to classify some newer p2p applications and instant messaging programs. the traffic classes considered for the calgary trace are http, p2p, smtp, and pop3. the applicat",UTILIZE,EXTEND
85301303,82285266,"lem, topological order 1 introduction the covering problems appear in many fields starting from mathematical problems up to practical problems of cutting-covering 4 , problems of pattern recognition , or problems of communications 9 . on the other hand, the topological sort of a set of elements is an often treated problem, details can be found in introductory algorithm literatures 2 3 . the p",NOTUTILIZE,MENTION
5081613,5255869,"thm is picking a partition function that minimizes the memory required by each node, but at the same time limits the number of messages required between the nodes. 3.1 improvements the algorithm from has been adapted to our system, at rst without any modi cation. after making the tool operational we worked on some extensions, mainly aiming to reduce the communication overhead. in ls99 a modi ca",UTILIZE,USE
57981328,57239988,"to move from a pseudo-basis to another.as for z-lattices, the choice of the pseudo-basis is of utmost importance. however, a key di erence is that no analogue of lll is known, as repeatedly noted in . there have been attempts 10, 22, 11 but the algorithms are either limited to certain elds or give no guaranteed bounds on the output size. while every ok-module is also a z-lattice and can thus be",NOTUTILIZE,NOTALGO
4981863,5148564,"the degree of the curve, and are thus, not practical for high degree curves. the subdivision based algorithms subdivide the domain up to a user-specified tolerance and evaluate the curves accordingly . some of the other approaches are based on lattice evaluation where the surface-surface intersection problem is simplified to a set of curve-surface intersection problems. the biggest drawback in thi",NOTUTILIZE,MENTION
16102500,17225366,"cting blocks of highly-optimized special-purpose code 8 . additionally, researchers have developed algorithms and data structures for computing approximate answers in small amounts of time and space . realistically, making query processing scale to line speed involves compromises. custom hardware is expensive; specialized code limits the flexibility of the query language; approximate query answ",NOTUTILIZE,MENTION
58354949,57609625,"teral filter as a weighted sum of gaussians in a high-dimension domain, and evaluating the resulting summation using the fgt. this algorithm has linear complexity in the image elements. fattal et al. provided an acceleration scheme for the application of the bilateral filter at multiple scales for detail enhancement purposes. this scheme reuses computations at the j-th scale level for computing t",NOTUTILIZE,MENTION
6518209,6804408,"that gives a positive answer. note that the determination of the dimension of each w can be done in pspace just combining the main idea of 14 section 6 with the parallel algorithms given in 16 or . for step (s5) one can apply the algorithms given in 16 or 24 . however, we remark here that a cylindrical algebraic decomposition together with the coding a la thom (see 7 for the algorithms,",NOTUTILIZE,MENTION
30760310,31466825,"on. in the present paper we do not discuss the computation of the steady-state probability vector (or any other probability vector). the interested reader is referred to de nitto person and grassi for an algorithm to compute the steady-state probabilities in non-homogeneous qbd processes with a finite state space. we construct a queueing system, which may be modelled as a markov process having",NOTUTILIZE,MENTION
1534877,1623236,"ocused on effectiveness and scalability. as reported in surveys on data clustering 11, 14 clustering methods can be classified into partitioning approaches 17, 21, 5, 22, 31 , hierarchical methods , density based algorithms 8, 2, 13 , probabilistic techniques 6 , graph theoretic 31 , fuzzy methods 4, 23 , grid-based algorithms 30, 25, 1 , and model based approaches 24, 18 . as pointed out",NOTUTILIZE,MENTION
5055977,5227526,"isors r 0 ). any relations are reported to a central processor which also discards duplicates. linear algebra. for c62, c93, and c124, we used our unoptimized implementation of wiedemann s algorithm as described in 23 to compute a vector in the kernel of the matrix modulo the large prime divisor r of the group order. for c155, it will be necessary to optimize our implementation and most likely",UTILIZE,USE
374060,400642,"rt by nist, advanced technology program grant number 70nanb5h11. 1 introduction most of the work that appears in the orthogonal graph drawing literature deals with graphs whose maximum degree is four . the drawings produced by these algorithms require at least two bends per edge. this is a big restriction since in most applications graphs generally have degree higher than four. orthogonal drawings",NOTUTILIZE,MENTION
9285673,9826217,"otherwise it is false. each node has a flag executionflag. its function is the same as the one of control flow edges. the full concurrent sparse conditional constant propagation algorithm is given in . figure 13(a) is the initial ccfg before cssa transformation. figure 13(b) is the one after cssa transformation. the result of the constant propagation is given in figure 13(c). in this figure, all t",NOTUTILIZE,MENTION
18370818,19560088,"cate memory space to guarantee message arrival, this is the case for aix 9 , it allocates space for user s data but not for controldata. also fast messages in its credit-based control flow algorithm preallocates space for both data and control-data for every other process in the system. portalsmpi 28 pre-allocates space for control-data, while data is dropped if no memory is available. we shoul",NOTUTILIZE,MENTION
7755333,8120917,2s2 and c 3 ; c 4 0 such that e(tn () i )sc 2 2 (c3 i p n lg 2 n) gamma(c 4n lg 2 n lg n) : proof. it is worth remembering that e(tn () i ) p p(n) l 1 l i p r( l ). the proof refines a claim in and follows from enumeration results in 13 . 2 now we can state and prove the main theorem concerning the algorithm above. theorem 2.3. there is an m 2 theta(n) such that if g n is given then the a,NOTUTILIZE,MENTION
32582732,32936206,"itrary reals. no superlogarithmic improvement over this simple algorithm is known. if the edge lengths are assumed to be integers, the fastest known algorithm to date is an o(m n log l) of goldberg , improving earlier algorithms of gabow 9 and gabow and tarjan 10 , where l is the absolute value of the smallest edge length (if l is assumed to be a constant and m is sufficiently large then ther",NOTUTILIZE,MENTION
10465754,11137360,"ich are not applicable to rsa keys. the nfs factoring algorithm using a combination of highly parallel electronics and an analog optical adder. recently, d. j. bernstein made an important observation about the major algorithmic steps in the nfs algorithm. these steps have a huge input, which is accessed over and over many times. thus, traditional pc-based implementations are very inefficient in t",NOTUTILIZE,MENTION
4685312,4840474,"t does, and how we use it. dsa: authentication digital signature algorithm (dsa) is part of the digital signature standard (dss), proposed by the national institute of standards and technology (nist) . nist has made the algorithm publicly available, royalty-free. it is a public-key signature and verification algorithm based on discrete logarithms. an important feature of this algorithm is that eac",NOTUTILIZE,MENTION
58119103,57365964,"he lu factorization of a matrix a has the form a p lu, where l is a unit lower triangular matrix, u is an upper triangular matrix and p is a permutation matrix. the block lu factorization algorithm proceeds in the following steps: initially, a set of nb columns (the panel) is factored and a pivoting pattern is produced. then the elementary transformations, resulting from the panel factorization",NOTUTILIZE,MENTION
84742370,81817743,"proof-of-concept of the main idea. we develop methods that could be seen as special cases of general algorithms that have appeared for this problem (tillman et al., 2008; triantafillou et al., 2010; ). the methods are able to predict the presence and strength of conditional and unconditional dependencies (correlations) between two variables y and z never jointly measured on the same samples, base",NOTUTILIZE,NOTALGO
57785238,57060884,"ptimum. recently, genetic algorithms (ga) are very much used to solve mop. many researchers have transformed the mop to a single objective problem using appropriate weights. then, ga was been applied . unfortunately, the obtained solution depends on the weight vector used in the process. also, this method requires a number of runs equal to the size of the desired pareto optimal solutions. moeas ar",NOTUTILIZE,MENTION
9980129,10593089,"to be absent, it assumes that the message contains value e. detecting presence and absence of messages correctly requires that the clocks of various nodes be synchronized. this issue was discussed in . we now present hbyz(1) and hbyz(t) (algorithm for m 0 is omitted here). in these algorithms, the following notation is used. in hbyz(1), n 1 is the number of nodes to which algorithm hbyz(1) is ap",NOTUTILIZE,MENTION
84650180,81745738,"this section describes how to utilize a cm to find homologous rna sequences in a genome database. aligning an rna sequence to a cm can be implemented as a three-dimensional cyk (cocke-younger-kasami) dynamic programming (dp) parsing algorithm. each state in the cm is represented as a two-dimensional matrix with rows 0 through l where l is the length of the genome database, and columns 0 through w",NOTUTILIZE,MENTION
15408021,16506252,"cdsa signature in 150 msec. on the other hand, scalar multiplication of a random point takes 480 msec and ecdsa verification 630 msec. the whole implementation occupied 4 kbyte of code data space. in , two new methods for implementing public-key cryptography algorithms on the 200 mhz ti tms320c6201 dsp are proposed. the first method is a modified implecryptography in embedded systems: an overview",NOTUTILIZE,MENTION
8692075,9162610,"documents, respectively. for indexing purposes, documents and queries have been stopped using the stop-list used in our trec-6 experiments. 1 single terms have been stemmed with the lovins algorithm . two-word phrases are indexed if they satisfy the following conditions: ffl individual words of the phrase occur at least 30 times in collection, and ffl the phrase occurs at least 10 times in collec",NOTUTILIZE,MENTION
26581091,27275965,"t non-contractible and non-separating cycles; their arguments are the foundation of all later improvements of their algorithm 8, 53, 9 . our proof is quite similar to the argument of chambers et al. that the shortest splitting cycle crosses any shortest path o(g b) times. however, our new proof is simpler, because the structure we seek is a true subgraph, which need not be connected, rather th",NOTUTILIZE,MENTION
1826162,1933572,"et drop strategies and corresponding udp-lite checksum coverage. the dropping strategies described above have been simulated in matlab. phonetically rich speech samples from the speechdat-at database , which has been collected at our institute, are coded using the etsi implementation of the amr codec 4 . voice data packetization is simulated according to the bandwidth efficient payload mode as de",NOTUTILIZE,NOTALGO
10724797,11423694,"trust network, or social network (figure 1), and a graph walking algorithm be used to predict the importance of a certain node of the network. this intuition is exploited, for example, by pagerank , one of the algorithm powering the search engine google.com. according to this analysis, the web is a network of content without a centralized quality control and pagerank tries to infer the authorit",NOTUTILIZE,MENTION
31128138,31796851,"se, although in practice we must consider a limited set of classes (denoted as ). using the reordering distance d (see figure 1) as defined by (koehn et al., 2005), we extend the two class model in ( ) to multiple classes (e.g. three",NOTUTILIZE,NOTALGO
171712246,152781683,ients were alive at 1 year in the arm that received the experimental therapy compared to 9 in the standard treatment arm. the planned total patient sample could not be reached due to low recruitment . 5. conclusion thyroid cancers are one of the greatest challenges for those treating advanced tumors. thyroid cancer offers extensive opportunities to work in interdisciplinary teams that include not,NOTUTILIZE,NOTALGO
13505817,14491866,"stance between the feature vectors and the prototypes. this minimization problem is actually a reformulation of the problem of determining fuzzy -partitions that was solved by fuzzy -means algorithms , 6 . pal et al. 20 suggested that lvq can be performed through an unsupervised learning process using a competitive neural network whose weight vectors represent the prototypes. according to their",NOTUTILIZE,MENTION
97571705,92092826,"s paper and is the subject of ongoing work 10 . our work affirms and extends basic insights of many pioneers in software engineering: the software families and abstract interface concepts of parnas , parametrized types of goguen 281, hierarchical system designs of habermann 34 , object-orientation of goldberg 28 , and the frameworks concept of deutsch 25 . acm transactions on software engmee",NOTUTILIZE,NOTALGO
169815484,151087648,"se, and thus were less likely to besfamiliar with the internet. these results are consistent with recent studies on trust in online sources of health information 15,s23 . in particular, hesse et al. showed that those who searched online the most tended to have higher incomes.sthis study showed that education level was not related to trustsin online health information. this is in agreement with y",NOTUTILIZE,NOTALGO
5208781,5391371,"a step is required) and the lack of negative evidence (e.g., the step appears in all examples of this recipe that have been seen so far). our machine learning algorithm 5 extends work done by bauer uer",UTILIZE,EXTEND
18358146,19547210,"ptiness of a type under can be reduced to checking the emptiness of the type under , and vice versa. therefore, whether r can be decided by employing the algorithm developed in ( ) that checks if r . the following corollary of the theorem allows us to reduce a type inclusion test under to a type inclusion test under . corollary 7.5 for any r1,r2 type,",NOTUTILIZE,MENTION
66433002,65199131,"wever, the equation do not take into account the size of the droplets. for the investigated small droplets, the weber number is much less than 1 and therefore the droplet deformation can be neglected . 43 numerical experiments to test the suitability of different inversion algorithms, we simulate light scattering of spherical water droplets with a well known refractive index (n 1.33) in the size",NOTUTILIZE,MENTION
77057432,75282751,"mployed to develop vast bodies of parallel algorithms for many real life applications such as fourier transform 18 , matrix decomposition 5 and ascend descend-type of divide-and-conquer algorithms . the pipeline and grid frameworks for developing algorithms, which will be presented in this section, are important for at least three reasons. first, they fill the gap in algorithm development for t",NOTUTILIZE,MENTION
17883730,19066426,"ation 27 tion to the block between the scheduling points expected to be executed the least frequently. the implementation of gvn and gcm in the safetsa compiler is based on the algorithms of click , which are broadly comparable to the techniques used in jikes rvm s bytecode compiler. global code motion starts with early scheduling, which determines, for each instruction, the first basic block",NOTUTILIZE,MENTION
45525013,44604068,"fail at random times; 2) the network protocol is randomized, i.e., the link states along time are controlled by a randomized protocol (e.g., standard gossip algorithm 11 , broadcast gossip algorithm ). in both cases, we model the links as bernoulli random variables. each link has some formation probability, i.e., probability of being active, equal to pij. different links may be correlated at the",NOTUTILIZE,MENTION
11838450,12667319,"the offspring is evaluated. then the new population is sorted using relation favour. 4. if no improvement is obtained for 50 generations the algorithm stops. for more details about the algorithm see . 6 experimental results all experiments in the following are carried out on a sun sparc 20 using the benchmark set from yan91 . first, the proposed model is compared to the weighted sum approach, be",NOTUTILIZE,MENTION
33233202,33415490,"behaviour could be reused by one or more use cases. the extending use case can access and modify the attributes of the base use case; however, the base use case is not aware of the extending use case . secondary use case fig 3. extend relationship in oo-method base use case the secondary use cases are potential candidates for reuse. however, we only will take into account the following situations:",NOTUTILIZE,NOTALGO
5860560,6070234,"improvement of the algorithm in terms of cpu time. reliability in computation performance, i.e. the performance of one processor does not affect the performance of the other processors. jog et al consider two basic categories of parallel genetic algorithms: 1. coarse-grained pgas, where subpopulations are allocated to each processor of the parallel machine. the selection and recombination ste",NOTUTILIZE,MENTION
203004282,241115225,"ls of data. however, they cannot recognize transitional activities. in this paper, we used an hmm to model the sequential constraints in human daily life and modified the short-time viterbi algorithm to decode detailed activities from only a single wearable inertial sensor. ii. hardware platform overview our proposed hardware system for human daily activity recognition is shown in figure 1. we us",UTILIZE,EXTEND
1549728,1638132,"gorithm on probability propagation network, which is a kind of factor graph 17 35 2 . the sum-product algorithm on probability propagation networks can be implemented using analog vlsi 67 26 . as a result, analog decoders have been built using bicmos 54 and recently by our research group using cmos 69 . in designing our cmos hamming decoder, the issue of how to simulate this analog cir",NOTUTILIZE,NOTALGO
2802297,2918702,"mpleteness results known. while ajtai s proof is a major step forward, the complexity of the shortest vector problem remains far from being well-understood. the best-known algorithms for this problem produce vectors whose length is only guaranteed to be within an exponentially large factor ibm almaden research center, 650 harry road, san jose, ca 95120, usa. email: ravi almaden.ibm.com y departme",NOTUTILIZE,MENTION
16421698,17557751,"problem 13 . some of these systems enjoy industrial success, but they are known to perform poorly when prior data is less than plentiful 14 , and they are extremely vulnerable even to mild attacks . canny 3 gives a distributed secure and private svd computation for the off-line single recommendation version of the problem. algorithmic results. theoretical studies of recommendation systems usu",NOTUTILIZE,NOTALGO
30768922,31475646,"these algorithms. we refer the reader to 5 for a comprehensive background on these methods and to 9, 10 for example of using sa in automatic differentiation elimination problems. as discussed in , a metropolis algorithm with the best temperature can outperform sa. the third heuristic hh that we used, described in algorithm 2, is a hybrid of metropolis and a regular random walk. algorithm 2 hy",NOTUTILIZE,MENTION
40038179,38569736,"ndard way as , greedy routing always reaches the closest node to the random target with (10) one-hop radio transmissions. note that in practice more sophisticated geographic routing algorithms (e.g., ) can be used to ensure that the packet approaches the random target when there are holes in the node coverage. however, greedy geographic routing is adequate for the problem considered here. 2) as",NOTUTILIZE,MENTION
31594040,32169642,"nt broadcast multicast trees have been developed. wieselthier et al. have proposed two centralized algorithms, bip mip 2 and two distributed versions of the bip algorithm, dist-bip-a and dist-bip-g , to build source-based broadcast multicast trees. these two distributed algorithms have slightly worse performance than their centralized counterparts. cagalj et al. 5 presented an embedded wireles",NOTUTILIZE,MENTION
60438850,59856966,"of the neutrino reaction, muon propagation in water and photon detection. optical noise equivalent to 40 khz in a 10 pmt (corresponding to results from measurements at potential detector sites 5 , ) was also simulated. event selection and muon-track reconstruction algorithms were applied. the detector configuration 1 was also used to determine the sensitivity of km3net to point sources. in fig.",NOTUTILIZE,MENTION
17707200,18886299,"o not overlap, as in the case of cascaded topology. we will extend our study on cascaded topologies in section 3.3. we propose an algorithm based on the non-negative matrix factorization (nmf) method . nmf decomposes x into two non-negative real matrices u n",UTILIZE,EXTEND
46006625,45191243,"es of functions that this type of algorithm can distinguish 3, 5, 6 . in this paper we extend deutsch-jozsa in yet another direction by applying it to the guessing secrets problem. terhal and smolin applied variations of deutsch-jozsa in order to recover an unknown object in a single ( query, ) but one oracle call will be n insufficient for our purposes. there are n triangles and maximal 3 sta",NOTUTILIZE,MENTION
