contextID,citationID,clean__citation_context,UTILIZE_LABELS,USAGE_LABELS
5264723,5450441,".11. note that in most situations we will have jj jj jaj. then the terms jj jj w 2 and jj jj s 2 can be omitted. if we use bodlaender s 6 algorithm instead of arnborg, corneil, and proskurowski s to compute the tree-decompositions, we can replace these terms by 2 p(w) jj jj and 2 p(s) jj jj, respectively (for a suitable polynomial p). remark 5.12. recall remark 4.11, where we evaluated a quer",NOTUTILIZE,MENTION
30572748,31284857,". some researchers target the limited hardware capabilities of standard epcgloabl-tags, providing algorithms that only rely on simple xor operations 35 or the presence of a random number generator . juels 26 points out that typical attack models need to be significantly relaxed in real-world rfid environments, as adversaries typically do not have 24 7-access5 to a tag, but rather minutes or",NOTUTILIZE,MENTION
4068175,4203268,"ted line segment. our algorithms are relatively slow, with a running time exponential in k. although standard k-server problems have polynomial-time algorithms due to a reduction to minimum-cost flow , the checkpointing problem is quite nonlinear due to forking and excursions. we first treat the case of only one permanent checkpoint. let c i (s) be the minimum cost of servicing requests r 1 ; r 2",NOTUTILIZE,MENTION
3009755,3131275,"de some new convergence estimates for multigrid algorithms. in recent years, there have been many advances in the understanding of multigrid algorithms (e.g., see 1 -- 3 , 5 , 6 , 9 , 11 , 12 , , 17 -- 19 ). two apparently different analytical approaches have been developed. historically, the first used a two level error recurrence and proceeded to develop estimates for the multilevel case",NOTUTILIZE,MENTION
202628325,240572660,"results were reported. in this section, we propose a new stln-based algorithm for approximate polynomial decomposition in order to solve equation (12) using the iterative methods proposed in 22 and to find a rank deficient ruppert matrix the associated polynomial of which is close to a given nondecomposable polynomial. this method requires solving a simple quadratic optimization problem at each",UTILIZE,USE
15759141,16872342,"ented by n features, and is the distance per feature. the distance between two patterns is simply the sum of the differences between the features. the k-nn algorithm with this metric is called ib1 ( ). usually k is set to 1. where: (x, y ) n (xi, yi) (5.1) i 1 xi yi abs( ) if numeric, else maxi mini (xi, yi) 0 if xi yi 1 if xi yi the major difference with the ib1 algorithm ori",NOTUTILIZE,MENTION
79300791,77223209,"y (k) i is a combij natorial task and thus very hard solve exactly. herein, we use bp to compute an approximation. bp is an iterative algorithm in which local messages are passed in graphical models . for details of the bp implementation in our graphic model, which is a first order markov random field, see 18, 19 . as in 9 , we adopt the laplacian density p( ) exp( 1), which enforces spar",UTILIZE,USE
8629727,9093636,"the problem of generating the linear extensions by transpositions. a natural way to generate permutations is by transpositions. for unrestricted permutations the algorithm of steinhaus 19 , johnson , and trotter 21 is wellknown and generates successive permutations by adjacent transpositions. in general, however, it is not always possible to generate all extensions by successive transpositions",NOTUTILIZE,MENTION
2406792,2542242,"llowing potentially simpler and more efficient motion tracking and object occlusion detection. a number of segmentation algorithms for building a hierarchical image representations have been proposed . although these hierarchical segmentation algorithms perform well in some specific areas, all of them suffer from various drawbacks. nacken 50 and hen et al. 65 employ methods similar to ours of",NOTUTILIZE,MENTION
11399274,12182003,"obtain the toggle rate of each signal. dynamic power analysis was then performed with the quartus ii powerplay power analyzer using these toggle rates. in contrast to the experimentation described in , all quartus ii power optimizations, except for our ram power optimization algorithms where noted, were included during experimentation. 10sieee transactions on computer-aided design of circuits and",NOTUTILIZE,NOTALGO
53230229,52758741,"y gender, age, occupation and workplace (hospitals) is shown in table 1. the scores for the eight dimensions of sf-36 were calculated using algorithms and following the sf-36 developers instructions . the scores and descriptive statistics for all eight dimensions are reported in table 2. the full range of 0 100 was observed for all scales. as expected the three scales measuring well-being (genera",NOTUTILIZE,MENTION
8331782,8766798,"able for rendering from multiple viewpoints, is a more daunting task. pioneer s engine for mesh generation exploits shewchuk s triangle algorithm for the production of constrained delaunay triangles . the overal mesh processing in the mapping software consists of four separate stages: texturing, cleaning, smoothing, and resampling. texturing: application of texture gives reconstructed scenes a mo",NOTUTILIZE,MENTION
14446547,15492552,"the one introduced in 27 . related prior work for region based segmentation using curve evolution implementation is by l. cohen 12 , 13 , paragios-deriche 21 , 22 , 23 , tsai, yezzi and willsky , among other work mentioned in 27 . we also mention the segmentation model by zhu-yuille, in a probabilistic energy minimization approach 30 . 2 description of the proposed models 2.1 the case of o",NOTUTILIZE,MENTION
69112858,67896757,". d. monotonicity in this subsection, we show the monotonicity of the decoding region of the proposed mas as a function of multiplicity parameter m over the mixed channel. it was shown by mceliece in , the error correction radius of gs algorithm is a monotonic function of multiplicity parameter m. this monotonicity does not hold for asd algorithms in general. however, the monotonicity result is of",NOTUTILIZE,MENTION
2092373,2213692,"n s fully-interpretive javainjava virtual jvm 17 , but is some way from matching the approaches discussed earlier based on the jdi virtualmachine.redefineclasses() feature 13 and using breakpoints . veneer is at an early stage of its development, and we expect to improve its performance substantially. the implementation whose performance is reported here suers a substantial overhead at each fr",NOTUTILIZE,NOTALGO
38350900,37003550,"fic terminal display. the storm motion algorithm, which relies on the cross-correlation tracker and storm extrapolation software libraries also used by the lincoln itws and wsp demonstration systems ( ), generates storm leading-edge lines and 10- and 20-minute predicted positions. the precipitation impact process evaluates storm cell position and storm motion information and detects current and pre",NOTUTILIZE,MENTION
59475372,58732005,"load and renewable availability, to allow controlled experimentation but provide realistic findings. we now explain the system model and formulation of online glb which extends the model presented in to include energy buffering and to account the electricity cost per peak power draw from the grid.4 zahra abbasi, madhurima pore, and sandeep gupta glb for interactive jobs can be generally modeled",NOTUTILIZE,NOTALGO
22921550,23918812,"elogram and then derived from it the following features that have been proposed for co-occurrence matrices: mean, variance, energy, correlation, entropy, contrast, homogeneity, and cluster prominence . thus, each image was characterized by a 36-dimensional vector. applying our algorithm to the texture database, only the mml and lec criteria found six categories (see fig. 8). however, all the crite",NOTUTILIZE,MENTION
124734726,112318127,"nsively tested and easily parallelizable. despite the existence of a gia code, after several attempts to reuse it, the conclusion was that the 1many of the advantages of using trilinos can be seen in . xi existing implementation was not straight-forward. a more flexible code that deals more easily with problem parameters, geometries, compressible and incompressible materials (including the fully i",NOTUTILIZE,MENTION
16768519,17911470,"mple of proposed public key encryption based the reader can find at the end of the article. the generalisations of the above algorithm on the case of arbitrary commutative ring the reader can find in , 26 , 27 . papers 18 - 20 , 23 , 24 devoted to the implementations of the algorithm using walks on graphs within the private key mode. 2 maximality of affine group and cryptography let (fq) n b",NOTUTILIZE,MENTION
39216917,37798713,"traightness and give some experiments in next section. we end the paper by some conclusions. 2. definitions we first review some definitions from algorithmic number theory. definitions are taken from . let k be a set of points of rd and a lattice included in rd . without loss of generality, we suppose both structures to be full-dimensional. the width of k along a direction c 0 in rd is define",NOTUTILIZE,MENTION
10124223,10752941,"te the operator information imposed on its relations. we obtain the answer using this algorithm by checking for validity of a certain functional dependency. this can be done by applying the result of , which is based on a chase technique 63 ( 53 contains a further development of the results in 51 ). examples of both approaches can be found in 60 . with respect to complexity, the propositional",UTILIZE,USE
16700427,17842748,"cription of our novel spam mitigation scheme a. a high level overview of our anti-spam scheme our new proposal extends a previously published idea to rate limit tcp connections from probable spammers . in 10 we monitored inbound smtp traffic on a per-source ip basis, and applied severe ip packet rate limiting on any flows that appeared to be carrying spam. we proposed that spam detection occur i",NOTUTILIZE,NOTALGO
78753231,76743489,"fer implementation; and the apache-2.2.9 web server. to assess the limit of clap, we also examined with simp race, a simple racey program 16 , and racey, a benchmark for deterministic replay systems . to evaluate clap for reproducing bugs on relaxed memory models, we also examined with the implementations of three classical mutual exclusion algorithms - dekker, bakery and peterson. setup clap wor",NOTUTILIZE,NOTALGO
29057819,29744114,"lutions. here we use uniform or two-point crossover, and bit-flip mutation 9 . the new candidate solutions are incorporated into the original population using restricted tournament replacement (rtr) . the run is terminated when termination criteria are met. 3.2 umda the basic procedure of the univariate marginal distribution algorithm (umda) 16 is similar to that of the ga. however, instead of",UTILIZE,USE
15609841,16717497,"pproach of reducing meet-over-paths 2sto graph reachability for sequential recursive programs 6 . finally, the reachability coverability problem is solved using the optimized partial-order unfolding based tool called pep 9 . for the important subclass of distributive dataflow analysis problems, we develop a more efficient algorithm for checking flows. if n is the control net of a program and th",UTILIZE,USE
