contextID,citationID,clean__citation_context,UTILIZE_LABELS,USAGE_LABELS
7115230,7439361,"we had to initially use a best estimate quot; of the gradient a0. thus, there is no guarantee how our implementation of this algorithm would work, even on the same problem class as that posed in 22 sets from 22 are labeled sc quot; while those from 21 are labeled mc quot;. we present a summary of the test problems in table 1. the numbers in the second column are the problem set numbers as",NOTUTILIZE,NOTALGO
39641059,38194774,"that x is completely recovered by the decompression process. encoding methods can be implemented either statically or adaptively. the most well-known static coding techniques are huffman s algorithm , fano s method 2 , and arithmetic coding 3,4 . the static huffman coding can be implemented as a recursive algorithm that proceeds by generating the so-called huffman tree 3 . it recursively merge",NOTUTILIZE,MENTION
85179424,82181580,"ion to execute in a given state. more recent planners to employ determinization that are, in contrast to ff-replan, successful at dealing with probabilistically interesting problems include rff-rg bg . at the same time, the latter kind of algorithms typically invokes a deterministic planner many117 more times than our techniques do. this forces them to avoid the all-outcomes determinization, as t",NOTUTILIZE,NOTALGO
10602124,11282183,"investigation into technologies for this context is necessary. we shall discuss the benefits and limitations of xml for authoring and delivering virtual courses, i.e., courses delivered using the web . we shall investigate whether the technologies needed to satisfy implementation requirements of advanced courseware do exist. our analysis includes the aspects of authoring and delivery. we do not co",NOTUTILIZE,NOTALGO
42453500,40811815,"ng its core theoretical properties by exploring practical numerical algorithms for using it in practice (e.g. 10, 32, 7, 11 ), evaluating theoretically these algorithms performance guarantees (e.g. ), addressing ways to obtain the dictionary from a bulk of data (e.g. 22, 1, 30, 38 ), and beyond all these, attacking a long series of applications in signal and image processing with this model, de",NOTUTILIZE,MENTION
22493314,23529596,"tives per day for cs.unm.edu, aya.org, i-pi.com, and explorenm.com respectively. in the 1999 darpa mit lincoln laboratories ids tests, they stated that above 10 false positives per day is a high rate . algorithm fp day mahalanobis distance 91,524 2 of icd length 6-grams 13 dfa 37 markov model (log transform) 39,824 linear combination table 1. false positive rate per day for the algorithms,",NOTUTILIZE,MENTION
39840882,38383036,"ycle) until the registers were over written by a new desired value. 3.6 atmega128 microcontroller the main decision making and high level algorithm were run on an 8-bit atmel atmeg128 microcontroller running at 16mhz. the bdmicro mavric iib board 16 (figure 31) was selected for this purpose atmega128 has 128k program flash, 4k static ram, 4k eeprom, two 8-bit timers, two 16-bit timers, 8-channe",NOTUTILIZE,MENTION
84793474,81857108,"icant challenge. 5.2 computation of an agreement tree the alignment method described in section 3 falls into a class of tree comparison algorithms extensively studied in theoretical computer science ( ; finden and gordon 1985; amir and keselman 1994; farach, przytycka, and thorup 1995) and widely applied in many areas of computer science, primarily computational biology (gusfield 1997). these algor",NOTUTILIZE,MENTION
12325927,13202171,"resents the required i o behaviour, and a data manipulation part, which represents the supported arithmetic. this approach allows us to describe even algorithms, which require galois field arithmetic . however, in this paper we focus on data transfer. to demonstrate the use of this common representation we use the fir filter yk nx i 1 ai xk;i mac accu delay mac accu s0 (0 1) (1 1) s1 (0 2) s2 (1",NOTUTILIZE,MENTION
967226,1035033,". in the literature, this is considered as a discrete optimization problem solved by a greedy search algorithm in the space of structures. some examples of the greedy search algorithm can be found in . a map (maximum a posterior) analysis of the most likely network structure has been studied in 34 and 35 when the data are fully observable. the resulting algorithms are capable of recovering fai",NOTUTILIZE,MENTION
41816165,40211753,"e want to check is obtained from the elementary formula (equality of two algebraic terms) by using quantifiers that run over all real numbers. there exists an algorithm (proposed originally by tarski ) that checks, for each such formula, whether it is true or not (see also 29 and 2 ). thus, by applying tarski s algorithm to the resulting formula, we will be able to check whether the formulas f",NOTUTILIZE,MENTION
85133313,82145345,cameras retrieves scenes with less occlusions. the pbku segmentation algorithm performance in terms of frame per seconds are showed in table 11.10. 11.6 npe: experimental evaluation pets 2009 dataset has been used to validate the accuracy of the number of people estimation (npe) module (see section 8.3.1). tests has been carried out on segmentation results obtained with and without npe analysis.,NOTUTILIZE,MENTION
19431838,20638283,"encies by more than 100 percent 28 . an even worse feature of these approximate algorithms is that many of them do not supply any information about how far their results are away from the optimality . furthermore, in heuristic approaches like genetic algorithm 10, 52, 40, 16, 17, 15 , the process always terminates after a certain number of iterations. hence, a prior idea about lower bounds on ba",NOTUTILIZE,MENTION
27428507,28138262,"they are executed. 4. a reorderable executor communicates with the scheduler to process the query plan in the order dictated by the scheduler. the scheduling unit (item 3 above) has been described in ; there we designed an algorithm that determines the order in which data should be fetched to reduce i o cost and presented preliminary results using simple hand-compiled queries. in contrast, this pa",NOTUTILIZE,MENTION
9283540,9823764,"lmost identical to our trec 6 clustering approach. unlike in previous years, we only used one algorithm (no experimental algorithm this year ), and ran it on different topic lengths. our trec 6 paper gives the details and rationale for the approach. the basic algorithm is 1. retrieve 1000 documents using the initial query (using lnu.ltu weights). 2. generate cooccurrence information about the que",NOTUTILIZE,MENTION
16738564,17880885,"-learning algorithm in the joint policy approach described in 16 , the cq ( ) learning algorithm enables collaboration of knowledge between several agents (the human and the robot). unlike 12 and , the cq ( ) algorithm does not allow human r",NOTUTILIZE,NOTALGO
9227899,9763049,"edicted and monitored values signal a failure. mi isolates the fault and diagnoses its cause, thus identifying the actual spacecraft configuration, using algorithms adapted from model-based diagnosis . mi provides a variety of functions within the ra architecture, including: ffl mode confirmation: provides confirmation to exec that a particular spacecraft com31 mand has completed successfully. ffl",NOTUTILIZE,MENTION
32587059,32940695,"ng include assumptions such as simultaneous startup or the availability of a global clock, which are not feasible in sensor networks. the selection problem, on the other hand, was studied by kowalski in a model where the node awakening schedule is adversarial, proving the existence of a o(k 2 log n) algorithm and showing constructively how to obtain an algorithm that achieves o(k 2 polylog n). th",NOTUTILIZE,MENTION
10200903,10838085,"1 ; : : : ; a n x b n . instead of calculating and applying all possible colour substitutions for all x b immediately, we delay colour substitutions by using the method of explicit substitutions . calculi of explicit substitutions are used in logical frameworks and their implementations (e.g., prolog nm88 ) to postpone the expensive operation of instantiation until necessary. the basic idea",UTILIZE,USE
12843722,13767598,"albert 1991; aha 1992; dasarathy 1991). similar algorithms include memory-based reasoning methods (stanfill waltz 1986; cost salzberg 1993; rachlin et al. 1994), exemplar-based generalization ( ; wettschereck dietterich 1995), and case-based classification (watson marir 1994). some efforts in instance-based learning and related areas have focused on one or more of 1999 blackwell publis",NOTUTILIZE,MENTION
1457659,1545265,"ake it impossible to configure an emulation system. therefore, it is preferable to take the former approach. to handle routing constraints that may arise from certain timing requirement, mak and wong proposed a performance-driven routing algorithm for the board-level routing problem that can handle additional routing constraints and reduce the delay of the routing solutions. it is an optimization",NOTUTILIZE,MENTION
71744502,70816119,"mages to results obtained on the same images when artificial gaussian noise is added. this is (the common way) to simulate increased noisy data. abutaleb s higher-order entropy binarisation algorithm is used to assist the comparison between the three operators. section 2 introduces the basic concepts of our paper, including a summary of the edge detectors used. section 3 covers which data we use",UTILIZE,USE
202904159,240970721,"optimal solutions depending on the initial value. in our experiments, highest confidence first (hcf), a deterministic approach, is used for mrf optimization due to its fast speed and good performance . the hcf algorithm finds a block such that the flipping of its label to another labelwould reduce the total energy the most and then flips its label to the desired one. it repeats this procedure unti",UTILIZE,USE
78717000,76711485,"s was a prefilter for slam processing, thereby reducing the effects of moving objects in corrupting the map that was being built. object tracking algorithms used the interacting multiple model (imm) ( ) for probabilistic data association. a related project addressed the tracking of pedestrians and other moving objects to develop a collision warning system for city bus drivers (thorpe et al., 2005).",NOTUTILIZE,MENTION
202030123,239715720,"ucted using r software 6 . the algorithms used were the k-nearest neighbours (knn) 7 , the random forests (rf) 8 , the projection pursuit regression (ppr) 9 and the support vector machines (svm) from the r packages kknn , randomforests , stats and e1071 . regarding the feature selection, a well-known state-ofthe-art technique was used: principal component analysis (pca) 11 . the tested",UTILIZE,USE
17787182,18967486,"p of the framework is not affected by the size of the dataset. hence, it may be worthwhile to apply more sophisticated graph-based balanced partitioning algorithms in step 2 (karypis and kumar, 1998; ). further, the populate and refine stages are quite efficient and provide the guarantee that each cluster will eventually have the pre-specified minimum number of points. as seen from the experimenta",NOTUTILIZE,MENTION
34972746,34848647,"processing random-order stream and adversarial streams. in particular, streaming algorithms to find the median using polylog space require exponentially fewer passes if the stream is ordered randomly . in this paper, we use robust lower bounds on communication complexity in order to deduce robust data stream lower bounds. once the communication bounds have been shown, the data stream bounds follow",NOTUTILIZE,MENTION
16815218,17959563,"o the destination processors. direct algorithms aim at exploiting specific communication architectures and emphasize sequencing of messages to avoid link and node contention. in the indirect approach processors combine messages into larger data blocks which are sent to intermediate processors to be routed to the final destination. indirect approaches allow message combining, and are are hence mos",NOTUTILIZE,MENTION
27109574,27830739,"to the previously developed mediation solution 3,4 we have provided a support for a new electronic payment scenario and our solution has been extended with a fully-fledged rule-based data mediation . in order to address the sws challenge requirements, we base our solution on the specifications of wsmo 9 , wsml 9 and wsmx 12 providing a conceptual framework, ontology language and architecture f",NOTUTILIZE,NOTALGO
58344437,57597010,"bility, ln(t) log n 2(t) in probability, in this section, we describe and extend a barycenter technique for the study of particle systems. this technique has been already used e.g. in 2 , 6 , 7 , , 17 . we identify the particles with their numbers, and call a block of particles any set of particles which have consecutive numbers. we denote such a block by j (i,i k ; this block contains the",NOTUTILIZE,MENTION
60531184,59954372,"for stressing this aspect has to do with the way the chiral symmetry breaking effects appear in the sm and in the anomalous models. in particular, we will start by extending the analysis presented in for the derivation of the z vertex, which is here presented in far more detail. compared to 7 we show some nontrivial features of the derivation which are essential in order to formulate general",NOTUTILIZE,NOTALGO
48386381,48054034,"nt could be of great interest for a non-perturbative canonical quantization of the theory. our work is based on the covariant phase-space formalism 3 - 7 and extends the results of a previous paper . the covariant formalism has already been applied to the cghs-model in ref. 9, 10 although their results are valid for the case of a closed space only. moreover, for lagrangians vanishing on-shell,",NOTUTILIZE,NOTALGO
14912119,15989864,"plements cpu frequency changes and data recording. the client is a modified version of an earlier tool used to understand user comfort with resource borrowing 1 and implement user-driven scheduling . in the client, the user can express discomfort at any time by pressing the f11 key. these events drive the udfs algorithm which then uses the windows api to control cpu frequency. we monitor the cpu",NOTUTILIZE,MENTION
42597170,40939336,"gms such as propositional logic 2, 20, 26, 34, 36, 55, 61 , constraint programming 4, 52, 59 or description logic 23, 57 . others propose ad-hoc algorithms and solutions to perform these analyses . finally, these analysis capabilities can also be found in several commercial and open source tools such as ahead tool suite 1 , big lever software gears 7 , fama framework 22 , feature model plug",NOTUTILIZE,MENTION
13451871,14433952,"ture where special algorithms are coded to achieve success in individual problem forms 15 . also there are some other algorithms which we wonder about their performances on the transformed instances . one other source of curiosity concerns the disappearing of the phase transition effect in 2 p , 3 -sat with increasing p. we are suspicious whether the result which says that every instance of 3 ,",NOTUTILIZE,MENTION
16313369,17444872,"each required concept a trust calculation is computed from for each user data set. it is these values that are discounted by the second phase. the abdul-rahman-hailes semantic difference algorithm allows the application to offset each calculated trust value by some degree based on previous experiences and recommendations. for example, if a data set provider tends to over exaggerate in its opin",NOTUTILIZE,MENTION
7486053,7832916,"arly takes o(tnq f 1 ) time. now the only constraint on the order in which we add nodes to the frontier is that we add parents before children. 3 the boyen-koller algorithm the boyen-koller algorithm presents the belief state, t p (x t jy 1:t ), as a product of marginals over c clusters quot;, p (x t jy 1:t ) q c c 1 p (x c t jy 1:t ); where x c t is a subset of the variables fx i t g. (the c",NOTUTILIZE,MENTION
22095471,23168804,"dvantages are: i) it is simple as it does not actually require the nxn ip-latency matrix (therefore it can be completely distributed), and ii) it leads to connected topologies if the degree d log2n (see figure 4). we will refer to the centralized and distributed version of this algorithm as ran and dran respectively. 12sfig. 4. visualization of a random graph with n 332 nodes (average degree 2,",NOTUTILIZE,NOTALGO
15552966,16658257,"e voronoi paths are longer than the optimal visibility graph-based paths, especially in sparse environments. aiming to improve the quality of generated paths, another composite algorithm is proposed ( ) where three methods of voronoi diagram, visibility graph, and potential fields are integrated in a single architecture, called v-v-p compound model. the compound model provides a parametric tradeoff",NOTUTILIZE,MENTION
18277863,19465893,entary row transformations until a is finally diagonalized. we use the notation presented in 13 to make the algorithm more clear and codable. we only give the algorithm here and refer the reader to for figures and details.s98 h. sak et al. parallel computing 33 (2007) 92,NOTUTILIZE,NOTALGO
68951215,67697387,"l cw98 give an analog code construction based on chaotic maps for uniformly distributed analog source, along with an efficient decoding algorithm using estimation techniques. vaishampayan and costa construct analog codes using linear dynamical systems and provide efficient decoding algorithms. using curves on higher dimensional spheres and topological arguments they show that their codes have m",NOTUTILIZE,MENTION
29016693,29704721,"ion problem, namely 1.52, which is due to mahdian et al. 19 is achieved by a greedy-like algorithm. 2 in addition, quite good approximation ratios for facility location (namely, 1.61 13 and 1.861 ) have also been derived by greedy-like algorithms. for these two optimization problems, we apply the priority-algorithm framework and derive lower bounds on the approximation ratio for algorithms in",NOTUTILIZE,MENTION
