contextID,citationID,clean__citation_context,UTILIZE_LABELS,USAGE_LABELS
202268085,240058384,"solution we propose in this paper. the solution relies on distributed stream processing middleware storm 5 for processing updates and maintaining the aggregate profile clusters in memory, and hbase for partial fault tolerance and for facilitating the migration. we use this system to study the impact of various workload, system and algorithmic parameters on the performance and accuracy of our re",UTILIZE,USE
8482504,8929208,"buses of cmos vlsi circuits can severely degrade both design reliability and performance. maximum current estimates are needed in the circuit to accurately determine the impact of these problems. in , a pattern-independent, linear time algorithm (imax) is described that is very effective in estimating the maximum current waveforms at various contact points in the circuit. in 1 , the algorithm wa",NOTUTILIZE,MENTION
61093890,60444367,represent another important development in statistics and machine learning. these models are widely used in the engineering and science communities. (see lauritzen 1996 for a systematic treatment and for a recent review from the algorithmic stand point and graphical model applications.) graphical models are effective in dealing with intricate dependencies and structures in the thousands or more v,NOTUTILIZE,NOTALGO
25991742,26733790,"rocedures such as forward or backward eliminations are employed due to their computational attractiveness. more complex procedures such as floating searches and genetic algorithms can also be applied . concerning the evaluation of the criterion, selection techniques are either univariate or multivariate. univariate approaches are simple and fast. multivariate approaches evaluate the relevance of f",NOTUTILIZE,MENTION
61431118,60745980,"tions. poor initial parameters may lead em to converge to a local minimum. em for motif finding was introduced by lawrence and reilly 28 and was an extension of the greedy algorithm of hertz et al. . it was primarily intended for searching motifs in related proteins, but the described method could also be applied to dna sequences. the basic models assumption is that each sequence contains exactl",NOTUTILIZE,MENTION
972908,1041341,"10, 2, 11, 1 ), and the systems processed symbolic data off-line. more recently, several beat tracking systems have been developed which work with audio input (e.g. 12, 4 ) or run in real time (e.g. ) or both (e.g. 5, 6 ). compared with the real time audio beat tracking work of 5, 6 , our tempo tracking algorithm performs a simpler task, that of finding the tempo but not necessarily the beat. h",NOTUTILIZE,NOTALGO
97584914,92103618,"on or inhibition, the effects spreading downward from complex stimuli toscomplex patterns of response like a cascade, leading to feelings of well-being: the ultimatesreward (cascade theory of reward) . although the neurotransmitter system is tooscomplex and still not completely understood, the main central reward areas in the human brain ssmeso-limbic system are summarized in figure 4a and 4b.sfun",NOTUTILIZE,NOTALGO
201687187,239221679,"ence of brucellosis. to account for the lack of information from neighbouring countries, we used a kernel smoothing algorithm that included a correction term for edge effects in the package spatstat ( ) in the statistical software r, version 2.9.1.sin parallel, areas of significantly greater risk of reporting serological evidence of brucellosis were identified by quantifying the amount of spatial c",UTILIZE,USE
87529357,84144011,"gn job allocated m computational cores, each evaluation of p k for node k with structure sk is performed using m cores for some m 1, ..., m selected to approximately minimize run time based on sk ). more implementation and infrastructure details are given in appendix a. 2.4 computational design studies our primary test scenario is rna sequence design at 37 c for target structures in the engine",NOTUTILIZE,NOTALGO
5970333,6189430,"disk. we used different synthetic databases that have been used as benchmark databases for many association rules algorithms (agrawal, imielinski, swami 1993; agrawal et al. 1996; brin et al. 1997; ; lin kedem 1998; lin dunham 1998; park, chen, yu 1995a; savasere, omiecinski, navathe 1995; zaki et al. 1997c). the dataset generation procedure is described in (agrawal et al. 1996), and the",UTILIZE,USE
68440898,67031631,"responding supercharge, which is found to agree with an expression derived earlier by a somewhat different method 14 . next, we investigate the extended n 4 supergravity 15 in a scalar reduction in which besides the gravity multiplet only the scalar multiplet is kept.3 the scalar fields have a mass m 2 2, which is within the breitenlohner-freedman range 17, 18 . the reduced theory has a",NOTUTILIZE,NOTALGO
42568522,40915202,our safmdl work differs from their work on not only providing mechanisms for validating feature model constraints but also extending feature model for semantic annotation of the features. peng et al developed an owl ontology for feature modeling which helps in validating and tailoring feature models. the proposed ontology categorized features according to underlying business model. in their appr,NOTUTILIZE,MENTION
8390289,8831889,"e manifolds. fig. 8 demonstrates that this property also holds for the 5-dof spatial manipulator considered in this example. the critical value manifolds are computed using the algorithm described in and are depicted in a solid line. the bold part of the critical value manifolds is the boundary of the ftws. as a second example, consider an 8-dof manipulator, with d-h parameters listed in table 4.",UTILIZE,USE
9363484,9910925,"ally in the context of parallel numerical algorithms 5, 7 . broadcasting is an essential operation in almost every parallel algorithm. multinode broadcasting arises naturally in iterative algorithms . total exchange is a communication pattern occurring for example in fft algorithms and is usually identified with matrix transposition. saad and schultz 12 , johnson and ho 8 and bertsekas et al",NOTUTILIZE,MENTION
12520191,13416190,"at evaluates in uence diagrams directly (shachter 1986), the two phase approachwas largely abandoned. none of the recent algorithms (cooper 1988, shachter and peot 1992, zhang at al. 1993a, zhang and b) needs a secondary representation. one reason for abandoning the two phase approach might be that people believe that direct evaluation is more e cient. however, all those algorithms that evaluate i",NOTUTILIZE,NOTALGO
27109577,27830743,"t scenario and our solution has been extended with a fully-fledged rule-based data mediation 6 . in order to address the sws challenge requirements, we base our solution on the specifications of wsmo , wsml 9 and wsmx 12 providing a conceptual framework, ontology language and architecture for semantic web services. the overall contribution of our work is to show: (1) how flat xml schema of roset",NOTUTILIZE,NOTALGO
83402266,80687299,"d substring problems have been proved to be np-hard 9 , 12 . this has motivated researchers to come up with heuristics without performance guarantee 15 , 19 , 20 , parameterized algorithms 11 , , 23 , 26 , and polynomial-time approximation algorithms 1 , 2 , 5 , 12 , 14 for these problems. we here design parameterized algorithms for them. z.-z. chen is with the department of mathem",NOTUTILIZE,MENTION
57591337,56879538,"ent with a semi-supervised approach using vision and prerecorded robot actions. we extend this idea to outdoor, remove any supervision, and predict vehicle actions in an on-line fashion. meyer et al. predicted traffic situations using hidden markov models (hmm). they however restricted their situations space by modeling states with respect to surrounding vehicles (distance, speed, bearing) and ma",NOTUTILIZE,NOTALGO
10229671,10870436,"ammars (without left-corner or unit production recursion) . the parser now uses the method described here to provide exact scfg prefix and next-word probabilities to a tightly-coupled speech decoder ( ). an essential idea in the probabilistic formulation of earley s algorithm is the collapsing of recursive predictions and unit completion chains, replacing both with lookups in precomputed matrices.",NOTUTILIZE,NOTALGO
12470243,13360791,"ch and its even more elaborate successors have been responsible for the fastest known algorithms for almost all classes of finite groups, including the symmetric groups 29 and their wreath products . these are among the classes of groups for which o g log c g fourier transform algorithms are known. other examples include the supersolvable groups 3 , while the algorithms for finite matrix gro",NOTUTILIZE,MENTION
26581086,27275952,"lo and mohar 11 to develop the first subquadratic algorithms for shortest non-contractible and non-separating cycles; their arguments are the foundation of all later improvements of their algorithm . our proof is quite similar to the argument of chambers et al. 13 that the shortest splitting cycle crosses any shortest path o(g b) times. however, our new proof is simpler, because the structur",NOTUTILIZE,MENTION
13778566,14783493,"ength 53 . watermarking. audio watermarking can be achieved by time-scale modification if it is used to change the length of the intervals between relevant points of the audio signal to embed data . this algorithm has been shown to be robust to common audio processing operations like mp3 compression, low pass filtering and time-scale modification. with an appropriate time-scale algorithm the wa",NOTUTILIZE,MENTION
42094840,40478759,"research makes finding a portable method of provenance collection vital. to that end, we are exploring hypervisor-based provenance collection. in this paper, we propose an approach for extending xen to transparently collect operating system-level provenance from its guest vms, without requiring any modifications to the guest kernel. although we expect our approach to be implementable across a va",UTILIZE,EXTEND
27656413,28368433,"ng text) classifier 10 as the classification algorithm in our passage detection approach. fact is a statistical text classifier that uses a feature selection algorithm called ambiguity measure (am) . formally, ambiguity measure (am) is defined as the probability that a term falls into a particular figure 1: block diagram of passage detection method figure 2: algorithm for passage detection input",NOTUTILIZE,MENTION
13243046,14204631,algorithms. we also discuss the relationship between the incorrectness of this algorithm and two extensions of the inverse compositional algorithm to fit (what we would classify as) 2.5d head models . 1s2 background: 2d image alignment algorithms 2.1 the lucas-kanade algorithm the goal of the lucas-kanade algorithm 13 is to align a 2d template,NOTUTILIZE,MENTION
1722104,1822528,and they have been extended to take account for time and probabilistic behavior. in this paper we present the process algebra p 2 acsr which extends our previous work on formal methods for real-time and probabilistic systems 13 by incorporating the ability of reasoning about power consumption. the algebra of communicating shared resources (acsr) 11 is a timed process algebra which represents,UTILIZE,EXTEND
18501213,19690864,"e would imply that there is a fast, provably correct algorithm for computing the number of degrees of freedom and determining the maximal rigid subgraphs in a molecular graph. the algorithm of jacobs , which was used in the first versions of the first software, uses a different approach for computing the degrees of freedom and the maximal rigid subgraphs. it runs on g 2 , rather than g, and is a m",NOTUTILIZE,MENTION
7259453,7597513,"called inclusion functions. examples of application to robust stability and to parameter estimation of such domain-splitting algorithms which use methods from interval computations are given in 12 , , 14 . in 15 the mean value form, the optimal centered form presented by baumann 16 , and the taylor form are applied to robust performance problems and compared with bernstein expansion. the exam",NOTUTILIZE,MENTION
17256819,18419476,"etter time performance through optimistic delivery. i will develop a regular publish subscribe system as well as an improved publish subscribe system using the two algorithms described by zhao et al. . i will then perform a suite of tests to determine which system performs better in terms of time and accuracy. the recovery algorithm could cause decreased time performance, but the claim is that thi",UTILIZE,EXTEND
149778507,131527239,"existing data sets for the av research community. in particular, a strong effort has been made to produce a variety of multimodal data sets focusing on faces and speech, like the av-timit 15 , grid , m2vts 31 , xm2vtsdb 27 , banca 3 , cuave 30 or mobio 25 data sets. these data sets include individual speakers (av-timit, grid, m2vts, mobio, xm2vtsdb, banca) or both individual speakers and",NOTUTILIZE,NOTALGO
3307895,3408126,"g the student model taking into account the issue of language transfer. in particular, we use an innovative combination of stereotypes 1 , 14 and the distance weighted k-nearest neighbor algorithm 16 , 17 to set initial values to all aspects of the student model. stereotypes are used to make initial assumptions about the student",UTILIZE,USE
2989405,3113467,"be underdetermined and some form of regularization should be employed. genetic algorithms have also been used to identify damage in structures by optimizing the force residual 17 or modal residuals . a second group of methods, called forward methods, assume a candidate set of possible damage scenarios, which can include both damage mechanism and location. the change in dynamic response due to th",NOTUTILIZE,NOTALGO
34374246,34332837,"ondition is needed to ensure stability and accuracy of the method. we solve the algebraic system resulting from the multiscale mortar mfmfe method via a non-overlapping domain decomposition algorithm . by eliminating the subdomain unknowns, the global multiscale problem is reduced to a coarse interface problem, which is solved using an iterative method. employing the approach from 30 , we precomp",UTILIZE,USE
31449460,32054558,"hich measures the aggregate distance among corresponding joint positions relative to the root kgp02 . to minimize l(c), we use particle swarm optimization, a stochastic global optimization algorithm . candidate solutions si are created at the locations of each of the current control targets ci. each solution is then treated as a particle in control space, with associated velocity vi. we track the",UTILIZE,USE
20055978,21275238,"vinced by a plan for transportation from lille to ottawa which costs less than 1050 euros (the argument a). we have formalized here a protocol to reach a practical agreement. since this paper extends , we can warrant as in 8 that the dialogue are finite and leads to an agreement. 7 related works classicaly, argumentation has been mainly concerned with theoretical reasoning to check beliefs verac",UTILIZE,EXTEND
48906977,48760384,"uppressed by requiring wx 50 gev. final state hadrons are reconstructed from deposits in the lar calorimeter in combination with tracking information. following the so-called democratic procedure , the photon candidate and the reconstructed hadrons in each event are combined into massless jets using the kt algorithm 44 . the algorithm is used with a ptweighted recombination scheme and with th",NOTUTILIZE,MENTION
27877733,28590502,"number of approaches like 20, 25 used clustering as a way of improving the feature selection for classification. these semi-supervised classification algorithms are similar to transductive learning in that transductive learning also allows the structure of the test set to play a role in classification. our cphc algorithm is similar to existing pattern-based classification algorithms in that we",NOTUTILIZE,MENTION
11242818,12008762,field. 1.4.1. practical guidelines the following list sums up the experiences of our and other research groups who have implemented fixed-parameter algorithms: fixed-parameter tractability in general do not despair of bad upper bounds for fixed-parameter algorithms that are given in theoretically oriented papers the analysis is worst-case and often much too pessimistic. (2) fixed-parameter algori,NOTUTILIZE,MENTION
9907237,10513530,"zation delay from 2t to t . our scheme is independent of the coterie being used. k is p n if we use maekawa s quorum algorithm 7 , and k becomes log n when we use agrawal and abbadi quorum algorithm . moreover, the redundancy in the quorum can increase the resilience to site and communication link failures. the rest of the paper is organized as follows. section 2 describes the system model. in se",UTILIZE,USE
65663662,64437216,"both topologically and numerically limited compared to modern dynamic implicit surface approaches. surface reconstruction from 2d images recently, several new volumetric algorithms have been proposed that simultaneously reconstruct the surface and obtain dense correspondence. the method of space carving or voxel coloring 20, 14 directly works on discretized 3d space, voxels, based on their imag",NOTUTILIZE,MENTION
7342019,7683086,"model the accent types and syntactic boundaries. the training and the recognition were done by em algorithm and viterbi algorithm respectively. in the previous paper for syntactic boundary detection , the best result was obtained when the number of states coincides with the number of morae under the observation. therefore, in the present paper, these two numbers were made equal throughout all the",NOTUTILIZE,MENTION
8274135,8702308,"unification was on developing algorithms that compute a most general unifier for unification problems with constants 5, 14, 13 , or finite complete sets of unifiers for general unification problems . of course, such algorithms can also be used to decide solvability of a given unification problem. however, the complexity of a decision procedure obtained this way need not be optimal. in fact, to t",NOTUTILIZE,NOTALGO
23047038,24030660,-bit node mark content-specific encoding process. our algorithm does not require the original un-watermarked object in order to perform mark detection. published research results of this work include . further work is required in improving conte,NOTUTILIZE,NOTALGO
40594351,39131584,"hus it is usually approximated. in order to reduce the computations needed, existing illumination algorithms make several simplifications such as approximations to the environment lighting conditions , the scene geometry 67 , reflectance properties of materials etc. consequently, this has a negative impact on the quality of the rendered image. moreover, most of the real-time illumination methods",NOTUTILIZE,MENTION
34555769,34496862,"is generalization of the bif algorithm to the nonsymmetric case is similar to generalizations of other biconjugation-based algorithms to get ldu factorization or its inverse. for instance while ainv ( ) runs the processes to compute its factors successively, straightforward nonsymmetric generalizations of sainv 1 and rif 5 and similar algorithms 10 , 28 do interleave the computation. the dro",NOTUTILIZE,MENTION
81922732,79465032,"t syllable boundaries also apply at morpheme boundaries). not everyone is convinced that it is necessary to consider the syllable as a starting point for a phonemisation algorithm. for instance, boot claims that (...) there is no linguistic motivation whatsoever for a phonemisation wd model in which syllabification plays a significant role (o.c. p. 63) my translation wd . it is clear from th",NOTUTILIZE,MENTION
38311751,36971842,"ce this decision with the correct transition, and resume parsing from this state. 2 related work incremental deterministic classifier-based parsing algorithms have been studied in dependency parsing ( ; yamada and matsumoto, 2003) and cfg parsing (sagae and lavie, 2005). johansson and nugues (2006) describe a non-deterministic implementation to the dependency parser outlined by nivre and scholz (20",NOTUTILIZE,MENTION
57253963,56577638,r mndp; we need to find trees that are nearly node-disjoint. the algorithm of chuzhoyfor finding the disjoint trees is involved; she uses the splitting-off operation that preserves edge-connectivity to create an auxiliary graph and then shows the existence of a bounded degree spanning tree t in the auxiliary graph via a result of singh and lau 52 . this tree t is then used as a template to ge,NOTUTILIZE,MENTION
902534,965933,"algorithm also depends only on the link adaptation speed and the user utility function. if gl(pl) is fixed to be 1 cl as in the dual algorithm 23 , then the utility function must be specified as in . to allow arbitrary utility functions, we could either add a slow adaptation at the source 28 or choose a different gl(pl). thus, the interesting observation from our analysis is that slow adaptati",NOTUTILIZE,MENTION
61657976,60949853,"arch in computer science and engineering (c.f., littman, sutton, sigh, 2002). indeed, many popular algorithms for learning sequential decision strategies in complex environments such as q-learning ( ) and sarsa (sutton, 1996; sutton barto, 1998) require learning agents to correctly identify changes in the state of the environment as a consequence of their actions. the experimental manipulations",NOTUTILIZE,NOTALGO
164641280,145980688,"aints. finally in section (6) we outline our results and suggest possible extension of this work. 2. review of lifshitz scalars and quantum criticality the aim of this section is to review, following the physics of d free scalar fields defined on p dimensional euclidean space with coordinates x xi , i 1, . . . , p with action w 1 2 dpx ij i m j ngmn , (2.1) where gmn is a constant posit",NOTUTILIZE,NOTALGO
202510949,240404190,"generation of a static model from the volume reconstructed at the 80 of the r-r interval. b. centerline extraction we applied a tracing-based algorithm for the coronary artery central axis extraction . the tracking algorithm relies on a local modeling of the vessel by a cylinder in a 3d homogeneous space. the parameters of this cylinder (location of the center of gravity, and diameter) are estimat",UTILIZE,USE
14343829,15384080,"f the oating-point registers (mmx uses 64 of the 80 available bits) and mixing of oating point and mmx code becomes costly. in dsp applications, several algorithms surface more frequently than others . the most common dsp kernels are the nite impulse response (fir) lter, in nite impulse response (iir) lter, fast fourier transform (fft), least mean square (lms) adaptive lters, and matrix-vector ari",NOTUTILIZE,MENTION
28729494,29420696,"pects based on a large set of real web sites. finally, we report the performance of the near mining algorithm. note that we do not compare our approach with existing techniques for efficient crawling as these techniques are page-level strategies and orthogonal to our problem. we are not aware of any publicly-available site-level web archive maintenance techniques. 6.1 empirical examples dataset.",NOTUTILIZE,NOTALGO
16385033,17518821,"ightly more overhead than forest simulation. thompson and smith developed extensions that count the number of writes to main memory for different-sized caches that implement a write-back write policy . they also studied multi-configuration algorithms for sector or sub-block caches. wang and baer combined the work of mattson70 , hill89 and thompson89 to compute both miss ratios and write backs",NOTUTILIZE,NOTALGO
33319475,33480893,"very interesting but they have two main drawbacks. first, they lack generality; indeed, the fixed point results are always obtained starting from very special initial sandpiles (just one column). in , we tried to solve this problem by giving a fast algorithm for finding the fixed point starting from any possible initial condition. second, the model lacks symmetry; in fact, grains either stay or m",NOTUTILIZE,MENTION
59840745,59172192,"b model in two dimensions. we claim that the two moduli spaces are the same and isomorphic to the extended moduli space of complex structures of the calabi-yau x, defined by barannikov and kontsevich . the second named author showed that the extended moduli space of complex structure is the moduli space parametrizing the family of b-models, conjectured by witten, by actually constructing such a fa",UTILIZE,EXTEND
99344733,93454087,"0, and for j eszj max .yy,c hj1j tj s3.4. cost-scaling algorithmsin this section is presented a extension of the minimum costsflow circulation algorithm proposed by goldberg and tarjan (sees )ssolve npl programs with integer data. it is possible to to prove that this specialized algorithm (see 5 and 6 ) is asstrongly polynomial one, and runs in 0(n.m .log n.min(log nc ,sm .log n)) tim",UTILIZE,EXTEND
9580721,10153488,"we refer to this as the assumption of additivity. falling into this category are inference methods such as neighbor joining 22 , fitch--margoliash 13 , upgma 23 , the l1 -- nearest tree algorithm and split decomposition 5 . however, due to hidden mutation events, m tends to underestimate dt . to circumvent this problem, a difference matrix m can be corrected to account for hidden mutation ev",NOTUTILIZE,MENTION
7946162,8336608,"inhomogeneity in the readout field should cause shift artifacts like b 0 inhomogeneity in conventional mri. to correct this distortion, sekihara s quot;rubber sheeting quot; algorithm could be adapte . in this case, the readout gradient should be strong enough to provide a unique map of frequency to position in spite of the readout field inhomogeneity. for readout in the x direction, we require g",NOTUTILIZE,MENTION
