contextID,citationID,clean__citation_context,UTILIZE_LABELS,USAGE_LABELS
53903956,53449542,110into groups based on motor nerve conduction velocities and age of onset. results were used to create algorithms for testing. in terms of mncvs affected patients were categorized into four groups: those with normal mncv ( 45 m sec); (2) those with mild or intermediate slowing (35 and 45 m sec); (3) those with slow mncv (15 and 35 m sec) and those with very slow mncv ( 15 m sec). pat,NOTUTILIZE,NOTALGO
22167429,23233413,km00 . the hashchaining technique for creating self-verifying data structures is due to merkle mer88 . the fast fingerprinting algorithm that we use for delta-encoding updates was developed by rabin . the data structure that we use to support delta-encoded updates is inspired by a similar data structure developed in the exodus database project cdrs86 . 41spart ii techniques for improving access,UTILIZE,USE
61786328,61063831,"is similar to the entropy regularization method, except that the vector is perturbed by the previous solution. it leads to algorithms similar to one based on an augmented lagrange multiplier method . here, we only require that k 0. we do not require that k is decreasing (in fact it may be set to k 1 for all k). 2 2 2 1 1 0 0 (a) m (b) m figure 1: geometric illustration",NOTUTILIZE,MENTION
28773976,29457073,"tes using global search methods such as a genetic algorithm or simulated annealing. these are useful to find the optimum set of parameters corresponding to the true minimum of the cost function 11 , . the inversions in this paper use a genetic algorithm from the saga inversion package 13 . the basic principle of a genetic algorithm is as follows. first, an initial population is created randomly",NOTUTILIZE,MENTION
238387329,201105384,"medline unitedsstates kilmer rp, cook jr, taylor c,skane sf, clark ly. siblings ofschildren with severe emotionalsdisturbances: risks, resources,sand adaptation. am j horthopsychiatr. 2008;78(1):1-10 . to analyze risks,sresources and adaptation among siblingssof children withssevere emotionalsdisturbances in ordersto develop familyssystems of centralized care. longitudinalsstudy with 34sfamilies -",NOTUTILIZE,NOTALGO
9993541,10607315,"mulas. the basic iterative linear equation solver that we use is orthomin 18 . other reasonable choices include gmres 5 and the stabilized version of the conjugategradient -squared (cgs) algorithm . to focus on adaptive preconditioning, we chose to use one basic iterative solver only. we selected the well-known scheme orthomin, in part because an effective implementation of it along with severa",UTILIZE,USE
401642,430153,"address the following two key questions: the selection of cluster centers and the connections between clusters. several graph-theoretic algorithms, such as k-hst 25 , min k-center 26 , and l-greedy , may be used to perform center placement. while these algorithms offer either absolute or probabilistic bounds on the latencies between nodes in a cluster and its center, there is no performance guar",NOTUTILIZE,MENTION
10981424,11724698,"e the object observations come in incrementally, the agent must add new classes incrementally. the task of adding new classes incrementally is known as online clustering, and several algorithms exist . for simplicity however, we solve this clustering task with a distance function. we define the asymmetric dissimilarity function between two aligned shape images v and w by comparing their component",NOTUTILIZE,MENTION
14098928,15122766,"ng scheme, cost function and fitness scaling function that we used. it seems that some problem specific heuristic is needed to make genetic algorithms work efficiently in these problems. according to it is widely recognized that simple genetic algorithms are not good at fine tuning the final solution and a hybrid approach where genetic algorithms are used in the beginning of the optimization ru",NOTUTILIZE,MENTION
46865123,46035966,"rstand what is happening in the core of the system. also, no facilities are provided for tweaking the solver algorithms for a speci c application. more recent clp(fd) systems such as those in sicstus , gnu prolog 7,8 , and b-prolog 9 are built instead following more the glass-box approach. the basic constraints are decomposed into smaller but highly optimized primitives (typically indexicals).",NOTUTILIZE,NOTALGO
