contextID,citationID,clean__citation_context,UTILIZE_LABELS,USAGE_LABELS
41205167,39663978,"p. no other information is given a-priori. figure 8 shows the steps the landing zone evaluation algorithm follows to find a landing site. the approach is an extension of the algorithm we presented in . first, the aircraft overflies the known position of the casualty in downward-scan survey configuration (see figure 3) and builds a map of the surrounding terrain in the global coordinate frame. this",UTILIZE,EXTEND
16793061,17937511,"ms. in addition the gmdh algorithms and the best subset methods of multivariate analysis of variance, manova, (hawkins, 1976), are severely hampered by very large dimensionality. multiple regression ( ), stepwise regression (efroymson, 1960) and mahalanobis distance techniques (rao, 1965, p.482), as well as the transformation methods such as principal component analysis, factor analysis, and canoni",NOTUTILIZE,MENTION
31607809,32179320,"cepts in many of these games is rather questionable. while in some cases, we can give efficient algorithms, most of our insights turn out to be hardness results. in section 3 we study anonymous games , in which the cost of a player does not depend on the identity of the other players. a notable case are games with a constant number of strategies, in which the existence of pure ne can be decided ef",NOTUTILIZE,MENTION
10031865,10649717,"escribe the accesses to the data array (in the case of regular accesses) or to the indirection array (in the case of irregular accesses). we also extended the interface ( 10 , 23 ) to the treadmarks run-time sdsm system to take advantage of the compiler analysis. we have measured the performance of these techniques on an 8-node ibm sp 2 for applications with both regular and irregular access pat",NOTUTILIZE,NOTALGO
83709825,80932761,"a good starting point for scalability. our algorithm is an extension of one called push-relabel. 2.1. pushrelabel algorithms the first push-relabel algorithms proposed in 1988 by goldberg and tarjan offer the most robust performance for general graphs 1, 8, 10 but are surpassed by 4 for many graphs used in vision, particularly 2d grids. the more recent pseudoflow algorithm shares much in com",NOTUTILIZE,MENTION
6898897,7210744,"ma for all the di erent random initial conditions tested. the method is unsuitable for practical imaging applications as it su ers from high sensitivity to initial conditions. mccallum s algorithm of roduced good results for small images however, for the degraded toy image, it was too computationally time consuming to produce a reliable estimate. the order of the algorithm per iteration is o(n",NOTUTILIZE,MENTION
39876221,38416249,"lled by a single selfish agent. the time bound of the malik et al. 12 algorithm was improved to o(m (m, n)) time for integer-weighted undirected graphs 13 . a similar o(m n log n)-time algorithm was given for the vertex-failure problem, i.e., computing g v(s, t) for each vertex v. the replacement paths problem appears to be much more difficult on directed graphs. the trivial algorithm (see",NOTUTILIZE,MENTION
75050950,73631623,"vailable system 3, 4 , which we extended to also deal with the training of the models. 4.1 implementation our dpm implementation uses the same modified histogram of oriented gradients (hog) features and the same initialization of the parts locations, sizes, deformation cost, and left right pose assignments as in 9, 11 . it similarly initializes the parts at twice the resolution of the root (one",UTILIZE,EXTEND
184629145,163782991,"9sat penn state u niversity (paterno lib) on february 21, 2016 http: nar.oxfordjournals.org d ow nloaded from nucleic acids research bond distances and bond angles in the imidazole ring of (a) cgmf , (b) 5 -gmp (13), and (c) neutral guanine base (mean values of the two structures, see table). the similarity of the geometrical parameters of (b) to (a) indicates that the base of 5 -imf is also pro",NOTUTILIZE,NOTALGO
18555606,19745983,"). j 1 according to the established terminology, we shall call an object, being subdue to any of transformations wj, agenerator. one way of visualizing the attractor is the random iteration algorithm , described next. let x 0 denote an initial generator. we obtain the transformed generator x 1 by randomly selecting a transformation wk from the set w j; j 1, ..., m using probabilities c the eu",UTILIZE,USE
84493667,81608606,"v r and a such that x av t r subject to the constraints (3) for a. this scaling procedure can be achieved using the bayesian algorithm presented in 14 for unsupervised su assuming the lmm (see for details). once the final abundance matrix and the matrix v r have been estimated, we propose an endmember extraction procedure based on gp regression. this method is discussed in the next sec",NOTUTILIZE,MENTION
481588,514390,". however, these proxies must be registered with the jini lookup service. since proper parameterization is necessary we have left this task to an extended version of our scot configuration repository , which is used to maintain service location within a network. it could easily be replaced by another mechanism, ranging from a simple service using file based configuration information up to an arbit",NOTUTILIZE,NOTALGO
201766184,239336920,"alan families apply to find isomorphisms for other combinatorial families, e.g. the generalized catalan families described in 4 . 5 algorithmic remarks in this section we adapt some ideas of 7 and to define a ranking on special catalan families and show the connection to the isomorphism problem. theorem 3 for every special catalan family (m,f) there exists a unique total order on m (usually ca",UTILIZE,USE
15241160,16332383,"address by sending heartbeat messages periodically. despite all these differences from tcp, the congestion control algorithm is a window-based aimd as in tcp, primarily for achieving tcp friendliness . one minor difference is located in the fast retransmit algorithm which needs now four duplicate acknowledgments before it retransmits the presumably lost packet. a recent extension to the sctp proto",NOTUTILIZE,MENTION
38073326,36743386,e now discuss this and other related work to better distinguish the contributions of our algorithm. all recursive ray tracers implement some form of whitted s original recursive ray tracing algorithm . recent innovations to the basic algorithm include the use of simd instructions to trace multiple rays in parallel 19 and the tracing of a frustum of rays through the acceleration structure to elim,NOTUTILIZE,MENTION
89670048,85872500,"ever, the analysis there is limited to a first order approximation, which cannot pick up the slight convexity of the observed equity implied volatility surface. in this paper we extend the results of to second order. this extension is non-trivial, as it requires a careful terminal layer analysis, which we approach probabilistically. for some related multiscale perturbation techniques in european",NOTUTILIZE,NOTALGO
15960444,17077570,"side, more closures would be constructed at run-time causing excessive copying of variables and more frequent garbage collections. shao et al. show how to optimize the representation of such closures . 4.2 enhancing performance the implementation of scheme as presented in section 3 is simple and straightforward. we avoided almost all optimizations by performing only the essential analysis passes r",NOTUTILIZE,MENTION
1404458,1489435,"for this work was the above simple question of how to determine the true second (third, fourth, etc.) strongest player in a tournament. however we found that this problem dates back to lewis carroll , that it has close connections with lattice path counting in ballot problems, extreme value distribution, partially ordered sets and the parallel sorting algorithms. we believe that, in addition to p",NOTUTILIZE,NOTALGO
10539089,11214202,"tions and some recommendations. ii. application-level multicast in this section, we give a brief overview of application-level multicast protocol families. a. centralized algorithms the almi protocol and hbm 12 are examples of a centralized approach to application-level multicast. they have a session controller node which gathers distance information from all of the group nodes and calculates t",NOTUTILIZE,MENTION
26963070,27672323,"assumptions. again, in this chapter we consider both algorithmic and information theoretic aspects. this is mainly based on work that appears in 40 , but also includes parts from the recent work in . in chapter 5 we analyze active learning and present two main results. in section 5.1, we provide a generic active learning algorithm that works in the presence of arbitrary forms of noise. this se",NOTUTILIZE,MENTION
13567950,14558851,"roposed in the peer to peer literature. peer to peer networks have a rich theoretical structure, and sophisticated algorithmic techniques have been employed in the systems currently under development 4 5 . some of the rich structure of this problem was exemplified by the pioneering work of plaxton et al. 14 , where they give an elegant scheme to achieve optimum latency in networks which follow",NOTUTILIZE,MENTION
39666325,38217160,"et al. 4 address this problem by constructing a planar spanner using the gabriel test 9 . li et al. 11 present a local algorithm which computes a planar spanner with constant stretch factor. in li and wang introduce local algorithms which compute planar spanners with constant stretch factor and a constant maximum degree. however, the resulting maximum degree can be up to 20 and the weight o",NOTUTILIZE,MENTION
42094840,40478759,"research makes finding a portable method of provenance collection vital. to that end, we are exploring hypervisor-based provenance collection. in this paper, we propose an approach for extending xen to transparently collect operating system-level provenance from its guest vms, without requiring any modifications to the guest kernel. although we expect our approach to be implementable across a va",UTILIZE,EXTEND
67357064,66022089,onors and 30 prostate cancer patients obtained a sensitivity of 99 and a specificity of 98 (41). genetic clustering algorithms have also been applied successfully for analyzing seldi profiling data . novel software programs are available to identify proteins from peptide mass fingerprinting output of mald-tof by incorporating a parametric multilevel scoring algorithm (74). maldi-tof spectra and,NOTUTILIZE,MENTION
24922869,25756603,"n section 3.sas a solution to this problem, we present sns in section 4. we also discuss the requirements, and design sns, and define the interface of it using the interface definition language (idl) . section 5 describes the implementation architecture, and in section 6, we present the performance evaluation of our implementation. finally, we drew a conclusion in section 7. 2. corba-based tmn fra",NOTUTILIZE,NOTALGO
56576716,55908366,"and vi v i ) such that the difference in the outputs y and y corresponding to the two inputs is maximized over all executions of the program. our algorithm is based on symbolic execution 6 , which executes the program on symbolic inputs and aggregates symbolic constraints on each execution path. unlike normal test generation, in which symbolic execution on individual paths is used t",UTILIZE,EXTEND
30009628,30713988,"ed that countersampler can effectively defend against any sampler over hidden databases. as examples, we now illustrate how counter-sampler defends against hidden-dbsampler ddm07 and hybrid-sampler , two state-of-the-art sampling algorithms over hidden databases. defense against hidden-db-sampler: we start our discussion by a brief overview of hidden-db-sampler. its basic idea is to repeatedly p",NOTUTILIZE,NOTALGO
47212205,46398960,"sq. is the quantum system sq an individual dynamic (or stochastic) system s, or is it a statistical ensemble e s of dynamic (or stochastic) systems s in the conventional copenhagen interpretation of quantum mechanics sq s, whereas in another version, what is known as statistical interpretation 2, 3, 4, 5, 6 , sq e s . discussion on this subject lasts many years on the verbal level witho",NOTUTILIZE,NOTALGO
1722109,1822540,"ed an algorithm for computing probabilistic bounds on power consumption. we illustrated the utility of the proposed approach using a couple of examples. we are currently extending the paragon toolset 6 , which allows the specication and analysis of acsr and pacsr processes, to handle the power consumption model of p 2 acsr. to the present, we have extended paragon to accept p 2 acsr specications a",UTILIZE,EXTEND
17883730,19066426,"ation 27 tion to the block between the scheduling points expected to be executed the least frequently. the implementation of gvn and gcm in the safetsa compiler is based on the algorithms of click , which are broadly comparable to the techniques used in jikes rvm s bytecode compiler. global code motion starts with early scheduling, which determines, for each instruction, the first basic block",NOTUTILIZE,MENTION
34347576,34312643,"pling rate) of each sensor. 4.3 experiment results we start with briefly explaining our parameter settings used for the experiments, and the two state-of-the-art place learning algorithms, placesense and kang et al. 13 , we implemented to evaluate our place detection algorithm. sensitivity analysis of our parameters is presented at the end of this section. sensloc uses a similarity threshold tsi",UTILIZE,USE
40888539,39391054,"y using symbolic grammars to reduce the set of input strings for software systems, such as compilers and command processors 45 , validate web pages written in php 5 , and test database applications . compositional symbolic execution in 29 , godefroid proposes an algorithm, smart, which performs dynamic test generation compositionally. smart is intended to improve the scalability of dart23 by e",NOTUTILIZE,NOTALGO
32496329,32861095,"odel social interactions as graphs over nodes representing individuals. to model dynamic interactions, we use the model of 37 which follows and slightly extends the approach of berger-wolf and saia and that of affiliation networks 38, section 8 . let i 1, 2, . . . , n denote the set of individuals and t 1, 2, . . . , t denote the set of discrete time steps. let h h1, h2, . . . , ht",UTILIZE,EXTEND
41313300,39759778,"te. to reduce overhead, the run-time must carry out checkpointing in the face of actively running kernel instances or the control thread. we use the chandy-lamport (cl) distributed snapshot algorithm to perform checkpointing. to save a cl snapshot, each process records its own state and two processes incident on a communication channel cooperate to save the channel state. in piccolo, channel stat",UTILIZE,USE
51030147,50844807,"nterval. registration and measurements all the images were transferred to a separate workstation. to compensate for breathing motion we used a registration algorithm proposed by c. chefd hotel et al. . registration was performed pair wise between all the images and an arbitrary reference image. for each pair 13 , this algorithm finds a deformation that maximizes the local cross-correlation betwee",UTILIZE,USE
4883770,5047856,"ase. in this context, there has been considerable work on computational techniques for making the em algorithm more ecient when applied 32 to large data sets (bradley et al. 1998; moore and lee 1998; esson et al. 1999). one focus is the development of one-pass quot; methods, in which each part of the data needs to be loaded into memory only once. however, even with memory resources and processor",NOTUTILIZE,MENTION
39112173,37692388,"lynch csail.mit.edu texas a m, viqar cse.tamu.edu texas a m, welch cse.tamu.edu1 introduction neighbor discovery is an important aspect of many algorithms in mobile wireless ad hoc networks (cf. , 8 , 1 ). for example, knowledge about neighboring nodes can be used to route, cluster and broadcast in an efficient manner. neighborhood knowledge is assumed in many routing protocols used in wire",NOTUTILIZE,MENTION
23167248,24138222,"discussed. in addition, we will also discuss a sequential access-based web recommender system that has incorporated the csb-mine algorithm for web recommendations. 1s1. introduction web usage mining , also known as web log mining, aims to discover interesting and frequent user access patterns from the data derived from the interactions of users while surfing the web. the web browsing data can be",NOTUTILIZE,MENTION
75102848,73681071,"eatly, mimicking contact inhibition of growth. we model the attractive and repulsive interactions utilizing an extended hertz-model that yields an appropriate description of the cell-cell interaction . this model approximates cells as homogeneous, isotropic, elastic and adhesive spheres. once cells get into contact, cell-cell adhesion initially leads to an increase of the interaction area accompan",UTILIZE,EXTEND
28424594,29141250,"at the edf strategy is optimal when the values of all packets are identical. turning to the arbitrary values case, the best known deterministic online algorithm has a competitive ratio of about 0.547 (see also 28 ), while it is known that no deterministic online algorithm can achieve a competitive ratio better than 1 0.618 20, 9, 3 . focusing on the randomized setting, the best online algor",NOTUTILIZE,MENTION
7342019,7683086,"model the accent types and syntactic boundaries. the training and the recognition were done by em algorithm and viterbi algorithm respectively. in the previous paper for syntactic boundary detection , the best result was obtained when the number of states coincides with the number of morae under the observation. therefore, in the present paper, these two numbers were made equal throughout all the",NOTUTILIZE,MENTION
26175691,26904772,"large latency variations for a large set of destination nodes 31 . therefore, to further improve the s-torus algorithm, robinson et al. proposed the multi-phase multicast routing algorithm: m-torus . the idea was to shorten the path lengths of the multi-destination worms to stabilize the latency variations and to achieve better performance by partitioning the multicast group. they introduced two",NOTUTILIZE,MENTION
45344477,44394651,ountable union of proper algebraic sets. in the usual differential galois theory the tannakian approach is a base for algorithms computing differential galois groups which are linear algebraic groups . in the parametrised theory the galois groups are linear differential algebraic groups and the tannakian theory that we develop should contribute to computation of these groups. tannakian approach fo,NOTUTILIZE,MENTION
14432907,15478979,"ected joint histograms, and to guide the transformation towards the expected joint histogram. the feature-based registration algorithms extract features such as surfaces, curves 3 or skeletons 1 , at the preprocessing steps. they are faster than intensitybased methods but comparatively less accurate 4 . also, the extraction of skeletons can be sensitive to noise 9 . therefore, registration a",NOTUTILIZE,MENTION
71472517,70587288,"ributes and constraints limit the potential search space for a match significantly, the computational complexity of this algorithm is usually still manageable, as shown in the experiments reported in . for applications where large query graphs occur a novel approximate approach for querying graph databases has been introduced in 86 . this algorithm proceeds as follows. first, a number of importan",NOTUTILIZE,MENTION
169161721,150501144,"ugh casr mrna was not detected in this study, casr mrna and or protein and calcimimetic responses were demonstrated in rat and human smc by others farzaneh-far et al., 2000; smajilovic et al., 2006; ; ivanovski et al., 2009; alam et al., 2009 . farzaneh-far et al. showed that calcium and casr agonists induced mgp promoter reporter expression in rat aorta smcs. however, casr transcripts were not d",NOTUTILIZE,NOTALGO
60264512,59666442,"3 on the same set are isomorphic if there is a permutation sym( ) such that i i for all i 1, 2, 3 . an automorphism of a bitrade is defined similarly. we follow the presentation in . in the context of an algorithm for enumerating combinatorial objects, the domain of a search is the finite set that contains all objects considered by the search. the search space is conveniently",NOTUTILIZE,MENTION
28117382,28825030,effort by using the same proof steps for multiple algorithms the quest to find repeatable steps or a general methodology for constructing concurrent algorithms is not a new idea. a paper by herlihy outlines a precise methodology for constructing concurrent algorithms. another line of work revolves around building powerful primitives. the idea being that one could use these primitives as buildin,NOTUTILIZE,NOTALGO
9592747,10166832,"s more reasonable to use this as our base-line. the worse the base-line comparison algorithm chosen, the better other algorithms appear to be. by choosing negascout enhanced with aspiration searching iration negascout) as our performance metric, and giving it a transposition table big enough to contain all re-search information, we are emphasizing that it is possible to do better than the quot;be",NOTUTILIZE,MENTION
84437338,81560019,"as been some evidence presented by other researchers ann nucl med sci 2001;14:161-172 vol. 14 no. 3 september 2001 162pet reconstruction-based estimation of scatter in pet supporting this hypothesis . the study of convergence properties of the mlem algorithm by fourier analysis revealed clearly the non-uniform frequency response of the em algorithm 18 . moreover, preliminary investigations of in",NOTUTILIZE,NOTALGO
79636683,77524648,"lustering results. 1. introduction recently, there have been many algorithms proposed for nonlinear dimension reduction, which include isomap (tenenbaum et al., 2000), locally linear embedding (lle) ( ), kernel-lle (ham et al., 2004), hessian lle (donoho grimes, 2003), local tangent alignment (zhang zha, 2004), laplacian embedding (hall, 1971; belkin niyogi, 2001), and many variations. above",NOTUTILIZE,MENTION
12008710,12854371,"his section we employ a graph-rewriting approach to transform a soa to a sore. our algorithm rewrite is related to the usual state-elimination algorithm transforming an automaton to an re (cf., e.g., ). however, in a transformation step, we do not replace a state by introducing edges but rather replace a suitable set of states by a single state. further, there are rewriting steps which only remove",UTILIZE,USE
28729494,29420696,"pects based on a large set of real web sites. finally, we report the performance of the near mining algorithm. note that we do not compare our approach with existing techniques for efficient crawling as these techniques are page-level strategies and orthogonal to our problem. we are not aware of any publicly-available site-level web archive maintenance techniques. 6.1 empirical examples dataset.",NOTUTILIZE,NOTALGO
40468411,39000565,"order to preserve linearizability. second, adding a new phase to an object composed of n phases built ad-hoc may require deep changes to all of the n existing phases. thecaseofstatemachinereplication (abbreviatedsmr), usedtobuildrobustlinearizableobjectimplementations,illustrates thoseproblems.non-speculative smralgorithmslikepaxos 7 or pbft 6 are notoriously hard to understand. the formal corre",NOTUTILIZE,MENTION
9019416,9526579,"s to perform several acknowledgments concurrently. 8.3 previous work since the introduction of the time warp protocol, several algorithms have been proposed to compute gvt in a message passing system . with the exception of 8 , all of these algorithms share the property that they use the host communication network of the message passing computer to compute gvt. since inter-processor communication",NOTUTILIZE,MENTION
13536424,14524456,) algorithm we obtain for the data type two-dimensional array (n is the number of elements in the input array) with max replaced by min is described by dijkstra 36 . the algorithm given by smith for the same problem is a catamorphism on the bird malcolm data type two-dimensional array with the same time-complexity. i am not aware of other work on maximum subarray sum algorithms on arrays of,NOTUTILIZE,MENTION
23059082,24040807,"atabase schemas, which are suitably precise for the purpose of impact analysis but still computationally feasible. the precision of our analysis comes from using a recognised k-cfa contextsensitivity , but with a higher value of k than used in previous related work. we reduce the computational cost by reducing the size of the original program through program slicing. our implementation of both pro",UTILIZE,USE
94217988,89476200,"gn for marker extraction, which makes use of both luminance and color information. in the third step, we use a region-growing algorithm to assign the remaining pixels, which follows the principles of with a modification on color distance definition. iii. image simplification in image segmentation, images are first simplified for ease of segmentation. many standard morphological filters are often",UTILIZE,USE
30383704,31107300,successful on stochastic textures (e.g. stucco) but fails on deterministic textures (e.g. bricks). el-maraghi 7 has provided a public domain implementation of their algorithm. igehy and pereira integrate a composition step into heeger and bergen algorithm in order to erase flaws (e.g. stains or undesired features) from images. they manually create a mask which indicates which part of the,NOTUTILIZE,MENTION
