contextID,citationID,clean__citation_context,UTILIZE_LABELS,USAGE_LABELS
37556520,36395945,"tress at (version 2), written by j m sprauel. the program allows us to choose between different algorithms: the middle of chord at a given level (usually 40 of the net height), the centred centroid or the parabola method. the background can be modelled by a straight line and removed or not. the six possibilities (three methods with or without background removal) were tried for each material. th",NOTUTILIZE,MENTION
10760054,11464380,"d, and can instead focus on problems unique to that community. using xml also provides a common basis for interoperability that can easily leverage techniques such as semantic mediation 12 and xslt , and assist with automated provenance management. finally, by building libraries for formats such as netcdf, hdf5, grib, and others on a common bxsa implementation, they can avoid duplicating code fo",NOTUTILIZE,MENTION
44281210,43070688,"ion times in order to test the improvement of the chain metropolis algorithm, we studied the two-dimensional hard disk system in the nv t ensemble in the vicinity of the transition density c 0.898 , where is given reduced units. we used a square box with periodic boundary conditions and measured the normalized autocorrelation function o(t) for an observable o which is defined as o(t) o(0",NOTUTILIZE,NOTALGO
1496902,1585927,"ordered plans with conditional branches for observed uncertainties. details of the algorithm are in 37 . the ideas from this algorithm are now used in several other planners and algorithms including . see section 3.1. 1 planning impact future subtask plans generation techniques and methods influenced techniques being extended in other planners such as arpa--made program. 18, 20, 8, 27, 34, 29 .",NOTUTILIZE,MENTION
9770744,10364520,edges. theorem 3 the multiple updates mst problem can be solved in parallel in time o(lg n lg k) using nk lg n lg k erew pram processors. proof. the algorithm follows in general the one presented in but in certain parts uses different implementation techniques to achieve the tighter time and processor bounds. the algorithm consists essentially of three parts. 1. make k copies of t and solve k up,NOTUTILIZE,NOTALGO
47025253,46173103,"ations. there is extensive literature on how to find and fix data races efficiently. dynamic detectors may track the happensbefore relation 14 , implement the lockset algorithm 34 , or combine both . static race detectors may make use of aclass sorrunner implements runnable double g ; volatile long sync ; compound public void run() . . . for (int p 0; p 2 num iterations; p )",NOTUTILIZE,MENTION
78717000,76711485,"s was a prefilter for slam processing, thereby reducing the effects of moving objects in corrupting the map that was being built. object tracking algorithms used the interacting multiple model (imm) ( ) for probabilistic data association. a related project addressed the tracking of pedestrians and other moving objects to develop a collision warning system for city bus drivers (thorpe et al., 2005).",NOTUTILIZE,MENTION
63667799,62752621,"ever, similarly to the previous studies on hpsg parsing, these groups had no solution to the problem of exponential explosion of unpacked parse results. as discussed in section 6.1, geman and johnson proposed an algorithm for maximum entropy estimation for packed representations of lfg parses. recent studies on ccg have proposed probabilistic models of dependency structures or predicate argument",NOTUTILIZE,MENTION
83657233,80887294,"reporting tar 98.13 at far 0.001 on the ice2005 dataset. unfortunately, techniques based on random projections may be compromised by ica-based attacks, and as such, may have unsolved security issues . other transform schemes such as 15, 24 reduce iris data in such a way that they significantly reduce performance compared to the baseline algorithm.because iris codes are generally represented as",NOTUTILIZE,MENTION
16136421,17261250,"ng a resolution parameter, similar to the way we treat the definition of connectedness. there are already a number of algorithms for computing homological invariants, such as betti numbers, from data . we are currently investigating ways to formalize the relationship between the homology of a set and the homology of a finite point-set approximation to it. the ability to characterize the connectedn",NOTUTILIZE,MENTION
86624032,83383914,"ying the independent components for w1,w2,...,wk. the independent components are found using a clique finding algorithm applied to gind. several sequence level optimization have also been proposed in . in the subsequent discussion we will focus mainly on an enumeration level optimization. na vly enumerating all possible n k sequences of words and finding a sequence with the best score, as outlined",NOTUTILIZE,MENTION
40888566,39391098,"hm identifies blocks as moved, added, unchanged, removed, and modified. it also includes a name matching algorithm to capture renaming of program variables that is based on the work of neamtiu et al. . a similar approach is also applied by the ast comparison algorithm to capture renaming of methods. one of the challenges of matching java anonymous and inner classes is the absence of unique names.",NOTUTILIZE,MENTION
153926863,135323771,"ser interface. to implement some features of our web site (e.g., getting the entire list in a drop-down list or using some special tags in a html table), we had to use a couple of tomahawk components , like datalist and datatable. these components enrich the standard jsf implementation. at the current time, the interface consists of the following main web pages:",NOTUTILIZE,NOTALGO
29089063,29774497,e of the notion of constructing ;t siei-e . to sol -e (5.1). legendre suggested the continued fraction expansion of 6. tliis rnethocl vas further de eloped in 1931 by d.h. lehrner and r. e. powers to give a factoring algorithm. to go into the details of it would take us too far afield. but m must mention the work of llarrison and brillhart 32 in 1970. prior to this. the method was considered,NOTUTILIZE,MENTION
66536876,65295957,"ss corresponds to a uniform distribution 4 , 5 , and for large networks, the two distributions are equivalent for all practical purposes. many different routing algorithms exist for ad hoc networks , 7 , but common to all of them is the fact that at each hop, progress shall be made towards the destination. this generic routing strategy is illustrated in fig. 1. if the nearest neighbor within a",NOTUTILIZE,MENTION
17786985,18967195,"equired. for example, a 3 2-approximation algorithm for offline coloring of unit-bandwidth paths in trees with uniform edge capacities follows easily from the known results for the unit-capacity case , but nontrivial new techniques were needed to obtain a 4-approximation for the case with arbitrary capacities 6 . similar observations can be made for the throughput version of such problems (i.e.,",NOTUTILIZE,NOTALGO
46811605,45989054,"on algorithm for pips. multi-criteria optimization there has been considerable research on multi-criteria (approximation) algorithms in scheduling, network design, routing and other areas: see, e.g., . the motivation is to study how to balance multiple objective functions under a given system of constraints, modeling the fact that different participating individuals organizations may have differin",NOTUTILIZE,MENTION
3171888,3273373,hitt 26 which require less computational effort. qbd (quasi-birth-and-death) chains are special cases of m g 1 type markov chains and include the map ph 1 queue as a subcase. latouche and ramaswami have presented a logarithmic reduction algorithm for finding the matrix-geometric rate matrix for qbd chains with a quadratic convergence rate. the extension of the n g 1 queueing model to the case o,NOTUTILIZE,MENTION
40853221,39363460,"rmation operators, but also operators for self-optimization regarding, e. g., parameter settings of learning algorithms. since the true quality of learners depends on the quality of their predictions , the considered learners are directly involved in the model selection run on real-life benchmarks. using this approach allows to find the best learner with the highest performance increase for a part",NOTUTILIZE,NOTALGO
201657233,239180883,"ctly skipped if necessary. a brief comparison of runs between galago and indri2 show comparable execution times between the two systems. we use the query likelihood variation of language models (lm) ( ) as one of the base data points, where we have high-speed execution for a base amount of retrieval accuracy. we call that ql. additionally, we apply maxscore to that algorithm to create ql-ms, a fast",UTILIZE,USE
15963209,17080641,"projections are the most popular data acquisition format used in ct, pet and spect. in this section we will derive the corresponding fbp algorithm for fan-beam projections. since the fbp algorithm in degenerates to the standard fbp algorithms in hn77, horn79 , so we only present the derivation of fbp algorithms for attenuated fan-beam projections. assume that the source positions are located on",NOTUTILIZE,MENTION
7150733,7477270,improvements to the two basic connected component algorithms we described. here we mention some of them. the deterministic algorithm can be improved to run in o(log n) depth with the same work bounds . the basic idea is to interleave the hooking steps with the pointer-jumping steps. by a pointer-jumping step we mean a single step of point to root. this means that each tree is only partially contra,NOTUTILIZE,MENTION
19648065,20857554,"of user revocation over 100 trials. the results are shown in figures 4-5. regarding our algorithms, we consider degrees 3, 4 and 5. we also experimented with these degree values for the algorithms in and selected the version with the minimal cost. based on these figures, as the degree of the hierarchy increases, the rekeying cost reduces due to the reduction of the height h of the hierarchy. from",UTILIZE,USE
19546661,20755427,"4.2760) sp max maxvalue(f,46) labeled as(f, n3) we have built an ontology inference engine, ontoengine, which can be extended to implement this kind of optimization (transformation) for axioms . the inference process will continue until no rule can be trimmed anymore. 5. discussion and future work in this paper, we have outlined a new framework for mining erp ontologies based on clustering,",UTILIZE,EXTEND
4643007,4797426,") special case of the problem is max cut problem with given sizes of parts where for some psn 2 , x 1 delta delta delta x p 0 and x p 1 delta delta delta x n 1. ageev and sviridenko applied a novel method of rounding linear programming relaxations and developed a 1 2 -approximation algorithm for this problem. they also obtained a similar result for a more general max k-cut probl",NOTUTILIZE,MENTION
202048549,239742529,"accurate as the post-placementstiming analysis. in other words, it is concerned that setup andshold time constraints may be violated after placement.stherefore, we use a standard timing analysis tool aftersplacement to verify our skew scheduling algorithm andsexamine that timing constraints have not been violated. thestiming constraints have been calculated based on minimumsclock period obtained",UTILIZE,USE
27391232,28099513,"ightened formulations are considered as reformulations 96 . an effective and novel nlp solution algorithm based on blending two completely different formulations for the same problem is described in . the mathematical programming glossary 84 defines reformulation as obtaining a new formulation of a problem that is in some sense better, but equivalent to a given formulation. the main purpose",NOTUTILIZE,MENTION
11150084,11903983,"ample provider that implements the naive bayes algorithm. netz 18,19 presents an useful overview that describes the ole db for dm technology. siedman brings out an excellent reference to sql for dm . however, the task of creating a provider and implementing an algorithm remains complex due to the lack of discussion about experiences in doing this work. the main objective of this paper is to desc",NOTUTILIZE,MENTION
22810373,23818204,"the nonlinearities within the nodes. it is found that a three layer nn with the backpropagation learning algorithm can model a wide range of nonlinear relationships to a reasonable degree of accuracy . there are typically two steps involved when using neural networks for control: system identification and control design. in the system identification stage, there is designed a nn model of the contr",NOTUTILIZE,MENTION
82133571,79651338,"tive conditions needed for k-plex, e.g., each node has at least n neighbors in the group. however, qgraph does not have notion of groups to succeed in such selection. many efficient algorithms (e.g., ) were proposed for selection of social formations exhibiting certain structural characteristics (e.g., regular equivalence, n-clique, k-plex, n-club), and implemented in such popular social network a",NOTUTILIZE,MENTION
41713644,40105071,"al or global information draw from the graph. agarwal 1 proposed to model the data by a weighted graph, and incorporated this graph structure into the ranking function as a regularizer. guan et al. proposed a graph-based ranking algorithm for interrelated multi-type resources to generate personalized tag recommendation. liu et al. 17 proposed an automatically tag ranking scheme by performing",NOTUTILIZE,MENTION
1895771,2009507,"erfaces. instead of building a new application from scratch, we incorporated our device into an algorithmic music application that had been written for a master s thesis at the university of colorad . the application generates, in real time, a variation on a midi sequence by mapping musical segments to regions of a three dimensional chaotic attractor. a new trajectory, beginning from a different",NOTUTILIZE,MENTION
9911945,10518358,"data. unfortunately, the existing model-based parameter estimation algorithms for 2-d nmr data are still sensitive to measurement noise, which limits their frequency resolution. the subspace methods , which provide high-resolution estimation in many signal processing applications, are good candidates for nmr spectroscopy to further improve the frequency resolution. multiple signal classification",NOTUTILIZE,MENTION
65640452,64415007,"m (m1,m2, ,ml) that maximizes (m), for given n, l, pn (n),and (r). various algorithms have been proposed in the literature to find approximate or exact solutions. the approximation algorithms of assume the convexity of the rate-fidelity function, but cannot guarantee the global optimality of the solution even under this assumption. among the globally optimal algorithms, the most efficient ar",NOTUTILIZE,MENTION
13251489,14214563,"earing and scaling deformations. however, for a non-rigid transformation, the method performs poorly. another popular method for point sets registration is the iterative closest point (icp) algorithm , which iteratively assigns correspondence and finds the least squares transformation (usually rigid) relating these point sets. the algorithm then redetermines the closest point set and continues unt",NOTUTILIZE,MENTION
4232017,4374478,"mined for known bounds on message delays. we are also aiming at enhancing distributed programming environments by priority support in a posix-like manner 20 , e.g. within our dsm-threads environment . the resulting algorithm works asynchronously in out-of-order message systems while we assumed ordered message delivery in our previous work 13 . in the following, the algorithm is derived from a no",NOTUTILIZE,NOTALGO
28525413,29245283,"mitives and define the behavior of these primitives using an operational semantics. among other programs, they develop round-robin and work-stealing schedulers using these primitives. sulzmann et al. compare the performance of different primitives for implementing a concurrent linked list. this comparison should be useful in extending and improving the performance of my implementation. 136chapte",NOTUTILIZE,MENTION
10450620,11120884,"ing and randomization techniques: many of the most successful approaches are based on computationallyintensive techniques such as randomization and resampling. for example, white s bootstrap approac is based on resampling. similarly, randomization tests have been employed in several knowledge discovery algorithms 3,1 . 5. conclusions the panelists sometimes differed in background, perspective o",NOTUTILIZE,MENTION
11908514,12745025,"this information to statistically estimate the interarrival times of references to a clip. when choosing a victim, it selects the least recently referenced clip across its last k requests. greedydual is a spectrum of algorithms. one algorithm considers a cache of pages with the same size and different costs to fetch from secondary storage. the algorithm assigns a priority value, , with each cac",NOTUTILIZE,MENTION
28185015,28892096,"uch as the cases covered in this paper. because our algorithm is to a limited extent reasoning about the teammate reasoning about itself, it is in fact engaged in a special case of recursive modeling . indeed, one question that remains open is what happens when the teammate is also trying to select actions that would cause the agent to shift policies. in this case, our agent would have to address",NOTUTILIZE,MENTION
15448293,16549295,"o eliminate causes of resistance toward using km programs. if employees are not ready for km implementation, technology construction may provide very little incentive for the adoption of a km program . if indeed employees are resistant to adopting a specific km program, the goals and the performance of km may not be achieved 111 . to improve the efficiency of km implementation, recognition of the",NOTUTILIZE,NOTALGO
157407819,138442742,"algorithm by using the fifo with second-chance algorithm. figure 1 shows the active, inactive, and free lists in a memory reservation, following the design of the mach page replacement implementation . each memory reservation has these lists and moves pages according to page references. the memory reservation allocates pages from the free list when a page fault has occurred. a page scan is trigger",NOTUTILIZE,MENTION
13789519,14795447,"d services. together, these two protocols contribute to the scalable and decentralized features of the tuxedo system. 1 introduction peer-to-peer systems have increasingly become a hot research topic . however, in the context of peer-to-peer (p2p) computing, most of the research projects focused on routing algorithms and efficient query search mechanisms. currently, major applications of peer-to-p",NOTUTILIZE,MENTION
202413844,240266236,"easonable number of the remaining true -las keys (we use one-fourth as our rule) without incorrectly classifying many false class keys. when this occurs, we use the basic isodata clustering algorithm to divide the remaining true class keys into two clusters, ,nd then apply the minimum-cost hk algorithm to each cluster separately. for difficult pr problems (for which this algorithm is intended) su",UTILIZE,USE
13789261,14795098,"cryption scheme 9sconstructed from these ideas as a kem-dem construction. it should be noted that not every hybrid encryption scheme can necessarily be phrased as a kem-dem construction: whilst ecies can be viewed as a kem- dem construction, epoc-2 34 can not. a kem is a triple of algorithms consisting of: 1. the key generation algorithm, gen, which takes as input a security parameter 1k and ou",NOTUTILIZE,NOTALGO
6132948,6362558,"vocated in 9, 89 , and this is one of the post-processing options in chaco 53 . bui and jones have implemented a multilevel kernighan-lin algorithm to improve the quality of the partitions computed . the kernighan-lin algorithm has been used to partition the coarsest level and to refine initial partitions within multilevel partitioning algorithms, as described in section 6. gilbert and zmijewski",NOTUTILIZE,MENTION
19117130,20314813,"they offer 41 . the transition to a distributed memory system requires the partitioning of the database among the processors, a procedure that is generally carried out indiscriminately cheung et al. presented an algorithm called fdm. fdm is a parallelization of apriori to (shared nothing machines, each with its own partition of the database. at every level and on each machine, the database scan",NOTUTILIZE,MENTION
231973993,196696551,"e dcl ko lines, with tcv maintaining a replicative advantage.ssincesthese experiments were performed, it has become clear that there is significant geneticsredundancy in antiviral silencing pathways ( ; gasciolli et al., 2005).shence our results cannot completely rule out the possibility of the involvement of thessilencing pathway genes in the absence of testing multiple knock out lines as recently",NOTUTILIZE,NOTALGO
32317292,32724843,"re the books by higham 96 and muller 135 . older references include wilkinson s classics 176, 177 . collins, krandick and lef vre proposed algorithms for multiple-precision floatingpoint addition .modern computer arithmetic, 3.8 129 the problem of leading zero anticipation and detection in hardware is classical; see 147 for a comparison of different methods. the idea of having a short pro",NOTUTILIZE,MENTION
154470543,135810598,"n and un to be minimized. as a heuristic algorithm to solve the encoder problem we use the belief propagation with decimation. the algorithm is similar to the message passing algorithm described in , 31 . the algorithm description is presented in fig. 5, and the equations to compute the messages in fig. 4. the notation ma b is for the message passed by node a to node b. all messages have two co",NOTUTILIZE,MENTION
10876753,11602392,"simple euler scheme has proven sufficient in our experiments. of course, we could resort to higher-order schemes, such as the total-variation diminishing runge-kutta scheme of third order devised in . 3.3.4 overview of the algorithm for sake of clarity, we give an overview of our implementation of lspc in algorithm 1 below. algorithm 1 algorithm for level sets with a point correspondence for all",NOTUTILIZE,MENTION
103068206,96288305,"e, lasting for at least 3 days and for which the patient sought medical attention. the american thoracic society (ats) indications for hospitalization of patients with copd exacerbations were applied . patients were excluded when: 1) there was a personal or family history of asthma (defined as episodic wheezing or dyspnoea that rapidly improved with treatment) or atopy, 2) invasive or noninvasive",NOTUTILIZE,NOTALGO
71594703,70692912,"r inputs loaded into memory before running. fixed length gram-based: ed-join 8 and winnowing 16 . variable length gram-based: vgram-join 11 , 12 . tree-based: b ed -tree 21 and trie-join . enumeration-based: partenum 7 and ngpp 23 . vchunk-based: vchunkjoin and vchunkjoinnolc. vchunkjoin is our proposed algorithm equipped with all the filterings and optimizations. when comparin",NOTUTILIZE,MENTION
81015545,78698896,",b were used to assign the structures. our research work was finally extended to study the fusion of starting hydrazide 4 with phthalimide to afford 3- (6,8-dibromo2methylquinazolin-4-yloxy)methyl -5h triazolo 3,4-a isoindol-5-one (15, scheme 3). scheme 3. further reactions of 2-(6,8-dibromo-2-methylquinazolin-4-yloxy)acetohydrazide (4). r ncs r o nh nh (12a,b) s nh r 5 na2co3 n n r n r (13a,b)",NOTUTILIZE,NOTALGO
1484252,1571839,"to be correct. the adjacent-diagonal stencil with this correctness criterion looks promising. 5.5 adjacent-diagonal difference schemes tsitsiklis presented a first-order accurate dial-like algorithm for solving static hamilton-jacobi equations that uses the diagonal as well as the adjacent neighbors in the finite differencing. (in k-dimensional space, a grid point has 2k adjacent neighbors and a",NOTUTILIZE,MENTION
38096378,36765511,"n. then, we computed the fusion of these two bands using the algorithm in section ii, both with a euclidean metric and the locally-adaptive metric in section iv, as well as with the wavelet method in , using a haar basis. the best possible result is obviously to recover the original noise-free image, with no corruption from the artificial noise band. measuring the departure from the optimal result",UTILIZE,USE
202118237,239843860,"lo (mcmc) technique is utilized to estimate the parameters.s metropolis-hastings within gibbs samplersgibbs sampling (gelfand and smith, 1990), along with the metropolis-hastingssupdating algorithm ( ; gelman, 2004) is employed to infer thesposterior estimates of the parameters in the hierarchical equation. as an initial step,sthe uniform priors ranging from ,sare considered for the mean la",UTILIZE,USE
201813537,239403825,"ctors on linear optics measurements based on the ac dipole. we compare two algorithms for the data processing, an interpolated fft refereed to as sussix 5 and the singular value decomposition (svd) . model parameters of interest in this paper are phase advance between two adjacent bpms, , and -function at bpms, . we use a simple statistical model describing the effect of white noise in the b",UTILIZE,USE
26051794,26788558,"r programming relaxations 22 , cutting planes 11 and branch-and-cut 20 . besides algorithms for generic ilp, algorithms specific to pbo have also been proposed. these include sat-based algorithms , branch-and-bound algorithms 8 and sat-based algorithms with lower bounding 17, 18 . this section addresses algorithms for pbo that are relevant to the work described in the paper. we briefly over",NOTUTILIZE,MENTION
