contextID,citationID,clean__citation_context,UTILIZE_LABELS,USAGE_LABELS
3313019,3413433,"variants of the experts algorithm and are (1 e) optimal with respect to the best static list. in this section we reapply the experts technique, this time using algorithm a (or b) and algorithm comb as the two experts. through this we can achieve both (l e) static optimality and (1.6 e) dynamic optimality simultaneously. the key idea is to use one of the experts for some number of accesses, and",UTILIZE,USE
8280822,8708873,aper we used 2 0.15 . the value of 1 is determined by the fact that 1 2 1. a.4 rewriting to presence weighting algorithm similar to the probabilistic model of robertson and sparck-jones probability measures for ranking documents can be rewritten into a format that is easy to implement. a presence weighting scheme (as opposed to a presence absence weighting scheme) assigns a zero wei,NOTUTILIZE,NOTALGO
1624622,1717733,"and as the logic we take an appropriate extension of the theory of real addition. a definition of semantics of algorithms of this type is given, without infinitesimals as compared to our previous one , however under a condition not too much restricting for applications. then we represent the semantics in the mentioned logic, and give a proof of correctness of a general railroad crossing controller",NOTUTILIZE,NOTALGO
9012376,9518795,"eled by generalized linear model (glim) theory 10 . accordingly, we extend the irls algorithm in 9 to the m-step of the em algorithm for the iohmm instead of the original gradient ascent method in . experiments demonstrate that the improved em algorithm yields significantly faster training than the original one. the remainder of the paper is organized as follows. section 2 briefly reviews the i",UTILIZE,EXTEND
11785332,12607978,"the opponent and result in decreased utility to the agent. it is therefore not feasible for agents to exchange their private information. we therefore extend the single stage negotiation protocol of by introducing a mediator. the mediator, that is assumed to be a neutral agent, obtains the required information from the two participants, and allows the players to improve their utilities by identi",NOTUTILIZE,NOTALGO
16004066,17123303,"works only for the cubic lattice, but not for the fcc-lattice which is much better suited for modeling real protein conformations. the second improvement is the appearance of approximation algorithms for different lattice models. despite their indisputable merits, their approximation ratio is still too weak to be used in practice. an approach of predicting structures using a fcc lattice-model and",NOTUTILIZE,MENTION
20055978,21275238,"vinced by a plan for transportation from lille to ottawa which costs less than 1050 euros (the argument a). we have formalized here a protocol to reach a practical agreement. since this paper extends , we can warrant as in 8 that the dialogue are finite and leads to an agreement. 7 related works classicaly, argumentation has been mainly concerned with theoretical reasoning to check beliefs verac",UTILIZE,EXTEND
21365111,22503003,"ted or decreased. the coherence overhead is classified by means of an extension of an existing algorithm 14 to the case of passive sharing, finite size caches, and process migration. this algorithm is based on the analysis of access patterns to data.s3 methodology and workload the methodology that we used is based on trace-driven simulation 20 , 15 , 27 and on the simulation of the three ke",NOTUTILIZE,MENTION
27463451,28173408,n. the main contributions of our research are as follows: 1) we extend previous feature line detection methods in a way which performs much better with typical noisy range images (suggestive contours are an example of the kind of feature lines intended). 2) we present a strategy for generating long smooth feature line paths which can be flexibly used as a basis for various stylization approaches.,NOTUTILIZE,NOTALGO
45582574,44676017,"omehow be specified. in our attempt to implement this concretely we will tackle equation (2.33) perturbatively, basically extending isaacson framework for small perturbations over a curved background to allow for the presence of conformal fluctuations. if we succeed, the intuitive picture of vacuum spacetime that would emerge is that of a smooth manifold presenting, at the random scale , metric",UTILIZE,EXTEND
59475372,58732005,"load and renewable availability, to allow controlled experimentation but provide realistic findings. we now explain the system model and formulation of online glb which extends the model presented in to include energy buffering and to account the electricity cost per peak power draw from the grid.4 zahra abbasi, madhurima pore, and sandeep gupta glb for interactive jobs can be generally modeled",NOTUTILIZE,NOTALGO
68613095,67256620,". the history of this problem and related works are summarized in 8 and will not be repeated here. our reasons to extend this work to the lattice case are: (i) to show that the methods initiated in , and later developed in 8, 9 for longer time scales, can be applied to a lattice setting as well; (ii) to make a connection with the extended state conjecture of the anderson model. 2anderson (de)",NOTUTILIZE,NOTALGO
75091712,73672399,"hing of each person 16 . in this work, we extend a previous work for 3d human motion capture by registering a 3d articulated human body model on video sequences using both color and edge information . we present a detailed analysis of the precision and processing time achieved by the color-based registration and the edge-based registration step. first, we introduce previous works related to 3d hu",NOTUTILIZE,NOTALGO
98876917,93097591,"e importance of documents on different topics, topical ranking methods 6 can be used, which is extensions of basic ranking algorithms, such as pagerank 7 and hits (hyperlink-induced topic search) . although these ranking methods are initially proposed for the purpose of ranking web pages, it can be also used to rank other kind of documents, such as research publications cited by each other, si",NOTUTILIZE,MENTION
101530357,95108749,"e the inference engine that is employed in a little more detail, before we go on to extend its capabilities. inference engine the reasoning of the inference engine involves the following stages (cf. ( )san elaboration): 1. the high-level modeling of ontology, facts and queries, which is all done in f-logic, is translated into a set of horn clauses.1 2. the horn clauses are processed using a strateg",NOTUTILIZE,NOTALGO
118066562,107276419,"s. 2. the kaapi programming model this section describes the high level instructions used to express parallel execution as a dynamic data flow graph. our instructions extend the ones proposed in cilk in order to take into account data dependencies. following jade 34 , parallel computation is modelled from three concepts: tasks, shared objects and access specification. however, while jade is rest",NOTUTILIZE,NOTALGO
103068206,96288305,"e, lasting for at least 3 days and for which the patient sought medical attention. the american thoracic society (ats) indications for hospitalization of patients with copd exacerbations were applied . patients were excluded when: 1) there was a personal or family history of asthma (defined as episodic wheezing or dyspnoea that rapidly improved with treatment) or atopy, 2) invasive or noninvasive",NOTUTILIZE,NOTALGO
203032699,241156611,"l with trypsin according to the method of shevchenko et al. (37). in-house proteomics pipeline software (proline) was used to process data. briefly, spectra were searched using the x tandem algorithm against the uniprot database restricted to p. putida entries (downloaded 7 january 2007). only proteins (i) with an x tandem table 2. primers used in this studya primerb sequence (5 to 3)c fadd nde",UTILIZE,USE
202606920,240541440,"y regulate ccnb1 expression. mirna-mediated activation of ccnb1 expression to identify candidate mirna(s) that may be involved in positively regulating ccnb1 expression, we used the miranda algorithm to scan 1-kb of ccnb1 promoter sequence for potential target sites complementary to known mouse mirnas included in the mirbase database (www.mirbase.org). by setting the prediction stringency level t",UTILIZE,USE
202264265,240052946,"rom 0; 1 , and the relative error in all experiments is 105. our algorithm has been implemented in c . we used the fast exponential, square root and reciprocal libraries in the cxml routines, fftw for the m2l translations, and petsc 2 for proling and for its krylov iterative solvers. all our tests were performed on the pittsburgh supercomputing center s tcs-1 terascale computing hp alphaser",UTILIZE,USE
202125290,239855795,"similarity is incremented for each such case. finally, the similarities are symmetrized and divided by the number of trees. 5.2.1 auxiliary data construction we used the random forest (rf) classifier for computing pair-wise similarities. the rf is an ensemble-based learning algorithm which constructs a set of 111 figure 5.3: auxiliary data construction for training a two-class random forest class",UTILIZE,USE
202048549,239742529,"accurate as the post-placementstiming analysis. in other words, it is concerned that setup andshold time constraints may be violated after placement.stherefore, we use a standard timing analysis tool aftersplacement to verify our skew scheduling algorithm andsexamine that timing constraints have not been violated. thestiming constraints have been calculated based on minimumsclock period obtained",UTILIZE,USE
202030123,239715720,"ucted using r software 6 . the algorithms used were the k-nearest neighbours (knn) 7 , the random forests (rf) 8 , the projection pursuit regression (ppr) 9 and the support vector machines (svm) from the r packages kknn , randomforests , stats and e1071 . regarding the feature selection, a well-known state-ofthe-art technique was used: principal component analysis (pca) 11 . the tested",UTILIZE,USE
201863949,239472997,"g problems, respectively. also, we express the resultssforenumeration of rna structures. in section 4, we use the additive algorithm for solvingslinear programming problems with binary variables only . the general notion of thesadditivealgorithm is based on testing a few number of possible solutions, m2s(in which m issthenumber of variables), of a problem instead of all solutions. in other words,",UTILIZE,USE
201813537,239403825,"ctors on linear optics measurements based on the ac dipole. we compare two algorithms for the data processing, an interpolated fft refereed to as sussix 5 and the singular value decomposition (svd) . model parameters of interest in this paper are phase advance between two adjacent bpms, , and -function at bpms, . we use a simple statistical model describing the effect of white noise in the b",UTILIZE,USE
201717569,239265568,"bchem or any other freely accessible database. searching with most common substructures to enable the user to search with common substructures, all compounds were fragmented using the recap algorithm . the 120 most frequent fragments containing a cyclic structure occurring as substructures in all streptomedb compounds are presented to the user for selection. data were stored in a postgresql databa",UTILIZE,USE
201676390,239209147,"e word) word ) -grams (up to ) 3) 3 , and class ) -grams (up to ) 5) 22 . we partitioned our vocabulary (of some 15,000 words) into 100, 300, and 1000 classes using the word classing algorithm of on our training data. s what do you have to live los angeles s s a. b. c. n. n. business news tokyo s s be of says i",UTILIZE,USE
1806142,1912095,"is model. in this case though, the model is fed piecewise (state-wise) to the execution monitor via a state extraction mechanism associated with the execution monitor. a special progression algorithm is used which evaluates formulas in a current state and returns a new formula which if true on the future states would imply that the formula is true for the complete time-line being generated. the d",UTILIZE,USE
2728032,2839828,"and contained significant noise. we reduced the size of image by half along each dimension and convolved it with a low pass filter to reduce noise. a different low-level tracker was used in this case , which incorporates robustness to intensity variations and a constant velocity tracker. the algorithm was run on both sequences with the same parameters. the trajectories obtained by establishing cor",UTILIZE,USE
3050114,3166450,"h a fixed finite object x on total arguments and the case when x 0 in a strong sense. the proof is by induction on the type, and in order to make the induction work we will use methods from normann . however, having nondeterministic if available, we may use the algorithm due to escard6 instead of the key algorithm in 6 , see the proof of theorem 3. we end this paper by formulating two problems:",UTILIZE,USE
10423009,11090895,"e switches. in their clustering algorithm, the clusters have bounded size and the notions of cluster splittingsand cluster merging are used to deal with the dynamic nature of the network topology. in the same group at bbn presents a heuristic technique for the formation of non-overlapping clusters for large self-structuring networks. according to the authors, the novelty of their scheme is that t",NOTUTILIZE,MENTION
13773444,14777836,"pixuq ps. fig. 3. pseudocode of the fast path algorithm. solution. besides the capacitance and delay , we also record the node and the buffer insertion on it. the algorithm uses a priority queue to sort the partial solutions and it is initialized with the first partial solution on sink with capacitance g, delay 0, and no buffer. each time, a partial solution with minimum delay is extracted",UTILIZE,USE
21235968,22386298,"noted by john et al 52 . recent comparative studies of these and more recent algorithms, applied to machine learning, include those carried out by dash and liu 26 , gordon and desjardins 42 , langley , siedlecki and sklansky 100 , jain and zongker 50 and kohavi and john 59 , the last of which is referenced in detail in subsequent chapters of this report. in general, feature subset selection",NOTUTILIZE,MENTION
26343310,27056521,"h (u, v) r(u, v), contradicting that f is a feasible solution for h 0 . the proof for the case s y is similar. in the rest of this section we prove lemma 4.4. we use a result due to wolsey about the performance of the greedy algorithm for a certain type of covering problems. a covering problem is defined as follows:s4 connectivity augmentation problems ( 0, 1 -costs) 12 instance: an in",NOTUTILIZE,MENTION
41781811,40174686,"al method with modulus 2 48 and multiplier 33952834046453. 2000 hpl-1.0 first release of hpl (09 09 2000). the pseudo-random number generator uses a linear congruential algorithm (see for example , section 3.2) x(n 1) (a x(n) c) mod m, with m 2 31 , a 1103515245, c 1235. the period of this pseudo-random number generator is 2 31 . 2004 numerical failure report gregory bauer ob",NOTUTILIZE,MENTION
14385210,15428330,"vide security services, e.g., user authentication, message con dentiality, and key distribution 24 . however, some of the security algorithms of the gsm architecture have recently been cryptanalyzed . to meet today s needs for wireless digital communication, the developed protocols need to be highly secure, requiring low computational overhead and thus low power. here, we introduce a new authenti",NOTUTILIZE,NOTALGO
21351668,22490603,"mputing equivalence classes under using suffix array in this section, we develop an algorithm that simulates algorithm 1 using suffix arrays. our algorithm is based on the algorithm by kasai et al. which simulates a post-order traversal on suffix trees with sa, rank and lcp arrays. asefficient computation of substring equivalence classes with suffix arrays 347 key feature of our algorithm is th",UTILIZE,EXTEND
76928910,75174069,"d in repeating an step which produces a more accurate solution. we will specify these iterative steps as an algorithm. if these algorithms are implemented, they lead to extremely efficient algorithms . the proofs of the theorems are just based on providing estimates of the newton step. to prove convergence, we provide a rather 109easy abstract nash-moser theorem, theorem a.2.1, which shows that,",NOTUTILIZE,MENTION
85091035,82114651,"(n 2 ) algorithm to solve the ccp on paths in section 3 and show how to extend this algorithm to interval graphs without any increase in time-complexity in section 4. since, the algorithm proposed in to solve ccp on paths is incorrect, it can be seen that the extension of the algorithm to solve the ccp in star-graphs and trees given in 4 is also incorrect. the ccp arises as an underlying graph",NOTUTILIZE,MENTION
613536,654884,"g the values of each sensor. fast distributed averaging algorithms are also important in other contexts; see kempe et al kdg03 , for example. for a body of related work, see kk02 , kkd01 , hhl88 , , kew02 , mfhh02 , vr00 , eghk99 , iegh02 , kssv00 , smk 01 , rfh 01 . we are also interested in algorithms for information exchange. here, a node that has sensed some data (image, pressur",NOTUTILIZE,MENTION
1397892,1482755,"y pictures in the picture library. each picture in the library is encoded with a semantic representation. matching between propositions and pictures is based on the algorithm presented in van deemter which selects the most informative picture whose representation contains nothing that is not contained in the proposition. for each picture that will be included, a leaf node of document representati",NOTUTILIZE,MENTION
2162045,2287519,etter generalization performance. evolutionary algorithm is an adaptive search technique based on the principles and mechanisms of natural selection and survival of the fittest from natural evolution . the interest in evolutionary search procedures for designing neural network topology has been growing in recent years as they can evolve towards the optimal architecture without outside interference,NOTUTILIZE,MENTION
5064588,5237216,"hereditary substrate (a bit string called quot;chromosome quot;). this new approach is an attempt to overcome problems raised by classical evolutionary paradigms in the design of behaviors. genetic a and evolutionary strategiess 4, 5 allow non-semantic manipulations of the genotypes (strings of bits or arrays of floats), inducing in most cases gradual modifications in the phenotypes. thus they e",NOTUTILIZE,MENTION
5155469,5334848,"ng from theoretical foundations to considerations of a more practical nature. while algorithms for answering queries using views are already being incorporated into commercial database systems (e.g., ), these algorithms will have even more importance in data integration systems and data warehouse design. there are many issues that remain open in this realm. of particular note are studying rewritin",NOTUTILIZE,MENTION
5310775,5487655,"rre cs.few.eur.nl euridis and department of computer science erasmus university of rotterdam p.o.box 1738, 3000 dr rotterdam the netherlands september 11, 1995 abstract inductive learning models 14 often use a search space of clauses, ordered by a generalization hierarchy. to find solutions in the model, search algorithms use different generalization and specialization operators. in this articl",NOTUTILIZE,MENTION
7816217,8189327,"ing mrr 53 and introduced for solving problems in the area of combinatorial optimisation skv83 . we present one version of the sa algorithm in pccp (table 5,) which follows the general schema of . prove( ). prove( true---moregoals ) :- prove( moregoals ). prove( tell(constr)---moregoals ) :- call( constr ), prove( moregoals ). prove( guardedgoals---moregoals ) :- islist( guardedgoals",NOTUTILIZE,NOTALGO
8025926,8427817,"scheduling comes within 4 of optimal. the literature on coloring algorithms for general graphs also includes more computation-intensive polynomial-time algorithms such as the berger-rompel algorithm , which colors any k-colorable graph using o((n log n) (1 gamma1 (k gamma1)) ) colors, and polynomial-time algorithms that color random k-colorable graphs optimally with high probability. (for a disc",NOTUTILIZE,MENTION
9217615,9751239,"o inter-processor link connections in such a way that the program execution time is minimized, are a subject of intensive research. since the scheduling problem is npcomplete for a general task graph , several heuristic algorithms have been proposed in the literature. the most common approach is list scheduling 1, 5, 12, 15 which relies on an initial task ordering according to a given priority a",NOTUTILIZE,MENTION
9460415,10018244,"twork at the same time, then maxfc;dg is a lower bound on the time it takes to deliver all packets. therefore, this result is tight up to constant factors. the proof relies on the lov asz local lemma , and hence is not algorithmic. in a followup paper leighton and maggs 11 use an algorithmic version of the local lemma due to beck 5 to give centralized algorithms for the problem. leighton, magg",NOTUTILIZE,MENTION
11251997,12019011,"near duration invariant of a timed automata can be done automatically. in fact, this problem has attracted a great deal of attention during last decade, since the introduction of duration calculus in . many algorithms have been proposed in the literatures, but all of them have high complexity and do not work for the general case. some restrictions are needed either on timed automata, or on linear",NOTUTILIZE,MENTION
11828522,12656295,"cted backjumping 6 , in which pruning of the search tree is achieved through look-back techniques. this provided a great improvement in both run-time and branching rate. learning was then introduced . this had much less impact than occurred in sat. while improvements were seen on some problems, the algorithms actually performed worse on others. recently, it has been shown that solution learning f",NOTUTILIZE,MENTION
12520191,13416190,"at evaluates in uence diagrams directly (shachter 1986), the two phase approachwas largely abandoned. none of the recent algorithms (cooper 1988, shachter and peot 1992, zhang at al. 1993a, zhang and b) needs a secondary representation. one reason for abandoning the two phase approach might be that people believe that direct evaluation is more e cient. however, all those algorithms that evaluate i",NOTUTILIZE,NOTALGO
13778566,14783493,"ength 53 . watermarking. audio watermarking can be achieved by time-scale modification if it is used to change the length of the intervals between relevant points of the audio signal to embed data . this algorithm has been shown to be robust to common audio processing operations like mp3 compression, low pass filtering and time-scale modification. with an appropriate time-scale algorithm the wa",NOTUTILIZE,MENTION
14697928,15761820,". general terms algorithms, documentation. keywords version control, program slicing, program slice encoding. 1. introduction software configuration management (scm) tools such as cvs 1 , subversion , and clearcase 3 are intensively used to perform version control and manage source code changes in modern software development projects. when submitting source code changes using these tools, best",NOTUTILIZE,NOTALGO
17115154,18272666,s it exhibits an exponential behavior in k. fork 4it has a runtime of the order of n 2 and in general it seems to have a runtime function that has the order of n k 2 . in another recent work rahmann apparently re-discovered hertz and stromo s dynamic programming method but in addition the paper also includes a clearer exposition of the problem and the algorithm. the paper also makes the importan,NOTUTILIZE,MENTION
17516691,18690492,"complexity in 25 depends on n (and hence, cannot be time-optimal). in addition, that algorithm of 25 requires a bound on the time that it takes to travel over a path of n nodes in the network. in and 1 , spanning tree algorithms for ad hoc networks with larger than o(diam) stabilization times are given. for an additional survey one can refer to 21 . finally, we note that the algorithm prese",NOTUTILIZE,MENTION
18370818,19560088,"cate memory space to guarantee message arrival, this is the case for aix 9 , it allocates space for user s data but not for controldata. also fast messages in its credit-based control flow algorithm preallocates space for both data and control-data for every other process in the system. portalsmpi 28 pre-allocates space for control-data, while data is dropped if no memory is available. we shoul",NOTUTILIZE,MENTION
21230597,22381469,"ction of many fields. while cognitive scientists seek the mental operations that enable readers to make the leap from symbols on a page to elaborate models of narrative worlds (gerrig egidi 2003; ), ai researchers explore the algorithmic nature of storytelling and build systems that interact with humans on narrative terms (mateas sengers 1999). narratologists distinguish between content and",NOTUTILIZE,MENTION
24449339,25323679,"of masks. however, the new algorithm is robust and because of its more bruteforce approach, it is more likely to be immune to algorithmic bugs that are associated with certain surface singularities ( ). figure 11 shows the complexity of the computation with the number of atoms. these numbers reflect the runtime after initialization of the masks, using a pentium iii, 750 mhz, running redhat linux v",NOTUTILIZE,MENTION
