contextID,citationID,clean__citation_context,UTILIZE_LABELS,USAGE_LABELS
65678909,64451832,"ction in 15 , 17 , as sift has been widely demonstrated successfully for multiple computer vision applications. recent extensions of the basic sift algorithm have been developed by ke and sukthankar by applying principal component analysis (pca) to the sift feature descriptor, which demonstrate a significant improvement in computational performance and improvements in object recognition performa",NOTUTILIZE,MENTION
73411233,72319475,"currently the dominant class of optical flow techniques is based on extensions of the variational model of horn and schunck. in particular, we use the large displacement optical flow (ldof) algorithm which integrates discrete point matches with a continuous energy formulation in order to obtain accurate flow for large displacements of small structures. this helps us track objects like limbs in hu",UTILIZE,USE
84703837,81787552,"h the same optimal performance as the original algorithm. actually, in trying to extend the applicability of adaptive wavelet-based methods, we had to rethink to some extent the adaptive algorithm in . the end result is an algorithmadaptive wavelet methods ii",NOTUTILIZE,MENTION
87083975,83735507,"in understanding the co-evolution of both gene regions in the presence and absence of directed selective pressure we extended our bayesian hierarchical phylogenetic model (hpm) (suchard et al., 2003; ) to allow for the simultaneous estimation of multiple gene regions across multiple patients and time points. this method was specifically developed to test the hypothesis of evolutionary interactions",UTILIZE,EXTEND
98876916,93097589,"performance of topic modeling. to quantify the importance of documents on different topics, topical ranking methods 6 can be used, which is extensions of basic ranking algorithms, such as pagerank and hits (hyperlink-induced topic search) 8 . although these ranking methods are initially proposed for the purpose of ranking web pages, it can be also used to rank other kind of documents, such as",NOTUTILIZE,MENTION
66822087,65555068,"ce, in addition to the expected fracture plane within the plasma membrane, a second and main plane within the cell wall when freezefractured preparations of cells are observed by electron microscopy ( ; chami et al., 1995; takeo et al., 1984); this plane is postulated to propagate between the mycolate monolayer, formed by the mycoloyl residues which esterify the arabinan termini, and the lipid laye",NOTUTILIZE,NOTALGO
202349589,240174695,"affinity chromatography, we identified proteins present in each purification using mudpit (25) (reviewed in ref. 7) (fig. 1a). to analyze mudpit data, we used the sequest algorithm (19) and dtaselect to assemble a list of proteins identified in each sample (26). we next determined which proteins were enriched in the halo-rela samples but not in control samples expressing the halo tag alone (halo-",UTILIZE,USE
202346183,240169840,"the rss target dynamically. 3.4 co-operation with ad hoc routing algorithm we implemented the proposed algorithm with the aodvjr routing algorithm 29 . the aodvjr is a simplified version of the aodv and is used as a routing algorithm of the zigbee protocol 4 . in the aodvjr, the route discovery procedure is performed through the route request (rreq) and the route reply (rrep) message exchanges,",UTILIZE,EXTEND
202257494,240043884,"we demonstrate the advantages f such an approach by applying it to a crosswell seismic monitoring. forward modeling next we present the 2d fdfd forward-modeling algorithm dalain, 1986; pratt, 1990; h ; hustedt et al., 004 used as the forward engine in our inversion method. this simlator models acoustic-wave propagation in an isotropic, lossless, ut inhomogeneous medium. the cartesian coordinates",UTILIZE,USE
201740297,239300215,"st free energy, or shortest length. in order to classify mirnas into families, all predicted mature mirnas were compared with themselves using the ssearch35 program in the fasta package (version 3.5) . using a single-linkage algorithm, mature mirnas with up to two mismatches were included in same clusters. mature mirnas were then compared with the mature mirnas in the mirbase (release 16) 37 usi",UTILIZE,USE
8208458,8630312,"0) 6 0 will be satisfied. (3) now let n ss1 and suppose that h 1 ; : : : ; h s ; l (s) s 1 ; : : : ; l (s) n are constructed. denote for brevity l (s) j l j , s 1sjsn. using the algorithm from , see also 8 , find all the points fx j g 1jn of the set v s . find a linear form l 0 with integer coefficients, such that l 0 (x j ) 6 0 for all 1sjsn . (4) let x j (x j;0 : : : : : x j;n ) 2 p n",UTILIZE,USE
8587040,9045223,"chieved the wide-spread use in practical applications that alpha-beta has. thirty years of research has found ways of improving the algorithm s efficiency, and variants such as negascout 42 and pvs are quite popular. interesting alternatives to depth-first searching, such as breadth-first and best-first strategies, have been largely ignored. in 1979 stockman introduced sss , which looked like a",NOTUTILIZE,MENTION
8605374,9066019,"ail (though without resolution) in dsp, but which we will not be concerned with further here. the second step, solution of equations, can be performed using huet s higher-order unification algorithm ( ). as pointed out in dsp, our analysis does not rely on the existence of a syntactic constituent in the source (for example, a vp) whose interpretation is also the interpretation of the missing materi",UTILIZE,USE
29769459,30454699,"as image patches with strong gradients in two directions. the motion of these features between consecutive frames is determined using a pyramidal version of lucas and kanade s optical flow algorithm , which uses a hierarchy of different resolution images to efficiently match sparse image patches between two frames. see figure 2(a) for a visualization of these features. as features are lost (moved",UTILIZE,USE
38946167,37544899,"urve, which allows them to use the tools from algorithmic number theory. in order to identify jacobians and class groups, they are restricted to work with a unique point at infinity. the algorithms and 23 for picard curves do not appear in this table as their point of view is different: they deal with the more general problem of reduction of divisors and they give only asymptotic complexity.",NOTUTILIZE,MENTION
40921081,39415338,"sifiers for this dataset. among these algorithms, the one which provided the best results was chosen as the algorithm for the final classifier. in this case, the sequential minimal optimization (smo) learning algorithm for training a support vector machine classifier was chosen. using leave-one-out cross validation, the precision (percentage of correct predictions) and recall (coverage percentage",UTILIZE,USE
59388362,58638108,"ts. namespace size, while some of the results were recently rederived by attiya and paz 11 using counting arguments. significant effort went into obtaining efficient deterministic algorithms, e.g., . we refer the reader to 16 for a survey of deterministic and long-lived solutions. panconesi et al. 32 were the first to use randomization, and gave an algorithm guaranteeing a namespace of size",NOTUTILIZE,MENTION
4506559,4657404,"ng problems are studied extensively in both fields of operations research and computer science 6 , 7 , 8 , 9 , 10 , 11 , 12 , 13 , 14 . for a set of independent periodic tasks, dhall and liu and their colleagues developed various assignment algorithms based on the rate monotonic scheduling algorithm 16 , or intelligent fixed priority algorithm 17 . however, if there exist precedence co",NOTUTILIZE,MENTION
4763673,4923018,"(such as a faro-arm tm ), or attaching it to a magnetic position sensor (such as a polhemus isotrak tm ). much work has been done on merging sets of points and forming compact surface triangulations . as we are only interested in the cross-section of the moulding, the input to the algorithm is essentially a planar version of the surface triangulation. the curve is constructed as 1 self-occlusion",NOTUTILIZE,NOTALGO
11464520,12253235,"t serve property for real-time applications. for non-real-time applications, one may associate the priority with the number of requested resources to achieve the maximum degree of concurrency. yang ( ) proposed a distributed algorithm to solve the mutual exclusion problem in manets. the proposed algorithm improves the cs execution time by allowing at most r tokens to be concurrently dispatched, i",NOTUTILIZE,MENTION
7156376,7483329,"ator result has been used recently by eppstein et al. 18 in improved methods for dynamic planar graph algorithms, and our parallel polygon triangulation result has been used recently by hershberger for improved parallel computational geometry algorithms. although our methods for solving these two problems are quite different, they are both based upon similar paradigms. one of these paradigms is",NOTUTILIZE,MENTION
7845107,8220862,"ues presented above (so if eg. the level separation 2, then it has actually a value of 4). this manual does not go into detail of the node-positioning algorithm. the reader is therefore referred to . nevertheless, the code of our implementation was enclosed in our appendix in section 7.3 and we remark that the time needed by this algorithm is in o(n) where n is the number of nodes in the tree. 1",NOTUTILIZE,MENTION
9161033,9687855,"buted version of the system, bigloo1.8 is the new version including the unboxed representation and the stack allocation optimization. both versions of bigloo use boehm s garbage collector release 4.7 . this collector allows ambiguous pointers and uses a traditional mark sweep algorithm. gsc is the gambit-c compiler version 2.3a, s2c is bartlett s scheme-to-c compiler version 15mar93jfb 5 and g",NOTUTILIZE,MENTION
9622377,10199592,"ource vector have approximately the same sensitivity to channel errors. we are now investigating the use of two-stage source codes like the weighted universal vector quantizer in our design algorithm . since the codebook index (1st stage), which is very sensitive to channel errors, is sent along with the codewords (2nd stage), we expect multiresolution channel coding to have more of an impact for",NOTUTILIZE,MENTION
9773647,10367738,. then the offspring is mutated to provide the evolutionary algorithm with the necessary power of exploration. if a 0 is an offspring of a: fi a 0 u fi a (1 gammasfi ); fi a (1 sfi ) wheresfi 2 is a parameter and u is the uniform distribution. the values of fi are clipped to fi max to maintain some exploratory behavior. the neural net is mutated by adding random noise to a fraction i w of t,NOTUTILIZE,NOTALGO
10329808,10984990,"ng field vector, which takes time of order o(nfk). as a consequence, the time complexity of condensing is of order o( f(nk l)). the condensing algorithm and a more detailed analysis can be found in . 5.3.1.2. activation the complexity of constructing an activation graph is of order o(n 2 ) and retrieving the children of a given node in an activation graph takes constant time. thus, the time comp",NOTUTILIZE,MENTION
10736408,11437627,"ves, complex matrix reordering and sophisticated data structures are required in order to obtain good performance on parallel computations. supernodal, multi-frontal versions of the classic cholesky ( , 64 , 117 , 87 , 52 ), qr ( 118 ), and least squares ( 119 ) algorithms have recently been developed towards this end. 1.3 the process of exploiting sparsity very roughly, we can divide the proce",NOTUTILIZE,MENTION
11396251,12178580,"es 1 x1, . . . , xn, its range can be easily computed as e n n xi, i 1 1 n n xi . for i 1 the variance v , there exist polynomial-time algorithms for computing the lower bound v (see, e.g., ), but computing the exact upper bound v is, in general, an np-hard problem; see, e.g., 2, 3 . there exist polynomial-time algorithms for computing v in many practically reasonable situations; see, e",NOTUTILIZE,MENTION
12304224,13177800,ted that this overview is restricted to the airs2 or version two of the airs algorithm 10 . it has been explained to the author (private communication) that the airs1 or version one of the technique is now deprecated in favour of the second revision of the technique. please see section 4. for a review of the airs1 and airs2 algorithms and their specific differences. 3s3.1 the algorithm the funct,NOTUTILIZE,MENTION
13551866,14541159,and peer-to-peer systems have also been successful services on overlay networks. a number of overlay multicast algorithms have been proposed over the last four years. end system multicast (or narada) was one of the earliest and most tested approaches. overcast 3 provides scalable and reliable single-source overlay multicast. castro et al. 30 compare a number of overlay multicast algorithms bu,NOTUTILIZE,NOTALGO
15070672,16154278,"eserved. doi:10.1016 j.cag.2004.11.001 www.elsevier.com locate cag rectangle with edges parallel to the coordinate axes. the algorithms presented byo rourke 3 , preparata and shamos 4 , foleyet al. and sutherland and hodgeman 8 are limited to convex clip polygons. that of schutte does not permit concave polygons with holes 20 . both the algorithm presented byweiler 9,10 and the one bysuthe",NOTUTILIZE,MENTION
16124676,17249018,"ris-pratt algorithm the knuth-morris-pratt algorithm kmp77 can solve the pattern matching in linear time by preprocessing the pattern. a quick explanation of the algorithm is presented in wikipedia . cormen et al. csrl01 present the algorithm too and proof its running time and its correctness. consider the following example, were p is the pattern and x is the text to search. furthermore we kee",NOTUTILIZE,MENTION
16201757,17329191,"s global nonlinearities. center for digital economy research stem school of business ivorking paper is-97-22sica algorithms for mixed and convolved signals have also been considered, (see for example , jutten et al. 1991, nguyen thi and jutten 1995, parra et al. 1997, pope and bogner 199613, torkkola 1996, weinstein et al. 1993, yellin and weinstein 1996). 3 ica in finance 3.1 reasons to explore i",NOTUTILIZE,MENTION
16218749,17346671,"omain independent. that is, the transformational operators are independent of any particular domain. spa s adaptation algorithm is provably correct. in this category we include also the priar system ( ). priar is a hierarchical casebased planning system that laso implements domain-independent transformation rules. this category is particularly interesting because it is sometimes believed that trans",NOTUTILIZE,MENTION
16752574,17894902,"ss of rcp in sdsat and third, we compare it with the state-of-the-art solvers. comparison of range allocations algorithms: we compared our approach nusmod with previous approaches smod 20 and uclid on these benchmarks and present results in figure 5. we used a time limit of 2 minutes for each run. note, the uclid procedure allocates each of n nodes in an scc a continuous range from 1 to n maxc",UTILIZE,USE
16786222,17930397,"vester 24 , although he did not actually state it. eq. (1.1) gives an efficient algorithm to compute g for two elements. for k 3, efficient algorithms have been given by greenberg 15 and davison ; if x1 x2 x3, these algorithms run in time bounded by a polynomial in log x3. kannan 18 gave a very complicated algorithm that runs in polynomial time in log xk if k is fixed, but is wildly exp",NOTUTILIZE,MENTION
23049156,24032086,"763 . recently, synaptic connection strengths were also found to be spatially correlated, i.e. strong connections are more spatially clustered than weak ones forming a skeleton of strong connections . to deal with this problem, a spatial-growth algorithm based on a spatial constraint has been proposed 247,765 . such a procedure leads to generate surrogate networks with similar topological proper",NOTUTILIZE,MENTION
23568058,24509326,"the dct coefficients signs are encrypted in dct transformed blocks 17 , the data blocks are permuted in frequency domain 18,19 , and both the coefficients signs and block positions are encrypted . these algorithms encrypt only some parameters in the image, reduce the encrypted data volumes, and thus, improve the encryption efficiency. the key problem is how to select the parameters. consideri",NOTUTILIZE,MENTION
25624988,26401870,"13 , emerging patterns 8 , indexing 17 and caching 18 , etc. over the last decade, a huge amount of research has been conducted on improving the efficiency of mining fis and many fast algorithms have been proposed. however, the mining operation can easily return an explosive number of fis, which not only severely thwarts the application of fis, but also directly affects the mining efficiency",NOTUTILIZE,MENTION
25688818,26460765,"er data have become an active research area. motivated by the increased ability to produce high-quality data quickly, these algorithms have become crucial in cost-effective analysis of data (see ref. ). one difficulty in applying automatic structure revealing algorithms to raw spectroscopysvolume 111, number 2, march-april 2006 journal of research of the national institute of standards and technol",NOTUTILIZE,MENTION
28769862,29453949,"l scaling obviate the need for matrix inversion without loss of computational efficiency. we also briefly mention a connection with the td(0) and fpkf algorithms, but note that the analysis of konda ( , ch. 6), as well as an example given in yu and bertsekas yub07 show that even with optimal scaling, td(0) and fpkf have worse convergence rate than our methods, which all converge at the optimal co",NOTUTILIZE,MENTION
29401171,30067035,"le ii. each value of gives a measure of the extent to which the labeled cell phone image (see figs. 10 16) belongs to the global class . in table iii, we use the ycxcz lab color image fidelity metric , 31 as a quantitative measure of each color correction algorithm s performance on test images in figs. 10 14. each entry in the table represents the color difference in terms of the ycxcz lab mean",UTILIZE,USE
30208632,30927454,r b(n i) b(i) mod p for 0 i p 1. the period divides n if and only if all p of these congruences hold. a polynomial time algorithm for computing b(n) mod p has been known at least since 1962 . pseudocode for the algorithm appears in 10 . in the last section of this note we give a heuristic argument for the probability that the conjecture holds for a prime p and estimate the expected numb,NOTUTILIZE,NOTALGO
30344391,31070709,hm was about twice as slow with 4 threads and 3 times as slow with 8 threads. the superiority of barrier3 over algorithms based on more complicated operations was also reported by hill and skillicorn . dataflow is a natural way to describe many data processing tasks. it 34may provide a good way to program the coming generation of multiprocessor chips. our algorithm can efficiently implement dataf,NOTUTILIZE,MENTION
31089639,31760334,"l methods (such as the multigrid method below) are based on hierarchies of successively refined grids, with vertical (coarse fine) relationships between them. multigrid algorithms multigrid methods are optimal algorithms for solving sparse linear systems living on a hierarchy of grids. grid-related operations, such as the mapping of state vectors and matrices between different grid levels (re",NOTUTILIZE,MENTION
32614101,32966905,"at need special formulations to be able to solve the latter case. the first category of algorithms include decision trees 5, 16 , neural networks 3 , k-nearest neighbor 2 , naive bayes classifiers , and support vector machines 8 . the second category include approaches for converting the multiclass classification problem into a set of binary classification problems that are efficiently solved",NOTUTILIZE,NOTALGO
33223293,33406242,"versions of ci(a), i.e. di(a) is equal to ci(a) if and only if the corresponding constraint is active or near-active; it is fixed at i otherwise. we minimize la(a, , ) based on algorithm 4.20 in . putting together the optimization of a and b, we have the partial augmented lagrangian method, which is presented in algorithm 1. the algorithm works as follows. given the initial values 0 and 0 o",UTILIZE,EXTEND
34050981,34051015,"very narrow and a fast algorithm could not follow it properly or because the gradient cannot be computed analytically and hence was approximated. other optimization methods such as genetic algorithms or simulated annealing 10 could be more appropriate for avoiding local optima and are subject to further investigation. the one iteration parameters were trained first, for the level of noise 2",NOTUTILIZE,MENTION
39287599,37858713,"we give conclusions in section 4. 2. the proposed manifold denoising algorithm 2.1. gaussian process latent variable models we begin by introducing the gaussian process latent variable models (gplvm) . denote a set of data points y y1 yn t , yn rd ,n 1,..., n. a latent variable model says that there is a set of latent variables x x1 xn t , xn rq (q d),n 1, ..., n associated wit",NOTUTILIZE,MENTION
40250078,38788230,"series prediction and the iris cluster learning problem. these tuning methods has a weak point, because the convergence of tuning depends on the initial condition. ishigami, fukuda, shibata and arai 272present a hybrid auto-tuning method of fuzzy inference using genetic algorithms and the generalized delta learning rule, which guarantees the optimal structure of the fuzzy model. 2733.5 fuzzy r",NOTUTILIZE,MENTION
46787587,45967809,"variants of k-means have been largely implemented for document summarization to improve efficiency and accuracy. some of them include euclidean k-means, spherical k-means 11 and bisection k-means . the quality of partitioning summarization algorithms is highly dependent on the initial centroids. a new partitioning algorithm has been recently proposed 14 and has been tested efficiently on two",NOTUTILIZE,MENTION
65908189,64677198,"lustering... algorithm properties complexity strengths weaknesses lowest-id (lca2) 14 highestconnectivity 14 max-min d-cluster 2 discrete mobile centers. 13 hierarchical 5 adaptive clusters clusterhead selection based on node id. clusterhead is directly linked to any other node in the cluster. clusterhead selection based on highest degree, otherwise same as lca2. cluster radius d, where",NOTUTILIZE,NOTALGO
66770824,65511032,"low false-positive rates observed in this study. uracil-n-glycosylase and dutp are incorporated into the reaction mixtures to avoid false positives due to product carryover from one sample to another . the establishment of equivocal zones for the test results and an algorithm for retesting equivocal samples also reduced the number of false-positive results. however, these features cannot prevent f",NOTUTILIZE,MENTION
68951215,67697387,"l cw98 give an analog code construction based on chaotic maps for uniformly distributed analog source, along with an efficient decoding algorithm using estimation techniques. vaishampayan and costa construct analog codes using linear dynamical systems and provide efficient decoding algorithms. using curves on higher dimensional spheres and topological arguments they show that their codes have m",NOTUTILIZE,MENTION
81023761,78707114,"n different contexts. nonuniform resolution properties are not unique to penalizedlikelihood methods. the ml-em algorithm for emission tomography also exhibits resolution variation and asymmetry 12 . an advantage of the penalized-likelihood approach is that one can modify the penalty to overcome the resolution nonuniformity (sections 5, 6, and 7), whereas it is not obvious how to modify ml-em to",NOTUTILIZE,MENTION
85803659,82692820,". various efficient and distributed algorithms have been designed thereafter within the linear optimization framework, for achieving maximum multicast throughput or minimum multicast cost 45 , 46 , , 47 , 48 , 49 . to conclude, in all the above three examples we have shown, the optimal transmission throughput problem is much more tractable with network coding considered. in the first and the",NOTUTILIZE,MENTION
86541416,83312381,"over the others in terms of the cardinality of the wcds (i.e., the number of dominators). we also compare the proposed clustering algorithm (dla-dc) with min id 3 , max degree 3 , wcds-dst 7 , and awf in terms of the cluster-head set size and the message overhead of algorithm. the obtained results show that dla-dc outperforms the best existing wcds-based clustering algorithms. the rest of the pape",UTILIZE,USE
86573539,83338257,"y also want to limit the number of radios equipped on each node, which is a current trend in the research on mac layer design of multi-channel multi-radio wireless networks. for example, in 1 , 4 , , 6 , the number of radios used is fixed to two, or even one. then certain heuristic channel assignment algorithm is used on a per packet basis to coordinate the transmissions among nodes. optimal th",NOTUTILIZE,MENTION
503056,536775,main source that we used for our brief presentation of results in algorithmic coding theory in section 2. a survey on applications of coding theory to complexity theory was written by joan feigenbaum about ten years ago. many themes treated in fei95 are still current. venkat guruswami s thesis gur01 has a chapter on applications of coding theory to complexity and cryptography. a survey paper,NOTUTILIZE,MENTION
