contextID,citationID,clean__citation_context,UTILIZE_LABELS,USAGE_LABELS
50261664,50125486,"e numbers). another very robust technique concerns exploiting the information from the second-order taylor expansion term of a cost function to speed up the convergence. this approach was proposed in , where the mixing matrix a is updated with the projected newton method, and the sources in x are computed with the projected least-squares method (the fixed point algorithm). in this paper, we extend",NOTUTILIZE,MENTION
55348927,54811287,"quiet wake . isolated rem epochs flanked by nrem periods were re-assigned to nrem. even before manual reassignment, this algorithm has high concordance (78 88 ) with experienced human sleep scorers ( ). dhpc o2 signals were processed as follows. first, to eliminate signal drift over the 4-h recording period, the linear trend (leastsquares regression method) was subtracted from the o2 signal (chall",NOTUTILIZE,MENTION
56483047,55822683,"on unavoidable trees in tournaments, see for example 7 , unavoidable trees in topological graphs 6 , and more. the universal trees containing all trees of given order have been studied as well, see . the algorithmic aspect of finding a given tree as a subtree in a larger given tree has been addressed in 8 . however, the extremal problem of unavoidable subtrees in trees did not receive a due att",NOTUTILIZE,MENTION
58212234,57459187,"chanisms called affine maximizers. such mechanisms maximize affine transformations of the valuations. when the domain of valuations is unrestricted, affine maximizers are the sole truthful mechanisms . similarly to vcg, we generalize these mechanisms to incorporate sub-optimal algorithms. notation: let a (a0, . . . , an) be an n 1-tuple such that a0 0, and a1, . . . , an are strictly positiv",NOTUTILIZE,NOTALGO
75384295,73914043,"smaller dynamic problems. the elaborate details of this step can be found in section 5. note that this leaves us with an o(n (d 2) 3) algorithm for c-kmp. for differentiating between our approach and or 1 , one has to point out that our base case is a static problem, while the mentioned algorithms solve a dynamic one. furthermore, the identification and solution of our reduced base case is compl",NOTUTILIZE,MENTION
77506325,75687175,"ces, an additional advantage would be that the numerical evaluation becomes simpler because algorithms for the regular case 4, 8 become applicable. implementations of these algorithms are available , which to our knowledge is not yet the case for van der hoeven s general algorithm for the divergent case 10 . unfortunately however, it is not obvious how to compute from a given basis of",NOTUTILIZE,MENTION
77536693,75714532,"is a tree 2 , a series-parallel graph 20 or a k-tree 6 . for the general problem, branch and bound exact algorithms have been studied ( 1, 13 ) and several heuristic methods have been proposed in . from the theoretical point of view, fernandez-baca 6 showed the unfeasibility of a polynomial time approximation scheme, but the question of existence of any approximation guarantee for the proble",NOTUTILIZE,MENTION
77578098,75751663,"ompression rates (cr bs cs) for both objects, after encoding. table 2 shows a comparison, for the fandisk object, with different state of the art algorithms: alliez and desbrun progressive encoding and the wavelets based algorithms from khodakovsky et al. 10 and valette et al. 19 . our algorithm achieves drastically better compression rates ( 800), while keeping a low geometric error. coder",NOTUTILIZE,MENTION
77777117,75924664,"tite graphs, as well as a subclass of product graphs 4,9 . hypercubes are a very famous topology for developing network algorithms. some of the studies are concerned with fault-tolerant broadcasting . in 11 , tang et al. first from the viewpoint of ist, designed an algorithm to solve the fault-tolerant broadcasting problem on hypercubes. they also first proposed the concept of optimal independen",NOTUTILIZE,MENTION
80857730,78556844,"lopments related to constrained connectivity and ultrametric watersheds are discussed in sec. 5. 4.2 methods based on graph representations hal-00733251, version 1 - 18 sep 2012 horowitz and pavlidis are among the first to suggest a formulation of hierarchical image segmentation in a graph theoretical framework. it is based on the split-and-merge algorithm. because their implementation relies on",NOTUTILIZE,MENTION
83261431,80567312,"y, and random replacement is known by the same name. there has been a substantial amount of work on analysis of page replacement algorithms including lru and rr; see e.g. 9 11 and the discussion in . stochastic analysis of page replacement algorithms has generally been limited to the independent reference model in which one page pt is accessed in each timestep t,where the (pt) are i.i.d. this",NOTUTILIZE,MENTION
16261184,17389970,"usually a deterministic routing function guaranteeing a escape route to every message if the adaptive options are not available 5 . vcs and adaptive routing have been extensively studied in the past . most of the research has been based on simulations using synthetic workloads, or at most traces of real applications. in addition, adaptive routing has seen a few actual implementations, like in the",NOTUTILIZE,NOTALGO
22180443,23244540,"nnels used between the ac and analyzer components where modified to use middleware transport services. the communication between the ac and the analyzer is done using globus-xio communication library configured with the gsi driver over the tcp provided driver. by that implementation strategy, organization network use polices like available tcp ports are respected. the security access is restricte",NOTUTILIZE,NOTALGO
57988993,57246943,"sms using lrc. it reads the input frames given by the user and converts into a framing sequence. the arm processor is configured to act as a error detection and correction unit for the physical layer . the hardware (figure 3) functions as a self-healing physical layer implementation in future embedded web server. the receiver receives the information, detects and corrects errors and retransmits it",NOTUTILIZE,NOTALGO
88562451,84993154,once with the longest and shortest path through each line was proposed and it was shown that the coverage for the shortest paths is much higher than the longest paths. we use an algorithm similar to to generate the shortest path through each net. it is an iterative algorithm in which it lists the kth structurally longest (shortest) paths through each net in the kth iteration. the algorithm was b,UTILIZE,USE
9907237,10513530,"zation delay from 2t to t . our scheme is independent of the coterie being used. k is p n if we use maekawa s quorum algorithm 7 , and k becomes log n when we use agrawal and abbadi quorum algorithm . moreover, the redundancy in the quorum can increase the resilience to site and communication link failures. the rest of the paper is organized as follows. section 2 describes the system model. in se",UTILIZE,USE
10831768,11548815,"timation algorithm comparison we used a variety of different algorithms to try to reconstruct the original tree, given the matrix of estimated distances. we used the nj program from the paup package ( ), with and without the bionj (gascuel, 1997a) option; weighbor version 1.2, available at www.t10.lanl.gov billb weighbor ; the fitch program from the phylip package (felsenstein, 1989); the harmonic",UTILIZE,USE
12612591,13517677,nstant multiple of the cofactors g1 and h1. this null vector can be computed numerically without computing the full svd by using an iterative method. for our implementation we use the method given in . once we have our approximations of g1 and h1 we can compute an approximate gcd by doing least squares approximate division. a very similar multivariate approximate gcd algorithm was proposed in 33,UTILIZE,USE
14016806,15035934,"at high speeds have been met in anticipation of future advances in terrain sensing and interpretation capabilities. 2 related work many previous efforts have accomplished high-speed driving on roads , 0 , 0 . these onroad behavior generators deliberately exploit road characteristics by using explicit models of roads. current implementations for onroad driving consist primarily of lane detection",NOTUTILIZE,NOTALGO
2033126,2151229,"p and log to compute products in r. i do not know the history of exp and log for z 2 and a x . improvements. as in sections 6, 7, and 9, one can remove some redundancy from the above algorithm. see . brauer in 22 pointed out that, if e is a positive integer, one can compute f e with about lg e squarings and at most about (lg e) lg lg e other multiplications. this is faster than the exp-log al",NOTUTILIZE,MENTION
2584246,2705941,"n of claim 1. to test claim (1), we have designed a new language ilac (pronounced eye-lack-sharp, for instance level aspects for cgo. ilac is an instance level aspect oriented language extending c . we have implemented a prototype ilac compiler using the code document object model (codedom) 29 namespace which is part of the base class library of microsoft s .net framework. the codedom provid",NOTUTILIZE,NOTALGO
5590316,5784754,". we now use an example to illustrate how this protocol is used in optimizations. 2.6 an extended example let us consider a simplification of the matrix storage format used in the blocksolve library ( ). this format exploits the fact that in many physical simulations, there are many rows of a sparse matrix with the same non-zero structure 1 . each set of rows with identical structure is called an i",NOTUTILIZE,MENTION
17171682,18331665,up from a sitting position while manipulating a box. this simulation includes an extension of above algorithms address closed-chain branching mechanisms with a computational complexity of o(nm m 3 ) ( ). figure 4: the image shows intermediate snapshots of a motion during a dynamic simulation involving contacts and impulses between an articulated body and its environment. the sliding motion and subs,NOTUTILIZE,NOTALGO
21417949,22551166,"he observation into parts as it computes the path through the network of chained hmms. in this paper, we adapt a different formulation of the recognition algorithm, called the token passing algorithm , for asl recognition. it works as follows:",UTILIZE,EXTEND
29706028,30387547,"d be able to deal with large segment of gene duplications and deletions that lead to the inverted repeats, while different genomes may have different set of genes in the ir region. we extended grappa so that it is able analyze data sets with a limited number of deletions, but no duplication is allowed. to remedy this problem, we develop a new algorithm (grappa-ir) for chloroplast genomes that tak",UTILIZE,EXTEND
42408330,40766548,"ds), and we will extend to the model using keywords representing user s interests in the next step. 4.1 word relationships from the web pages related to kyoto, we have derived relationship among words . words are classi ed into g-words(geowords, location names) and n-words(nongeo-words). if two words are appeared frequently in one paragraph, or one web page, we assume that there are strong relation",NOTUTILIZE,NOTALGO
77602847,75773869,"onditions, we have to adaptively update the thresholds of (s, v ) for different test images. this can be done by finding the mode of the probability distribution p(si,vi) using the camshift algorithm . since the camshift algorithm is derived from the meanshift 11 , it is necessary to introduce the meanshift prior to the camshift. the meanshift is a non-parametric technique that climbs the gradien",UTILIZE,USE
77839413,75977419,"ile. furthermore, when a document is created, it is difficult to foresee all constraints, in particular those introduced by futures devices. 2 our proposed classification extends the one presented in , especially the static and dynamic adaptation cases.semantic adaptation of multimedia documents 7 3.1.2 using transformation rules hal-00781024, version 1 - 25 jan 2013 to avoid the specification of",NOTUTILIZE,NOTALGO
107561497,99571509,"f our knowledge, there are no multiplicity results for quasilinear equations via penalization methods. however, our result seems to be new even in the semilinear case p 2. it extends the results in and complements those of 11, 13, 16, 25 . we end this introduction by quoting some papers which dealt with the nonlinear schro dinger problem (1.3) 8 : 2",NOTUTILIZE,NOTALGO
118241488,107402275,"o a measure of information, we must extend it to a set of actions. it is this extension, in our opinion, which is the critical and essential step in the development of a logically defensible method. ( b, pp. 190",NOTUTILIZE,NOTALGO
121502903,109852682,low the summing of images acquired in separate imaging sessions (for improvement of signal to noise); (6) signal enhancing data analysis algorithms and statistical evaluations of signal significance; large volume data management routines (5,NOTUTILIZE,NOTALGO
124564872,112191242,"ion can be that a room element has to be transformed including an environmental control system as air conditioning. we have implemented our approach using and extending the openarchitectureware (oaw) toolkit. we have chosen oaw, because this is a complete ha l-0 04 12 36 6,sv er sio ns1s- 1ss eps2 00 9 using transformation-aspects in md-spls 3 mdd framework integrated into eclipse that makes poss",UTILIZE,EXTEND
231973993,196696551,"e dcl ko lines, with tcv maintaining a replicative advantage.ssincesthese experiments were performed, it has become clear that there is significant geneticsredundancy in antiviral silencing pathways ( ; gasciolli et al., 2005).shence our results cannot completely rule out the possibility of the involvement of thessilencing pathway genes in the absence of testing multiple knock out lines as recently",NOTUTILIZE,NOTALGO
182901204,162582596,"; sonuga-barke, daley, thompson,slaver-bradbury, weeks, 2001; weiss hechtman, 1993). further,sresearch indicates that problems for children with adhd becomesprogressively worse without treatment ( ).stherefore, effective treatment for childhood adhd is of greatsimportance.sthere seems to be consensus in the empirical literature that there aresthree effective treatments: medication (abikoff et a",NOTUTILIZE,NOTALGO
202982340,241084113,"our combining method on the adult, hypothyroid, sick-euthyroid, and sick datasets from the uci machine learning repository 6 . we chose five base classifiers from the yale machine learning platform : part (a decision list algorithm), smo (sequential minimal optimization), simplelogistic, votedperceptron, and y-naivebayes. we used default settings for all classifiers. the adult dataset has around",UTILIZE,USE
202977844,241078230,"nd topology privacy. to this purpose, we propose algorithm 17, which is a modification of the pseudo-tree generation algorithm 6, and is an improved version of the algorithm we initially proposed in - l",UTILIZE,EXTEND
202919146,240990853,"lusterings are not available. in addition to eac-al, we also list the results obtained with three well-known graph-based cluster ensemble algorithms: hbgf 26 , cspa 21 , and mcla 21 . we use metis as the method that partitions the graph into final clusters. among the three, only cspa is based on coassociation matrices. the computational complexities of hbgf and mcla are both linear with respec",UTILIZE,USE
202879400,240934391,"in transpose2 traffic, node (i, j) only sends packets to node (j, i).sin this paper, we study routing algorithms through detail simulations, the configurations aresshown in table 1. we use the noxim simulator which is an open source simulator and based onssystemc. the network payload traffic is regulated by packet injection rate (referred to as pir).stable i.ssimulation configurationsssimulator",UTILIZE,USE
202942132,241026160,"it is exactly solvable in polynomial time. to solve it we use the quadprog function frommatlabwhich is based on a reflective newton method suggested for solving this type of the optimization problem . we refer to the modification of the sphere decoder algorithm based on using lb lbplt in (7), as the pltsd-algorithm and give its performance in figure 2. the simulation results presented in figure",UTILIZE,USE
202571408,240491235,18 . at the first step of our algorithm we set the number of the data parts. we choose this number to be the same as the intrinsic dimension of the data manifold. we use the k-nn method described in to estimate the intrinsic dimensionality. in this method the dimension is estimated from the length of the minimal spanning tree on the geodesic nn (nearest neighbour) distances computed by the isoma,UTILIZE,USE
202502299,240392079,"five runs is used to compute the effective arithmetic throughput of each method in gflop s (billions of floating-point operations per second). the clustering benchmark was performed using msmbuilder version 2.0. msmbuilder contains a python-numpy implementation of the k-centers 6, 5 clustering algorithm using the theobald rmsd metric. we modified msmbuilder to use either the current multiplica",UTILIZE,USE
202138211,239876207,"of the entity trees in addition to coreference, it is advantageous to consider multiple mh proposals per sample. therefore, we employ a modified variant of mh that is similar to multi-try metropolis . during each time-step, our modified mh algorithm makes k proposals and samples one according to its model ratio score (the first term in equation 2.8) normalized across all k (see algorithm 1). as s",UTILIZE,USE
201892550,239513714,"ete generalized he non map and the continuous-time colpitts oscillator, is used to transmit secret information. in this direction, we shown an avr-microcontroller implementation of the algorithm from , in the paper 74 . chapter 7 rises some questions, and tries to find some of the answers, in the context of hybrid dynamical schemes. a first idea is to substitute the colpitts oscillator with a con",UTILIZE,USE
201823741,239416564,"ich and o. ritter we solve the system of normal equations (eq. 11) using a preconditioned conjugate-gradient (cg) algorithm (bjo rck 1996). to precondition the system, we use jacobi diagonal scaling ( ), that is, we left-multiply eq. (11) by the inverse of m diag re j h j 2 m(m) . (16) this preconditioner is most efficient if the hessian matrix is diagonally dominant. although this condit",UTILIZE,USE
1178649,1256436,"mulation results. to compare static and dynamic resource announcement algorithms, we have performed a series of simulations using our discrete event simulator for mobile wireless networking protocols . the simulation assumes a network with the following parameters: ffl 100 nodes ffl area of 1000x1000 meters ffl varying node movement speeds ffl transmission range of 400m the nodes are capable of mo",NOTUTILIZE,NOTALGO
4446021,4595419,"objects. therefore, it is necessary to use a mechanism in order to validate the estimated velocities. motion detection is an active research domain and a number of algorithms have been proposed (e.g. ). here, we propose to use a temporal derivative circuit and consider the estimated velocities only in those spatial locations where the output of the derivative circuit is larger than a threshold det",NOTUTILIZE,MENTION
5331835,5510338,"rrespond to computing the critical path starting from a consistent state during the execution of p. this is a special case of the consistent global snapshot problem described by chandy and lamport in . chandy fig. 4. computing logical zeroing. and lamport describe an algorithm to record the global state of a computation by sending a marker token along communication channels. in our scheme, the rec",NOTUTILIZE,NOTALGO
5938041,6153654,". noise in the labels) while the training data sets are expanded. we evaluate our co-training strategy via experimental results using data from the uci repository using id3 (quinlan, 1986) and hoodg ( ) as our two supervised learning algorithms. both id3 and hoodg are trained using only the labeled data whereas our co-training strategy also makes use of a provided pool of unlabeled data. the result",UTILIZE,USE
9468227,10027230,"als: sgaonx, ncaonx, idcaonx and hekaonx. the symf library provides functions to handle symmetric functions. in particular, we have reprogrammed almost all functions of the sf package of j.stembridge using specific algorithms for the changes of basis to accelerate computations. the gl library provides functions to manipulate characters of the linear group gl(n). it essentially amounts to consider",UTILIZE,USE
9580718,10153484,"wn to have low bias, but high variance. this is the desirable composition of algorithms. we use constructive induction as a way of extending the description language bias. using wolpert s terminology , the constructive step performed at each decision node is a bi-stacked generalization. from this point of view, the proposed methodology can be seen as a general architecture for combining algorithms",UTILIZE,EXTEND
9962528,10574010,"gonal transformation, that is its transposed, o t . 6 possible extensions to non linear processing there has been already works proposing redundancy reduction criteria for non linear data processing , haft et al 1995, parra 1996 , and for defining unsupervised algorithms in the context of automatic data clustering hinton et al 1995 . here we just point out that all the criteria and cost function",NOTUTILIZE,NOTALGO
10725017,11423906,"training examples. the class conditional probability table for attribute ai has vi c entries, where c is a set of class labels. the probabilities are typically estimated using a bayesian approach . avt-nbl is a natural extension of the standard algorithm for learning a naive bayes classifier from data 2 . avt-nbl starts with the naive bayes classifier that is based on the most abstract value",NOTUTILIZE,MENTION
11501253,12293149,"processing time. the objective is to assign the jobs to the submeshes so as to minimize the total processing time. the algorithm for tpp z described in 4 has asymptotic performance bound 4 4 7 . in li and cheng describe several algorithms for tpp: for the general case, an algorithm whose asymptotic performance bound is 3.25, and for the special case in which all boxes have square bottom, an alg",NOTUTILIZE,MENTION
14433439,15479628,"istic systems, showing once more that determinism plays a lesser role in quantitative transition systems. the branching distances can be computed in polynomial time using standard fixpoint algorithms . we also present our results in a discounted version, in which distances occurring i steps in the future are multiplied by i , where is a discount factor ins0 1 . this discounted setting is com",NOTUTILIZE,MENTION
18696394,19887046,"chosen, and again we only keep the one for which m m is minimal, until we get a hyper-rectangle, after d 2 steps. 4 examples the algorithms presented in this paper have been implemented in ocaml . in this section, we show the effectiveness of our approach on some examples. all computations were performed on a pentium iv 3.2ghz with 1gb ram. 4.1 5-dimensional benchmark to evaluate the error in",UTILIZE,USE
19034344,20231673,"hat used either the estimated independent components or the corresponding column vectors of the mixing matrix (or row vectors of the de-mixing matrix) as features for classification. hyvarinen et al. , hyvarinen 29 and hung and luo 30 used ica for image denoising. they applied the ica algorithm and maximum a posteriori (map) estimator in a noise-free training image to find the mixing matrix. t",NOTUTILIZE,MENTION
46900125,46062789,"state vectors were dumped every 5 seconds in game time. each p u j was learned using a feedforward neural network with a 15-neuron hidden layer and the levenberg-marquardt backpropagation algorithm to update weights. inputs and outputs were mapped to the 1, 1 range. a tan-sigmoid activation function was used for hidden layers. because it is not possible to alter production decisions in the v",UTILIZE,USE
56563341,55896206,"not dt. the outlier identification for the modt method uses a robust parametric 2d motion estimation algorithm 27 . our proposed methods are compared to the level-set-based system by fazekas et al. using an implementation provided by its authors. no comparison is performed with their fast approximations since they are less accurate than their level-set procedure, and we are interested in using",UTILIZE,USE
59042025,58309692,"geometrical issues are treated by using generic programming and the outsourcing of this treatment into numerical libraries, e.g., interval arithmetic or exact numerical kernels like cgal 3 or mauch . if the geometrical predicates are correct, the element consistency is given by a simple advancing front algorithm. this design decision permits an orthogonal optimization approach. related to the ge",NOTUTILIZE,MENTION
68944072,67688912,"gth, and in addition ik k s and jk k s for every k 1, . . .,m. b consists of the elements in f, whose normal form does not contain any of the generators x0, x1, . . .,xs (or their inverses) . in both cases, the conditions are straightforward to check. following is an algorithm for solving problem 1. algorithm 2 (alternative solution search). (1) execute algorithm 1 (with any of the intro",NOTUTILIZE,MENTION
85446202,82404813,"ctor 3 and grouped to form one-pixel-wide edge segments or edgels. a curved edge segment is represented by a series of break points along the curve, determined using the algorithm of rosin and west . the break points are essentially points of significance (i.e., corners and high-curvature points) along the curve and are represented efficiently as a chaincoded vector. for each approximated curve",NOTUTILIZE,MENTION
