contextID,citationID,clean__citation_context,utilize_label,USAGE_LABELS
9495242,10057829,"r algorithm for rotation and distances in the following we show that given the translation direction, finding rotation is a simple linear operation. this result has also been shown by heeger jepson . in section 4, we develop linear algorithms for computing translation direction. 3 since the magnitude of translation cannot be obtained from the information on the image, this magnitude k vk has be",0,MENTION
11164004,11919789,"placing a few dozens of cameras around the scene 14 . a discussion and analysis of the multiple depth image representation, ways to acquire them, rendering techniques for them, etc., can be found in . depth maps can be represented and stored essentially as images. the range of the depth map depends on the extent of scene of interest and the resolution of the structure recovery algorithm. a 16-bit",0,MENTION
12186728,13048837,"ted from both the mac and phy layer perspectives. examples include the tree algorithm 6 , capture effect 2, 9 , forward error control coding 4 , spread spectrum 12, 13 , multiple receive antennas . as of very recently, several works appeared, suggesting that cr can be achieved with single antenna systems and without relying on coding. in 15 the diversity was provided by the network, thus the",0,NOTALGO
12350848,13229363,"ble states can be removed from a representation (regardless of their initial values). there is a simple algorithm to refactor the states of a system and expose the unreachable and unobservable states . for unreachable states, the algorithm assumes that there is no initialization stage, i.e., that ----- initvec and bpre are zero. we first describe the basic algorithm and then extend it to handle th",0,MENTION
15144628,16231999,", the signature si(l) of an m - order discrete state l (l1, . . . , ln), m 1, is determined by checking what different symbols appear in each of the sets si(l ) l v(l) , i 1, . . . , n . we give here an informal and intuitive description of the algorithm from 22 for finding transitions of ds. for every state l (l1, . . . , ln) l, a set l is created, such that l l contains",0,MENTION
16258443,17387672,", so it is difficult to achieve a fast software implementation that does not compromise on image quality. 2.1.3 cell projection a third class of algorithms consists of the cell projection techniques , max et al. 1990, shirley tuchman 1990, wilhelms van gelder 1991 . these methods are often used for volumes sampled on a non-regular grid. the first step is to decompose the volume into polyhedra",0,MENTION
16287396,17417829,"anteed to give a ranking that is globally optimal, but only one that is optimal as a greedy algorithm. this assumption that a greedy algorithm is used to construct the optimal ranking is implicit in ( ), since the decision problem involves whether to retrieve one single document rather than choosing a ranking of all documents. in contrast, under our assumptions, ranking based on the expected risk c",0,MENTION
18179991,19367986,"em is a special case of the maximum coverage problem. we wish to cover the maximum number of edges of g with t sets, where each set is a matching. the following theorem is well known (see for example theorem 3.8): theorem 5.1. the greedy algorithm for the maximum coverage problem yields a 1 1 1 t approximation. it follows that greedy has an approximation ratio of at least 1 1 1 t. t w",0,MENTION
19417647,20622856,"alks with boundaries are given in 13 . main definitions and theorems on quantum walks on graphs are given in 4 , 133 and 106 . finally, algorithmic applications of quantum walks may be read from , 165 and 7 . applications of quantum computation in pattern recognition and neural networks. 172 , 173 and 87 . finally, the following phd theses were extremely useful: 32 , 99 , 34 , 144",0,MENTION
19433988,20640631,"ointed out previously (li et al., 1996) that structural integrity is necessary for periodic constructions based on dna sticky ends. the same feature is even more important for algorithmic assemblies ( , 2000), such as the one described here. indeed, these tiles are essentially wang tiles: besides the coding, they carry geometrical information. two tiles match if their sides are coded with opposite",0,MENTION
19759044,20974278,"when the additional sorting can be done offline. hence, lazytop-naive would be more useful when it is integrated into the index building stage, we will talk about such scenario in the section 3.4.2. discussed the adaptive ta algorithm taz for the case when sorted-access is not available for all lists, that is only some sorted resource are available. in particular, the extreme situation is only o",0,MENTION
22609846,23634470,"details of the application are implemented in the simulation build-ability how easy can the application code simulated be transformed into real application table 1: criteria 3.2 serapis serapis 21 is a java-based simulator that is designed for evaluating different caching algorithms for freenet. serapis has been extended to simulate the gnutella protocol, however, the work is halted and the ex",0,MENTION
23047038,24030660,-bit node mark content-specific encoding process. our algorithm does not require the original un-watermarked object in order to perform mark detection. published research results of this work include . further work is required in improving conte,0,NOTALGO
25319107,26121003,"window (packets) fig. 9. fairness index in hidden-terminal topologies since maximizing capacity utilization and achieving fairness are generally two conflicting objectives in wireless ad-hoc networks , when evaluating a fairness algorithm, it is also necessary to look at the throughput results to ensure that the algorithm does not unduly degrade the throughput. table ii presents the throughputs un",0,NOTALGO
32658732,33003105,"general theory for synthesizing stabilizing control laws under arbitrary system and information constraints is still lacking. due to its ability to handle constraints, model predictive control (mpc) has become one of the preferred tools for setting up control algorithms. interesting examples of non-centralized implementations of mpc are 1 4 , 6 10 . when stability is the main focus, a suc",0,MENTION
34610025,34551539,"cluding real-world instances. the results show that the proposed algorithm is able to solve to optimality the small-sized instances in a reasonable computing time. two heuristics are also proposed in . the first one, h1, is an adaptation of the algorithm proposed by baldacci and dell amico 4 for the multi-depot cmrsp and is executed at the root node of the enumeration tree. the second heuristic,",0,MENTION
41804719,40200225,"ifetime, where n is the total number ofnodes.in 8 ,adistributedschedulingalgorithmis proposed which achieves a o(logn lognb) performance factor, where b is the upper bound of the initial battery. in , 20 , fullview coverage which considers the sensor s viewing direction is introducedfor camera sensor networks,and techniqueshave been proposed to achieve full-view coverage. the point coverage has",0,MENTION
45344477,44394651,ountable union of proper algebraic sets. in the usual differential galois theory the tannakian approach is a base for algorithms computing differential galois groups which are linear algebraic groups . in the parametrised theory the galois groups are linear differential algebraic groups and the tannakian theory that we develop should contribute to computation of these groups. tannakian approach fo,0,MENTION
46865123,46035966,"rstand what is happening in the core of the system. also, no facilities are provided for tweaking the solver algorithms for a speci c application. more recent clp(fd) systems such as those in sicstus , gnu prolog 7,8 , and b-prolog 9 are built instead following more the glass-box approach. the basic constraints are decomposed into smaller but highly optimized primitives (typically indexicals).",0,NOTALGO
49505969,49328202,"p: www.biomedcentral.com 1471-2164 13 23 page 7 of 11 the miqe guidelines, accuracy of a rt-qpcr refers to the difference between experimentally measured and actual concentrations as fold difference . accordingly, we performed mir-q arrays for all concentrations and determined the fold differences between 3.3 and 33 pm as well as 33 and 330 pm applying the cq algorithm, respectively. the reacti",0,MENTION
57151894,56486799,"iterations. we use 3 iterations as no significant improvement is observed for more iterations. the average mse is employed for the performance measure. apart from crlb, comparison is made with esprit , 11 and ml 9 algorithms. in particular, 11 is employed for cisoids while 4 which applies partial forwardbackward averaging is used for the real-valued signals. on the other hand, the ml estim",0,MENTION
57874992,57148243,"ly constructs the minimal state space whose size may only grow polynomially with m. for the horspool algorithm, it is known that the state space has a size of only o(m2 ), as the construction of tsai can be adapted to construct a daa according to our definition. however, we have been unable to provide a direct construction of the minimal daa applicable to all window-based pattern matching algorit",0,MENTION
64047242,63074973,"rsion of the matrix a (i.e., the effective pathlengths li,j). while several advanced imaging algorithms have been developed including analytic diffraction tomography approaches (cheng and boas, 1998; ; matson and liu, 1999; schotland, 1997), perturbation approaches (arridge and schweiger, 1995; barbour et al., 1995; o leary et al., 1995; schotland et al., 1993; yao et al., 1997), the taylor series",0,MENTION
66019502,64786824,"h recognition power, evaluation and replacement of the clones, generation and preservation of antibody diversity. the clonalg algorithm implemented by brownlee in weka consists of the following steps : (1) initialization. the clonalg algorithm starts by generating a pool of n antibodies. these antibodies are then partitioned into a memory antibody pool (map) and a remaining antibody pool (rap). ma",0,MENTION
71448966,70565927,"there exists 0 such that for any 0 the mstm algorithm converges to a fixed unique solution w when initial feature weights w (0) are nonnegative. the proof is following a similar schema as in . details are omitted for lack of space. the complexity of the mstm algorithm is o(tn 2 m) where t is the total number of iterations, n is the number of instances, and m is the number of features. our",0,NOTALGO
73359930,72276938,"rm, where certain regular access patterns can be identified via data access monitoring at runtime. examples include generalpurpose replacement algorithms in production systems: lru, lirs 12 and arc , as well as recently proposed tac 4 and lazy-cleaning 7 . however, monitoring-based management may not be effective under the following three conditions. first, monitoring-based methods need a per",0,MENTION
74219183,72992471,"strategies there exist several multipath, full-message strategies in which each node on the path sends a full message to several neighbors that are best choices for all possible destination positions . there is significant communication overhead, and lack of guaranteed delivery can make this approach inferior to even a simple flooding algorithm. clever flooding algorithms may use about half of the",0,MENTION
78811363,76794940,"ocalization category, a wide range of technologies have been explored: ultrasound 11 , infrared 13 , 802.11, and custom radios. within this wide variance, the works using 802.11 and signal strength , 6 , 9 are most closely related to ours. our work, however, does not propose any specific localization algorithm. instead, we experiment to characterize the effect on a wide spectrum of rss-based",0,NOTALGO
82461269,79929992,"itional collaborative filtering technique 15 . in 2009, songjie gong proposed an item based collaborative filtering using back-propagation neural networks for improving the quality of recommendation . authors work explores the extent to which amm, a new algorithm of cf based recommender system is able to improve the quality of recommendation and also describe incremental amm for dynamic dataset.",0,MENTION
7399219,7742651,"ank (mafi) spectral estimators. with the mafi interpretation, the apes estimator was given a simpler and more intuitive derivation, which was later extended to a form using forward-backward averaging , as well as to the case of real-valued data 5 . furthermore, there has been recent work wherein ecient implementations of the capon and the apes estimators was proposed 11, 2 , as well as a new der",0,MENTION
81934512,79475827,"k running on multi-hfe with embedding. table 4. comparison of each step of our attack on embedding variant on multi-hfe with parameters q 31, n 3, d 8, d 2 ( 120 bits security) using a magma (v2.16-10) implementation on a 2.93 ghz intel r xeon r cpu. mr time mr dreg finding u finding w no variant (ref. time) 23.3 s 3 0.01 s 7.29 s embedding (r 1) 788 s 3 0.01 s 6.14 s embedding (r",1,USE
86152226,82982967,"we focused on 52 overlapping, nuclear families of four or more genotyped offspring, as simulations suggested that our algorithm is highly reliable for families of more than three children (for k 5) . based on the total 576 meioses, we constructed the distribution of the number of crossovers in (male or female) gametes, for each chromosome. for female transmissions of chromosome 21, we supplement",0,NOTALGO
117494195,106847740,"structure. there are also additional advantages of using the tta such as, e.g., cycle minimization, implementation flexibility, performance scalability, etc. they are all explained in more details in . hence, these architectures have serious potential in important applications in the future. addressing the test in the early design phase of these architectures will definitely lower their cost, maki",0,MENTION
3476352,3584054,). in contrast to the mentioned algorithms we do not make use of any global data structures in our algorithm. we use neither a central constraint store like 19 nor a centralized history trail like . omitting such central structures allows the concurrent execution of dierent solvers without further synchronisation. this is a prerequisite for distributed (non client-server) applications 15 . to,0,NOTALGO
4789323,4950188,"me, the predictive assignment module is designed to be elaborate and optimal. in order to solve this dynamic video mapping problem, we use the heuristic algorithms that are presented in our paper ref. . 1 we present the principles of the predictive assignment algorithm as follows. all these principles are encoded into the heuristic algorithms based on simulated annealing. thus, the case of the dyna",1,USE
13158772,14111796,", we evaluate the effectiveness of ulda gsvd and compare it with several other commonly used feature reduction algorithms, including orthogonal centroid method (ocm) 22 , pca 19 , and subspace ulda , on various types of data sets, including text documents, chemical analysis of wine, face images, and microarray gene expression data. the experimental results show that the ulda gsvd algorithm is co",1,USE
14280677,15316689,"for the source to receive rrep and enter the final state is 1 ppolyfail 1 (n). 13sanother proof of theorem 2 using chernoff bounds is available in standard cryptography literatures, such as . therefore, by definition 6, such a protocol implementation with ideal forwarding communities is in gvg rp. discussion: from ideal to practical a major contribution of this paper is to show the exi",0,NOTALGO
16962758,18112972,"icients for the biorthogonal 9 7 wavelet filters were derived using our new method: we refer to them as mua-lsgc. the best design began with the unquantized, rational coefficients proposed previously , 5 . the mua-lsgc set offers the best image compression performance (in terms of psnr) with a small, fast hardware implementation. the energy required by mua-lsgc to compute the dwt of an image is l",0,MENTION
650076,693966,"vidence is assumed given by some external source. kewords: belief functions, dempster-shafer theory, clustering. 1 introduction in this paper we extend an earlier method within dempster-shafer theory for handling belief functions that concern multiple events. this is the case when it is not known a priori to which event each belief function is related. the belief functions are clustered into subs",1,EXTEND
17592665,18769632,"best of our knowledge, only palsberg and jim approached this subject. in 17 they study the type inference problem for one of the abadi-cardelli systems 1 extended with the notion of selftype. in , palsberg presents an algorithm for the abadi-cardelli",0,NOTALGO
23107475,24084958,generated during cognitive tasks. complementary actions and imitation how are such actions generated we will extend two models from imitation research to investigate this question. a recent review ( ) succinctly captures the central problem in imitation:,0,MENTION
28397919,29114055,"5 : 120 cities; 18 : 532 cities; 6 : 666 cities; 1 : 13.509 cities), no methods of xsp tasks have yet been considered to our knowledge. by extending the available implementation of a tsp solver , we have developed a new xsp solver. pederson has used genetic algorithms (ga) to solve the traveling salesman problem. a simple introduction in the theory of ga can be found in 13 . adapted to mt",0,MENTION
63016441,62159366,"imbing moves. consequently, a number of probabilistic iterative improvement algorithms that often explore with analogy to physical and biological world have been proposed including genetic algorithms , neural networks 14 , simulated evolution 7,12 , and tabu search 8,11 . the new probabilistic constructive paradigm is different from all the above paradigms. in some sense it is closest to random",0,MENTION
77563413,75738594,"to lut inputs. in 11 , only combinational circuits are included. in this paper, we extend this work to sequential circuits as well so css can be applied. other work done to reduce glitching includes , which uses routing techniques, and 12 , which proposes a new glitch-driven technology-mapping tool. d. power calculation dynamic power is defined by p",0,NOTALGO
86423343,83219727,"bow can also benefit from existing dml methods, we implement several different spbow methods by adapting four state-of-the-arts metric learning algorithms, including relevant component analysis (rca) , information theoretic metric learning algorithm (itml) 7 , large margin nearest neighbor (lmnn) 39 , and neighborhood components analysis (nca) 14 . all of them were implemented in the same exper",1,EXTEND
97768337,92245534,"viours1. introductionspage 4sas a result of the systematic literature review, we extend the measurement framework of itsservice quality (illustrated in section 5) that was initiated in lepmets et al. . thesframework will be validated in industry through case studies in the next stage of the project.s2.1 previous work - measurement framework for it service qualitysin previous work we described a qu",1,EXTEND
116028742,105783313,"id based schemes 9, 10, 6, 13, 24 . the scheme that we introduced in the previous section can also be extended for id based threshold ring signatures. however, this extension was already done by wei . the construction of the signature provided by wei is based on boneh et al s 6 bilinear signature, and itsts the so called spontaneous anonymous groups. these groups 29 are ad-hoc groups without se",0,MENTION
120690960,109243931,"es in flooding between experimental areas, herbivory manipulations and site contributions to changes in population growth rate,s , we extended life table response experiment (ltre) analysis methods ( ) to include nested designs. using both ltre analysis and stochastic demographic analyses, we estimated the separate and interacting impacts of changes in herbivore community and flooding probability",1,EXTEND
125882099,113190957,"icki (1991) suggested that the seasonal cycle in steric height difference was too small by a factor of 2 to explain the geosat ssh difference. using the newer version of the levitus data (levitus and ), wang and koblinsky (1996) showed that the seasonal steric height variations were consistent with seasonal variations in topex poseidon ssh in the region of gulf stream recirculation. however, based",0,NOTALGO
43674813,42306378,"limit functions, l2 (r) or continuous, while the other extreme ones lead to fractal-like pictures. this is based on two analogies, in addition to the existing results in dala92 , cohe92 , cohe94 , , wan96 : (i) first, we think of (2.1) as a version of an iterated function system in the sense of hutchinson hut81 . hutchinson considers borel mappings f1, . . .,fn on a complete metric space x, p",0,NOTALGO
65864192,64633654,"d degradation. also in this case, the investigators speculated that proteolysis of incorrectly folded supc-phoa hybrid protein might be caused by an extracellular cell-associated proteolytic activity . when the mature ompa protein was precisely fused to the pre-pro part of the lipase from s. hyicus, a major part of the translocated propeptide-ompa hybrid protein was released into the supernatants",0,NOTALGO
203033860,241158146,"sto achieve optimal results two high resolution parametersestimation algorithms have been applied to the measured data.sto the ula-measurements the 3-d joint unitary esprit andsthe 3-d sage algorithm , 3 , 4 have been applied to estimate time-delays, doppler-shifts, azimuth angles of arrival,sand the complex path weights of the dominant rays. there wassno noticeable difference in the estimated pa",1,USE
203032641,241156529,"by 10 ), thessuggestion algorithm provides the optimal recommendationsfor the change of the environment f (e.g. increase thestempo).swe use a mixture-of-experts based dynamic decision networks(ddn) for prediction and suggestion. we train ddn mixturessper patient, per session. the questions are answered through ansoptimality criterion based search on ddnsmodels trained in previous sessions.s5.6",1,USE
202868767,240918788,"n them. if both points are k-covered, then assign them to the nodes that correspond to the voronoi regions of vdk(s) they belong to. starting at one of these nodes, traverse g using the dfs algorithm . if the other node is found, then both points belong to the same connected component of k-blobs and there is a k-path between them. in fig. 5, there is an example of graph g and a path between p and",1,USE
202737267,240727521,"t r0i pig fvit jd0i t dig (33) are eliminated from v . among several consistency tests proposed so far, three types are utilized in our algorithm; immediate selection (carlier and pinson 1989, ), edge-finding (carlier and pinson 1990, carlier and pinson 1994, baptiste et al. 2001), and not-first not-last (carlier and pinson 1989, baptiste et al. 2001). in addition to these, we apply the fol",1,USE
202621795,240563977,"consideration, we can compute a splitting cycle on any surface m in o(n) time as follows. first we construct a simple non-contractible cycle, using a variant of an algorithm of erickson and har-peled , whichsnds the shortest non-contractible loop with a given basepoint in o(n log n) time. the running time is dominated by the computation of a shortest-path tree rooted at x using dijkstra s algorith",1,USE
202393827,240238233,"processor has an internal cache of 1 mb and the total memory consists of 32 gb. the system runs debian etch. we compiled using g -4.1.2 with ags -o2 -dndebug and use the exact number types of core . observe that our software currently does not benet from having several processors, although many steps of the algorithm are well-suited for parallel computations. table 1 states for a selection of",1,USE
202336015,240155537,"ot learning, and we have shown that the learned low-level parameters are strongly related to the desired behavior. in 4 , we have proposed an extension of the policy gradient algorithm introduced in , that has been successfully used to optimize quadruped gait of aibo robots. our approach guarantees a higher convergence rate than the standard policy gradient, by exploiting additional information o",1,EXTEND
202131628,239865185,"in the gene expression omnibus with accession number gse18269 at http: www.ncbi.nlm.nih.gov geo . the microarray data were normalized using genechip (affymetrix) robust multichip average algorithm ( ) implemented in the r package affylmgui (wettenhall et al., 2006) when any two or more datasets are compared.",1,USE
1135875,1210973,"with two kinds of negation, the explicit one used to state what is false, and the default (defeasible) one used to state what can be assumed false. the system lelp (learning extended logic programs) learns extended logic programs under answer-set semantics. as our algorithm, lelp is able to learn nondeterministic default rules with a hierarchy of exceptions. from the point of view of the learnin",0,MENTION
7656657,8012202,"encoding and logic synthesis algorithms 9 . for fast controllers performance driven logic synthesis should be applied 17,5,23,4 , and the resulting structure may be optimized by retiming algorithms . the performance should also be respected during technology mapping and layout generation. all these performance driven synthesis algorithms contain essentially two phases: first, the fsm is mapped t",0,MENTION
7755665,8121272,"that the rank usually does not change by more than one, the problem still exists if the rank is underestimated. figure 2 shows the rank tracking behavior of the ulv algorithm using the heuristics of , 9 and that proposed in this paper. the input initially consisted of two complex sinusoids each having an amplitude of 0.1. the background noise was white with a variance of 10 gamma12 . therefore",1,USE
