contextID,citationID,clean__citation_context,utilize_label,USAGE_LABELS
152934080,134437010,"ested using web scraping tools. iv. related work in this section, we briefly review research that is closely related to the concept and realization of contributional implementation. human computation is a computing paradigm in which task execution is delegated to online humans to perform. crowdsourcing is the special case where humans are found through an open call. research in human computation",0,NOTALGO
161518672,142190778,"discovered the universal behavior for the number of local extrema). 5.2.1. computation. for the computation of the discrepancy we use a recent implementation of the dobkin-eppstein-mitchell algorithm by magnus wahlstro m 26 , which is freely available online. this algorithm computes the star discrepancy exactly; for details on the implementation and a fast randomized algorithm for the approximat",1,USE
218840609,187705892,"idea is to first estimate the expected intensity distribution of the lv cavity and myocardial wall based on the previous 2d segmentation. we propose to use an expectation-maximization (em) algorithm ( ) assuming a mixture of two gaussians to describe the lv (cavity plus myocardium) histogram. after estimating the intensity distribution parameters (mean and standard deviation), two thresholds are de",1,USE
10200903,10838085,"1 ; : : : ; a n x b n . instead of calculating and applying all possible colour substitutions for all x b immediately, we delay colour substitutions by using the method of explicit substitutions . calculi of explicit substitutions are used in logical frameworks and their implementations (e.g., prolog nm88 ) to postpone the expensive operation of instantiation until necessary. the basic idea",1,USE
13638164,14633213,"sons: the first is that any suitable method for key exchange could possibly be used for it. sending a shared key by secure e-mail 13 , using an implementations of diffiehellman key exchange protocol , by sms messages or by traditional mail should be equally feasible in order to obtain as much flexibility as possible. second, many of these tools can be used at the same time and replaced at any mom",0,NOTALGO
15413776,16512499,"inding min-cut maxflow in the graph we applied the algorithm 15 used for the user-driven image segmentation for grayscale non-textured images 15, 16, 17 augmented to colour and textured images in . the proposed method works very well for images containing strong textures like natural images, see fig. 1. compared to other methods our approach does not need a learning process 8 or a priori inf",0,NOTALGO
16058007,17179632,"nked lists in the java collections framework, a part of the standard java libraries. this implementation uses doubly-linked, circular lists that have a size field and a header node as a sentinel node . (linked lists also provide methods that allow them to be used as stacks and queues.) treemap implements the map interface using red-black trees 9 . this implementation uses binary trees with parent",0,NOTALGO
145158,148766,"alizing an existing early requirements modeling language, and by building on state-of-the-art formal verification techniques. in order to allow for formal analysis, we extend the i modeling language into a formal specification language called formal tropos. the language offers all the primitive concepts of i (such as actors, goals, and dependencies among actors), but supplements them with a ric",1,EXTEND
882211,943591,"ators of the rtt values, e.g., 20 , and of the congestion window sizes. another area for improvement resides in the type of filter used in the heuristic algorithm. while the serial multistage filter we use in this paper appears to exhibit good performance, a follow-up work described in 27 , indicates that parallel multistage filters typically perform better than serial multistage filters, and",1,USE
17707200,18886299,"o not overlap, as in the case of cascaded topology. we will extend our study on cascaded topologies in section 3.3. we propose an algorithm based on the non-negative matrix factorization (nmf) method . nmf decomposes x into two non-negative real matrices u n",1,EXTEND
22110824,23182802,"1. ar database correct recognition results. - 451 -s3 accurate location refinement via 3d tracking approach to refine the quality of face location we use an extended version of our tracking algorithm . to cover the problem of precise face location, we adopt the same 3d model and convergence strategy than our tracking algorithm considering the information extracted from face detection as a rough po",1,EXTEND
27109577,27830743,"t scenario and our solution has been extended with a fully-fledged rule-based data mediation 6 . in order to address the sws challenge requirements, we base our solution on the specifications of wsmo , wsml 9 and wsmx 12 providing a conceptual framework, ontology language and architecture for semantic web services. the overall contribution of our work is to show: (1) how flat xml schema of roset",0,NOTALGO
38979500,37577342,"e and inde nite problems. in the inde nite case we make use of the du -reid 11 pivoting strategy now, but we plan to extend the library with other strategies too, for example aschcraft-grimes-lewis . pivoting strategies are discussed in detail in the latter paper. also, the library can be easily extended with other factorization algorithms, such as the left-looking algorithm. the current factori",0,MENTION
41594366,39990997,"hown that a model of ionic solutions consisting of hard spheres in a uniform frictional dielectric does surprisingly well at equilibrium when all flows are zero. we extend this work to nonequilibrium . our research on excluded volume of ions is particularly motivated by the study of the selectivity of ion channels in cell membranes 15, 16, 19, 20 . two key physical properties are the basis for th",0,NOTALGO
69221833,68031875,"effect in a systematic way, a more specific model is required. such a model was considered for spinless neutrinos 6 . for completeness, we extend that discussion explicitly to the spin-1 2 case below . in the absence of non-gravitational interactions, the properties of a spin1 2 particle in a specified gravitational field, g , are usually described to first order (linearized therory) by the inter",0,NOTALGO
77491102,75674376,"mation. we have been working on a system that improvises with british saxophonist john butcher, whose complex vocabulary incorporates extended saxophone playing techniques, amplification and feedback . we classify butcher",0,NOTALGO
82257731,79758640,"i-concepts from a given p-folksonomy, i.e., a quadratic context, we may use one of the reported algorithms in the literature: quadricons 20 , an extension of the tricons algorithm 31 or datapeeler which are able to extract all frequent quadriconcepts fulfilling user-defined minimum thresholds on each dimension of the p-folksonomy. both algorithms take as input a p-folksonomy as well as four mi",0,MENTION
89670048,85872500,"ever, the analysis there is limited to a first order approximation, which cannot pick up the slight convexity of the observed equity implied volatility surface. in this paper we extend the results of to second order. this extension is non-trivial, as it requires a careful terminal layer analysis, which we approach probabilistically. for some related multiscale perturbation techniques in european",0,NOTALGO
182860041,162554945,"ials resulting in a fine alloyed powder. the optimization of ma by cook lead to his thorough investigation of the parasitic effects that oxygen has on thermoelectric n-type si80ge20 (gap and p doped). since oxidation will always be a concern for sige materials, a comprehensive review of cook",0,NOTALGO
220061020,188568742,"tatus would be positively affected byshigher levels of susceptibility, severity, and benefits (hbm1-hbm3), and negatively affected by higherslevels of barriers (hbm4) 13 . following previous studies we added the followingssubjective and personal factors as explanatory variables:ssubjective and personal factors: risk",0,NOTALGO
115428858,105356199,"factors for hemorrhagic stroke zodpey et al. reported similar results.(24) however, other researchers reported that those with diabetes mellitus were at greater risk for stroke than control subjects. among hawaiian japanese men in the honolulu heart program, those with diabetes had twice the risk of thromboembolic stroke than those without diabetes, which was independent of other risk factors.(25",0,NOTALGO
203001623,241111622,"elements. such a selection is regarded invalid. we return the whole array a as the solution and exit. otherwise, the selection is valid. we proceed to select kthmax by the linear selection algorithm . we rearrange and partition the array a into a1, a2 and a3 such that each contains elements of a greater than, equal to, and less than kthmax respectively (line 5). we compare each element of a again",1,USE
202933752,241012495,"rofiles of the amplified fragments (i.e. plots of the midpoint melting temperature as a function of position along the pcr product) were generated using the computer algorithm of lerman and coworkers . parallel denaturing gradient gels (24x18x0.1 cm) were cast and run using the hoefier scientific instruments model se620, according to the method described by myers and colleagues (19). the gels cont",1,USE
202542089,240447072,"hen mining frequent closed itemsets, we use the program of closet 13 provided by its authors, with threshold of support set to 30. for multiclass svm classifier we adopt libsvm package provided at , using 5-fold cross validation on training set for parameter tuning. 5.1.2 image-based multiclass adaboost (samme) as a baseline model for comparison, we implement the algorithm in 14 as it is the",1,USE
202481905,240360858,"specific application container to deploy applications on a vehicle. the environment simulator eworld1 is the fourth integrated component. we use eworld to import real road map data from openstreetmap , enhance them with location-based information, and export them as sumo input files. 5.1 the simulation scenario to evaluate the effectiveness of our algorithm and to identify potential problems, we s",1,USE
202339922,240160633,"g(class specific hyper graph) model 12 sthat can recognize the face rapidly.sa recognition algorithm based on rsom clustering tree and cshg modelsfor an image i , this paper adopts a method given by to choose out its robust sift local featuressas a set , 1, 2, ,nf n tf 11 14 , and then constructs a relevant spectral graph ( , )i i ig f e via thesspectral graph theory 15 , wheresi f",1,USE
202286440,240085006,"that the exactive instrument is able to detect peptides ranging over 4 orders of magnitude. we next examined the quantification accuracy of the proteins by using the label-free algorithm of maxquant to calculate the normalized intensities of ups1 proteins and ups2 proteins and then calculated the ratio between ups2 and ups1 (fig. 4b). we found a linear correlation between the protein mixtures, c",1,USE
202249094,240032191,"(eh l t 1 r(qt h)p(h ) ) hmax) (6.3) where eh is the expected total reward over histories and hmax is the maximum possible entropy, the policy gradients with parameter exploration (pgpe) algorithm is used. infomax policies were trained for 500 episodes of pgpe. the svm testing set results were used to estimate the parameters of the action-object specific dirichlet distributions. the experiment",1,USE
202156788,239903734,"flt is better than that of the upcc and pr algorithms. 4.2. the feasibility of c2p platform to validate whether the proposed platform architecture is feasible, we used myevalvid-nt 27 and myevalsvc the computer journal, vol. 57 no. 12, 2014sat pennsylvania state u niversity on septem ber 18, 2016 http: comjnl.oxfordjournals.org d ow nloaded from 1786 h.-y. chang et al. figure 16. an experimen",1,USE
202148048,239889551,"ally tractable. in order to get an estimate of the marginals i(xi), we use the g-amp algorithm that is a beliefpropagation based algorithm. b. related works the 1-minimization based algorithms 1 , are widely used for compressed sensing of approximately sparse signals. they are very general and provide good performances in many situations. they, however, do not achieve optimal reconstruction wh",1,USE
202130256,239863108,"rimental results in our experiments, we test the proposed image registration algorithm and some state-of-the-art algorithms on two image datasets. the first is the open dataset provided by shen et al. . the dataset contains 4 image pairs with different exposures and 3 image pairs with and without flash. the dataset also provides a set of human labeled corresponding points as the ground truth in the",1,USE
202100630,239819131,"se of the system matrix is relevant to measuring convergence in a nite element context. we then provide alternative ways of calculating or estimating this quantity. finally, we extend the results of to the block conjugate gradient (bcg) algorithm 2,4 . in particular, we show that the simple rule proposed in 1 for computing the stopping criterion can be easily extended to the bcg algorithm wit",1,EXTEND
201715650,239263112,"rimental settings we implemented our algorithms in c and ran them on a pc with a 3ghz intel p4 processor, 1gb ram, and a 80gb hard drive running red hat linux enterprise 4. we used the cplex solver to solve the integer-programming models. for comparative purposes we also independently developed computer programs for two other algorithms, which we refer to as acn and ghru. we coded these algorit",1,USE
1574739,1664352,"be optimal. for 1 a solution can be sub-optimal, but the sub-optimality is bounded by a factor of : the length of the found solution is no larger than times the length of the optimal solution . the left three columns in figure 2 show the operation of the a algorithm with a heuristic inflated by 2.5, 1.5, and 1 (no inflation) on a simple grid world. in this example we use an ei",0,MENTION
3309505,3409722,"code kernels. for the tflops benchmark, these kernels were written in x86 assembly code. for a detailed description of the techniques and algorithms used in this code, see the paper by bolen et. al. . our past work with mp linpack has shown that for very large problems, at least 93 of the runtime is consumed by the blas-3 matrix multiplication code, dgemm (which computes c c-a b). the dual proce",0,MENTION
6861904,7171934,this structure may be exploited to give a specialized simplex algorithm using basis partitioning although this was not done here. instead we solved the problem using the general lp-solver cplex (see based on two di erent approaches. the rst approach is based one the original network ow formulation min c t x : x m(k) and the resulting algorithm is denoted simxo. the second approach is to solv,1,USE
13512546,14498673,"ngent notions of correctness in terms of both concurrency and failure semantics. furthermore, distributed file systems are typically designed for workloads in which read-write sharing is rare (e.g., ). caching is often done at a fairly coarse granularity, such as entire files or large portions of files. even so, the algorithms used in distributed file systems (e.g., andrew howard et al. 1988 a",0,MENTION
18375831,19564828,"onservative bound of the proxy. we identify potentially intersecting surface patches and a penetration direction for each contact region, using a fast collision detection algorithm for convex objects . we then refine the query result by considering a localized height-field representation of the deformable geometry parameterized on a 2d domain. we have developed an image-space algorithm for computi",1,USE
22298800,23356297,"e. then, queries are evaluated based on a voting scheme using the hash table. this voting scheme replaces the seed generation process. in this lecture, we look into the voting scheme used in 3dsearch . the algorithm is based on the concept of geometric hashing 1 developed in the field of computer vision. the basic idea is to represent all secondary structure elements (sses) from all target prote",0,MENTION
26404561,27110547,"for databases. broadly speaking, the algorithms can be classified into workload-aware and statistical. workload-aware algorithms use workload information from the query optimizer. for example, sacco observed that if the buffer allocated to a database system is less than the hot set size of the workload, many misses occur. based on this observation, he suggested a buffer management algorithm in w",0,NOTALGO
37272620,36243446,"ated the techniques into a tool, called optimised set reduction (osr) to provide benchmark results for spice trials participants. the tool uses traditional machine-learning techniques in an algorithm that is able to generate a set of patterns relevant to the industry to be predicted. in the spice trials, benchmarking is performed against each process assessed, so the result is a benchmark profile",0,MENTION
38171186,36839871,"he content of each pixel. these kinds of algorithms have been extensively addressed in the literature and many developed systems have proved their efficiency. most of them are based on chaotic system which is mainly used for the substitution process, although some critics are always done for an improvement purpose 9 . for the permutation process, a position permutation algorithm by magic cube tr",0,MENTION
68323942,66883101,"esponding to the mexican hat is ( x y , a a ) (1 x2 y 2 a2 )e (x2 y 2 ) 2a 2 (2) more recently the trous wavelet transform algorithm has been used because it allows an easy reconstruction ( ; vikhlinin et al. 1996). by this algorithm, an image i(x,y) can be decomposed into a set (w1, ..., wn, cn), i(x,y) cn(x,y) n wj(x,y) (3) j 1 several statistical models have been used in order to",0,MENTION
70391775,69553164,"erns. once the basic framework is in place, the coding of, say, the widely used 1981-style integration-by-parts algorithms is much easier and i d say very much more enjoyable than was the case in . more important, however, is the new range of options in regard of what kind of algorithms may be efficiently implemented. not to mention a full control over the resulting software and its applicatio",0,MENTION
78600757,76605833,"ating the values of actions, such as monte carlo tree search (mcts). specifically, we use the mcts algorithm called upper confidence bounds for trees (uct) as a startingpointfor creating our algorithm . mcts does not require the complete model of the environment; itonlyneedsawayofsamplingtheeffectsofselectedactions. furthermore, rather than treating all of the state-actions as equally likely, uct f",1,EXTEND
81349567,78982637,"ultiply operations to complete a point multiplication. table 3 compares performance vs. our proposed designs synthesized in 130 nm. references 20 and 21 were in 350 nm; 17 used 250 nm; 16 and used 130 nm. the algorithm in 20 depends on the number of one bits in the key and is vulnerable to side-channel attacks. 20 and 21 operate in affine coordinates, requiring division for point ad",0,NOTALGO
7738130,8101912,"and minimize the total completion time. many heuristics have been proposed to deal with this problem, such as asap scheduling, alap scheduling, critical path scheduling and list scheduling algorithms . the critical path, list scheduling and graph decomposition heuristics have been developed for scheduling acyclic data flow graphs (dfgs) 7, 14 . these methods, however, do not consider the parallel",0,MENTION
12571472,13472510,"s in fact 2 6, 3, 11 . this greedy conjecture is themain subject of our paper. also in 3 a modified version of the greedy algorithm achieving a 3-approxi-mation is introduced. further improvements have led to the best known result of a 2.5 approximation 11 .the greedy algorithm when allowed to close cycles (i.e. merging a string with itself) determines a minimum length cycle cover 3 . we ver",0,MENTION
66209798,64975864,"mb(v ). the algorithm stops as soon as v is smaller or equal to the radius of mb(v ), i.e. when all balls are contained in mb(v ). this method, together with a suitably adapted updating-scheme from to efficiently and robustly solve the equations in the proof of lemma 3.1, handles degeneracies in a satisfying manner; numerical problems tend to only occur towards the end of the computation, when",0,MENTION
71722041,70796142,"es) whose currents can be (in)directly metered by pmus. using topological observability as a criterion, optimal pmu positions have been pursued via simulated annealing 5 , or genetic algorithms 3 , . if the number of available pmus cannot provide a spanning tree, only incomplete observability can be afforded, and a tree search yields the pmu positions sought 30 . by extending topological (in)ob",0,MENTION
718486,768335,"ches. 4 selected shape from shading algorithms most sfs algorithms assume that the light source direction is known. in the case of the unknown light source direction, there are algorithms 36 , 26 , which can estimate the light source direction without the knowledge of the surface shape. however, some assumptions about the surface shape are required, such as the local spherical surface, uniform",0,MENTION
1196479,1275199,"yay 168 gave a linear-time algorithm for computing a center point, using a direct and elegant technique. near-quadratic algorithms for computing a center point in three dimensions were developed in . clarkson et al. 72 gave an efficient algorithm for computing an approximate center point in r d . 9.5 ham-sandwich cuts let s 1 ; : : : ; s d be d (finite) point sets in r d . a ham-sandwich cut i",0,MENTION
1586066,1676742,"inition 3.2 unique-sat is easy if there exists a polynomial-time algorithm a that on formula with exactly one satisfying assignment, a( ) outputs that assignment. unique-sat is easy implies np rp and p up. there exist relativized worlds where unique-sat is easy and p np. theorem 3.3 if unique-sat is easy then for all polynomials p there is a polynomial q and a constant c such that for al",0,MENTION
3001686,3124177,"ies) decision trees of constant rank in polynomial time and gave a pac-learning algorithm for general polynomial size decision trees in time n o(logn) , (see also bl92,r87 ). kushilevitz and mansour gave a polynomial time pac learning algorithm with membership queries for decision trees under the uniform distribution. hancock h93 gave a polynomial time algorithm for pac learning read-k decisio",0,MENTION
3487853,3596154,"echniques. visibility culling is only one of a set of real-time rendering techniques. the issue of integrating a visibility-culling algorithm with other forms of acceleration is an important one (see ), which we believe is an area still rich in interesting problems. dynamic objects. another largely under-explored area is the handling of dynamic objects 82 . acknowledgments we would like to thank",0,MENTION
4237936,4380682,"interesting. mimd algorithms are ecient at rapidlysnding the amount of available bandwidth, but it is believed that they lead to instability as well as unfair sharing of resources; see chiu and jain the other hand, it has been observed for some time ( 5 , 10 , 11 ) that if most hosts follow aimd ( are altruistic quot;) then aggressive individual hosts are able to subvert aimd congestion control i",0,MENTION
4490750,4641525,"e. (in particular the approximation should be within an additive factor of less than 1 y deltae .) this will be done using the quot;continued fractions method quot;, and specifically algorithms due . we briefly introduce some notation and summarize known results regarding continued fractions. we follow the description in lovasz 27, pages 9--12 . given a positive real ff, consider the sequence a",1,USE
4932789,5099016,"f parallelism, without 18 or with 17 constraints. up to our knowledge, only one attempt has been made in order to exploit explicit data-(and-)parallelism in logic programming : our dp-log project . most of the works in parallel constraint satisfaction consist in parallelizing a specific algorithm, like backtracking search 21 , grobner basis computation 4 or arc-consistency 15 . only recent",0,MENTION
8073192,8482905,ch is infeasible without learning all of the bits of both products. what practical hash functions h are available for use in an implementation of our scheme two possible candidates for h are the md4 and md5 18 message digest algorithms. these were designed specifically for securely preprocessing a document before being signed with a public-key cryptosystem. they are also fast (11.6 mbit sec on,0,MENTION
9373372,9921365,"ark, contrasts with the onset of a plateau in the pp and ep data samples, and supports the interpretation of the large-gap events in pp and ep collisions in terms of hard colorless exchange processes . the jade jet-finding algorithm 18 was used to define jets and the rapidity and gap distributions were studied as a function of the jet multiplicity of the events. we considered 2-jet and 3-jet ev",0,MENTION
11745851,12565475,"new structural and algorithmic results. good examples are proofs of min-max theorems ontreewidth by seymour and thomas 18 , the polynomial time algorithm computing branch-width of a planar graph in , the linear time algorithm on trees for com-puting cutwidth in 15 , as well as the computation of the topological bandwidth in 14 , and the vertex separation number in 7 . it is therefore natural",0,MENTION
