contextID,citationID,clean__citation_context,utilize_label,USAGE_LABELS
1809173,1915365,"minates, a new seed is placed within the bundle and a new ber is advected. as de ned in equation 2, the advection method for the bers is accomplished using a simple fourth-order runge-kutta algorithm . to maintain the coherence of the bers, they must be advected in lock-step. this is important because as bers die o , they have to be re-seeded according to the distribution of the other bers in the",0,MENTION
29908809,30604721,"e an important category if we would like to explore different kinds of mammals. to show the difference between typicality analysis and clustering analysis, we apply the k-medoids clustering algorithm to the zoo data set. we first compute the 10 clusters of the zoo data set. the median animals of the clusters are starfish, boar, lark, tuatara, dolphin, flea, bass, mink, scorpion, hare . the group",1,USE
30522897,31235696,"vitable for tasks whose domains are not well understood. the impact of features is particularly significant for the class of instance-based learning algorithms, such as the nearest neighbor algorithm , in which the distance function is very sensitive to the quality of features. how to improve the quality of features has been one of the critical issues concerned in the field of instance-based lear",0,MENTION
45673045,44790120,ound by random sampling. we can nd all regular polygons with high probability in o(n 2 ) expected time for every positive . this compares well to the o(n 2 2 ) deterministic algorithm of bra . 1 introduction the focus of this study is on the detection of regular structure in point sets. our motivation comes from observations that have been published concerning extraordinary symmetries in,0,MENTION
56602802,55932864,"recursively: p i i 1hi (1.51) ) 2 r1:i 1 pni pni h t i p i i 1hi pni (1.52) ki p i i 1hi h t i p i i 1hi pni (1.53) this gain shares similarities with the gain of the lstd algorithm (equation (1.19)), which is not a surprise. the lstd is based on a least-squares minimization (however with the introduction of instrumental variables in order to handle stochastic transitions), and",0,MENTION
82280241,79777622,"nts with the normalized range and detection of vowels accordingly. 3.1 formant estimation for formant estimation, methods based on linear prediction analysis (lpc) have received considerable attention . root finding algorithms are employed to find the zeros of the lpc polynomial, or local maxima of the lpc envelope are searched using peak-picking techniques. the steps described below are followed t",0,NOTALGO
83923211,81129622,"m spanning tree and delaunay triangulation problems in linear expected time. the details of these algorithms, together with some of the applications areas in which they arise, are discussed by shamos . all of the results that we have described so far are valid only for point sets drawn uniformly on the unit square; the algorithms can easily be adapted to work for many known distributions of points",0,MENTION
85666390,82586579,"cessing in to remove undesirable small parts of the skeleton. smoothing and removing undesirable small parts of the skeleton is done using our distance step and is very similar to techniques shown in , where the scale is also an input in the algorithm. to conclude with the use of morphological techniques, the skeletal description we are looking for corresponds to the needed of an accurate basis fo",0,MENTION
3392864,3495687,"ions which are similar to this are often used in evolutionary strategies and evolutionary programming bs93 . quot; we took up this suggestion and combined it with the hcwl algorithm from kvasnicka et . the resulting shclvnd algorithm is related to evolutionsstrategien and -- similar to hcwl -- does not store information as parents in a population 3 . hcwl stores it as vector of probabilities, but",1,USE
8274135,8702308,"unification was on developing algorithms that compute a most general unifier for unification problems with constants 5, 14, 13 , or finite complete sets of unifiers for general unification problems . of course, such algorithms can also be used to decide solvability of a given unification problem. however, the complexity of a decision procedure obtained this way need not be optimal. in fact, to t",0,NOTALGO
26175691,26904772,"large latency variations for a large set of destination nodes 31 . therefore, to further improve the s-torus algorithm, robinson et al. proposed the multi-phase multicast routing algorithm: m-torus . the idea was to shorten the path lengths of the multi-destination worms to stabilize the latency variations and to achieve better performance by partitioning the multicast group. they introduced two",0,MENTION
29786804,30473144,correct mappings between couples of ontologies. it exploits an algorithm used for word sense disambiguation originally proposed by michael lesk 16 and adapted by satanjeev banerjee and ted pedersen . the obtained alignment is then post-processed in order to further refine it by finding semantic inconsistencies. the paper is organised in the following way: section 2 provides some background knowl,0,MENTION
54461524,53974291,"ssociations extracted from biomedical abstracts by text mining. several computational algorithms have been developed to computationally predict target genes sites of mirnas, such as pita 12 , pictar , targetscan 14 and miranda 15 . patterns of gene silencing induced by mirna are achieved by mrna degradation or translational inhibition 16 . several transcription profiling studies of mirna tran",0,MENTION
56242982,55611930,"was done when the author was writing his thesis at saarland university and max-planck institute for informatics.2 han, rosenhahn, weickert, seidel offsets, efficient and easy to implement. borgefors improved the chamfer matching by using a more reasonable confidence measure and embedding the basic algorithm into a resolution pyramid, which has reduced the computational cost significantly. a rece",0,MENTION
57840589,57115847,"the road network is dense. for this reason, many methods have been embedded to the algorithm to make it faster. to sum up these enhancement methods we will put them into categories as it was cited in as follows: shortest- path with bi- directed search: in this approach as it was illustrated in 76 , 77 the search starts from both positions start and end, at the same time. thus, the scanning t",0,MENTION
65601037,64375006,"thogonal projection of w0 onto the convex set k as n , and w n converges to the solution of (9). 4 how to minimize the energies with graphcuts 4.1 principle greig, portehous and seheult proved in that discrete energy minimization can be exactly performed. graphcuts have been introduced in computer vision by y. boykov and his collaborators in 8 as an algorithm for this type of minimization.",0,MENTION
2335645,2470266,"h deadlines on a processor have been studied extensively in the literature. a typical example is the earliest deadline first (edf) algorithm, which has been widely used in many real-time systems (see for a survey). from a theoretical viewpoint, edf is optimal for scheduling underloaded systems, i.e., whenever there exists a schedule meeting the deadlines of all jobs released, edf can always do so",0,MENTION
2506906,2635784,eight-map and merges triangles based on the visible error in screenspace. the method cleverly avoids t-meshes and cracks in the surface by propagating triangle splits and merges in the height-map. in the method originally developed in lindstrom96 was extended with a rapid geomorphing algorithm in order to avoid vertex popping. hoppe also applied geomorphing to terrains in hoppe98 . this geomor,0,MENTION
2827098,2947387,"13 temporal relations defined by allen 1 the number of solving rules which lead to an arc consistent csp contains over 26000 rules. this is, obviously, too large to generate by hand. apt and monfroy describe an algorithm which automatically generates these rules for small finite domains. in the case of the allen relations, the table provided by allen ( 1 page 836) is used as input for the algor",0,MENTION
3204937,3305147,"etry, e.g. in context of robot motion planning algorithms 6 when d 2; 3. figure 2 illustrates the minkowski sum of two polygons in r 2 . this section describes the principles of the algorithms of used above to compute minkowski sums of polytopes, and illustrates their role in theorem 1 using the case of m 2. it is not hard to see that the minkowski sum s of k polytopes is a polytope, in fac",0,MENTION
4292291,4437050,"cale compression algorithm that kept the spectral and pitch content intact across different compression ratios. the time-scale algorithm used was based on a modified form of a phase-vocoder algorithm and produced artifact-free compression of the speech sentences (fig. 1). onsets were aligned for different sentences and compressions, with data acquisition triggered on a pulse marking sentence onse",0,MENTION
4845685,5009932,"e, -optimal strategies provide the transparent interface to the optimizer. we use our model to analyze conventional pipelining execution strategies, as given in 8 and dte, a data parallel algorithm . dte outperforms pe in most cases significantly. however, it is not yet -optimal: in typical skew situations, some processors may become overloaded while others remain idle. we present dte r an impro",0,MENTION
5423094,5606974,rious message sizes and numbers of destination nodes in a 2 5 theta 2 5 torus with 5 table 1. comparison of multicast costs in a 2 n theta 2 n torus under the one-port model. algorithms a g u-torus dlog 2 jdm je dlog 2 jdm je np-ut 2 d 2d gamma1 minfdlog 2 jdm je; 2(n gammad)g 2 minfdlog 2 jdm je;2(n gammad)g d gamma2 2 d figure 7. the multicast latency ratio of the utorus scheme to our np,0,MENTION
8766468,9244640,"parallel supported by xunta de galicia xuga10502b94 given that the semantics of the language guarantees that no interference among them can arise. this is the sort of parallelism that jones and hudak call implicit parallelism. algorithms are written in a declarative way without taking care of the execution model. thus, the expressions to evaluate have to be scheduled by the compiler in both time",0,MENTION
8825052,9309696,"lot, forwards processor s 7 data in the second time-slot, and so on. contention for memory is avoided because a processor always accesses the same memory. this is the well-known daisy chain algorithm . 4 scheduling multicast communication neither of the solutions proposed in section 3 is adequate when data must be written into the memories of some but not all of the processors. if the set of proce",0,MENTION
10876753,11602392,"simple euler scheme has proven sufficient in our experiments. of course, we could resort to higher-order schemes, such as the total-variation diminishing runge-kutta scheme of third order devised in . 3.3.4 overview of the algorithm for sake of clarity, we give an overview of our implementation of lspc in algorithm 1 below. algorithm 1 algorithm for level sets with a point correspondence for all",0,MENTION
10970604,11712851,"gh space overhead. the suffix tree in mummer, e.g. uses 37n bytes of memory, where n is the input length (delcher et al., 1999), although with careful implementation, this can be reduced to 8n. avid ( ) handles mismatches and gaps by using a variant of the smith waterman algorithm once the anchors have been selected with the help of suffix trees. chaos (brudno and morgenstern, 2002) indexes k-mers",0,MENTION
11070790,11817447,"algorithm failed to detect. they accomplished this through a novel approach to providing an em algorithm with a good starting point (seed). probably the best tools for finding consensus based motifs ( ) are the pattern-driven algorithms (brazma et al., 1998) that test all 4 l l-letter patterns, score each pattern by the number of approximate occurrences in the sample (or by a more involved function",0,MENTION
11294455,12066583,"there are clearly many coexisting levels of design: we share many capabilities with organisms that evolved much earlier, but we can control, modulate, and deploy those abilities in far more ways (cf. ). 4. architectures not algorithms it is argued in 18 that the search for powerful explanatory architectures is more important than the search for algorithms. figure 2 indicates very loosely a sketc",0,NOTALGO
11319433,12094391,"lgorithms on turing machines have been devised too. fischer and paterson 8 give a linear-time off-line turing-machine algorithm for finding all initial palindromes in a string. finally, galil 10 , describes a real-time (that is, on line, but in between reading two symbols from the input string constant time is spent) multitape turing-machine algorithm finding all initial palindromes in a strin",0,MENTION
13780287,14785480,"y many researchers. the color icp algorithm 4 uses not only the pure 3d information but also the color information in searching corresponding point pairs. the icp algorithm using invariant features uses euclidean invariant features like curvature and moment invariants. in this paper, we propose a new icp based method using the normal vectors of the 3d points as well as the 3d position of every",0,MENTION
16226141,17354221,"assumption and have a narrow scope of applicability. recently, several techniques have concentrated on reducing the computational complexity of eigen-decomposition based methods: pesaventosand haardt presented a real-valued variant of root-music based on the unitary transformation. lineborge 35 developed several efficient algorithms for real value singular value decomposition (svd). in this cha",0,MENTION
16840181,17984570,"the packet arrivals and energy replenishment. most solutions proposed in the energy-aware routing literature incorporate certain measures of nodal residual energy, and therefore are dynamic in nature . for example, in 5,9,10,18 , algorithms have been presented to optimize the lifetime of the network. these algorithms can be viewed as different attempts to combine the elements of two routing appro",0,MENTION
18132750,19320213,"rmance of a learner using filtered features is very sensitive to the score criterion of the ranking technique. in order to avoid this situation, hycla adopts what has been called the wrapper approach , 13 , in which final feature selection depends on the inductive algorithm used. when a learner receives a feature set, it carries out the following tasks: 1. empirical learning feature selection.",0,MENTION
20236538,21460650,given tables. dennis peters has prepared a tool that generates test oracles from tabular program specifications 15 . the transformation algorithms discussed above have been implemented by hong shen to provide a prototype tool that assists designers in transforming tables. much work remains to be done in finding transformation algorithms which are simple and also produce compact transformed tabl,0,MENTION
27347025,28054391,"ly valid states than feasible (reachable) states in the planning task. this is not necessarily problematic for example, a planning algorithm based on forward search, such as hoffmann and nebel s ff , will never encounter any of the infeasible states, so there is no obvious advantage to the finite-domain representation. however, a number of other planning approaches do benefit significantly from",0,MENTION
28410508,29127858,"proposed to synergistically apply various automated transformation algorithms to simplify and decompose complex problems into simpler problems which may be solved with exponentially lesser resources . however, little prior research has addressed the applicability of various transformation algorithms in the presence of constraints. additionally, in some cases prior research lacks optimality, and d",0,MENTION
28422319,29139461,"necessary. online algorithms. online algorithms have a long history (see, e.g., 11, 21 ), and there have been many attempts to relax the strict worst-case notion of competitive analysis: see, e.g., and the references therein. online algorithms with stochastic inputs (either i.i.d. draws from some distribution, or inputs arriving in random order) have been studied, e.g., in the context of optimi",0,MENTION
30668817,31377804,"a variety of different sorts of morphological information. 1. introduction in computer vision, a variety of algorithms have been developed that generate the so-called skeleton of a depicted object 2 3 4 5 6 7 8 9 10 11 . one way to define the skeleton of an object is as the set of centres of the maximal discs that can fit inside that object while touching two or more points on its bou",0,MENTION
38103066,36771908,"he subgraph induced by s . thus, we may assume that s opt1, and hence equation (1) yields r1 1 rst. in particular, a ratio of r1 25 9 2.78 is possible using the steiner tree algorithm of . observe that r1 to be minimized in equation (1) is of a special nature, and in fact a bound r1 2.46 has been shown ha . 3 approximating the tour cover the problem we discuss in this section is a",0,MENTION
38707666,37312038,"map on the space of differentials. a normalized isogeny is an isogeny : e e for which ( e ) e where e denotes the invariant differential of e. algorithm 1 (identical to algorithm 4.1 in ) evaluates, up to automorphisms of e, the unique normalized horizontal isogeny of degree corresponding to a given kernel ideal l o . the following theorem, taken verbatim from 4 , shows that the",0,MENTION
39535520,38090413,"e computed in (d log n ) o(1) time and n1 o(1) space, as summarized in 25 . the problem however remains challenging for general metrics, such as those commonly used in many scientific applications . the efficiency or accuracy of approximate nearest-neighbors algorithms is typically reduced when general metrics are used instead of euclidean distances 25 . a distinctive feature of hcdpes in cont",0,MENTION
39578248,38134879,"utation mechanism where the recommended strategy is a nash equilibrium that survives iterated deletion of weakly-dominated strategies. these results can be viewed as steps in the program advocated in of unifying the strategic model and computational model in distributed algorithmic mechanism design. our work is related to 15 , but uses a different solution concept. the rest of this paper is orga",0,MENTION
59857727,59192062,"ength; as far as we know this is the first example in q of this kind. 2 extension of the coefficient field several algorithms for decomposing univariate rational functions are known, see for instance and 1 . in all cases, the complexity of the algorithm grows enormously when the coefficient field is extended. a natural question about decomposition is whether it depends on the coefficient field,",0,MENTION
65869573,64638942,"diagnosis 1 and effective monitoring of therapies in retinopathy 2 . alotof research has been focused on the development of algorithms and strategies for the extraction of the retinal vessel tree , especially with respect to the accuracy required for more precise and repeatable diagnostic methods. among other techniques, active contours have been shown as a flexible tool for vessel extraction,",0,MENTION
82893095,80240207,"nd we isolate real roots as soon as we approximate them within less than b 2. effective solution algorithms rely on continued fractions (see below), having highly competitive implementation in synaps and its descendant realroot, a package of mathemagix, on the descartes rule of signs, and the sturm or sturm habicht sequences. theorem 3.2 the rational algorithms discussed in the sequel isolate al",0,MENTION
84379705,81509772,of maximum pairs orientation admits a solution d such that p d p (4logn).furthermore gamzu et al. 7 show that maximum pairs orientation admits an o(logn loglogn)-approximation algorithm. in it is shown that k pairs orientation is fixed parameter tractable 4 when parameterized by the maximum number of pairs that can be connected via one node. they posed an open question if the problem is,0,MENTION
7115230,7439361,"we had to initially use a best estimate quot; of the gradient a0. thus, there is no guarantee how our implementation of this algorithm would work, even on the same problem class as that posed in 22 sets from 22 are labeled sc quot; while those from 21 are labeled mc quot;. we present a summary of the test problems in table 1. the numbers in the second column are the problem set numbers as",0,NOTALGO
7660272,8016411,"speed, while p 7 through p 13 were crippled. figure 5.5 compares the results of using the hcgm linear-partition algorithm and then sorting locally against the results obtained by standard sample sort . the test sorts a list of 2:5 delta 10 6 integers, using the leda implementation of quicksort as the local sorting function. in both cases, the input is initially distributed in a load balanced mann",1,USE
18032745,19219398,"manceofthepb -tree on the itanium 2 processor, focusing on various implementation choices and their effect on performance. 1. introduction modern computers are based on the von neumann architecture , which separates the processing unit (cpu) and storage (main-memory). the trend in the last two decades has been that cpu speed is increasing at a rate of about 60 per year, whereas main-memory spee",0,NOTALGO
39729812,38274395,"iption we use two functions, namely minimum hp(g) and minimum 1pc(g,u): the function minimum hp(g) corresponds to the algorithm for computing a minimum path cover of an interval graph g described in , while minimum 1pc(g,u) corresponds to the algorithm for computing a minimum path cover with specified endpoint u of an interval graph g described in this paper. algorithm hp biconvex input: a biconv",1,USE
190951764,168158603,"y using the following observations: (i) no, sh, ns are correct, (ii) the class of theories csi is closed under disjoint union, and (iii) the class sh is contained in csi. similar results are given in . as an additional remark, we mention the possibility of refining the abstract inference systems presented here with strategies as done in 10 , so to get a more fine-grained rule-based implementation",0,NOTALGO
4236173,4378670,"e d(c i ; c j ) as an independent random integer x, 0sxs10 6 . here and in what follows, quot;random quot; actually means pseudorandom, using an implementation of the shift register random number gen . for these instances it is known that both the optimal tour length and the ap lower bound approach a constant (the same constant) as n 1. the rate of approach appears to be faster if the upper boun",0,MENTION
10001597,10616350,"n of the sequence. fig. 1. regular or red refinement of a tetrahedron we use an algorithm which combines regular (red) and irregular (green) mesh refinement as introduced for 2d meshes by bank et al. and its extension to three dimensional tetrahedral meshes of bey 2 and go ong 8 . these refinement algorithms are carried out in three steps. first, a refinement rule for a single element has to b",1,USE
10760054,11464380,"d, and can instead focus on problems unique to that community. using xml also provides a common basis for interoperability that can easily leverage techniques such as semantic mediation 12 and xslt , and assist with automated provenance management. finally, by building libraries for formats such as netcdf, hdf5, grib, and others on a common bxsa implementation, they can avoid duplicating code fo",0,MENTION
14787654,15858048,"ection we present our algorithm, algorithm learn boxes, which learns unions of n-dimensional boxes over infinite domains. the algorithm gets a labeled sample and uses the algorithm learn sensitive of to produce a hypothesis consistent with the sample. we then extend the hypothesis to n in a way that the vc-dimension of the extended hypotheses is small. the details of learn sensitive are not impo",1,USE
6835904,7144983,"they do not give a solution to atomic broadcast, we think that it will be straightforward to extend their solution of consensus to prefix agreement and thus to atomic broadcast. f. cristian et al. in propose an atomic broadcast algorithm, called on-demand atomic broadcast. their algorithm tolerates crash, omission and performance failures and has good performance with bursts of messages. their sy",0,MENTION
11526607,12320699,"the input string and may even loop. to solve this problem, in this section we extend the s 2 and s 1 tabulation techniques to the case of bidirectional push-down automata. 5.1 the s 2 framework from we know that extensions of push-down automata can be tabulated by using s 2 items storing the two elements on the top of the configuration stack. in the case of bpda, s 2 items are of the form b, i,",1,EXTEND
34509726,34447221,"are distinguishable (which they are not in 5 ). 4 security models 4.1 chosen plaintext security we begin by extending the usual left-or-right (lor) indistinguishability game for a cpa adversary from to handle stateful encryption and leakage of length information. this extension is only needed at intermediate steps in our security analysis, while we are primarily interested in the security of the",1,EXTEND
40312438,38845825,"we have also extended the results of 50 to the case of partial observation in order to handle more realistic applications 41 . symbolic algorithms have also be developped and implemented in sigali 4. application domains 4.1. panorama keywords: telecommunication, control-command systems, smart-cards, software embedded systems, transportation systems. the methods and tools developed by the verte",0,NOTALGO
