contextID,citationID,CLEAN_CITATION_CONTEXT,UTILIZE_LABELS,USAGE_LABELS
8278267,8706594,"eves a queue size of k, and does not make any copies of packets. in addition, it can easily be generalized to meshes of arbitrary dimensions. a similar algorithm was independently discovered by kunde . however, the lower order terms of his algorithm are larger, particularly for higher dimensions. next, we apply our techniques to several randomized routing algorithms recently proposed by kaklamanis",NOTUTILIZE,MENTION
7469420,7816239,"v 1 ; :::; v n gamma1 g, where v i 1 iff x i xm . then echx;zisb maxchx;zisb maxchv; f0; 1gisb xorhv; f0; 1gi b omega gamma n delta log n); the lower bound on the xor has been established in . 2 thus, the proposed algorithm has an optimal bit complexity. 7 extensions and remarks 7.1 bidirectional rings in the previous section, we have considered unidirectional rings; that is, rings where",NOTUTILIZE,MENTION
13822684,14832402,"m works as follows: 1. if more than one recorded channel is available for a given meeting recording, combine them all into a single enhanced channel using a delay sum algorithm further described in . 2. run speech non-speech detection on the enhanced data using the speech non-speech algorithm presented in 9 and explained in section 3. 3. extract acoustic and delay features from the data and",NOTUTILIZE,MENTION
14098928,15122766,"ng scheme, cost function and fitness scaling function that we used. it seems that some problem specific heuristic is needed to make genetic algorithms work efficiently in these problems. according to it is widely recognized that simple genetic algorithms are not good at fine tuning the final solution and a hybrid approach where genetic algorithms are used in the beginning of the optimization ru",NOTUTILIZE,MENTION
25129462,25948304,"ng new violations. these algorithms are interesting in their own right, and will be discussed in future work.ssearch techniques used in aspen are an evolution of those developed for the dcaps system a that has proven robust in actual applications. in terms of related work, iterative algorithms have been applied to a wide range of computer science problems such as traveling salesman lin kernig",NOTUTILIZE,MENTION
161030571,141602986,"r our purposes, we use tree-width as a black box in our algorithm. the following two properties of tree-width are crucial. 7 theorem 4 (robertson and seymour 11 , boadlaender 2 , perkovic and reed ). for every s 1, there is an integer w 1 and a linear time algorithm that, given a graph g, either (correctly) recognizes that the tree-width of g is at most w or returns an embedding h : hs g",NOTUTILIZE,MENTION
3400271,3502945,"stream. 8 (2)san extract (e) filter reads voxels, produces a list of triangles from the voxels, and writes the triangles (the isosurface) to its output stream. we use the marching cubes algorithm , which is commonly used for extracting isosurfaces from a rectilinear mesh. the extract filter receives data from the read filter in buffers. a buffer contains a subset of voxels in the dataset. the",UTILIZE,USE
32495586,32860523,l complexity bounds and reflects the inherent conflict between the requirements of global convergence and fast local convergence. in an attempt to address both paradigms mentioned above i proposed in the first infeasible-interior-point algorithm having both polynomial complexity and superlinear convergence. this result was generalized for linear complementarity problems (lcp) in 61 . a simplifie,NOTUTILIZE,MENTION
57874992,57148243,"ly constructs the minimal state space whose size may only grow polynomially with m. for the horspool algorithm, it is known that the state space has a size of only o(m2 ), as the construction of tsai can be adapted to construct a daa according to our definition. however, we have been unable to provide a direct construction of the minimal daa applicable to all window-based pattern matching algorit",NOTUTILIZE,MENTION
18660791,19851076,"16 , 17 , 18 . 2.2 multi-objective differential evolution (mode) and its strategies several studies on extension of differential evolution for solving moops are reported in literature 19 , 20 , , 22 , 23 , 24 , 25 , 26 27 , 28 . babu and gujarathis 22 used mode algorithm to solve multi objective optimization of supply chain planning and management. mode algorithm is also applied suc",NOTUTILIZE,NOTALGO
56929607,56257162,"ot predict well when the aircraft makes an unanticipated change of flight mode such as making a maneuver, accelerating, etc 7, 8, 9, 10 . many adaptive state estimation algorithms have been proposed . the interacting multiple model (imm) algorithm 15, 16 runs two or more kalman filters that are matched to different modes of the system in parallel. it uses a weighted sum of the estimates from th",NOTUTILIZE,MENTION
111966692,102819553,ntroduced the first efficient algorithm for the computation of the betti numbers of all the level sets of a scalar field in o(m logm) time. in this paper we introduce an extension of the algorithm in that allows one to add the betti numbers of each contour while maintaining the simplicity of the scheme and the efficient o(m n logn) time complexity. we also introduce a new divide and conquer sch,UTILIZE,EXTEND
32561868,32916364,"he major issue anticipated in the extension of the algorithm to 3-d would be the high computational cost, which can be tackled by incorporating accelerating methods, such as the fast marching methods",NOTUTILIZE,MENTION
27463451,28173408,n. the main contributions of our research are as follows: 1) we extend previous feature line detection methods in a way which performs much better with typical noisy range images (suggestive contours are an example of the kind of feature lines intended). 2) we present a strategy for generating long smooth feature line paths which can be flexibly used as a basis for various stylization approaches.,NOTUTILIZE,NOTALGO
6117986,6346237,parison of equal error rates for several authentication techniques in the m2vts database. authentication technique eer ( ) mdla with discriminating grids 5.6 mdla 9.2 gray level frontal face matching 8.5 discriminant gdla 9 6.0-9.2 gdla 9 10.8-14.4 6. conclusions novel methods for incorporating discriminant analysis into the elastic graph matching algorithm have been proposed. they are based,NOTUTILIZE,MENTION
202765965,240772664,"l select the bestsprobability distribution based on the observed features.sfor comparison, we used support vector machine from weka 12 andsmaximum entropy from mallet 13 . please refer to 21 and for furthersdiscussion on these common techniques.s4. labeled ldaslabeled lda is a topic model algorithm that was created by ramage et al.s14 as part of the stanford",UTILIZE,USE
72949974,71938498,"hizotypy, discriminated relatives of schizophrenic probands from relatives of controls 33 . even, elevated rates of only positive schizotypy have been found in biological relatives of schizophrenics . to explain these conflicting results, the finding is of interest that individuals with elevated scores on negative and positive schizotypy appear at particularly high risk for development of schizop",NOTUTILIZE,NOTALGO
5551990,5743733,"is paper. to compare the performance of the genetic algorithm with typical numerical procedure for minimization of nonlinear functions we used the powell minimization algortihm, as described by brent . this is a well proven general purpose minimization algorithm which was chosen after experiments with other minimization techniques.sresults and discussion the genetic algorithm was tested on experim",UTILIZE,USE
46764250,45944132,"for example, if the first task is scheduled by max-min algorithm, the next task will be scheduled by min-min scheduling. this algorithm ignores the waiting time of the large task in minmin scheduling . he xiaoshan et al proposed qos guided min-min heuristic algorithm. qos requirement is one of the important factor in grid task scheduling. it is similar to min-min scheduling algorithm. scheduling c",NOTUTILIZE,MENTION
202040712,239730604,"paper, in addition to the constructive and improving algorithms 1 and 2, we adopt asconstructive dispatching rule called etp v2 and an improving procedure called 3sw fromsthe study by valente et al. . these two methods are the most effective ones among thesseveral alternatives investigated in 18 . for the sake of brevity, we signify the constructives(12)salgorithm 1 and etp v2 by heu1 and heu4,",UTILIZE,USE
202502307,240392085,"atoms), and 3pb4 (4947 atoms). this range of sizes covers all single-domain proteins with structures in the protein data bank 2 . to generate nonequivalent protein conformations, we used the gromacs molecular dynamics package to simulate each protein for 5 ns. clustering benchmarks were performed using single-threaded linear algebra. the k-centers algorithm was used to cluster each dataset of 40",UTILIZE,USE
40716303,39252892,"lar geometry enable to determine a point position in the 3d space from the relations between their projection in the 2d space. in the last years the improvement of well kown image matching algorithm ( , gruen, baltsavias 1988) have provided optimization for multi-image approach and the study of geometrical constrains. there are many which establish the correlation on the area and on objects previou",NOTUTILIZE,MENTION
34492822,34432171,"an irreducible polynomial p in two variables, this procedure computes a holonomic equation satis ed by anyfunction y(z) solution of p (z;y(z)) 0. the algorithm used by gfun was pointed out by comtet , it can also be found in 4, pp. 276 278 : ( ) di erentiating p (z;y(z)) with respect to z yields y 0 (z) a(y; z) b(y; z), with a and b two polynomials. ( ) since p and b are relatively prime (p is",NOTUTILIZE,MENTION
6931593,7246242,"scales are complete for large classes of images 53 120 115 . however, recently counterexamples have been found to the most general statement of the problem 28 by meyer, as described by mallat in . in spite of this result, a number of algorithms have been proposed to invert the edge detection process that work very well in practice 69 34 . 29 chapter 3 parametric feature detection 3.1 intro",NOTUTILIZE,MENTION
74120511,72913239,"signal (oss), which is mainly a parameter time-series at a sampling frequency lower than that of the audio signal. the term oss has been used in 4 , while oss are referred to as novelty function in and as detection functions in 1 . 3) detection of transients in the oss usually using a peakpicking algorithm 1 . the preprocessing is an optional step as in many other signal processing applicatio",NOTUTILIZE,MENTION
20790810,21976441,"ng algorithms provide a basis for this study. the first task of the compiler algorithm for forwarding, which should also work well for a-r synchronization, is to determine the producer-consumer pairs . 5.2.1 producer-consumer pairs algorithms presented in related work in data forwarding for finding producerconsumer pairs can also be applied here. these pairs can be found in three basic steps 10 .",NOTUTILIZE,MENTION
235692088,199251765,dditional information 7 . in recent years more systems emerged that provide information related to physical objects using mobilesphones. common implementation mark objects either with visual markers orswith electronic tags 28 . barcodes can be seen as the first implementation of visualsmarkers back in 1948. since special barcode readers are needed to read 1d barcodess2d barcodes such as qr-code,NOTUTILIZE,NOTALGO
21583956,22701414,"ation algorithm that computes the solution up to any desired accuracy quot;) used the ellipsoid method 50 but faster interiorpoint methods were later given by alizadeh 5 , and nesterov and nemirovskii . the running time of these interior point algorithms is o(pm(m n3)l) where l is an input size parameter. in this chapter, the o notation is used to suppress polylog( mn quot; ) factors. in addition to",NOTUTILIZE,MENTION
5662823,5861221,"ss of normalisation. 3.2 clustering algorithm post-retrieval document clustering has been well studied in the recent years, eg (cutting, karger, pedersen and tukey 1992; allen, obry and littman 1993; ; zamir and etzioni 1998). we deploy a variant of the buckshot algorithm (cutting, karger, pedersen and tukey 1992), a two-phase process to cluster the document representations ui in an euclidean k-di",NOTUTILIZE,MENTION
174134989,154951860,"s study at our institution using pre- and postbundle implementation measures found no effect, but that study was an ecological design and was not able to evaluate individual patient bundle compliance . with these signatures, we will be able to give a higher resolution evaluation of the effect of the ventilator bundle. we can also work towards developing real time compliance monitoring of the venti",NOTUTILIZE,MENTION
202296772,240099777,"est possible rectangle was fitted according to the intensity shifts, see figure 5.6. the result of bounding a midsection can be seen in figure 6.19. the graph cut algorithms used, were from matlabbgl , which is a package of graph algorithms designed to work with large sparse matrices. it utilizes the c library called boost graph library (bgl) 27 . this means that a graph had to be represented a",UTILIZE,USE
164038191,145253234,oldberg and satoshi nawata for their collaboration on ref. 25 . we also thank ignatios antoniadis for his permission to use figure 1. most of other diagrams have been created by the program jaxodraw . this work is supported in part by the european commission under project mrtn-ct-2004-005104. st.st. thanks the theory division of cern for hospitality and financial support during preparation of thi,NOTUTILIZE,NOTALGO
13526318,14513404,tration problem can then be formulated as maximising the mutual information between the optical image intensities and the surface normal vectors of the model. leventon et al. 46 and clarkson et al. have shown that a registration algorithm based on maximising the mutual information can be improved by using multiple rather than single images. the algorithm in 13 applies photo-consistency to fin,NOTUTILIZE,MENTION
8376903,8818121,"polation of functions over simplicial complexes of arbitrary topological type. our method allows fitting of a parametric surface of arbitrary topological type to a set of three-dimensional points. in , we sketched an algorithm for fitting a mesh of fixed vertex connectivity to the data. the algorithm presented here is an extension of this idea in which we also allow the number of vertices and thei",NOTUTILIZE,MENTION
6146456,6377432,"ing, as they can be parallelized with much greater ease than direct methods. as a result there has been a great deal of interest in implementing the conjugate gradient algorithm on parallel computers . in this paper, we study performance and scalability of parallel formulations of an iteration of the preconditioned conjugate gradient (pcg) algorithm 6 for solving large sparse linear systems of e",NOTUTILIZE,MENTION
16277916,17407279,"are prone to malicious attacks. a list of possible attacks on localization algorithms is presented in 30 . the authors also propose, robust statistical methods for attack-resistant localization. in , du et. al suggest a general scheme to detect localization anomalies that is independent of the localization techniques by formulating it as an anomaly intrusion detection problem. our approach requi",NOTUTILIZE,MENTION
79940046,77794376,", in which the imputed variables for the dependent variable are dropped before analysis, usually resulting in greater efficiency (von hippel 2007). we used the bootstrap-based algorithm in amelia ii ( ) to generate twenty imputed datasets and the mitools package (lumley 2004) to combine results across datasets. downloaded from http: poq.oxfordjournals.org at acquisition services on july 5, 2010 be",UTILIZE,USE
22735497,23748023,"ng. 3saluminum foil 4 paper 17 pvc 3 polyester 3 polypropylene 20 other resins 5 4 polyethylene 48 figure 1.2 percentage share of various packaging substrates in the us market in the year 2003 . high-barrier packaging can comprise several different layers and various types of resins, which provide advanced features for such characteristics as extended shelf life and the ability to allow per",NOTUTILIZE,NOTALGO
202506886,240398411,"optimize the selection of proteins with coiled-coil regions we used two different approaches: firstly the coils program 58 with windows of 28, 21 and 17 residues, and secondly the maircoil program . we considered high coiled coil predictions when both algorithms returned high probabilities of coiled coils. other alpha helical conformations were predicted respectively with heliquest for amphiphi",UTILIZE,USE
13512546,14498673,"ngent notions of correctness in terms of both concurrency and failure semantics. furthermore, distributed file systems are typically designed for workloads in which read-write sharing is rare (e.g., ). caching is often done at a fairly coarse granularity, such as entire files or large portions of files. even so, the algorithms used in distributed file systems (e.g., andrew howard et al. 1988 a",NOTUTILIZE,MENTION
39127129,37707438,"lly 9, 18 or dynamically 20 . the modelization of synchronous pipelined wavefront algorithms has been presented in 11 for smp clusters. these techniques have been applied to several applications achieving high performance. concerning out-of-core computation, two approaches can be applied. the system approach 6 proposes a technique adapted to large amount of data to improve the virtual memo",NOTUTILIZE,MENTION
3990114,4121405,"e constraint solver parcon 7 . 2 a graph structure signature is an algebraic signature according to 5 with unary operation symbols. 2 bardohl, schultzke, taentzer the parsing algorithm proposed in (which is based on contextual layered graph grammars (clgg) and critical pair analysis) is now implemented using the agg system, hence we call it agg graph parser. in genged we integrated the agg gra",NOTUTILIZE,MENTION
35315338,35145785,"nnual time series of income statement, balance sheet, and cash flow statement data for north american companies from the period 1972 1999. references 4 and 5 propose a genetic algorithm 6 and propose genetic programming frameworks respectively for induction of both classification and generalized rules from databases. the framework outlines a method for classification using tuple set descr",NOTUTILIZE,MENTION
19269515,20470971,", and future 8.1 previous related algorithms based on spacepartitioning trees. both tree-based methods presented represent new extensions along a continuing line of research in statistical algorithms . for the closely-related problem of kernel regression, a single-kd-tree-based method was presented in 4 . we presented an early bare-bones dualtree method for the kde problem in 11 , which used the",NOTUTILIZE,MENTION
18380393,19569831,"transform of xw(u). a benefit of the wiener filter is that even a sloppy determination can still give excellent results, even though the method is not as sophisticated as methods previous discussed. 3.9 expectation-maximization maximum likelihood estimator (em-mle) algorithm the em-mle algorithm computes the maximum likelihood estimate of the intensity of a poisson process. the noise distortion",NOTUTILIZE,MENTION
19569237,20778045,"specificity, in order to test algorithm behavior on data with different vocabulary characteristic. the first three queries represent very general concepts and are frequently used as a test by authors of search results clustering algorithm. next three queries are more specific subjects but broad enough to have interesting subclasses. last three queries are about relatively specific topics and were",NOTUTILIZE,MENTION
14051201,15073210,"ion of nonterminals can be handled just as easily. so we assume that the input to the algorithm includes a set p of productions whose production functions have been modified. the steps given in lines - 34 implement essentially the same idea as procedure dynamicswsf fp. a heap, called globalheap, of all the inconsistent non-terminals is maintained as before, and in each iteration the inconsistent",NOTUTILIZE,MENTION
28191983,28898907,"ce the rules we chose the c4.5 algorithm (quinlan, 1988), using the original implementation provided by the sniffer system (batista and monard, 2004), as part of the discover data mining environment ( ). this environment offers integrated tools to produce and evaluate models according to different algorithms, evaluation measures, and other data mining characteristics. besides being one of the most",NOTUTILIZE,MENTION
14320073,15358579,"uropa orbit. petit grand tour. we now apply the techniques we have developed to the construction of a fully three dimensional petit grand tour of the jovian moons, extending an earlier planar result.( ) we here outline how one systematically constructs a spacecraft tour which begins beyond ganymede in orbit around jupiter, makes a close flyby of ganymede, and finally reaches a high inclination orbi",UTILIZE,EXTEND
16401701,17536011,"ector to know exactly where the pointers are cannot be used. 13sscheme- c a portable scheme-to-c compiler to solve this problem, a new garbage collection algorithm called quot;mostly-copying quot; was devised . instead of requiring that the root set be a known set of cells containing pointers which define all accessible storage, the new algorithm only requires that the root set include pointers or values d",NOTUTILIZE,MENTION
10239266,10881421,to path expressions. there is also room at the physical level for algebraic common subexpressions 88 . many algebra operators can be implemented by using the same algorithm with different parameters as combinations of basic building block algorithms. an example illustrated in the rexall paper 88 is the expression sum(a quot; b) gamma sum(a gamma b). this expression can be optimized if we note,NOTUTILIZE,MENTION
263420,246835,"ation, then using these higher-level runtime systems often just adds unwanted overhead to the performance of the operations. for example, although it is possible to access mpi calls from within nexus , doing so is much slower than accessing the machine-specific mpi implementation directly. in light of these disadvantages for using high-level runtime support systems, we decided to use low-level com",NOTUTILIZE,MENTION
18233122,19421235,"generation of 2880 k-leader and 1320 l-leader for a total of 4200 experiments (table 1). the discretization, reduct computation and rule generation algorithms are those included in the rosetta system . gps was used with the following settings: function set , , , , exp , random constants in the range 0, 100 , population size 100, 000, reproduction probability 0.05, mutation probability",NOTUTILIZE,MENTION
23933443,24847350,"el. more accurate models can be obtained using trilinear elements with a support extending over a cube of eight voxels. we use an art algorithm with generalized kaiser-bessel window functions (blobs) . these functions are spherically symmetric, spatially limited, and have a tunable smoothness. 96s(a) 1d blob profile. (b) fourier transform of the profile from figure 5.7(a). figure 5.7: 1d blob prof",UTILIZE,USE
8241980,8666692,"discuss spatial inference in databases of symbolic spatial indexes, the representation of aggregation hierarchies using spatial indexes and implementation issues. parts of chapters 4 and 5 appear in ( ), (papadias et al., 1994a) and (papadias et al., 1994b). chapter 6 enhances the expressive power of symbolic spatial indexes by incorporating topological relations. as in the case of direction relati",NOTUTILIZE,NOTALGO
34265567,34241009,"a way that the actual edges between nodes of b are not involved. to carry out the connected-components computation (and to find spanning trees of the components), we use the connectivity algorithm of , suitably modified to take into account our assumption that every two blue nodes are adjacent: we start by constructing a tree containing all the blue nodes in h d and another tree containing all the",UTILIZE,USE
202202682,239967568,"near the dam. nevertheless, relative lower density in the east and north of hla might blur the final result both at shallow or deeper depths. 4 algorithm we applied the version of lotos-07 algorithm ( ), which includes absolute source location, optimization of starting 1-d velocity model, and iterative tomographic inversion for 3-d seismic vp, vs and source parameters. the fortran-based programme c",UTILIZE,USE
17999834,19186146,"icit surfaces to improve the rendering quality, and still have a compact representation. moreover, we would like to extend our approach to handle other kinds of input model types such as point clouds and higher order primitives. it might be useful to integrate approximate visibility criteria within our efficient lod metric to further improve the performance ray tracing on massive models with high",NOTUTILIZE,NOTALGO
85012068,82052583,"osed mechanism, we will present a neural network model that performs an extended version of an appetitive and aversive trace conditioning task used in recent neurophysiological recording experiments ( ; belova et al., 2007; salzman et al., 2007; belova et al., 2008; morrison and salzman, 2009). in those experiments, monkeys learned whether an abstract fractal image (conditioned stimulus, cs) predic",NOTUTILIZE,NOTALGO
