contextID,citationID,CLEAN_CITATION_CONTEXT,UTILIZE_LABELS,USAGE_LABELS
448133,479186,"ransformation phase is coupling our general semantic processing with semantic processing tailored for an encountered domain. this could include extending the dublin core processing proposed by little by including the conclusions it determines in clustering. at later processing, one could design communicative devices specifically for presenting concepts that these techniques generate. a task for t",NOTUTILIZE,MENTION
40100085,38631661,"ons are typically applied to modify an image. popecu and farid propose a runtime efficient algorithm to detect duplicated image regions by calculating the similarity of overlapping blocks of an image . figure 25 shows the result of an analysis of an image showing an iranian rocket test, which was distributed by the government of iran. the white areas in the generated map indicate duplicated image",NOTUTILIZE,MENTION
202612780,240549722,"eady to execute. since all tasks in the ptq are ready to execute, a scheduling algorithm must be used to apportion the cpu time amongst these tasks. we use the earliest deadline first algorithm (edf) , which is optimal for a uniprocessor system with independent, preemptible tasks having arbitrary deadlines 15 . the ctq is organized as a series of slots, one for each compensating task. each slot c",UTILIZE,USE
202253684,240038592,"ts because the initial conditions that guarantee the reliability of the parametric tests cannot be fulfilled, which implies that the statistical analysis loses credibility with these parametric tests . specifically, we use the friedman aligned ranks test 33 to detect statistical differences among a group of results and the holm post-hoc test 34 to find the algorithms that reject the equality h",UTILIZE,USE
6738336,7039344,"never generalize any type variables. hence removing applicative type variables from tofte s system yields a system isomorphic to ours. 1 the existing proofs of type soundness for tofte s system 18 , establish type soundness for ours. 7 we can easily establish that our system possesses a type inference algorithm which finds principal types 2 . the algorithm is the ordinary hindley-milner type in",NOTUTILIZE,MENTION
22574511,23602865,"is a variety of important applications which utilise the ndft, e.g. in computerised tomography 18, 32, 34, 29, 28 , for fast summation algorithms 35, 36, 23 , for moving least squares approximation , as fast fourier transform on the sphere 25 , or as part of the ridgelet and curvelet transforms 27, 6 . furthermore, the reconstruction from nonuniform samples is stated in 20, 13, 1, 26 as inve",NOTUTILIZE,MENTION
6122876,6351389,"ics in order to handle dynamic semantics (condition (6), no dynamic rule). a first condition is to store all attributes outside the tree: we think of using a technique similar to the one presented in s quot;, or quot;cactus stacks quot;, to store non-temporary attributes. in this context, the current implementation does support successive assignments of a given attribute instance, thanks to an at",NOTUTILIZE,NOTALGO
202783669,240797886,"riance. we scaled the features by dividing with the maximal feature value in the data followed by pca reducing the dimension to 10. for the locally linear projection, we run the neural gas algorithm ( ; cottrell et al., 2006) with 14 prototypes to get a division of the data space into receptive fields. pca was applied to every receptive field to define local transformationssk. together with the res",UTILIZE,USE
13505233,14491287,"fv and glmm for pe and colon training data algorithm time (colon) time (pe) fd 5 26 fd-afv 7 28 glmm 518 329 helping them detect and characterize emboli in an accurate, efficient and reproducible way , 11 . an embolus forms with complex shape characteristics in the lung making the automated detection very challenging. the candidate generation (cg) algorithm searches for intensity minima. since ea",NOTUTILIZE,MENTION
4256171,4399696,"on the bachelor kaon candidate to remove possible contamination due to b semileptonic decays. we extract the signal yield by using an unbinned extended maximum likelihood fit method described in ref. . for the b j c k analysis, the fit variables are the beam constrained mass m(b), the energy difference deltae, the j c candidate mass and the cosine of the angle between the direction of the b can",UTILIZE,EXTEND
57981328,57239988,"to move from a pseudo-basis to another.as for z-lattices, the choice of the pseudo-basis is of utmost importance. however, a key di erence is that no analogue of lll is known, as repeatedly noted in . there have been attempts 10, 22, 11 but the algorithms are either limited to certain elds or give no guaranteed bounds on the output size. while every ok-module is also a z-lattice and can thus be",NOTUTILIZE,NOTALGO
77645966,75811570,"their global optimisation procedure. note also that lca-gauss allows us to perform unsupervised dimensionality reduction with the same performance as previously proposed supervised algorithms (e.g., ). figure (4) shows the clustering accuracy on the three datasets for various numbers of em iterations, one iteration corresponding to manifold parzen windows 26 with agaussiankernelwhosecovariancemat",NOTUTILIZE,MENTION
30767842,31474628,y e were embedded in each event in order to enhance statistics. the l1 sts track reconstruction algorithm was applied 2 . two different methods were used for trd track reconstruction: l1 2 and lit . we observed only changes on a few percent level in the tracking efficiency (see eg. figure 1) and also no big changes concerning ghosts and mismatches with sts tracks. this reassures for planning a,UTILIZE,USE
57785238,57060884,"ptimum. recently, genetic algorithms (ga) are very much used to solve mop. many researchers have transformed the mop to a single objective problem using appropriate weights. then, ga was been applied . unfortunately, the obtained solution depends on the weight vector used in the process. also, this method requires a number of runs equal to the size of the desired pareto optimal solutions. moeas ar",NOTUTILIZE,MENTION
81955256,79496049,"active modeling. in collaboration with a researcher in formal computation, evelyne hubert, we improved and extended the analytical methods for computing closed form solutions for convolution surfaces . within c",NOTUTILIZE,NOTALGO
6427013,6694642,"thms. in particular, sparse certificates could be used for speeding up fully-dynamic algorithms for maintaining minimum spanning trees and the connectivity and 2-edge-connectivity relations in graphs , to o( n) time per operation. basically, these sparse certificates were defined in terms of (successive, minimum) spanning trees, and were maintained by applying fredericksons minimum spanning tree",NOTUTILIZE,MENTION
20875869,22053414,"ery time: since we only have several nanoseconds to react to an item, we can afford to update a small number of counters or indexed variables. there are many algorithms for identifying frequent items and other statistics 1,9,12,13 in the entire data stream. many of them use random sampling; they make assumptions on the distribution of the item frequencies and the quality of their results are on",NOTUTILIZE,MENTION
2411840,2547017,"ar meshes with complexity of o(n) and o(logn) respectively have been presented here. although the timing of our algorithms is similar to those by eva01 , de floriani et al. def84 , lindstrom et al. and ab solo et al. aba00 , we emphasize the following points in this paper: the types of mesh subdivisions produces right isosceles similar triangles, and the algorithms admit both very simple descr",NOTUTILIZE,MENTION
39869791,38410144,"re not shown here. detect states are the same colour as the black state for simplicity. in this example the detection occurred at the bottom left black cell. the shrinking phase of the algorithm from uses time at most 2.5m. in order to deal with the discussed problematic inputs, our algorithm sometimes 15uses yellow intermediary states when deciding whether to transition from a grey state to a w",NOTUTILIZE,MENTION
14435496,15481611,"mallest one. once the circle is well fit to data, border detection gets much easier. as a pre-process to the automated circle determination, we begin by applying a generic segmentation algorithm like . after that, we have a first sight at the edges. those are cut by a very coarse manual circle, as figure 2 shows: figure 2. edges detected by the generic segmentation algorithm (white). the coarse ci",UTILIZE,USE
202474230,240350797,"178sfeatures 8 4 13sclasses 28 3 3sf-measure 18 is often used to measure the accuracy ratesof the data clustering algorithms. in these experiments, thestraditional k-means 16 , fast global k-means ,sfkcucd 20 , and bi-level k-means algorithms will besused to classify the data sets abalute, iris, and wine,srespectively and f-measure will be applied to evaluate theirsperformances. tables i to iv",UTILIZE,USE
6679728,6977510,"for this bias by assigning weights to individual sequences, usually based upon the level of sequence similarity. such schemes may signi cantly improve the performance of homology detection algorithms ; however, heniko and heniko 21 2 procedure average score (query set, database) for i 1to size(database) target database i sum of scores 0.0 for j 1to size(query set) query query set j (evalue,",NOTUTILIZE,MENTION
2060589,2180213,"rsion algorithm. finally, hoppe 11 investigates memory versus memoryless simplification. 3. simplification and smoothing algorithm our algorithm follows the same basic steps as the qem algorithm in . the major differences are, however, that we do not use triangle normals but rather vertex orientation estimates 2 and we incorporate new quadrics to handle different types of orientations. 3.1. ro",NOTUTILIZE,MENTION
16375697,17508241,"e correctness of the whole system. the nelson-oppen method has been widely adopted as the basis for combination algorithms 11 . its bare bones versions are described and proved correct by ringeissen and by tinelli and harandi 15 . we work at the level of abstraction that is close to these works, but our system is extended with implementation-related details. a series of recent papers is devoted",NOTUTILIZE,NOTALGO
13496372,14481771,"n of linear size, which can be computed in nearly linear time. we obtain a cc-partition of the workspace by applying a simpli ed version of the rst stage of de berg s binary space partition algorithm to the set fg(e; b)je 2egof grown obstacles. the procedure takes the set of vertices of the axis-parallel bounding boxes of the grown obstacles as input and outputs a decomposition of the workspace i",UTILIZE,USE
202830499,240863872,"his extension is key for policy analysis under rational expectations, but the forwardlooking variables make the model nonrecursive. we show that the recursive saddlepoint method of marcet and marimon can nevertheless be applied to express the model in a convenient recursive way, and we derive an algorithm for determining the optimal policy and value functions. a second main contribution of our pa",UTILIZE,EXTEND
22912319,23910328,"o denote the matching whose cost is (a, b). the problem of aligning two point sets arises in various areas ranging from structural molecular biology 11 to shape registration 9 to medical imaging . the hungarian algorithm can be used to compute m(a, b) in o(n 3 ) time. no polynomial-time algorithm is known for computing m(a, b). a popular approach for finding a good alignment between a and b u",NOTUTILIZE,MENTION
201748727,239312646,"edge weight wmax such that there exist k paths in a subgraph gi of gi which is the same as gi except that it only includes those edges whose weight is no less than wmax. we also use the algorithm in to test or find k shortest paths in terms of the edge conflicting number in gi. in this way, it can ensure that the minimum edge weight of the k paths found in step 1 is maximized. in step 3, we use",UTILIZE,USE
7154527,7481315,"orithm was considered in the specific context of petri nets and was improved upon, by amongst others, alaiwan and memmi 3 . a variant of alaiwan and memmi s algorithm, designed by d anna and trigila , includes further efficiency improvements. 2.2 generation of the coverability graph this technique involves the enumeration of all reachable markings (or the covering markings in the case of an unbou",NOTUTILIZE,MENTION
12004726,12849816,"(e.g. the k-d trees described in 8 ). in this paper, we compile the case base into a decision diagram. decision diagrams are described by wilson 9 , extending the approach of 1 . they, along with , represent a strand of research into compiling constraint satisfaction problems (csps). our contribution is to apply them to cbr, especially casebased retrieval and to current conversational recommen",NOTUTILIZE,MENTION
30877572,31576196,"mance for sparse matrix-vector product kernels using segmented scan vs. assigning 1 thread per row. while our reduce downsweep implementations expend much effort to avoid shared memory bank conflicts , the intra-warp scan algorithm is inherently conflict-free. the main efficiency advantage of segmented scan is that its performance is largely invariant to the way in which the sequence is decomposed",NOTUTILIZE,NOTALGO
9764628,10358026,"l. 1 . we investigated the performance of our algorithm with respect to various benchmark instances generated by the project generator progen published in kolisch et al. 6 and kolisch and sprecher . they specified a large number of parameter constellations and generated problem groups, each group consisting of 10 instances. for each n 30; 60; 90 and r 4 they obtained 48 groups. at first we",UTILIZE,USE
202890466,240949155,"ement data like the retention times to ensure that all pepxml files resulting from different search engines contain the same information. for peptide quantification the algorithm xpress version 2.1 was used with peptide mass tolerance set to 0.8 da. as we searched both, unlabeled and labeled peptides, for each raw file and search engine two pepxml files were processed by xpress. this approach y",UTILIZE,USE
19947099,21164817,"ly, optimal solution. they are slow to converge and inconsistent and seem the last resort. a comparison between this method and simplex procedure is found in 3 . simulated annealing algorithm (see ) the algorithm begins randomly choosing a point in the variables space and evaluating the attributes. subsequently, an adjacent feasible point is randomly selected and evaluated. the second point bec",NOTUTILIZE,MENTION
57840589,57115847,"the road network is dense. for this reason, many methods have been embedded to the algorithm to make it faster. to sum up these enhancement methods we will put them into categories as it was cited in as follows: shortest- path with bi- directed search: in this approach as it was illustrated in 76 , 77 the search starts from both positions start and end, at the same time. thus, the scanning t",NOTUTILIZE,MENTION
201679145,239212096,"areas with bright and dark symmetry. on the segmented image, we applied phase symmetry detection algorithm described in 33 . bright and dark regions were segmented using otsu thresholding algorithm , resulting in two masks; one for the bright bulging regions and the other for the rest. based on thesemasks the following features were computed: total area of bright regions, total area of dark regi",UTILIZE,USE
42000703,40395208,"ke multiple fixed sinks cooperate with each other to lighten the load and distribute it among the nodes 8 9 . most of published works suggest to move a single sink to improve the network lifetime 10 12 13 14 . but, very few studies focused on the mobility of multiple sinks. some proposed algorithms find the locations of mobile sinks by solving a mathematical model 15 16 . in 15 , the algorit",NOTUTILIZE,NOTALGO
42188664,40566195,"p(x) c1 x, r(x) where c1 0.331 for the iwasaki action 6 and the coupling was chosen to be 2.13. the ensembles were all generated on qcdoc machines, using the exact rhmc algorithm , for 1 paraphrasing n. isgur in why n s are important 1 (2.1) 2baryons in 2 1 flavour domain wall qcd c.m. maynard m f volume ntraj nmeas nind physical length 0.03 0.04 163 32 4000 700 70 0.0",NOTUTILIZE,MENTION
25478782,26267477,"in this section, we will extend the l2 gain property of discrete-time switched system to the case that not all subsystems are schur stable. the techniques used in this section are similar to those in for continuous-time switched systems. following the assumptions in 24 , the initial state is assumed to be the origin, x 0 0. and we assume that the schur stable subsystems achieve an l2 gain sma",NOTUTILIZE,MENTION
16150770,17276249,"me model of inputs. finally, in both papers, the set of relations in the warehouse is given as part of the input, whereas in our work we re only given the database schema and the workload queries. in , theodoratos and sellis describe an algorithm for searching a space of candidate warehouses. they do not discuss the complexity of the view selection problem, and their search space does not include",NOTUTILIZE,MENTION
5086793,5261419,"oposed by amis et al. 3 . for the connected dominating set problem, wu and li proposed a distributed algorithm that performs badly in the worst case (o(n)-approximation) but works well in simulation . 3. basic algorithm before presenting the algorithms, we first give some formal definitions. a d-cube with size r is a d-dimensional axis-aligned cube with side length r. when d 1 or 2, a d-cube is",NOTUTILIZE,MENTION
27426711,28136457,"on a small sketch 1 http: www.csie.ntu.edu.tw cjlin libsvmtools datasets multiclass.html news20matrix consisting of randomly sampled columns from a according to a certain probability distribution , but their used sketch matrix, unlike ours, contains many duplicate columns and consequently impairs the algorithm s time and space efficiencies. achlioptas and mcsherry proposed an alternative entry",NOTUTILIZE,NOTALGO
2418386,2552719,"isregard the order of subelements. in the matching process, we represent both dtds and xml documents through labeled trees. the document representation is compliant wit the tree representation of dom . by contrast, the representation of dtds we adopt facilitates the description of the algorithms we propose. in this section we discuss this representation. 2.1 tree representation of documents an xml",NOTUTILIZE,MENTION
41749942,40142402,"their sub-structures follow: algorithm (which is an algorithmidentifier type): the object identifier for rsa pkcs 1 v1.5 with sha-256 must be used in the algorithm field, as specified in section 5 of . the value for the associated parameters from that clause must also be used for the parameters field. subjectpublickey: rsapublickey must be used to encode the certificate s subjectpublickey field, a",NOTUTILIZE,MENTION
75241196,73802550,"d schemes, the source and the destination have no knowledge about the location of the misbehaving node(s). a technique to overcome these shortcomings of end-to-end detection is the watchdog mechanism , a monitoring method used for ad hoc and sensor networks which is the basis of many misbehavior detection algorithms and trust or reputation systems. the basic idea of the watchdog mechanism is that",NOTUTILIZE,MENTION
34046930,34047820,"it is assumed that the system has multiple cameras with partial overlapped fov. to compute motion descriptors, the algorithm makes use of background modelling 2 3 , feature extraction and matching 6 and depth estimation using disparity 9 10 . the paper is organized into five sections. section 2 presents the novel approach of precise motion descriptor extraction using depth information of se",NOTUTILIZE,MENTION
41462990,39881252,"processors in each step. consequently, the updates take place in different order on the elements of c. in this algorithm we keep all the processors busy using only nearest neighbor communication (xnet ). in the preskewing all elements of a move along rows on the processor grid while b s elements are moving along columns. this is a very regular communication and consequently well suited for the xnet",UTILIZE,USE
65967436,64735356,uracy by gradually augmenting the originally small training set with the ex-amples downloaded from the web. our algorithm for semi-supervised learning is an adaptation of a method proposed elsewhere . it mainly considers the following steps: 1. build a weak classifier (cl) using a specified learning method (l) and the training set available (t). 2. classify the downloaded examples (e) using the c,UTILIZE,EXTEND
12489029,13381275,"ch is crucial for implementing the concepts presented before in a truly reusable and general way. the concepts of gral cannot be discussed here in detail, the interested reader is referred to 12 or . here, we restrict ourselves to an example. looking at figure 14, we see a generic implementation using the gral interface of the algorithm of fig. 13, which volume-averages cell values on vertices.",UTILIZE,USE
202431970,240291294,", which is a major cause for cesc. we aligned all the contigs assembled fromcesc samples to the genomes of all 175hpv strains downloaded frompave (http: pave.niaid.nih.gov ) using the blat algorithm . none of the contigs indicative of svs could be aligned to the hpv genomes, suggesting that the svs we identified were not caused by hpv. a survey of molecular mechanisms underlying somatic svs becau",UTILIZE,USE
27064630,27782666,"tric l1. for the analogous unrestricted median problem of type 1 p ffl l1 2 gammasp exact algorithms are given in 14 . these algorithms are implemented in lola, the library of location algorithms , which will be used to find the exact efficient and nondominated sets of 1 p bl (l1)b l 2 gammasp . 18s- 6 y x 0 1 2 3 4 5 6 7 8 9 10 11 0 1 2 3 4 5 6 7 8 b b b b ex 1 1 ex 1 2 ex 2 1 ex 2 2 b b p1",NOTUTILIZE,MENTION
12484963,13376446,that the algorithm by schmidt-schauss and smolka was actually a re-invention of the tableau algorithm for k known from modal logics 34 . the first dl systems employing tableau-based algorithms (kris and crack 45 ) demonstrated that (in spite of the high worst-case complexity of the underlying dl alcn ) such algorithms can be implemented in a practical way. the complexity barrier has been pushed,NOTUTILIZE,MENTION
56904549,56230566,"ysics, and circuit theory, etc. mathematically, this problem is called an inverse eigenvalue problem (iep). for details of mathematical theory and algorithmic aspects of the iep, readers can refer to . in this paper, we consider the inverse singular value problem (isvp) which is a natural generalization of the iep. the main concern of an isvp is the reconstruction of a matrix with singular values",NOTUTILIZE,MENTION
18392671,19580900,"ent). such probabilities are important in determining the steady state loss probabilities in networks with common finite buffer (see, 95 , 63 ). 24sin this setting, under the ce algorithm, 36 and consider the search space that includes all probability measures under which the stochastic process remains a markov chain so that p is absolutely continuous w.r.t. them. the resultant ce algorithm i",NOTUTILIZE,MENTION
86059029,82899553,"the so(3)-fourier transform implementation, which is needed for the numerical inversion of the funk transform. in our numerical simulations, we used the so(3)-fourier transform algorithm presented in . for a function defined on s 2 , which ist t t inversion of the circular averages transform using the funk transform 14 phantom (c0, y0) r 1 (0, 2) .5 2 (0, 2) .25 3 (0, 2) .125 table 2. the phantom",UTILIZE,USE
1847279,1957040,"cenario). fourth, a distributed klt is presented in the shape of an iterative algorithm. some evidence of the convergence of this algorithm is presented. a more detailed analysis will be presented in . this distributed transform has potential applications in sensor networks, distributed databases, surveillance systems and hyper-spectral imagery. a proof of theorem 4 proof of theorem 4. for the con",NOTUTILIZE,MENTION
8688800,9158917,"nodes ) 8 . non-bayesian methods for learning structure of multiply connected bayesian networks are search methods exploiting the properties of the model of independencies detected in data 37 33 . as this model depends on node ordering, the algorithms demand an ordering on all nodes or a weaker set of constraints on the ordering of nodes 39 . the maximum entropy heuristics 2 is used by sever",NOTUTILIZE,MENTION
2205457,2333233,"er maintain lists of the vertices of degree zero, one, and two. the buddy, triangle and cube rules can also be implemented to take overall linear time, for example using techniques from 2 , see also . more straightforward implementations, however, will also be fast enough for moderately sized networks. for the simplicial vertex and almost simplicial vertex rule, efficient implementation is less s",NOTUTILIZE,NOTALGO
10388493,11050618,"rgin and other interesting cases 5 , and (ii) to apply the criterion to two-way clustering of co-occurring continuous data. we suggest using a bayes factor, extended from a dc optimization criterion , as a measure of dependency for groupings or partitions formed of co-occurrence data. it compares the evidence for two models, one assuming dependent generation of data in the margin clusters, and th",NOTUTILIZE,MENTION
