contextID,citationID,clean__citation_context,UTILIZE_LABELS,USAGE_LABELS
7946162,8336608,"inhomogeneity in the readout field should cause shift artifacts like b 0 inhomogeneity in conventional mri. to correct this distortion, sekihara s quot;rubber sheeting quot; algorithm could be adapte . in this case, the readout gradient should be strong enough to provide a unique map of frequency to position in spite of the readout field inhomogeneity. for readout in the x direction, we require g",NOTUTILIZE,MENTION
18032745,19219398,"manceofthepb -tree on the itanium 2 processor, focusing on various implementation choices and their effect on performance. 1. introduction modern computers are based on the von neumann architecture , which separates the processing unit (cpu) and storage (main-memory). the trend in the last two decades has been that cpu speed is increasing at a rate of about 60 per year, whereas main-memory spee",NOTUTILIZE,NOTALGO
10031865,10649717,"escribe the accesses to the data array (in the case of regular accesses) or to the indirection array (in the case of irregular accesses). we also extended the interface ( 10 , 23 ) to the treadmarks run-time sdsm system to take advantage of the compiler analysis. we have measured the performance of these techniques on an 8-node ibm sp 2 for applications with both regular and irregular access pat",NOTUTILIZE,NOTALGO
3424901,3528954,"ble from the channel. koetter and vardy have recently proposed an algebraic soft-decision decoding algorithm by extending the list decoder of guruswami and sudan. the koetter-vardy (kv) algorithm 4 chieve up to about 4 db of coding gain at a frame-error-rate (fer) of 10 3 on a gaussian noise channel, with a practical range of 1 1.5 db and gains of 2 7 db on a rayleigh fading channel 6 .",NOTUTILIZE,MENTION
12501688,13394984,"d phase, we check the c candidates to determine their exact frequencies. the algorithm is illustrated in figure 4.1. phase 1 (finding candidates). the key idea in this phase is essentially what misra used. we find and remove a set of t (t c) distinct elements from the multiset. the resulting multiset has the property that those elements that were cfrequent in the original multiset are still c-f",NOTUTILIZE,MENTION
17927439,19111666,but relies on gcd computations of polynomials with coefficients in an extension field to achieve efficiency (hence the name g rur). for the gcd computations the algorithm (and the implementation) of is used. the algorithm is presented in pseudocode in algorithm 6. algorithm 6: sturm::g rur. input: f z x y g z x y . output: a list s of solutions (x y) ralg,NOTUTILIZE,MENTION
12498274,13391259,"ng in fixed, wired networks ant colony optimization was applied to various optimization problems such as the traveling salesman problem 58 , graph coloring problem 244 , and vehicle routing problem . overviews of optimization algorithms based on the ant colony optimization can be found in 57, 234 . recently, several routing protocols have been proposed inspired from social insects behavior for",NOTUTILIZE,MENTION
9101683,9620478,"feasibility of this approach. the implementation language considered in this work is ada. the flexible manufacturing system is shown in figure 1. this system has been discussed in some previous works , where the authors only considered specification and validation of the model. here we extend these works focusing on the implementation phase. the system is a workshop of car body puttying. the putty",NOTUTILIZE,NOTALGO
6122876,6351389,"ics in order to handle dynamic semantics (condition (6), no dynamic rule). a first condition is to store all attributes outside the tree: we think of using a technique similar to the one presented in s quot;, or quot;cactus stacks quot;, to store non-temporary attributes. in this context, the current implementation does support successive assignments of a given attribute instance, thanks to an at",NOTUTILIZE,NOTALGO
62120730,61361191,"onlinear operations on individual wavelet coefficients. among the algorithms that result from such models are so-called wavelet shrinkage algorithms 2 , 49 , 57 , 68 , 104 , 192 , 193 , 251 , , 330 . as described in 80 , such independent mixture models result in very simple nonlinear operations on individual wavelet coefficients for optimal estimation. moreover, both the discrete-state h",NOTUTILIZE,MENTION
226410921,192919406,"nmental context. in turn, feeling unsafe was linked tosincreased symptomology for depression, anxiety and increased blood pressure.sin research involving inner-city youth in chicago, garbarino et al. found thatsconcerns about neighborhood security and safety cause youth to be more cautious and alert instheir daily lives, heightening physiologic responses to stress. wilson et al. (2002) examinedsa",NOTUTILIZE,NOTALGO
40888566,39391098,"hm identifies blocks as moved, added, unchanged, removed, and modified. it also includes a name matching algorithm to capture renaming of program variables that is based on the work of neamtiu et al. . a similar approach is also applied by the ast comparison algorithm to capture renaming of methods. one of the challenges of matching java anonymous and inner classes is the absence of unique names.",NOTUTILIZE,MENTION
28179200,28885629,"lar recommendations on cryptographic algorithms and key lengths to be used for different scenarios. the european ist research project ecrypt releases their yearly reports on algorithms and keysizes covering a broad range of cryptographic algorithms and related topics. table viii contains an excerpt of the relevant information, such as key length of comparable strength and recommended usage scen",NOTUTILIZE,MENTION
48351341,48003493,"bvious flaw that they broke space-time symmetries 104, 105, 106, 107, 108 . nevertheless the quest is not completely hopeless. with some reflection it is realised that a simulation of an ising model with 10a metropolis algorithm is a cellular automaton if the definition is relaxed to allow probabilistic transitions. the ising model has a continuum limit in which rotational symmetry is restored.",NOTUTILIZE,MENTION
42509073,40866838,"e. we thus provide a detailed treatment of the stability and accuracy aspects of the proposed determinant calculations employed by the proposed algorithm. 2.1. chio s condensation chio s condensation method reduces a matrix of order n to order n 1 when evaluating its determinant. as will be shown, repeating the procedure numerous times can reduce a large matrix to a size convenient for the appl",NOTUTILIZE,MENTION
23588193,24527854,"information from video sequences. the short term temporal link provided by our algorithm can be efficiently exploited to build long term object trajectories, even in the presence of long occultation . background motion estimates can be exploited to compute mosaic or key frames 9 as well as to identify and to characterize different shots of a video sequence 5 . the use of motion and trajectory",NOTUTILIZE,MENTION
8278267,8706594,"eves a queue size of k, and does not make any copies of packets. in addition, it can easily be generalized to meshes of arbitrary dimensions. a similar algorithm was independently discovered by kunde . however, the lower order terms of his algorithm are larger, particularly for higher dimensions. next, we apply our techniques to several randomized routing algorithms recently proposed by kaklamanis",NOTUTILIZE,MENTION
