contextID,citationID,clean__citation_context,UTILIZE_LABELS,USAGE_LABELS
18032745,19219398,"manceofthepb -tree on the itanium 2 processor, focusing on various implementation choices and their effect on performance. 1. introduction modern computers are based on the von neumann architecture , which separates the processing unit (cpu) and storage (main-memory). the trend in the last two decades has been that cpu speed is increasing at a rate of about 60 per year, whereas main-memory spee",NOTUTILIZE,NOTALGO
15881100,16996034,"lculus. for simplicity, we have presented our work in the context of a substitution semantics. we would like to extend this work to more realistic models of space consumption for functional languages . our preliminary results in this direction are promising. more work remains to demonstrate the applicability of this technique in the setting of more advanced type systems. in particular, recursive t",NOTUTILIZE,NOTALGO
33705697,33788028,1ma in twisted edwards coordinates and 1m 1s (k 6)m 5s 2ma in extended coordinates. 5.3 miller loop miller s algorithm loops over the bits in the representation of n. we follow hisil et al. and denote the system of projective edwards coordinates (x1 : y1 : z1) by e and the extended system (x1 : y1 : z1 : t1) by e e . if the whole computation is carried out in e e each addition step in t,NOTUTILIZE,NOTALGO
132266275,117978843,"we embark on this study with the pinney equation and show how such a discretisation procedure may be found. 2. the classical pinney equation the classical ermakov system, as extended by ray and reid adopts the form u (t)u f(v u) u3 ; v (t)v g(u v) v3 ; (1) where f , g, and are arbitrary functions of their indicated arguments, and the overdot denotes the derivative ddt . its general",NOTUTILIZE,NOTALGO
5845039,6053405,"gamma1 i q gamma p k gamma1 i 1 ff i q i j v k fi gamma1 i v gamma p k gamma1 i 1 ff i v i j return fig. 3. the classical gram-schmidt algorithm global communication. unfortunately, bjorck has shown that the classical gram-schmidt method is unstable with respect to rounding errors, so this method is rarely used. on the other hand, hoffmann 21 gives experimental evidence indicating th",NOTUTILIZE,MENTION
23083732,24063362,"ed by ff 21, 2, 17 1. for more details on the sparsest cut problem, its relation to embeddings, and its application to the design of a host of divide-and-conquer algorithms, see the survey by shmoys . equally important in algorithmic applications are certain special 1 embeddings known as embeddings into random (dominating) trees, whereby the given metric is approximated by a probability distribu",NOTUTILIZE,MENTION
32560353,32914669,"nct is a function on variables of at most two processes) in general. nonetheless, the problem can be solved efficiently for several useful classes of predicates such as stable 2, 1, 14 , conjunctive , linear and semi-linear 4 , and relational 18 predicates. several fast but exponential algorithms have also been developed for solving the general version of the problem 5, 11, 16 . stoller and s",NOTUTILIZE,MENTION
77057432,75282751,"mployed to develop vast bodies of parallel algorithms for many real life applications such as fourier transform 18 , matrix decomposition 5 and ascend descend-type of divide-and-conquer algorithms . the pipeline and grid frameworks for developing algorithms, which will be presented in this section, are important for at least three reasons. first, they fill the gap in algorithm development for t",NOTUTILIZE,MENTION
57513306,56808906,"sequences in sequence databases. the algorithm is designed to mine a less restrictive form of rule than the one discovered by the algorithms of lo et al. 14 , pitman and zanker 36 and zhao et al. . cmrules is based on association rule mining because it was observed that for some datasets, the number of association rules that are sequential rules is high (this was confirmed in the experiments).",NOTUTILIZE,MENTION
14592965,15650697,"w. the episodes were mined over a single event sequence and their statistical significance was measured as a percentage of windows containing the episode (frequency) or as a number of occurrences. in , an issue of incremental and interactive sequence mining was addressed. an algorithm was proposed for finding sequential patterns in the expanded database using the old frequent patterns. another con",NOTUTILIZE,MENTION
27009290,27721039,"tion integration based on the above observations, a number of researchers have suggested that direct data on protein interactions can be combined with indirect data in a supervised learning framework . studies using this approach all use a classification algorithm to integrate diverse biological datasets. a classifier is trained to distinguish between positive examples of truly interacting protein",NOTUTILIZE,MENTION
17799707,18981146,"able set. finally, we discuss extensions of these results to the general case of polyhedra described with limited accuracy. some of these ideas and the corresponding algorithms were first reported in , where more details and proofs can be found. a. planning in discrete reachable sets assume that (15) and (25) hold. hence, there exists a quantization angle , and is a 2d lattice generated over by a",NOTUTILIZE,NOTALGO
18809584,20003150,", for each group, starting at those with the largest weights, finding maximal matchings. each maximal matching can be found with one pass. further details and the proof of correctness can be found in . we propose a new algorithm that uses only one pass yet still manages to find of the optimal size. a matching which is at least 1 6 algorithm 4 (weighted matching). we maintain a matching m at all ti",NOTUTILIZE,MENTION
30750182,31456173,thematics buckley and qu 13 examine the problem of solving linear and quadratic equations and present the conditions governing the existence of a solution when using the -cut method. dong and wong used a combinatorial interval analysis scheme to account for multiple occurrences of a parameter as part of an algorithm for computing fuzzy weighted averages (fwa). inverses of functions can be dete,NOTUTILIZE,MENTION
9283540,9823764,"lmost identical to our trec 6 clustering approach. unlike in previous years, we only used one algorithm (no experimental algorithm this year ), and ran it on different topic lengths. our trec 6 paper gives the details and rationale for the approach. the basic algorithm is 1. retrieve 1000 documents using the initial query (using lnu.ltu weights). 2. generate cooccurrence information about the que",NOTUTILIZE,MENTION
22493314,23529596,"tives per day for cs.unm.edu, aya.org, i-pi.com, and explorenm.com respectively. in the 1999 darpa mit lincoln laboratories ids tests, they stated that above 10 false positives per day is a high rate . algorithm fp day mahalanobis distance 91,524 2 of icd length 6-grams 13 dfa 37 markov model (log transform) 39,824 linear combination table 1. false positive rate per day for the algorithms,",NOTUTILIZE,MENTION
