contextID,citationID,clean__citation_context,UTILIZE_LABELS,USAGE_LABELS
7946162,8336608,"inhomogeneity in the readout field should cause shift artifacts like b 0 inhomogeneity in conventional mri. to correct this distortion, sekihara s quot;rubber sheeting quot; algorithm could be adapte . in this case, the readout gradient should be strong enough to provide a unique map of frequency to position in spite of the readout field inhomogeneity. for readout in the x direction, we require g",NOTUTILIZE,MENTION
18032745,19219398,"manceofthepb -tree on the itanium 2 processor, focusing on various implementation choices and their effect on performance. 1. introduction modern computers are based on the von neumann architecture , which separates the processing unit (cpu) and storage (main-memory). the trend in the last two decades has been that cpu speed is increasing at a rate of about 60 per year, whereas main-memory spee",NOTUTILIZE,NOTALGO
10031865,10649717,"escribe the accesses to the data array (in the case of regular accesses) or to the indirection array (in the case of irregular accesses). we also extended the interface ( 10 , 23 ) to the treadmarks run-time sdsm system to take advantage of the compiler analysis. we have measured the performance of these techniques on an 8-node ibm sp 2 for applications with both regular and irregular access pat",NOTUTILIZE,NOTALGO
3424901,3528954,"ble from the channel. koetter and vardy have recently proposed an algebraic soft-decision decoding algorithm by extending the list decoder of guruswami and sudan. the koetter-vardy (kv) algorithm 4 chieve up to about 4 db of coding gain at a frame-error-rate (fer) of 10 3 on a gaussian noise channel, with a practical range of 1 1.5 db and gains of 2 7 db on a rayleigh fading channel 6 .",NOTUTILIZE,MENTION
12501688,13394984,"d phase, we check the c candidates to determine their exact frequencies. the algorithm is illustrated in figure 4.1. phase 1 (finding candidates). the key idea in this phase is essentially what misra used. we find and remove a set of t (t c) distinct elements from the multiset. the resulting multiset has the property that those elements that were cfrequent in the original multiset are still c-f",NOTUTILIZE,MENTION
17927439,19111666,but relies on gcd computations of polynomials with coefficients in an extension field to achieve efficiency (hence the name g rur). for the gcd computations the algorithm (and the implementation) of is used. the algorithm is presented in pseudocode in algorithm 6. algorithm 6: sturm::g rur. input: f z x y g z x y . output: a list s of solutions (x y) ralg,NOTUTILIZE,MENTION
12498274,13391259,"ng in fixed, wired networks ant colony optimization was applied to various optimization problems such as the traveling salesman problem 58 , graph coloring problem 244 , and vehicle routing problem . overviews of optimization algorithms based on the ant colony optimization can be found in 57, 234 . recently, several routing protocols have been proposed inspired from social insects behavior for",NOTUTILIZE,MENTION
9101683,9620478,"feasibility of this approach. the implementation language considered in this work is ada. the flexible manufacturing system is shown in figure 1. this system has been discussed in some previous works , where the authors only considered specification and validation of the model. here we extend these works focusing on the implementation phase. the system is a workshop of car body puttying. the putty",NOTUTILIZE,NOTALGO
6122876,6351389,"ics in order to handle dynamic semantics (condition (6), no dynamic rule). a first condition is to store all attributes outside the tree: we think of using a technique similar to the one presented in s quot;, or quot;cactus stacks quot;, to store non-temporary attributes. in this context, the current implementation does support successive assignments of a given attribute instance, thanks to an at",NOTUTILIZE,NOTALGO
62120730,61361191,"onlinear operations on individual wavelet coefficients. among the algorithms that result from such models are so-called wavelet shrinkage algorithms 2 , 49 , 57 , 68 , 104 , 192 , 193 , 251 , , 330 . as described in 80 , such independent mixture models result in very simple nonlinear operations on individual wavelet coefficients for optimal estimation. moreover, both the discrete-state h",NOTUTILIZE,MENTION
226410921,192919406,"nmental context. in turn, feeling unsafe was linked tosincreased symptomology for depression, anxiety and increased blood pressure.sin research involving inner-city youth in chicago, garbarino et al. found thatsconcerns about neighborhood security and safety cause youth to be more cautious and alert instheir daily lives, heightening physiologic responses to stress. wilson et al. (2002) examinedsa",NOTUTILIZE,NOTALGO
40888566,39391098,"hm identifies blocks as moved, added, unchanged, removed, and modified. it also includes a name matching algorithm to capture renaming of program variables that is based on the work of neamtiu et al. . a similar approach is also applied by the ast comparison algorithm to capture renaming of methods. one of the challenges of matching java anonymous and inner classes is the absence of unique names.",NOTUTILIZE,MENTION
28179200,28885629,"lar recommendations on cryptographic algorithms and key lengths to be used for different scenarios. the european ist research project ecrypt releases their yearly reports on algorithms and keysizes covering a broad range of cryptographic algorithms and related topics. table viii contains an excerpt of the relevant information, such as key length of comparable strength and recommended usage scen",NOTUTILIZE,MENTION
48351341,48003493,"bvious flaw that they broke space-time symmetries 104, 105, 106, 107, 108 . nevertheless the quest is not completely hopeless. with some reflection it is realised that a simulation of an ising model with 10a metropolis algorithm is a cellular automaton if the definition is relaxed to allow probabilistic transitions. the ising model has a continuum limit in which rotational symmetry is restored.",NOTUTILIZE,MENTION
42509073,40866838,"e. we thus provide a detailed treatment of the stability and accuracy aspects of the proposed determinant calculations employed by the proposed algorithm. 2.1. chio s condensation chio s condensation method reduces a matrix of order n to order n 1 when evaluating its determinant. as will be shown, repeating the procedure numerous times can reduce a large matrix to a size convenient for the appl",NOTUTILIZE,MENTION
23588193,24527854,"information from video sequences. the short term temporal link provided by our algorithm can be efficiently exploited to build long term object trajectories, even in the presence of long occultation . background motion estimates can be exploited to compute mosaic or key frames 9 as well as to identify and to characterize different shots of a video sequence 5 . the use of motion and trajectory",NOTUTILIZE,MENTION
8278267,8706594,"eves a queue size of k, and does not make any copies of packets. in addition, it can easily be generalized to meshes of arbitrary dimensions. a similar algorithm was independently discovered by kunde . however, the lower order terms of his algorithm are larger, particularly for higher dimensions. next, we apply our techniques to several randomized routing algorithms recently proposed by kaklamanis",NOTUTILIZE,MENTION
27016586,27729327,-the-art methods: celebi et al. recently compared seven tumor area extraction algorithms. table 3 comparison of the extraction results for tumor area methods precision ( ) recall ( ) (a) thresholding 99.2 82.8 (b) thresholding k-means (ycbcr),NOTUTILIZE,MENTION
213270463,183794304,"point and e is the energy of the saddle point, as compared to the reactant state. for comparison between the present hqtst sticking coefficient and the quantum wave packet propagation (qd) from ref. , refer to fig. (3.15). in obtaining the qd data, olsen et al. ran wave packet propagation with kinetic energy as low as 0.3 ev, which is still about an order of an magnitude larger than what would be",NOTUTILIZE,NOTALGO
40310970,38844456,nto significant time savings. the efficiency of both depth-first and best-first and or search methods also depends on the accuracy of the guiding heuristic function. we used the mini-bucket heuristic which is extracted from the functional specification of the graphical model using the mini-bucket approximation algorithm 11 . these heuristics were explored in 1 in the context of and or search t,UTILIZE,USE
13505817,14491866,"stance between the feature vectors and the prototypes. this minimization problem is actually a reformulation of the problem of determining fuzzy -partitions that was solved by fuzzy -means algorithms , 6 . pal et al. 20 suggested that lvq can be performed through an unsupervised learning process using a competitive neural network whose weight vectors represent the prototypes. according to their",NOTUTILIZE,MENTION
5991707,6212536,"dynamic algorithms (see e.g., 4, 7, 8, 11, 26, 27, 28, 32 ). only recently, fully dynamic algorithms have started to appear for maintenance of shortest path trees 18, 19, 30 and transitive closure . however, despite the number of interesting theoretical results achieved, very little has been done so far with respect to implementations even for the most fundamental problems (the only implementat",NOTUTILIZE,MENTION
81331843,78968030,"sampling plans in order to limit the number of data points in an optimal manner while maximising model accuracy, we employ an adaptive sampling algorithm the local linear approximation (lola)-voronoi . this algorithm iteratively selects data points, based on the previous iterations, to efficiently distribute new samples into areas highlighting the most salient features of the design space. this is",UTILIZE,USE
9914596,10521577,"ools detailed understanding of the eects of architectural and system software design alternatives also requires powerful data-analysis and visualization tools. we are extending the paradyn and pablo software for data analysis and display and exploiting the virtue toolkit for immersive visualization. the new pablo interface supports a hierarchy of performance displays, ranging from routine prole",UTILIZE,EXTEND
8782841,9263802,e time of o(n) with respect to the rr-model. the algorithm is based on the static maximum matching algorithm described in 33 . the space needed is linear and the preprocessing time is o( p nm) using . additionally we give an insertions-only algorithm for maximum cardinality matching with o(n) amortized time per insertion. in the case of k-edge and k-vertex connectivity we slightly improve the kno,NOTUTILIZE,MENTION
201813537,239403825,"ctors on linear optics measurements based on the ac dipole. we compare two algorithms for the data processing, an interpolated fft refereed to as sussix 5 and the singular value decomposition (svd) . model parameters of interest in this paper are phase advance between two adjacent bpms, , and -function at bpms, . we use a simple statistical model describing the effect of white noise in the b",UTILIZE,USE
75047024,73628328,"al and physical devices using communication networks. ncs research has been recently a very active area investigating problems at the intersection of control systems, networking, and computer science . the objective of this paper is to address fundamental problems in ncs caused by implementation uncertainties such as time-varying delay, and data loss. to deal with these implementation uncertaintie",NOTUTILIZE,NOTALGO
11150084,11903983,"ample provider that implements the naive bayes algorithm. netz 18,19 presents an useful overview that describes the ole db for dm technology. siedman brings out an excellent reference to sql for dm . however, the task of creating a provider and implementing an algorithm remains complex due to the lack of discussion about experiences in doing this work. the main objective of this paper is to desc",NOTUTILIZE,MENTION
13826306,14836419,"of to 0.75 ft-lbf (1.017 n-m). the second plot from fig. 1 is redisplayed in fig. 2 with a solid curve, and a plot of t f c t c f is displayed with a dashed curve, where t c f is given by eq. with 0.75 ft-lbf, 0.0011295 rad sec, and t 20860 sec. prior to t t , 0. 5 0 -5 cmg torque (no f w motion), flywheel torque (ft-lbf) 2 2.1 2.2 2.3 2.4 2.5 2.6 2.7 2.8 2.9 3 x 10 4",NOTUTILIZE,NOTALGO
4643007,4797426,") special case of the problem is max cut problem with given sizes of parts where for some psn 2 , x 1 delta delta delta x p 0 and x p 1 delta delta delta x n 1. ageev and sviridenko applied a novel method of rounding linear programming relaxations and developed a 1 2 -approximation algorithm for this problem. they also obtained a similar result for a more general max k-cut probl",NOTUTILIZE,MENTION
50106854,49991537,"sion, cell differentiation, axon guidance, the motility of myoblasts, neurons, neural crest cells, tumor cells, the morphogenesis of endothelium, and lung and kidney epithelium (goodman et al., 1989; ; sorokin et al., 1990; calof and lander, 1991; schuger et al., 1991; rivas et al., 1992; bronner-fraser, 1993; matter and laurie, 1994). much recent work on understanding how laminin directs cell beh",NOTUTILIZE,NOTALGO
100948601,94666370,"e algorithm into sub-sections andsperform the latter using dedicated hardware modules insparallel 5 . the use of reconfigurable hardware for thesdesign of ga has been reported in the literature 6 , ,s 8 . in stephan scott s behavioral-level implementationsof a ga 6 , the targeted application was optimization ofsan input function. in 7 , tommi rintala designed andsimplemented a ga on a pld, usi",NOTUTILIZE,NOTALGO
38350900,37003550,"fic terminal display. the storm motion algorithm, which relies on the cross-correlation tracker and storm extrapolation software libraries also used by the lincoln itws and wsp demonstration systems ( ), generates storm leading-edge lines and 10- and 20-minute predicted positions. the precipitation impact process evaluates storm cell position and storm motion information and detects current and pre",NOTUTILIZE,MENTION
7259453,7597513,"called inclusion functions. examples of application to robust stability and to parameter estimation of such domain-splitting algorithms which use methods from interval computations are given in 12 , , 14 . in 15 the mean value form, the optimal centered form presented by baumann 16 , and the taylor form are applied to robust performance problems and compared with bernstein expansion. the exam",NOTUTILIZE,MENTION
18233117,19421229,"ndence), an error measure frequently used is sammon error 18 : sammon error 1 i j ij i j ( ij ij) 2 3. evolutionary algorithms 3.1 differential evolution differential evolution 19 , 17 , is a kind of evolutionary algorithm working with real-valued vectors, and it is relatively less popular than genetic algorithms (ga). like ga, evolution strategies and other ec algorithms, it works w",NOTUTILIZE,MENTION
8971202,9471495,"h of the data. there is incentive to explore on-line (sequential) algorithms to seek improvements in terms of memory and computational speed. in earlier work, sequential algorithms have been proposed for estimating finite-state markov chains in white gaussian noise (wgn). these recursive kullback-leibler (rkl) algorithms are sequential em schemes and are derived using stochastic approximations to",NOTUTILIZE,MENTION
71702825,70778493,"s being activated or deactivated as a result of transitions. algorithms and libraries with multiple implementations can be matched to underlying hardware configuration to deliver the best performance , 68 . such libraries can be leveraged to choose the algorithm that best tolerates the predicted hardware variation and deliver a performance satisfying the quality-ofservice requirement. with suppor",NOTUTILIZE,MENTION
3314384,3414729,"c algorithm. details are given in section 5 together with simulation results. 2 systolic array computation 2.1 a historic overview the research in the area of systolic arrays began at the end of 70 s . the original motivation behind the systolic array concept was its potential for vlsi implementation. in fact, only a few systolic algorithms have been actually implemented in vlsi chips. the main ob",NOTUTILIZE,NOTALGO
11908514,12745025,"this information to statistically estimate the interarrival times of references to a clip. when choosing a victim, it selects the least recently referenced clip across its last k requests. greedydual is a spectrum of algorithms. one algorithm considers a cache of pages with the same size and different costs to fetch from secondary storage. the algorithm assigns a priority value, , with each cac",NOTUTILIZE,MENTION
85708501,82619444,"f the icp algorithm is o(npnx) and, for large data sets, most of the time is spent for closest point computation. k many solutions for the acceleration of the icp algorithm have been proposed. langis recently proposed a parallel implementation of the icp and showed that a nearly linear performance improvement with the number of processors can be obtained with up to 16 processors. beside this hard",NOTUTILIZE,MENTION
35309932,35139769,". although the maxcmo problem is np hard 47 , approximation algorithms exist using dynamic programming 48 , integer linear programming using lagrangian relaxation 26 and branch and cut approaches . an approach based on maximum cliques has recently been introduced 49 . for large and challenging protein data sets, meta-heuristic 1 2 3 4 5 6 7 8 9 10 a b c d e f g figure 3. a contact map overlap",NOTUTILIZE,MENTION
1616158,1708292,"we use, which has complexity n 4 , is applied twice while the ray tracing method also has a complexity of n 4 . first, one can reduce the complexity of the fdk algorithm with the methods presented in to n 3 log n. a second reduction is possible by reducing the number of necessary global (low magnification) projections; 9 looks promising to achieve this goal. third, one only needs to calculate t",NOTUTILIZE,MENTION
16870935,18016752,"iod. punnekkat 19 proposed an approach that uses a combination of a binary search algorithm and a slightly modified version of the response time schedulability tests proposed by audsley and tindell 31 . in the following we give a brief overview about the sensitivity analysis algorithm and the analysis models and metrics used in symta s. as already mentioned above, different approaches were prop",NOTUTILIZE,MENTION
14630947,15690332,"results indicate that this gp algorithm leads to an efficient and stable implementation for solving our problem. 6.3 ggp condensation to solve the ggp problem, we implement the algorithm described in . this algorithm takes advantage of the arithmetic-geometric mean inequality and transforms the original non-convex ggp to a sequence of convex gps. the ggp algorithm first introduces a new variable.",UTILIZE,USE
28185015,28892096,"uch as the cases covered in this paper. because our algorithm is to a limited extent reasoning about the teammate reasoning about itself, it is in fact engaged in a special case of recursive modeling . indeed, one question that remains open is what happens when the teammate is also trying to select actions that would cause the agent to shift policies. in this case, our agent would have to address",NOTUTILIZE,MENTION
20827406,22008721,"for different initial conditions. we will discuss this point in more detail in section 3.2. we conclude this section by comparing the algorithm described above with the related algorithm invented in . remark 2.4 instead of the systematic scan through all types in step csw 1 above, one could also use a random scan by resampling only the positions of a random (or, by type symmetry, a fixed) type. c",NOTUTILIZE,MENTION
24735571,25582387,"algorithm running in time f o(1) 2 (1 ) 1 k . we apply our construction, taking the known polynomial-time algorithms mentioned above as a0. for example, taking the 7 8-approximation algorithm ( ), we obtain the (7 8 )-approximation algorithm for max 3sat that runs in time f o(1) c k . the techniques used. to construct an ( )-approximation algorithm from an -approximation algori",NOTUTILIZE,MENTION
107561497,99571509,"f our knowledge, there are no multiplicity results for quasilinear equations via penalization methods. however, our result seems to be new even in the semilinear case p 2. it extends the results in and complements those of 11, 13, 16, 25 . we end this introduction by quoting some papers which dealt with the nonlinear schro dinger problem (1.3) 8 : 2",NOTUTILIZE,NOTALGO
81588053,79171289,"programming models simplify the challenging tasks of parallel programming by offering powerful abstractions and by hiding the low level details of synchronisation and coordination from the programmer . writing parallel programs using these models usually involves only small changes to the sequential algorithm and therefore does not obscure the core computation. this comes, of course, at the expens",NOTUTILIZE,MENTION
121250441,109669497,"thods 18, 31 , methods based an topological viewpoint 3, 33 and the origin of spurious solutions. in this paper, we review these results and extend this approach to equations of magnetic diffusion b t curl e , e 1curl",NOTUTILIZE,NOTALGO
8766468,9244640,"parallel supported by xunta de galicia xuga10502b94 given that the semantics of the language guarantees that no interference among them can arise. this is the sort of parallelism that jones and hudak call implicit parallelism. algorithms are written in a declarative way without taking care of the execution model. thus, the expressions to evaluate have to be scheduled by the compiler in both time",NOTUTILIZE,MENTION
101530357,95108749,"e the inference engine that is employed in a little more detail, before we go on to extend its capabilities. inference engine the reasoning of the inference engine involves the following stages (cf. ( )san elaboration): 1. the high-level modeling of ontology, facts and queries, which is all done in f-logic, is translated into a set of horn clauses.1 2. the horn clauses are processed using a strateg",NOTUTILIZE,NOTALGO
40972909,39458259,"there are certainly other hpsg grammar work that can be adapted to our system to further complement and extend coverage. an interesting experiment would be a coupling to the english resource grammar ( ). another extension that would put our approach to the test is a method of dealing with different forms of reference. we envision that, in addition to the domain background theory, the knowledge repr",NOTUTILIZE,MENTION
10693153,11387702,"rom the laboratory of web algorithmics 1 : indochina (kh,la,mm,th andvn domains), italy (it domain) and the united kingdom (uk domain); and one collection obtained using akwan 10 : spain (es domain) . 1 laboratory of web algorithmics, dipartimento di scienze dell informazione, universit degli studi di milano, http: law.dsi.unimi.it . 1 carlos castillo department of technology university pompe",NOTUTILIZE,NOTALGO
3909247,4036376,d at these locations. these overheads can be reduced with improved scheduling algorithms at both the client and server and by using restrained versions of 3 prefetching to reduce the network overhead 1.2 contributions the key result of this work is quantifying the tradeo between the costs of prefetching and the performance improvement perceived at the end user. a sensitivity analysis of this res,NOTUTILIZE,MENTION
154403958,135752749,arning networks capabilities in chest pathology detection. we extracted severalsdifferent descriptors and compared among them. our main descriptor is extracted using the decaf implementation of ascnn which follows the cnn in 7 . the cnn in 10 was trained over a subset of images from imagenet of moresthan one million images that are categorized into 1000 categories. using the notation of 10 t,UTILIZE,USE
3642306,3757955,"he n images. in this work we use linear warping over a delaunay triangulation of the feature points, which can be combined with a one-to-one constraint n algorithm to prevent the warped image folding . the process given above leads to prototype images, which although realistic, do not always represent the underlying sample in terms of texture burt95 . by texture here we mean the intensity differe",UTILIZE,USE
2728032,2839828,"and contained significant noise. we reduced the size of image by half along each dimension and convolved it with a low pass filter to reduce noise. a different low-level tracker was used in this case , which incorporates robustness to intensity variations and a constant velocity tracker. the algorithm was run on both sequences with the same parameters. the trajectories obtained by establishing cor",UTILIZE,USE
7742295,8106455,"to bregman generalized 3 projections. when the error is zero, our algorithm coincides with the generalized proximal point method. however, for nonzero error, it is dierent from the inexact method of described above. our new method is motivated by 40 , where a constructive error tolerance was introduced for the classical proximal point method. this approach has already proved to be very useful i",NOTUTILIZE,MENTION
45685396,44806123,"note that in general, the giambelli polynomials are only defined up to the ideal of relations generated by the invariant polynomials under the action of the weyl group of g. bernstein-gelfand-gelfand and demazure d1, d2 used divided difference operators to construct an algorithm that produces polynomials which represent the schubert classes. for the general linear group, lascoux and sch tzenber",NOTUTILIZE,MENTION
