contextID,citationID,clean__citation_context,UTILIZE_LABELS,USAGE_LABELS
71059221,70200112,"were taken as stated above and merged with the shg images using image j (nih, bethesda, md). nuclei detection and visualization 3d confocal images were segmented using the otsu thresholding algorithm using the itk software 35 . otsu thresholding algorithm assumes there are two classes of pixels in the observed image and finds a threshold value t that will automatically separate the foreground pi",UTILIZE,USE
20977806,22145324,"pplication is not available to us), and its algorithms are not dependent on a huge set of parameters whose settings are left mysterious in the publication (compare to the machine learning approach in where several statistical distributions would have to be assumed). we implement the pinpoint algorithm (as explained in 106 ) for comparison with our monitor s diagnosis approach. pinpoint requires",NOTUTILIZE,MENTION
4883770,5047856,"ase. in this context, there has been considerable work on computational techniques for making the em algorithm more ecient when applied 32 to large data sets (bradley et al. 1998; moore and lee 1998; esson et al. 1999). one focus is the development of one-pass quot; methods, in which each part of the data needs to be loaded into memory only once. however, even with memory resources and processor",NOTUTILIZE,MENTION
43035149,41462937,"x an integer r 2 and let a e i 2r . the quantum factorial is a factorial product based on n. let 0 m r 1. the mth quantum factorial is denoted by m . now, n ( 1) n 1 n 1 0 1 and 0 m m m 1 . . . 1 . 14a c b ... ... a j . b i ... ... c ... k figure 17: associating projectors to a trivalent vertex for r, an admissible triple is a set of three non-negative integer",NOTUTILIZE,NOTALGO
202535290,240437564,"rated in fig. 2. in order to provide a lower bound on the estimation error of our distributed filtering algorithm, the bayesian crame r-rao bound (bcrb) for discrete-time nonlinear filtering was used . in accordance with 26 , it can be computed by using message passing on an fg with a structure identical to that shown in fig. 1. since the bcrb is computed for gaussian priors to fulfill the",UTILIZE,USE
13918582,14932363,re the relationship with knapsack problems or consider the applicability of k-shortest paths algorithms 21 . k-shortest paths the literature on k-shortest paths algorithms is extensive; see eppstein for an introduction. much of the literature is motivated by applications involving multi-criteria or constrained optimization: the algorithms are used to generate a large number of solutions that are,NOTUTILIZE,MENTION
7226559,7561294,"gradient. thus, j-prop is suitable for training models to have specific first derivatives, or for implementing several other well-known algorithms such as double backpropagation 1 and tangent prop . clearly, being able to optimize equations 1 and 2 is useful; however, we suspect that the formalism which we use to derive our algorithm is actually more interesting because it allows us to modify j",NOTUTILIZE,MENTION
15287349,16381053,"d( 500) is 0.04 , and only one component allows any possibility for surface area improvement. several effective algorithms for partitioning a 2-dimensional grid graph are available in the literature . our algorithm generalizes the fast two dimensional algorithm due to martin 8 . with this generalization, we reduce the problem to several integer knapsack problems (as defined in 12 ) and use dyna",NOTUTILIZE,MENTION
34610025,34551539,"cluding real-world instances. the results show that the proposed algorithm is able to solve to optimality the small-sized instances in a reasonable computing time. two heuristics are also proposed in . the first one, h1, is an adaptation of the algorithm proposed by baldacci and dell amico 4 for the multi-depot cmrsp and is executed at the root node of the enumeration tree. the second heuristic,",NOTUTILIZE,MENTION
78746467,76737036,"4 and 10.5 of their revenues on technologies, biased or poorly suitable benchmarks lead to wrong software and hardware architecture decisions that result in billions of dollars of losses every year . benchmarks are very important for evaluating program analysis and testing (rat) algorithms and tools 2, 3, 9, 23 . different benchmarks exist to evaluate different rat aspects, such as how scalable",NOTUTILIZE,MENTION
27018174,27731136,"the case of tltl and timed automata afh96 . the literature contains several models that are close to dtgs. emerson et al. give polynomial time algorithms for model checking tctl over discrete kss in and tctl over tight dtgs (all intervals are singletons, see section 7.2) with the jump semantics in et99, section 4 . they also study model checking for quantitative logics with more complex const",NOTUTILIZE,MENTION
21537235,22659579,"ed usind dpll-like algorithms 6, 5 , for example the 1.505 n bound for 3-sat 10 . newer deterministic algorithms borrow ideas from randomized approaches to testing satisfiability. the algorithms in that have the best known upper bounds for k-sat are based on the derandomization of multistart random walk. they cover the boolean cube 0, 1 n by hamming balls and apply a local search method to fi",NOTUTILIZE,MENTION
24694560,25546334,"hms have all been drawn from the first class of approaches in which iterative improvements are made toward a local minimum. examples of this type of algorithm include active shape models 4 , obj cut , level sets 6 etc. in contrast, the algorithm proposed here belongs to the second type of variational algorithm in the sense that it will be possible to achieve a global minimum (of the binaryrelax",NOTUTILIZE,MENTION
2818122,2936595,"h strategy. additionally, competition for limited resources between these subpopulations have taken place. for a detailed discussion of evolutionary algorithms andspage 3 (63) the used extensions see . the genetic and evolutionary algorithm toolbox for use with matlab - geatbx 12 contains an implementation of these methods and was used for the experiments. we use an extended population model ins",NOTUTILIZE,MENTION
109888865,101287102,"ation and execution of complex transformations on the static aspects of design is argued. examples in the paper illustrate how grs can be used to implement the design transformations proposed by mda. proposes to allow particular portions of the design to be specified in an abstract manner, with the goal of using these as patterns in order to search for corresponding implementation components. grs",NOTUTILIZE,NOTALGO
42511198,40868617,"22 , duty cycle operation is not considered and hence, a different approach has been taken. note that energy consumption analysis has been performed in a node-centric manner for routing algorithms in , 25 . however, these models do not incorporate the effects of neighbor nodes, the wireless channel quality, or the channel-aware routing decisions in this context. moreover, the effects of channel c",NOTUTILIZE,MENTION
19269515,20470971,", and future 8.1 previous related algorithms based on spacepartitioning trees. both tree-based methods presented represent new extensions along a continuing line of research in statistical algorithms . for the closely-related problem of kernel regression, a single-kd-tree-based method was presented in 4 . we presented an early bare-bones dualtree method for the kde problem in 11 , which used the",NOTUTILIZE,MENTION
65864192,64633654,"d degradation. also in this case, the investigators speculated that proteolysis of incorrectly folded supc-phoa hybrid protein might be caused by an extracellular cell-associated proteolytic activity . when the mature ompa protein was precisely fused to the pre-pro part of the lipase from s. hyicus, a major part of the translocated propeptide-ompa hybrid protein was released into the supernatants",NOTUTILIZE,NOTALGO
29412647,30078444,"in a target document that correspond to the layout model with the highest probability. for this purpose, first a whitespace cover of the page background is extracted using the algorithm described in . then, each layout component in the structural mixture model is considered as a candidate that can explain the layout of the target document. we are interested in finding the layout model that best e",UTILIZE,USE
202100630,239819131,"se of the system matrix is relevant to measuring convergence in a nite element context. we then provide alternative ways of calculating or estimating this quantity. finally, we extend the results of to the block conjugate gradient (bcg) algorithm 2,4 . in particular, we show that the simple rule proposed in 1 for computing the stopping criterion can be easily extended to the bcg algorithm wit",UTILIZE,EXTEND
63297283,62415664,"d transition control. feature specification is performed by a person who chooses the correspondence between pairs of feature primitives. in actual morphing algorithms, meshes 3, 5, 6 , line segments , or points 10, 11, 12 are used to determine feature positions in the images. each primitive specifies an image feature, or landmark. feature correspondence is then used to compute mapping functions",NOTUTILIZE,NOTALGO
22380978,23428428,"performs at least as well as a with respect to the relative worst order ratio (for minimization problems). it is obvious that the relative worst order ratio is reflexive and transitivity is shown in . hence, we have the following lemma. lemma 3 the relation wr defines a preorder on the set of on-line algorithms for an on-line problem. it follows that it is not necessary to compare a new on-line",NOTUTILIZE,NOTALGO
68944072,67688912,"gth, and in addition ik k s and jk k s for every k 1, . . .,m. b consists of the elements in f, whose normal form does not contain any of the generators x0, x1, . . .,xs (or their inverses) . in both cases, the conditions are straightforward to check. following is an algorithm for solving problem 1. algorithm 2 (alternative solution search). (1) execute algorithm 1 (with any of the intro",NOTUTILIZE,MENTION
4971915,5138127,"learning procedure. comparisons with reinforcement learning an alternative approach to solving the class of problems that we have discussed in this paper is to use reinforcement learning algorithms ( ; sutton, 1984). reinforcement learning algorithms are based on the assumption that the environment provides an evaluation of the actions produced by the learner. because the evaluation can be an arbi",UTILIZE,USE
4789323,4950188,"me, the predictive assignment module is designed to be elaborate and optimal. in order to solve this dynamic video mapping problem, we use the heuristic algorithms that are presented in our paper ref. . 1 we present the principles of the predictive assignment algorithm as follows. all these principles are encoded into the heuristic algorithms based on simulated annealing. thus, the case of the dyna",UTILIZE,USE
34782125,34695048,"the target k-partitioning, but we still have to interact with the teacher to find out k. it is a recently resolved problem that single-linkage is not the only function satisfying the above properties , so the the class of consistent, k-rich, and order-consistent functions has many members. we now present the algorithm to interact with the teacher. theorem 6.2. given a dataset satisfying strict thr",NOTUTILIZE,NOTALGO
30443243,31163076,"have been precomputed, then our algorithms are faster than current methods. as noted by the referee, state of the art cm method implementations use class invariants of small height ( 10, 9 ; see also ). in 8 , enge carefully computes the complexity of some class polynomial computations. much work is being done on finding better algorithms for computing hilbert class polynomials (i.e., the minimal",NOTUTILIZE,MENTION
59952194,59304738,"ral separation properties weaker than those considered in this paper. they use a nash-moser algorithm suited for finitely differentiable nonlinearities, already employed in the one-dimensional case , and they find solutions belonging to suitable sobolev classes. by construction, their method looks for a sobolev regularity, and hence it produces only a finite smoothness even when applied to syste",NOTUTILIZE,MENTION
13298533,14266446,"and c2 such that c1n 1 5 n c2n 1 5 log n. 1 introduction there have been a number of papers analysing simple greedy-type algorithms for finding large matchings in graphs, e.g. korte and hausmann , karp and sipser 7 , tinhofer 8 , dyer and frieze 3 , goldschmidt and hochbaum 5 and dyer, frieze and pittel 4 . most of these deal with the expected performance of various algorithms on random",NOTUTILIZE,MENTION
14090292,15113814,"le problem. b.1 dependence cost for the smallest enclosing circle for the computation of the smallest enclosing circle, we have used the iterative version of the original recursive algorithm by welzl . the algorithm is shown in fig. 10. even though this algorithm runs in expected o",UTILIZE,USE
17927438,19111665,"rithms: a straightforward grid method (theorem 3.1), a specialized rur approach (theorem 3.5), and an improvement of the latter using fast gcd (theorem 3.6). the first two algorithms also appeared in . the best bound is ob(n ); within this bound, root multiplicities are computed as well. computing the topology of a real plane algebraic curve is in ob(n ) (theorem 3.12). moreover, a maple packa",NOTUTILIZE,MENTION
202516094,240410995,experiments refer to the silence-removed speech. for speaker modeling we used vector quantization (vq) as described in subchapter 4.1. all speakers were modeled by a codebook of 64 vectors using gla as the clustering algorithm. the matching function was the mean squared error between the test vector sequence and speaker codebook. the decision was simply the speaker with minimum error. as a test,UTILIZE,USE
2091198,2212358,". for all the given experiments, it is required to calculate the optimal number of shift bits needed to flip the required positions. to achieve such a goal, we use a brute force enumeration algorithm to pick the best tour, unless the number of bits to be flipped exceeds 10, in which case the greedy strategy previously discussed is used to tour the required states. the greedy strategy application",UTILIZE,USE
65853347,64622838,"ucture of all admissible assignments r,b is not a simple task. only for the mcd estimator was it recently shown that optimization can be carried out in polynomial time. in fact, bernholt and fischer designed an algorithm of complexity o(n v ), v d(d 3) 2 1, based on elliptical separability of regular objects and outliers. in general, one has recourse to general optimization schemes such as loc",NOTUTILIZE,NOTALGO
34300373,34274166,"ign using florian s method. evolutions have been conducted using parameters presented in tab. 2. all experiments have been implemented using the open beagle c framework for evolutionary computation . the results of the first set of experiments, constructing the nolh with an evolutionay algorithm and without using florian s method (nolh-ea) are shown in tab. 3. tab. 4 presents the results of the",UTILIZE,USE
9204665,9737116,"eady to execute. since all tasks in the ptq are ready to execute, a scheduling algorithm must be used to apportion the cpu time amongst these tasks. we use the earliest deadline first algorithm (edf) , which is optimal for a uniprocessor system with independent, preemptible tasks having arbitrary deadlines 10 . the rbq is organized as a series of slots, one for each recovery block. each slot cont",UTILIZE,USE
87529357,84144011,"gn job allocated m computational cores, each evaluation of p k for node k with structure sk is performed using m cores for some m 1, ..., m selected to approximately minimize run time based on sk ). more implementation and infrastructure details are given in appendix a. 2.4 computational design studies our primary test scenario is rna sequence design at 37 c for target structures in the engine",NOTUTILIZE,NOTALGO
73245377,72184011,"h, in most hospitals, are recorded in real time, or consultations with gps in private practice, when a system of real-time data collection is available, as is the case for the french sentinel network . once the databases are available in appropriate settings, outbreak-analysis algorithms are needed. an outbreak is an unexpected cluster of cases of a certain category, given the past experience in t",NOTUTILIZE,NOTALGO
14385210,15428330,"vide security services, e.g., user authentication, message con dentiality, and key distribution 24 . however, some of the security algorithms of the gsm architecture have recently been cryptanalyzed . to meet today s needs for wireless digital communication, the developed protocols need to be highly secure, requiring low computational overhead and thus low power. here, we introduce a new authenti",NOTUTILIZE,NOTALGO
9759137,10351632,"diately suggestive of an algorithm. two problems are multi-premise rules and the weakening rule. multi-premise rules pose a strategy problem and the weakening rule introduces some non-determinism. in we show how to derive an algorithm by modifying the logic using techniques similar to those used in 7, 8 . jensen s work 12 assures us that an algorithm exists because he establishes an exact corr",UTILIZE,EXTEND
19809936,21025945,"ndling dissimilarity data. prototype based clustering has also been an early target for extension from the vector case to relational data, in particular with the partitioning around medoids algorithm , which extends k-means like algorithm to relational data using the idea of the generalized median: as the center of mass of each cluster cannot be computed for relational data, it is replaced by its",NOTUTILIZE,MENTION
1869108,1981055,"ehaviour. in this case, the two views have to be synchronised to achieve a consistent system s behaviour specification. different solutions for (iii) can be distinguished. the viewpoint approach (cf. ) follows an algorithmic approach by checking the effect of operations and triggering update operations to end in a consistent result state. other specification approaches, like e.g. z ( cf. 19 ), fo",NOTUTILIZE,MENTION
16110787,17233429,"s are found between the elements of the factor base, whilst in the second phase we perform sparse linear algebra to solve the original discrete logarithm problem. the details of this algorithm are in , but we givesome details in an example below. theorem 8 (gaudry, 9 ). there isanindex calculus style algorithm to solve the hyperelliptic discrete logarithm problem in a hyperelliptic curve of genus",NOTUTILIZE,MENTION
9616651,10193375,"y the camera position) from each camera, but it is still possible to derive multi-linear camera-image relations which are independent of shape. this is the essence of the analysis described in, e.g., (see also appendix b). on the other hand, substituting (42) into (33) would significantly change the essence of the following derivations. now the g-matrix and the multi-linear shape tensors depend o",NOTUTILIZE,NOTALGO
29143980,29823117,"must have from two to four jets with the leading jet pt 25 gev and det 2.5, and all other jets having pt 15 gev and det 3.4. jets are defined using a cone algorithm with radius r 0.5 . misreconstructed events are rejected by requiring that the direction of et is not aligned or anti-aligned in azimuth with the lepton or the jets. the fraction of signal-like events is further enhan",NOTUTILIZE,MENTION
29282755,29954919,"states and how it does a repair, the initialization of the basic program following a global reset, the required minimal length of the cycle. consider the byzantine clock synchronization algorithm in . informally that algorithm operates as follows: the processes resynchronize their clocks every per time period. a process expects the time at the next resynchronization to equal et . when a process s",NOTUTILIZE,MENTION
202859870,240906714,"of the b-spline basicsfunction. the basic method is to calculate it directly 5 . thissmethod is easy, but the computation load is heavy. anothersmethod is to use the de boor interpolation algorithm .sassthe de-boor-based interpolation algorithm can avoid thesconvolution computation of b-spline basic function, its cansgreatly simplify the interpolation calculation so as to improvesthe real-time p",UTILIZE,USE
15257123,16349569,"od 14 , and the karatsubacomba-montgomery (kcm) multiplication 21 . all these algorithms have in common that they spend the majority of their execution time in inner loops performing mac operations . speeding up the inner-loop operations via special architectural features and instruction set extensions has a major impact on the overall execution time. therefore, a detailed exploration of the alg",NOTUTILIZE,MENTION
20653240,21854785,"ne schedule could be asymptotically close to the optimal makespan as can be seen from the performance guarantee of ls. in section 3, we give off-line upper bound results. by extending graham s result on lpt , we show that lpt is an (m; k)-machine (maxf 4m k gamma 13m 3k ; 1g)-approximation algorithm. this implies that lpt is (m; k)-optimal when k m gamma 12 ; that is, if lpt has at least 3m gam",NOTUTILIZE,MENTION
23356991,24317800,"-up table, reed andssolomon s algorithm is still useful only for the smallest reed-solomon codes. in 1960 peterson provided the first explicit description of a decoding algorithm for binary bch codes , his quot;direct solution quot; algorithm i",NOTUTILIZE,NOTALGO
8273545,8701648,"clindex s cf clustering algorithm, we replaced it with a more sophisticated algorithm, and then stored the clusters sequentially as usual. the re13 placement algorithm used is vq, a k-mean algorithm implemented for clustering data in high-dimensional spaces. it has been widely used in compression and lately in indexing high-dimensional data for content-based image retrieval 31, 32 . ffl r -tree",UTILIZE,USE
18132750,19320213,"rmance of a learner using filtered features is very sensitive to the score criterion of the ranking technique. in order to avoid this situation, hycla adopts what has been called the wrapper approach , 13 , in which final feature selection depends on the inductive algorithm used. when a learner receives a feature set, it carries out the following tasks: 1. empirical learning feature selection.",NOTUTILIZE,MENTION
69047867,67815803,"se additional free parameters cause an increase in the statistical error of about 20 . to test the robustness of our algorithm, we use a sample of lepton tagged, partially reconstructed d l decays . events are selected from the same data sample of 140 fb 1 . since semileptonic b decays are flavour 11asymmetry 1.5 1 0.3 0.2 0.1 0 -0.1 asymmetry 1.5 1 0.3 0.2 0.1 0 -0.1 0.5 -0.2 -0.3 -0.1 -0.05",UTILIZE,USE
30736489,31443208,"obal correspondence. indeed, the demons algorithm requires having at least a partial overlap of the corresponding patient and atlas structures in order to match them. as proposed by cuisenaire et al. , the global transformation from the patient cortical surface to the atlas cortical surface is modeled by a linear combination of elementary scalar functions for each coordinate of . these functions a",NOTUTILIZE,MENTION
8684903,9154817,"are typically given in terms of the bit-length of the data. more recently, approaches based on condition numbers and the distance to ill-posedness have been investigated (see 1 , 2 , 3 , 5 , 8 , , 11 ). the recent complexity estimates show that for well-conditioned problems, the underlying algorithms terminate quickly. not surprisingly, it is possible to devise poorly-conditioned examples fo",NOTUTILIZE,MENTION
16324183,17456402,"rithm stops after a predefined number of steps and thus, intuitively, highlights the surrounding area of the seed gene without having to compute the complete bayesian network over all genes. friedman introduces the structural em algorithm to learn bayesian networks in the presence of missing values or hidden variables. it is an extension of the expectationmaximization (em) algorithm that performs",NOTUTILIZE,MENTION
8118318,8533647,"sed on these observations, but it computes minimal diagnoses without necessarily computing all conflict sets. i present here the corrected version of reiter s algorithm as described in greiner et al. the algorithm requires a consistency-checking module with the following property: given a system description sd, observations obs, and a subset comp 0 of the system components comp, the module either",NOTUTILIZE,MENTION
16900492,18047282,"ce. for instance, jansen 24 describes various positions in a game where you would need to consider your opponents strategy, iida, et. al. suggested other potential applications of opponent modeling , and various other algorithms for opponent modeling have been suggested by carmel and markovitch 7 , korf 27 , and donkers et. al 28 . results from carmel and markovitch give a strong indication o",NOTUTILIZE,MENTION
201653223,239175942,"ity of technologys32s5. simulations5.1 simulation setupsin the simulation part, we apply the message representation and updates algorithm tosexisting cooperative positioning framework spawn (refer to ). the simulation issperformed on matlab.swe consider networks with 13 fixed anchors and 100 randomly distributed agents,swithin a 100m 100m area and a communication range of 20 m. both anchors andsag",UTILIZE,USE
81369811,78999391,"least half of separation pairs are new and since the number of new pairs is at most v , we obtain that k 1 2 v . 2.3 minimal forward a-b extensions in this section we present an algorithm from which generates all minimal forward a-b extensions. we consider a directed graph g (v,f b) whose arcs are partitioned into a set of forward arcs f and a set of backward arcs b, and two distinguis",NOTUTILIZE,MENTION
