contextID,citationID,clean__citation_context,UTILIZE_LABELS,USAGE_LABELS
10891144,11619464,"play the ball (e.g. in the direction of a player of the own team). furthermore the algorithm was greatly simplified yielding a further performance improvement. a detailed description can be found in . 4 collision detection in the case that obstacle avoidance fails or is impossible (e.g. when walking sideways or while the robot is turning), detecting collisions is advantageous. collision detection",NOTUTILIZE,MENTION
11212549,11975108,"mportant. in an e ort to work around this issue, anumber of algorithms have been proposed which focus on extensive local similarities only. the most well known among them are fasta 72, 84 and blast . in the majority of the cases, increased performance is achieved by rst looking for ungapped homologies, i.e. similarities due exclusively to mutations and not insertions or deletions. the rationale",NOTUTILIZE,MENTION
20193943,21416669,mutation is better. one of our major concern is to find an algorithm that can resolve this scalability problem. another issue that our algorithm does not address is the network delay. this is done in where the authors map quorum onto a physical network with a fixed topology. however they left as an open problem to take into account the service time. we do the opposite and we didn t use the networ,NOTUTILIZE,MENTION
202748242,240743650,"ensurable. in thisscase, the optimization process generates a pool of non-sdominated solutions called the pareto optimal set. after thesoptimization process, a simple linear fuzzy inferencesalgorithm is used for extracting the best compromisessolution from the pareto optimal set. the best compromisessolution is then used in the implementation of the practicalsflcd algorithm.sc. self learning and",UTILIZE,USE
11967254,12809595,"e polynomial in the size of the tree automaton. our algorithm for checking realizability is thus in exptime. if the tree automaton is indeed nonempty, it follows by the results of hossley and rackoff that there is a finitely generated tree accepted by the automaton. this implies that if a process has an infinite realization, then it also has a finite-state realization. theorem 7 given a process s",NOTUTILIZE,NOTALGO
17081185,18236317,"en compared against high-performance sls algorithms for sat, because it completely lacks heuristic guidance. the two other algorithms we used in this study, adaptive novelty (anov ) 14 and saps are amongst the best performing sls algorithms for sat currently known. anov , a member of the walksat family, placed first in the random category of the 2004 sat competition 15 . in addition to r",UTILIZE,USE
22003151,23084630,"e have produced corner or junction features of the type thought to be encoded in area v2 of the cortex (as suggested by the previously mentioned neurophysiological studies). 3 algorithm hinton et al. proposed an algorithm for learning deep belief networks based on treating each layer as a restricted boltzmann machine (rbm), and greedily training the network one layer at a time from the bottom up",NOTUTILIZE,MENTION
1326410,1409611,"uilding an abstract model for a timed automaton. thesrst one is based on the notion of a clock region graph 1 , which is built by bfs-algorithm. the second method exploits the partitioning algorithm , which iteratively builds the minimal model w.r.t. the initial covering of the concrete state space. the aim of our paper is to generalize the method of bounded model checking to verication of timed",NOTUTILIZE,MENTION
34309681,34283323,"elective rayleigh fading channel. in 13 and 14 , we considered the joint sspc algorithm and constrained least mean squared (clms) algorithm for wireless networks in a 2d urban environment. also in , we presented switched-beam (sb) technique in cdma cellular systems in a 2d urban environment with centralized power control. also in 16 and 17 , a rake receiver in a single-cell system was propos",NOTUTILIZE,MENTION
13292796,14260054,"cessed in these procedures and compute spurious information. this kind of imprecision can also be introduced by many other existing algorithms that compute non-parameterized pointer information (e.g. ). one way to improve the precision of pointer information computed by moppa is to refine n s scope by removing the procedures that p may never (directly or indirectly) call. however, because our prel",NOTUTILIZE,MENTION
38142149,36809360,"n be computed for the class tk of all graphs of tree-width k (see 60 ), for the class bk of all graphs of branch-width k (see 50 ) and for the class gk of graphs of genus k (this follows from or a combination of 85 and 43 ). fellows and langston were the first to study algorithmic issues related to the graph minor theorem and ways to overcome its non-constructiveness. in 43 , they pro",NOTUTILIZE,MENTION
43976088,42699353,"rithm to the polylogarithm and the hurwitz zeta function. as such, it may be taken as an extension of the techniques given by borwein s an efficient algorithm for computing the riemann zeta function , to more general series. the algorithm provides a rapid means of evaluating lis(z) for general values of complex s and a kidney-shaped region of complex z values given by z 2 (z 1) 4. by",NOTUTILIZE,MENTION
9639142,10217601,"-phase method is not specific to any particular machine, file system, or architecture; it can be easily implemented by using any file-system interface, or by using portable interfaces, such as mpi-io , resulting in portable implementations. it can also be easily modified and tuned for any particular system",NOTUTILIZE,NOTALGO
2351414,2486892,"to extract the objects from the background by using motion information. however, motion estimation is often not very accurate due to occlusion and aperture problems, and the sensitivity to noise. in , a morphological motion filter algorithm is proposed to resolve edge pixels localization along the motion boundary. however, this algorithm partitions the image email: jianyu ime.org.sg into differen",NOTUTILIZE,MENTION
6954632,7270923,"esults by a formula of the form (i 1) f ( (i) ): (3.1) chapter 3. new results for existing approximate mva algorithms 25 let g() f () gamma . if g is continuously differentiable, newton s method computes the estimation of the results by a formula of the form (i 1) s(i) gamma j gamma1 ( (i) ) delta g( (i) ); (3.2) where j is the jacobian matrix of g and must be nonsingular. if the analyti",NOTUTILIZE,MENTION
26343310,27056521,"h (u, v) r(u, v), contradicting that f is a feasible solution for h 0 . the proof for the case s y is similar. in the rest of this section we prove lemma 4.4. we use a result due to wolsey about the performance of the greedy algorithm for a certain type of covering problems. a covering problem is defined as follows:s4 connectivity augmentation problems ( 0, 1 -costs) 12 instance: an in",NOTUTILIZE,MENTION
56812621,56134200,"n for some alphabet , and let ed(x,y) denote the edit distance between the two strings. the computational problem is the promise problem known as the distance threshold estimation problem (dtep) : distinguish whether ed(x,y) r or ed(x,y) r , where r 0 is a parameter (known to the algorithm) and 1 is the approximation factor. we use dtep to denote the case of r n , where 1 m",NOTUTILIZE,MENTION
124734726,112318127,"nsively tested and easily parallelizable. despite the existence of a gia code, after several attempts to reuse it, the conclusion was that the 1many of the advantages of using trilinos can be seen in . xi existing implementation was not straight-forward. a more flexible code that deals more easily with problem parameters, geometries, compressible and incompressible materials (including the fully i",NOTUTILIZE,MENTION
9487082,10048547,"o generate separate motion controllers serially for each subproblem. this time-consuming approach is similar to one proposed by cohen 5 in the context of the original spacetime constraints paradigm . 4. the existing algorithm works for 2d articulated figures only---generalizing to 3d would appear to be computationally formidable. 1 because this optimization problem is np-hard, there exists no po",NOTUTILIZE,MENTION
42453500,40811815,"ng its core theoretical properties by exploring practical numerical algorithms for using it in practice (e.g. 10, 32, 7, 11 ), evaluating theoretically these algorithms performance guarantees (e.g. ), addressing ways to obtain the dictionary from a bulk of data (e.g. 22, 1, 30, 38 ), and beyond all these, attacking a long series of applications in signal and image processing with this model, de",NOTUTILIZE,MENTION
201886440,239504861,"watermark visibility. a flowchart of the feature extraction method is given in fig. 2. among the many feature extraction algorithms proposed in the literature, we have adopted the scheme proposed in and 12 for several reasons. first, since the mexican hat wavelet scale interaction is formed by two scales, it allows different degrees of robustness (against distortion) by choosing proper scale p",UTILIZE,USE
32436013,32816757,"license identification is used by fossology 12 . it uses an algorithm called the binary symbolic alignment matrix (bsam), traditionally used in protein alignment. all these tools are open source. in tuunanen et al. compared oslc, fossology and their own implementation, called asla (based on the regular expression method). their evaluation consisted in an empirical study that used 12 foss applica",NOTUTILIZE,MENTION
138585,140789,"within clusters, i.e. only our extended ipet can be used within clusters, but is planned for future work. the extended ipet and clustered calculation method both rely on the mixed ilp solver lp solve to solve generated constraint systems. all measurements were performed on a amdathlon 1800 with 512 mb ram. since the v850e processor used does not have a cache, cache analysis was not included in t",NOTUTILIZE,MENTION
83955702,81159084,"dependent variable. the procedure was as follows. for each categorical background variable a 2 -test was conducted (see table s4) employing the false discovery rate algorithm for multiple testing ( ). no variable showed any significant correlation after this correction, and only university music education (see table s4 for a precise definition) ( 2 20.91, df 6, p .002, p corr .091) and",UTILIZE,USE
15609841,16717497,"pproach of reducing meet-over-paths 2sto graph reachability for sequential recursive programs 6 . finally, the reachability coverability problem is solved using the optimized partial-order unfolding based tool called pep 9 . for the important subclass of distributive dataflow analysis problems, we develop a more efficient algorithm for checking flows. if n is the control net of a program and th",UTILIZE,USE
