contextID,citationID,CLEAN_CITATION_CONTEXT,UTILIZE_LABELS,USAGE_LABELS
17907160,19089487,"s, 536-ya is recommended as the antecedent of onun . the algorithm can be improved somewhat by applying simple selectional constraints, such as; dates and places and large fixed objects can t move . after np2 is rejected, it s proposed np3 as antecedent in step 6. and finally ligting upon np3 kral n as the antecedent of onun in step 6 as shown in fig. 7. s nbar pronoun np nomv noun noun onu",NOTUTILIZE,MENTION
18531180,19722217,"for measuring the performance of the online algorithm. the well-known moveto-front rule mtf, for example, which moves each item to the front of the list after it has been requested, is 2-competitive . this is also the best possible competitiveness for any deterministic online algorithm for the list update problem 10 . 1 institute for theoretical computer science, eth zurich, 8092 zurich, switzer",NOTUTILIZE,MENTION
41804719,40200225,"ifetime, where n is the total number ofnodes.in 8 ,adistributedschedulingalgorithmis proposed which achieves a o(logn lognb) performance factor, where b is the upper bound of the initial battery. in , 20 , fullview coverage which considers the sensor s viewing direction is introducedfor camera sensor networks,and techniqueshave been proposed to achieve full-view coverage. the point coverage has",NOTUTILIZE,MENTION
61701461,60987190,"ter performance, especially on difficult problems, but do not guarantee to find the optimal solution. a description and comparison of two popular local search algorithms, dba and dsa, can be found in . a hybrid local global search algorithm using dpop is presented in 15 . all of these algorithms show good results for time versus optimality, but do not converge to the optimal solution over time. w",NOTUTILIZE,MENTION
2297667,2430223,"ast partially, from this redundant information. when fec fails to recover from a loss, applications can resort to error concealment algorithms at the receiver to correct the effect of missing packets error concealment algorithms 12 , 13 , 14 , 15 use repair mechanisms like insertion, interpolation or regeneration. these techniques work well for relatively small loss rates ( ) and for small",NOTUTILIZE,MENTION
202631139,240577378,"cscamera location and direction is approximated by interpolatingsfrom those pre-generated images.sto visualize the entire colon while preserving the imagesquality, we use the marching cubes algorithm to extract astriangle mesh of isodensity from the volumetric data and latersrender the triangles with graphics hardware. for such a hugesdata set of several hundred mbytes, a brute-force marchingscub",UTILIZE,USE
8231764,8655651,"ith the same weight as (u; x), where r is the root of the microtree that contains u. the edges (r; x) can be verified locally in o((n 0 m) p) time using the sequential linear time algorithm given in , since every processor has a local copy of h . the edges within the microtrees are verified as follows. first, for every leaf v, we compute the heaviest edge on all paths leading from v to the root r",NOTUTILIZE,MENTION
13151250,14103551,of updates of the database instance. in this paper we will follow a different approach and allow the user to interactively engineer their base preferences. we have already proposed a basic algorithm to allow users to incrementally add domination and equivalence relationships between individual predicate values. now we extend the approach deploying a sophisticated user interface: users are enable,UTILIZE,USE
25432054,26224016,"oard. after such individual to select a destination point through eye blinks, the control software started to guide the robot to such point, following the path determined by a path planning algorithm , which is based on the dijkstra s algorithm, that determines a secure path, that is, more distant of walls and obstacles.sfigure 15 shows the map of a navigating environment and the path generated by",NOTUTILIZE,MENTION
202868061,176458224,"unted ramjet. later iterationssof this concept involved using very hot air pumped down the span of the blade into ascombustion chamber where it was mixed with fuel and ignited, such as the xv-1 rotors . though these concepts provided important analysis tools and implementation ideas,sthey were plagued by a plethora of problems and failed to evolve into a practicalsrotorcraft design (as evidenced by",NOTUTILIZE,NOTALGO
74513687,73214685,"tly help in the verification of programs or hardware designs. for instance, quantifier-free presburger arithmetic 15 has been used in rtl-datapath verification 3 , and symbolic timing verification . 1 however, the satisfiability problem for the quantifier free fragment is known to be npcomplete 14 . consequently, the search for practically efficient algorithms becomes very important. presburge",NOTUTILIZE,NOTALGO
82301626,79796054,"e quality of a path is measured by multiple metrics, and the goal is to find all paths for which no better exists. algorithms are categorized into three classes. the methods of the first class (e.g., ) apply a user preference function to reduce the original multi-criteria problem to a conventional shortest path problem. the second class contains the interactive methods (e.g., 36 ) that interact w",NOTUTILIZE,MENTION
8796588,9279086,represented using the chain 1-code. a gaussian filter of variable width was used to create smoothed versions of the boundary. the skeleton was computed using a technique based on arcelli s algorithm . this algorithm improves noise sensitivity and sensitivity to global convexities. 4.5 boundary decomposition the methods in this group decompose the shape boundary into curve segments. h. liu and m.,UTILIZE,EXTEND
27222493,27945594,817322 0.042523091 0.060007692 -0.025478793 table 4.3: example of integer coe cient pr qmf lter h(n) 3 6 2 -1 1114.3.2 3-d subband codec design we now extend the 2-d subband coding and pvq scheme of to the 3-d case. the 3-d subband coder allows for adaptive bit allocation between temporal and spatial information. a 2-d subband coding software codec from portable video research group (pvrg) 29,UTILIZE,EXTEND
10701209,11397009,"s turn out to be directly applicable to tdma wireless ad-hoc networks. 2 2 2 c 7 (4) (5) based on theorem 1, the results of power control with maximum power constraint for channelized cellular systems are also directly extendable to tdma wireless adhoc networks. in this case the iterative power control algorithm in (2) is modi ed to the following form, pi(n 1) min pmax sinri(n) pi(n) (6) b. t",NOTUTILIZE,NOTALGO
32592738,32945969,"t(v, sc) v (sc) random(0, 2), 11where v (sc) is the number of border vertices relative to sc, acoefficient from 0.05, 0.1, 0.2, 0.3 , andrandom(0, 2) a random integer number in the range . 4.2 perturbation mechanism the tabu search algorithm described above employs an aggressive search strategy to explore the search space. indeed, for a transition from the current partition to a new p",NOTUTILIZE,MENTION
12865668,13790534,"joint histogram is a central aspect of every registration algorithm based on mutual information or on its various versions, whether directly based on information-theoretic grounds 23 , or indirectly . on the other hand, these algorithms must also perform an optimization task, which is made easier and much more efficient by the availability of the gradients6 p. th venaz, m. bierlaire, and m. unser",NOTUTILIZE,MENTION
7738130,8101912,"and minimize the total completion time. many heuristics have been proposed to deal with this problem, such as asap scheduling, alap scheduling, critical path scheduling and list scheduling algorithms . the critical path, list scheduling and graph decomposition heuristics have been developed for scheduling acyclic data flow graphs (dfgs) 7, 14 . these methods, however, do not consider the parallel",NOTUTILIZE,MENTION
18501213,19690864,"e would imply that there is a fast, provably correct algorithm for computing the number of degrees of freedom and determining the maximal rigid subgraphs in a molecular graph. the algorithm of jacobs , which was used in the first versions of the first software, uses a different approach for computing the degrees of freedom and the maximal rigid subgraphs. it runs on g 2 , rather than g, and is a m",NOTUTILIZE,MENTION
15171252,16259683,"s not always reliable. what an algorithm can segment in this case is only regions, but not objects. to obtain high-level objects, which is desirable in image retrieval, human assistance is needed. in , samadani and han proposed a computer-assisted boundary extraction approach, which combined manual inputs from the user with the image edges generated by the computer. in 41 , daneels et al. develop",NOTUTILIZE,MENTION
37207034,36208123,e physical topology constraints and limits on the number of wavelength are ignored in the derivation. 12ch.2: literature review on routing optimization of static wavelength routed optical network in ramaswami and sivarajan derived an upper bound on the carried traffic of lightpath connections for any routing algorithm. the upper bound on the carried traffic was achieved by relaxing the integer c,NOTUTILIZE,MENTION
14435496,15481611,"mallest one. once the circle is well fit to data, border detection gets much easier. as a pre-process to the automated circle determination, we begin by applying a generic segmentation algorithm like . after that, we have a first sight at the edges. those are cut by a very coarse manual circle, as figure 2 shows: figure 2. edges detected by the generic segmentation algorithm (white). the coarse ci",UTILIZE,USE
5227538,5412320,"a result we may augment alc with qualifying number restrictions without increasing the (worst-case) complexity of the satisfiability problem. in this paper we present an extension of the algorithm in lly, deal with inverse roles and runs in polynomial space. the so-called quot;reset-restart quot; technique used to deal with concepts moving quot;backwards quot; in the completion tree due to the c",UTILIZE,EXTEND
9512703,10077460,"there exists a path of qrds q r of a for which the entries of q and r belong to s e . proof : to compute the qrd of a matrix with real entries we can use the givens qr algorithm (see, e.g., ). the operations used in this algorithm are additions, multiplications, subtractions, divisions and square roots. furthermore, the number of operations used in this algorithm is finite. so if we appl",NOTUTILIZE,MENTION
4701822,4857740,"perations research community has devoted decades of effort trying to find efficient methods for this problem. recently,many meta-heuristic methods like simulated annealing (sa) 13 , tabu search (ts) , genetic algorithms (ga) 3 , and neural networks (nn) 9 have been tested against this complex combinatorial optimization problem. even though there are some methods to efficiently tackle instances",NOTUTILIZE,MENTION
57946180,57210087,"lgorithm that nds a synchronized labelling with cubic worst-case time complexity. both of the above mentioned algorithms use concepts and ideas of the considered proof together with the concepts from , 14 , but use di erent methods to reduce the time complexity. a skillful study of the graph was added in 4 . the presented algorithm for the road coloring (see also arxiv 22 ) reduces the time com",NOTUTILIZE,MENTION
20427305,21648963,"each. thus, we still get only quasipolynomial-time algorithm in this case. we also would like to remark that, as one might suspect, a quot;uniform quot; version of theorem 33 can be proved, along the lines of ; the details are omitted. 6 further results here we state without proofs some other results that can be obtained using our techniques. theorem 36. at least one of the following holds: 1. perm over z",NOTUTILIZE,MENTION
71749005,70820451,"row represents the last iteration. we have tested the mesh evolution algorithm with the datasets provided by the multi-view stereo 10mrtn-ct-2004-005439 phd final report a. zaharescu evaluation site 1 and our results are comparable with state-of-the-art, attaining sub-milimeter accuracy. results are presented in figure 6 and table 2. the sparse ring datasets encompass 16 cameras, whereas the rin",NOTUTILIZE,MENTION
202372416,240208366,"the cliques are processed, we merge and rank the objects from all the candidateset. some efficient approaches for merging different result lists can be applied here, and we adopt threshold algorithm in our implementation. the threshold algorithm is the most well-known instance due to its simplicity and memory requirements, which is based on an early-termination condition and can evaluate top-k q",UTILIZE,USE
41612712,40009319,"tim from the case individuals. 4.3 recovering snps we implemented the integer-programming attack using matlab, based upon two toolboxes, rref 6 for solving systems of linear equations, and bintprog for integer programming. this implementation was run on our dataset to recover the snp sequences for all 100 individuals from their pair-wise allele frequencies. in the attack, we partitioned the seq",NOTUTILIZE,NOTALGO
202018844,239698252,"an s algorithm for networks with nonnegative arc costs. the version we use, called bell, was coded by b. golden and is described in 10 . the codes uses a forward star network representation scheme in which the arcs (i,j) a are ordered lexicographically in increasing order. thus for a given node in we list all arcs (i,j)sa in the order of increasing j and then go on to node i l to do the same a",UTILIZE,USE
39596029,38152942,"(simo) tems can be found in 21 . a number of spike domain processing algorithms were demonstrated 16 , 21 , including faithful stimulus recovery. real-time recovery algorithms were investigated in . in all these works, perfect or faithful signal recovery is achieved provided that a nyquist-type rate condition is satisfied. we have also investigated architectures for the encoding and decoding of",NOTUTILIZE,MENTION
1454061,1541584,ete functions. 2 evolutionary algorithms a previous survey of search strategies based on evolution has been done in 20 . evolutionary algorithms for continuous parameter optimization are surveyed in . algorithms which are driven mainly by mutation and selection have been developed by rechenberg 24 and schwefel 27 for continuous parameter optimization. their algorithms are called evolution str,NOTUTILIZE,MENTION
15405459,16503308,"treats every link the same, pagerank recursively defines the importance of a page p to be the weighted sum of the backlinks to p. this is the core of the pagerank algorithm, invented by brin and page . the pagerank algorithm crawls the web and simulates such a random walk on the web graph in order to estimate the visitation rate, which is used as a score of popularity. given a keyword query, match",NOTUTILIZE,MENTION
81917735,79460582,"al. published the hash function quark 4 , using sponge functions 7 as domain extension algorithm, and an internal permutation inspired from the stream-cipher grain 35 and the block-cipher katan . using sponge functions as operating mode is another step towards compactness. indeed, classical n-bit hash function constructions like the md-sha family utilize a merkle-damg ard 51, 28 domain ext",NOTUTILIZE,MENTION
17860066,19042323,"efficiency compared to the full mle. for bicast schemes, the resulting algorithm has third-order polynomial complexity, a substantial improvement over the full bicast mle. the heuristic algorithm in is based on solving higher order polynomials and is much faster. however, it uses only part of the data and is quite inefficient. the pseudo-likelihood method of 9 uses only data from all pairs of",NOTUTILIZE,MENTION
65901321,64670591,"ly automatically. our algorithm approaches transferring a mapped mln to the target domain as a revision problem. thus it is related to revision algorithms for other models, such as bayesian networks ( ), bayesian logic programs (paes et al. 2005), and first-order knowledge bases (richards mooney 1995; wrobel 1996). conclusions and future work we have presented a complete transfer learning system,",NOTUTILIZE,MENTION
1541994,1630895,"per we focus on the research stream related to extended-hebbian-learning based techniques. some contributions on the use of such methods to blind source separation have been given in 1 , 17 , 27 , , where various extensions of hebbian and anti-hebbian basic principles have been presented and adapted to signal separation and represen2 ieee transactions on circuits and systems",NOTUTILIZE,MENTION
7002405,7323736,"of the interconnection network. the bsp and logp models have become very popular in recent years, and many algorithms have been designed and analyzed on these models and their extensions (see, e.g., ). however, algorithms designed for these models tend to have rather complicated performance analyses, because of the number of parameters in the model as well as the need to keep track of the exact m",NOTUTILIZE,NOTALGO
28191983,28898907,"ce the rules we chose the c4.5 algorithm (quinlan, 1988), using the original implementation provided by the sniffer system (batista and monard, 2004), as part of the discover data mining environment ( ). this environment offers integrated tools to produce and evaluate models according to different algorithms, evaluation measures, and other data mining characteristics. besides being one of the most",NOTUTILIZE,MENTION
201820311,239411704,"ao river basin was optimized based on the strbk model-based optimization algorithm described above. first, according to the spatial distribution of modis gpp shown in fig. 1(c), the k-means algorithm was adopted to perform an unsupervised spatial clustering of gpp. in this process, the k-means method led to seven classes with isolated small areas that were merged to maintain spatial continuity in",UTILIZE,USE
40264400,38801109,"e chosen an edge detection algorithm described in section v-a for its speed and precision. as will be seen, our edge-detection algorithm consists of smoothing and finding directional derivatives 24 - . search for features in frame a: we refer to an 8 x 8 block as a feature if it contains more than 8 edge pixels. this is done in order to prevent false matches in the next step. to avoid aperture",NOTUTILIZE,NOTALGO
3339767,3441253,"functions. rather than representing such texture measurement in its true value as reported in the related literatures 7 , 8 and our previous studies 9 , we extended the fuzzy compactness approach to measure fuzziness in terms of texture energy 11 via fuzzy set 12 . an image i of size msn and l levels of brightness can be considered as an array of fuzzy singletons, each associate with a val",UTILIZE,EXTEND
202752129,240750061,"two interlocking spirals that orbit the origin three times. the classification task is to determine which spiral any given (x, y) point belongs to. we used the farthest distance clustering algorithm for initialization of both models. the k-means clustering algorithm places most centroids near the origin where the data points are denser and fewer centroids on the spiral arms further from the orig",UTILIZE,USE
42573536,40920227,"nd unlike these methods, we can handle programs that contain data-races, such as common lock-free algorithms and mutual exclusion primitives. checking equivalence to sequential consistency in 6 and algorithms are presented that can, based only on sequentially consistent executions, find violations of sequential consistency under the tso and pso memory models. similarly, it is possible to place",NOTUTILIZE,MENTION
2544501,2671054,d-side phrases have to be present. this can be ensured by matching from right to left in the right-hand side of the grammar rule; this is for example the case with the cocke--kasamiyounger algorithm ( ). a problem with this approach is that the analysis of the first part of a phrase has no influence on the analysis of the latter parts until the results from them are combined. this problem can be me,NOTUTILIZE,MENTION
5388125,5569792,"otal-cost, total cost, steiner tree) problem. let approx-steiner denote a approximation algorithm for the steiner tree problem. (for example, we can use the 11 6 approximation algorithm by zelikovsky .) in step 3 of the test procedure displayed in figure 5, we call approx-steiner to compute an approximate solution to the steiner tree problem in g using the weight hk(e) for each e 2 e. let msteiner",NOTUTILIZE,MENTION
19259767,20460582,"depth-first search strategy to mine frequent connected subgraphs. 9sgspan is a main memory algorithm and if the entire graph does not fit in main memory, graph-based data projection as in prefixspan is applied and then gspan is performed. 2.3.1 dfs coding figure 2.2 gspan a depth first search is conducted on a graph to generate dfs trees. multiple dfs trees can exist for a graph because the root",NOTUTILIZE,MENTION
9615161,10191502,"complex output), c c. the kmj method 8 learns f in polynomial time by approximating a polynomial number of large fourier coefficients in the context of a boosting algorithm due to freund fre90 order to determine the set a of large coefficients, the method requires access to a membership oracle. the large coefficients, f ( r a) (for r a a ) are then approximated by f ( r a) 1 m f (",NOTUTILIZE,MENTION
34618504,34559935,"-search (bfs), depth-first-search (dfs), and centroid decomposition 32 . 4the best known dfs and bfs algorithms for general directed graphs use o(v ev bm ) 32 or o((v e b) log 2 v sort(e)) memory transfers. for undirected graphs, impr",NOTUTILIZE,MENTION
14446624,15492628,"ly. we have successfully applied our theoretical results to the design of a set of distributed algorithms and a working protocol implementation. through careful and extensive experiments on planetlab , we have evaluated the correctness, performance, and efficiency of our protocol. results have shown that our distributed protocol not only converges to the correct solution, but also significantly in",UTILIZE,USE
202264265,240052946,"rom 0; 1 , and the relative error in all experiments is 105. our algorithm has been implemented in c . we used the fast exponential, square root and reciprocal libraries in the cxml routines, fftw for the m2l translations, and petsc 2 for proling and for its krylov iterative solvers. all our tests were performed on the pittsburgh supercomputing center s tcs-1 terascale computing hp alphaser",UTILIZE,USE
111348528,102364126,"aliency measure in order to detect robust features, we use an extended version of the saliency-based model of visual attention 19 . the saliency-based model of attention has been firstly reported in and gave rise to numerous soft and hardware implementations. for more details on the saliency-based attention model, the reader is referred to 21, 17 . the model of attention computes a saliency map",UTILIZE,EXTEND
15111792,16196853,"lgorithm. numbers of positive and negative samples are in proportions about 1:1. 4.2 methods 4.2.1 support vector machine as a supervised learning algorithm, svm introduced by vapnik and his coworkers is known for its outstanding performance and successfully applied in many issues of computational biology so far. in present work, we use 1-norm soft margin svm. with respect to a dichotomic classifi",NOTUTILIZE,MENTION
22458211,23498370,"ger and creating a resultant language with a consistent look and feel. rather than implement our own scheme interpreter, we chose to extend an existing implementation. elk, the extension language kit , is a scheme interpreter designed to figure 3. gcl operators be extended and embedded in other applications. to merge gcl and scheme three new data types, extents, intervals and queries, were added t",UTILIZE,EXTEND
8336445,8772267,"under, and substitution through, an abstraction; avoidance of duplication of free variables; and clean garbage collection. an implementation of closed reduction using interaction nets is presented in together with benchmarks and empirical comparisons with some other implementations of the -calculus. related work. our work builds upon the use of explicit substitutions for controlling substitution",NOTUTILIZE,NOTALGO
20688709,21885763,traditional scan) cc1 sand 1 100 1000 total test cycles 7000 figure 7.1: cost of test generation in sequential circuits: three paradigms generation on the original circuits using steed . note that only for the relatively small circuits (s344) do we get a reduction in test sequence length when using the sequential test generation algorithm steed. while circuits such as(sand) and (s14,NOTUTILIZE,NOTALGO
1668801,1765251,"o(m m). this implies also a complexity improvement for solving mdp s with reachability objectives under the almost-sure winning criterion, for which the best algorithm so far had o(mn) running time . interestingly, the novel technique we use for buchi mdp s allows us to shed some light on the important problem of finding subquadratic algorithms for simple buchi games. theorem 4. simple buchi gam",NOTUTILIZE,MENTION
5312016,5489011,"and backward-projection. forward-projection algorithms iterate over the dataset during the rendering process projecting voxels onto the image plane. a common forward-projection algorithm is splatting . backward-projection algorithms iterate over the image plane during the rendering process re-sampling the dataset at evenly spaced intervals along each viewing ray. in general, ray casting algorithms",NOTUTILIZE,MENTION
