contextID,citationID,CLEAN_CITATION_CONTEXT,UTILIZE_LABELS,USAGE_LABELS
202042831,239734233,nd vcs. we relied on the vcs as onsthe source of information on integrations; however differentsvcs implementations might not provide this data. in this casesthe algorithm described by fischer et al. can be used tosinfer this information. another assumption on the strict order ofsintegrations can be more severe. although in vista sp2 only assmall fraction of integrations did not follow that order,UTILIZE,USE
60852527,60233001,"238 . other applications of clustering algorithms for tissue classification include: mixtures of multivariate gaussian distributions 105 , ellipsoidal art 287 , and graph theory-based methods 29 , . in most of these applications, important genes that are tightly related to the tumor types are identified according to their expression differentiation under different cancerous categories, which ar",NOTUTILIZE,MENTION
14446543,15492544,"computationally more efficient than the one introduced in 27 . related prior work for region based segmentation using curve evolution implementation is by l. cohen 12 , 13 , paragios-deriche 21 , , 23 , tsai, yezzi and willsky 26 , among other work mentioned in 27 . we also mention the segmentation model by zhu-yuille, in a probabilistic energy minimization approach 30 . 2 description of t",NOTUTILIZE,MENTION
71254077,70382781,"lows the input of continuous and categorical variables and different scales of measurement amongst the predicting variables. boosting is a machine-learning algorithm that increases a model s accuracy . this is applied to the regression trees to help improve their predictive performance. boosting is based on the principle that in machine learning, a set of weak rules can create a single strong",NOTUTILIZE,MENTION
34630918,34571954,"rally low (we use t 4, selected empirically), this community detection algorithm is quite scalable. for most real-world networks, where the graph is sparse, this algorithm runs in time o(n 2 log n) . note though, the optimized greedy modularity algorithm scales significantly better for sparse graphs than the walktrap algorithm",NOTUTILIZE,MENTION
57575838,56865170,"that transform these components to normal coordinates 3 . a system for performing image registration algorithms uses of machine vision, image processing, machine learning and artificial intelligence . in recent decades, imaging changes identification in remote sensing has been much attention 5, 6 . in radiographic, images automatically compare and match and in mammography, cancer cases is easily",NOTUTILIZE,MENTION
29143980,29823117,"must have from two to four jets with the leading jet pt 25 gev and det 2.5, and all other jets having pt 15 gev and det 3.4. jets are defined using a cone algorithm with radius r 0.5 . misreconstructed events are rejected by requiring that the direction of et is not aligned or anti-aligned in azimuth with the lepton or the jets. the fraction of signal-like events is further enhan",NOTUTILIZE,MENTION
71543416,70650756,"ersect at a particular stage. these extensions to fg arose from the design requirements of an out-ofcore distribution-based sorting algorithm for a cluster. in a prior sorting algorithm for a cluster , which was based on out-of-core columnsort, all interprocessor communication sent and received the same amount of data every time, and so the single-pipeline model sufficed. in contrast, in the distr",NOTUTILIZE,MENTION
36932850,36061691,"d to precisely define dependants for social security payments are not included on the original ids file. consequently, dependants are not always defined exactly as they are by the social security act as indicated by an in table 2. the following is a description of how dependant status was simulated in the social security module. there are two definitions of dependant status in the social securi",NOTUTILIZE,NOTALGO
21783533,22886013,"factors, even when an improvement by cole 25 is applicable. as many researchers have commented, the resulting algorithms tend to be complicated and impractical; see the survey by agarwal and sharir . in contrast, our randomized reductions use the decision algorithms purely as",NOTUTILIZE,NOTALGO
11113704,11862445,"displacement expert to provide long-term reliability. recently, work such as 28 has provided highly efficient face detection algorithms and for face tracking applications of this system floatboost was used. experiments were carried out to measure both the cpu demand and accuracy of floatboost alone 7 and the hybrid tracker of section 4 using floatboost as the validator and detector. fig. 19 sh",NOTUTILIZE,MENTION
20990802,22157195,anation of equivalence preserving transformations that first appeared in lw95 while appendix b provides the proof of the input output equivalence of spec and prog that first appeared in law92 . in the algorithms for computing state-event equivalence outlined in section 3.1 and section 3.2 were im128splemented and used to verify the weak state-event equivalence of modified versions of the under,NOTUTILIZE,MENTION
56929607,56257162,"ot predict well when the aircraft makes an unanticipated change of flight mode such as making a maneuver, accelerating, etc 7, 8, 9, 10 . many adaptive state estimation algorithms have been proposed . the interacting multiple model (imm) algorithm 15, 16 runs two or more kalman filters that are matched to different modes of the system in parallel. it uses a weighted sum of the estimates from th",NOTUTILIZE,MENTION
19734813,20948691,"ethods relatively painless. future work on this topic might consider various improvements to the interpolation stages implemented in our algorithm, using recent results in the usfft literature (e.g., ). the proposed algorithm might have applications in stable and rapid inversion of radon transform, fast image rotation and registration, and elsewhere. extension to 3d will require definition of pola",NOTUTILIZE,MENTION
774053,826665,"assumption of independent snapshots and also, if possible, perform a second order analysis (mean square convergence). furthermore, ass-lms exhibits poor convergence in non-stationary signal scenarios it is of interest to develop new partial update algorithms with better convergence properties. one such algorithm based on randomized partial updating of filter coefficients is described in 8 . 7. r",NOTUTILIZE,MENTION
103068206,96288305,"e, lasting for at least 3 days and for which the patient sought medical attention. the american thoracic society (ats) indications for hospitalization of patients with copd exacerbations were applied . patients were excluded when: 1) there was a personal or family history of asthma (defined as episodic wheezing or dyspnoea that rapidly improved with treatment) or atopy, 2) invasive or noninvasive",NOTUTILIZE,NOTALGO
9283540,9823764,"lmost identical to our trec 6 clustering approach. unlike in previous years, we only used one algorithm (no experimental algorithm this year ), and ran it on different topic lengths. our trec 6 paper gives the details and rationale for the approach. the basic algorithm is 1. retrieve 1000 documents using the initial query (using lnu.ltu weights). 2. generate cooccurrence information about the que",NOTUTILIZE,MENTION
41692761,40083697,"the algorithm. it follows that an algorithm should work equally well in isomorphic worlds. compare 18, p. 128 . in this sense states are abstract . these considerations lead to the second postulate : postulate (state) states of an algorithm are (first-order) structures over a finite vocabulary, closed under isomorphism of domains, such that initial states and terminal states are also closed unde",NOTUTILIZE,MENTION
20634606,21837907,"nd then one eliminates the variable xi. a procedure to compute the noether normalization of an ideal has also been studied in 13 and it is available in singular through the library algebra.lib (see and its manual). we coded a version of the algorithm for cocoa as well, 4 . theorem 4.1 basically states that it is possible to find a new system of coordinates where the x variables act as variabl",NOTUTILIZE,MENTION
58959209,58236068,there are various scheduling schemes which achieve performance close to fundamental capacity limit for mimo broadcast (mimo-bc) under more practical assumption. the scheduling scheme discussed in 5 - employs simple zero-forcing beam-forming at the transmitter side and an algorithm named as semi-orthogonal user selection (sus) algorithm. although this algorithm achieves near optimal sum-rate but t,NOTUTILIZE,MENTION
10673100,11363724,"d as instance field accesses during the analysis. a program being analysed is represented by its pag. the points-to sets for the analysed program are computed using a points-to analysis pass in soot ( ). we have implemented our internal analysis and side-effect analysis algorithm as separate passes. we present our experimental results using nine benchmarks. the first four are from specjvm98, jasmin",NOTUTILIZE,MENTION
3739798,3859348,"n this paper, we use the ideas of genetic algorithms and tabu search to develop algorithms to generate solutions of the k-cardinality tree problem. this paper is based on a master s thesis of c. blum . we shall assume the reader to be familiar with the basics of genetic algorithms and tabu search. the rest of the paper is organized as follows. in section 2 we will prove that the kcardinality tree",UTILIZE,USE
32530785,32888133,the continuous time system and in reference 11 for the discrete-time systems. 4. closed-loop output error adaptation algorithm the cloe recursive adaptation algorithm (cloe) presented in reference is based on a reparameterized adjustable predictor for the closed-loop system in terms of a known xed controller k and an adjustable plant model gk . figure 4 shows the block diagram which is often,NOTUTILIZE,MENTION
4564055,4716675,"efined. if all its flaws can be removed without adding any actions and the resulting plan pn has a higher quality value than p i then it is returned, otherwise p i is returned. as ambite and knoblock point out, the performance of a rule-rewriting system depends on a number of factors: (1) the algorithm used to produce the initial plan, (2) the search algorithm used for plan-rewriting. two search",NOTUTILIZE,MENTION
4697426,4853167,"mation gives all zeros inside 4 . by carefully selecting an order for the long ar model and by using the burg estimation method, the performance of durbin s algorithm has been much improved recentl . it now yields satisfactory ma models, also for finite or small samples. ar modeling is the backbone of time series analysis in practice. for a few observations, the best ar model order is often grea",NOTUTILIZE,NOTALGO
16581246,17719514,"distance different types have been studied, e.g. whether the mapping is fixed or has to be injective, the permitted transformations (translation or rigid motions) and the dimension of the point sets. the difficulty for finding exact solutions or approximation algorithms depends widely on these parameters. several exact algorithms for two dimensional point sets can be found in ref. 10 . further w",NOTUTILIZE,MENTION
11520215,12313655,". since machine-oriented language translators often need to process large inputs in linear or near-linear time, and there appears to be no hope of general cfg parsing in much better than o(n 3 ) time , most parsing algorithms for machine-oriented languages focus on handling subclasses of the cfgs. classic deterministic top-down and bottom-up techniques 3 are widely used, but their limitations ar",NOTUTILIZE,MENTION
202661583,240619417,1 also presents the numerical results obtained when solving these problems with the sequential rrt. 9the application we have used is the molecular motion planning toolkit we are currently developing . 10to facilitate the algorithms,UTILIZE,USE
10687446,11380472,"tep 3 of algorithm 1 if all 2 d views are to be computed. for building the partial data cube, i.e. a subset of the 2 d possible views, we use a modified schedule tree construction method presented in . we now discuss how locally generated i-subcubes are merged in step 6. in step 5 of algorithm 1, each processor pj locally computes dcij from its local rootij. for a view v of si, let v j be the loca",UTILIZE,EXTEND
30318531,31047484,"the 6 outputs from each of these classifiers. this 6-dimension vector is then used as input to a decision tree algorithm. for these experiments we used the commonly used decision tree algorithm c4.5 implemented as the j4.8 algorithm in weka version 3.4.4. 26 . hdtree method the hdtree approach uses the outputs from each of our nb k-gram and nb(k) algorithms, and the output from the psi-blast cl",UTILIZE,USE
5539940,5731154,"4 is computed on each segmented character image, and a vector of kl coefficients are produced. these coefficients form a feature vector that is classified using a probabilistic neural network (pnn) . our k-d tree implementation 6 classifies a factor of 20 times faster than more conventional software implementations of the pnn algorithm. the recognition system stores the character s assigned id",NOTUTILIZE,MENTION
52227566,51833081,"re haplotypes have to be inferred. this is consistent with the results of some previous studies which evaluated and compared the performance of several algorithms on both empirical and simulated data . phase provided the most accurate reconstructions, probably because the true haplotypes conformed more closely to the assumptions of the approximate coalescent prior than to those of the dirichlet pr",NOTUTILIZE,MENTION
34320544,34292912,"weight to stay in cache. to do so, the algorithms can adjust the stream of block requests to have more fast device requests by filtering slow device requests to improve caching efficiency. in papers , the authors propose to adapt replacement algorithms or prefetching strategies to influence the i o request streams for disk energy saving. with the customized cache filtering effect, the i o stream",NOTUTILIZE,MENTION
41766447,40159837,"so solved in linear time. finding a convex isotonic regression for a convex cost function is a shape-constrained modeling problem that can be solved using convex optimization methods. ahuja and orlin present a convex optimization algorithm that solves the problem in , assuming that the inputs were sorted. melanie and holger also studied the problem of estimating a convex function for nonparametri",NOTUTILIZE,MENTION
13220726,14179133,"cluding a detailed time and space complexity analysis. we compare these algorithms on thirty-six natural domains from the uci machine learning repository 21 by using the bias-variance decomposition , a key tool for understanding machine learning algorithms. we also give some general recommendations for selecting appropriate semi-naive bayesian methods. 2 naive bayes (nb) naive bayes (nb) 2 4 s",UTILIZE,USE
7059357,7383194,"exceed o(lg lg n). indeed, some of the o(lgn) time qrqw pram algorithms are based on quot;highly parallel quot; crcw pram randomized algorithms, whose running time on the crcw is w.h.p. o(lg lg n) o e the quot;doubly-logarithmic paradigm quot; include those for load balancing, random permutation, and hashing. algorithms that use the quot;log-star paradigm quot; include those for multiple compac",NOTUTILIZE,MENTION
44426961,43245936,"(38) which uses the adaboost (39) algorithm to learn the decision rules and associate weights to them. adaboost is a general discriminative learning algorithm proposed in 1997 by freund and schapire , and has since been successfully used in numerous and varied applications (e.g., in text categorization (41, 42) and gene expression prediction (43)). it is equivalent to an additive logistic regress",NOTUTILIZE,MENTION
58849975,58131013,"till a challenging task because ann algorithms are multiplication-rich and it is relatively expensive to implement. various works reported in this area includes new multiplication algorithms for nn , nns with some constraints to achieve higher speed of operation at lower cost 9 and multi-chip realization 10 . in this paper, issues related to the fpga implementation of a multi-input neuron are",NOTUTILIZE,MENTION
202161276,239909228,"we compute several seassurface current vector fields with different mask-sizes. thenswe compared each computed vector field to the predictedscurrents of the bsh v3 model using the method proposed ins . note that we have to choose appropriate values for thesgaussian standard deviation, in order to make the resultsscomparable to the mask size of the lucas kanade algorithm.sthe resulting average angu",UTILIZE,USE
63306109,62424124,"). this theoretical progress enables us to match but still not to beat the bgy mba cost bound. to yield further progress, we extend the approach of pan p87 , pan p88 , abbott, bronstein and mulders , and eberly, giesbrecht and villard egv00 , which relates p-adic lifting to the computation of smith",UTILIZE,EXTEND
91992852,87745985,"nce, multimedia networks, augmented reality and mathematical visualization modeling. we also proposed a one-to-many hyperworld interaction reference model 33 by extending the dexter hypertext model . what we called the hyperworld at that time can be regarded as something like the hyperspace in this article. abowd, et al, in 1998, also called for research on correlated smart spaces, i.e.,",UTILIZE,EXTEND
141187792,125098321,"annel states. in 1999, torres andsco-workers obtained evidence that the transmembrane regions participate in the homo hetero-oligomericsassociation that is believed to be important for pore formation . the tm2 segment has beensidentified as responsible for ion permeation and trimerization because the region spanning residues 304sto 362 in this segment is critical for that association.srecently, ro",NOTUTILIZE,NOTALGO
6215460,6453756,"nsion independently. then, the memory addresses referenced on a processor correspond to iterations common to both the dimensions. this cannot be deduced simply by two applications of the algorithm in ; we need to expand the tables up to the least common multiple of the periods (in terms of iterations) of the two dimensions. this forms the basis of our table generation techniques. the rice method",NOTUTILIZE,NOTALGO
13464215,14447361,"t (abbott and garcia-molina 1988), have been proposed as basic mechanisms for incorporating priority in locking protocols. real-time locking algorithms based on each of these schemes were studied in ( ) and are described below. 4.2.1. 2pl wait promote (2pl-wp). the 2pl wait promote algorithm (abbott and garciamolina 1989) is identical to basic 2pl in its resolution of conflicts, that is, transactio",NOTUTILIZE,MENTION
19567820,20776287,"property testing was introduced by rubinfeld and sudan 48 and since then attracted a considerable amount of attention. property testing algorithms were introduced for problems in graph theory (e.g. ), monotonicity testing (e.g. 15, 19, 20, 24, 25, 27 ) and other properties (e.g. 2, 6, 10, 13, 16, 18, 21, 23, 29, 39, 41, 42, 44, 45, 47 ) (the reader is referred to surveys by ron 46 , goldreich",NOTUTILIZE,MENTION
99142449,93300949,wo trees to be joined. an improvement of this algorithm was recently reported in hjr97 . (another interesting technique for efficiently traversing a multi-dimensional index structure was proposed in in a slightly different context.) gu nther gu n93 studies the tradeoffs between using join indices and spatial indices for the spatial join. hoel and samet hs92 propose the use of pmr quadtrees f,NOTUTILIZE,MENTION
23167248,24138222,"discussed. in addition, we will also discuss a sequential access-based web recommender system that has incorporated the csb-mine algorithm for web recommendations. 1s1. introduction web usage mining , also known as web log mining, aims to discover interesting and frequent user access patterns from the data derived from the interactions of users while surfing the web. the web browsing data can be",NOTUTILIZE,MENTION
3720595,3839006,or bent) due to large lesions. figure 2 shows some 2d sample results after the midsagittal plane is extracted. the imsp algorithm is robust under adverse conditions and has been evaluated extensively - - - 9 . axial and coronal slices are used simultaneously to handle large out-of-plane rotation angles eectively. no statistically signicant dierence is found between the imsp algorithm and two experience,NOTUTILIZE,MENTION
38465985,37103375,"ted algorithms for convex minimization with linear constraints has been of interest since the early 1960 s. the essence of the work before the mid-1980 s is well documented in the book by rockafellar . rockafellar 10 describes distributed algorithms for monotropic programs, which are separable convex minimization problems with linear constraints. these algorithms leverage the decomposable struct",NOTUTILIZE,MENTION
22314435,23370062,"version of the knapsack problem requires omega (pn) rounds even by using 2 p n processors. we extend the result to the pram model without bit-operations. these results are consistent with mulmuley s recent result on the separation of the strongly-polynomial class and the corresponding n c class in the arithmetic pram model. keywords lower-bounds, parallel algorithms, algebraic decision tree 1 in",NOTUTILIZE,NOTALGO
202632648,240579278,"imultaneous acquisition of a range of shears in a two-dimensional dataset. in this letter, we use the recently developed spatially encoded arrangement of chirped arangement for spider (seacar-spider) to acquire such data, and reconstruct the pulses using a multiple-shear algorithm. as proof of concept, we demonstrate accurate measurement of the relative phase of two spectrally disjoint subpulses,",UTILIZE,USE
153983793,135376651,"re shown in figure 11a.sfrom apollo experience, dark mantling material has beensrecognized and identified as deposits of fine-grainedspyroclastic glass beads pieters eta ., 1974; adams et al.,s1974; ; gaddis eta ., 1985 . based on theirsphysical and spectral properties, many of the large nearsidesdeposits are interpreted to be similar to the black spheres ofsapollo 17 such as sample 74001 adam",NOTUTILIZE,NOTALGO
58906436,58184980,"1 . for both our case studies, the explicit implementation (in the sense of sect. 5) outperforms the symbolic one both in ram and computation time. in particular note that in tab. 1, for n 9,b 0,q the number of coalition grows but the symbolic algorithm does not take any advantage of this. 7 conclusions we presented two algorithms based on symbolic model checking for verification of nash equil",NOTUTILIZE,MENTION
201763361,239333088,"data at the same time. as for students at school, the order in which tasks are solved may crucially affect the overall performance of the learner. we study this question by using pac-bayesian theory to prove a generalization bound that depends on the data representation and algorithm used to solve the tasks. the bound quantifies the effectiveness of the order in which tasks are solved and theref",UTILIZE,USE
5826270,6033696,"vertices of the two-dimensional intervals representing the cartesian products of fi-cuts for any fisff. this case still admits an effective calculation by a method which we call the vertex algorithm . the only problem remains with the 1-cuts; here the global search has to be performed. (for fuzzy numbers, the 1-cuts are singletons.) 4. when we need to evaluate constrained fuzzy arithmetic in its",NOTUTILIZE,MENTION
27583334,28296022,"ability. the problem remains, in fact, np-hard for each fixed k 2. 1 introduction the correlation clustering problem for general (ordinary) graphs was introduced and proved np-hard by bansal et al. . given a complete graph with labels or on each edge, the problem is to partition the vertices into clusters so that the number of edges inside each cluster plus the number of edges be",NOTUTILIZE,NOTALGO
90407212,86503458,"white psychologists to advocate a culturally diversesperspective, for if it is just minority psychologists doing so, they can easily be dismissed or marginalised by whitespsychologists.s9 hutnyk and ; parham 1993; mio and iwamasa 1993; stanfield 1993 in relation to culturalsstudies and anthropology, psychology, and sociology). this should seem no more controversial than thesdevelopment of feminis",NOTUTILIZE,NOTALGO
3307896,3408128,"student model taking into account the issue of language transfer. in particular, we use an innovative combination of stereotypes 1 , 14 and the distance weighted k-nearest neighbor algorithm 15 , 17 to set initial values to all aspects of the student model. stereotypes are used to make initial assumptions about the student",UTILIZE,USE
20162206,21384327,"oded vector by vector. then traditional cryptosystems from commercial applications can be used. d. a new mirror-like image encryption algorithm and its vlsi architecture jiun-in guo and jui-cheng yen have presented an efficient mirror-like image encryption algorithm. based on a binary sequence generated from a chaotic system, an image is scrambled according to the algorithm. this algorithm consis",NOTUTILIZE,MENTION
13814810,14824597,"g a text vector containing a histogram of words. we fuse both the visual and textual vector using vector concatenation. in the learning phase, the semantic pathfinder applies a support vector machine to learn concept probabilities. here, we use the libsvm implementation 42 with radial basis function and platt",UTILIZE,USE
