contextID,citationID,CLEAN_CITATION_CONTEXT,UTILIZE_LABELS,USAGE_LABELS
27674849,28386877,onditions for a splitting scheme devised to find a zero of the weighted sum of m maximal monotone operators. this scheme is shown to be closely related to an algorithm originally designed by spingarn with different tools. the application of the results of section 2.2 to the construction of the resolvent of the sum of m maximal monotone operators is discussed in section 2.3. 2.1 asymptotic behavio,NOTUTILIZE,MENTION
476603,509569,describe a very simple and practical deterministic algorithm for this problem based on the total-exchange communication pattern 1 that was independently discovered by several groups of researchers . we use the randomized and deterministic algorithms for h-relation routing to point out an interesting relationship between randomized two-phase routing and the columnsort algorithm. we then present,NOTUTILIZE,MENTION
76587435,74877926,"stering algorithms require no assumption on probability structure of the data. it only requires a similarity function defined on the data pairs. the typical similaritybased algorithms include k-means and spectral clustering 39 , 42 , 10 , 47 . k-means produces a cluster set that minimizes the sum of squared errors between the data points and the cluster centers. the spectral clustering usuall",NOTUTILIZE,MENTION
13203517,14160358,"eek style and consistent representation before raw performance, translating internal blocks to and from column-major representation just to get impressive blas3 performance from dgemm is not a choice . the idea is to explore a uniform representation, and to discover the support it needs, as well as the algorithms it suggests. morton-order representation also fits strassen s algorithm perfectly 42",NOTUTILIZE,NOTALGO
13482983,14467622,"e 2, 13, 17, 30 . in addition, research on parallel algorithms and applications is required, since the bandwidth and latency differences in a metacomputer can easily exceed three orders of magnitude . coping with such a large non-uniformity in the interconnect complicates application development. the eco system addresses this problem by automatically generating optimized communication patterns fo",NOTUTILIZE,MENTION
4594263,4749376,y or (flexcase x of 0 - 0) (flexcase y of 0 - 0) under the assumption that quot; is asexible operation. transformation schemes for programs where all the functions aresexible have been propose . these proposals are easily adaptable to our representation using case and or expressions. the challenge of the implementation of curry is the development of a transformation scheme that provides bot,NOTUTILIZE,MENTION
202847598,240888060,"as in (6) a p 0 0 0 1 0 0 2 0 1 0 3 0 0 1 (26) 22 a is a basis of l l(a). in order to find a vector m with small coefficients (in absolute value), we use the lll algorithm , which gives us the approximated reduced basis lll(a) 1332 1562 3497 9 1629 3191 306 297 3191 306 297 1629 306 297 1629 3191 (27) we remark that the first vector of lll(a) has",UTILIZE,USE
31026611,31701617,"ly, crispell et al. 7 used this algorithm to recover additional points located on general depth discontinuities, not just silhouettes, using the multi-flash imaging method proposed by raskar et al. . while locally convex points inside concavities can be estimated from these additional samples, locally concave points at the bottom of concavities cannot be recovered, leaving holes in the recovered",NOTUTILIZE,MENTION
20214506,21438701,"dependence is desirable. the former step uses an abstract gate library, such as and-or-not, and emphasizes the scalability of synthesis algorithms that capture the given computation s global structure . in 4 some challenges are identified: 1. design a high-level programming language in order to create quantum algorithms that encapsulates the principles of quantum mechanics such as superposition a",NOTUTILIZE,MENTION
2945725,3075075,"y one offspring is produced. and becomes the new resident at that processor. several people have proposed this type of computational model (manderick and spiessens, 1989; collins and jefferson, 1991; ; davidor, 1991). the common theme in cellular genetic algorithms is that selection and mating are typically restricted to a local neighborhood. there are no explicit islands in the model, but there i",NOTUTILIZE,MENTION
26818844,27522149,"nally, we extend the feature vectors of shapes (links) with the high-accuracy output of shape (pair-shape) classifiers that assign contributions (pairs of contributions, respectively) into categories . in the next step, doceswhat",NOTUTILIZE,NOTALGO
29089063,29774497,e of the notion of constructing ;t siei-e . to sol -e (5.1). legendre suggested the continued fraction expansion of 6. tliis rnethocl vas further de eloped in 1931 by d.h. lehrner and r. e. powers to give a factoring algorithm. to go into the details of it would take us too far afield. but m must mention the work of llarrison and brillhart 32 in 1970. prior to this. the method was considered,NOTUTILIZE,MENTION
24299868,25191637,"xhaustive exploration of the search space is unlikely. bunch overcomes this problem by using evolutionary search techniques based on hill climbing and genetic algorithms mitchell (1997); doval et al. . in the preparation phase of the clustering process, source code analysis tools chen et al. (1997); chen (1995) are used to parse the code and build a repository of information about the entities and",NOTUTILIZE,MENTION
3476352,3584054,). in contrast to the mentioned algorithms we do not make use of any global data structures in our algorithm. we use neither a central constraint store like 19 nor a centralized history trail like . omitting such central structures allows the concurrent execution of dierent solvers without further synchronisation. this is a prerequisite for distributed (non client-server) applications 15 . to,NOTUTILIZE,NOTALGO
77578098,75751663,"ompression rates (cr bs cs) for both objects, after encoding. table 2 shows a comparison, for the fandisk object, with different state of the art algorithms: alliez and desbrun progressive encoding and the wavelets based algorithms from khodakovsky et al. 10 and valette et al. 19 . our algorithm achieves drastically better compression rates ( 800), while keeping a low geometric error. coder",NOTUTILIZE,MENTION
4897343,5062148,"emigroup e gammatre a , we can now take the limit ffl 0, which gives the inequality (15) in the general case. 2 3 trace-norm convergence without error bound in this section we extend the method of to the case of gibbs semigroups. let a and b be m-sectorial operators in a hilbert space h, with semi-angles a , b . we denote by a and b the associated closed sectorial forms. following 3 we c",UTILIZE,EXTEND
202469748,240344482,"or the probability of future unseen bigrams, which allocates some of the probability of the training bigrams to those that are as yet unobserved 6 . the modified kneser-ney (mkn) smoothing algorithm is chosen because of its superior performance with interpolated language models 6 . the mkn algorithm subtracts a constant d from the observed frequency of every known bigram. it then estimates the",UTILIZE,USE
17592665,18769632,"best of our knowledge, only palsberg and jim approached this subject. in 17 they study the type inference problem for one of the abadi-cardelli systems 1 extended with the notion of selftype. in , palsberg presents an algorithm for the abadi-cardelli",NOTUTILIZE,NOTALGO
16001588,17120599,"amount of resources in the sensor network, while giving some guarantees. i thus develop a probabilistic clock synchronization protocol for sensor networks, basing my work done previously by christian and arvind 1 . 5.1.3 sources of clock synchronization error the biggest source of error in synchronization algorithms stems from non-determinism in message delivery latency. in an effort to reduce t",NOTUTILIZE,NOTALGO
8852267,9339282,"ional case achieves the desired dist (p) 2(k gamma 1) bound and also maintains the o(n 1:5 ) bound given in 2 for permutation routing. for the two-dimensional case, ben-aroya, eilam and schuster independently obtained an equivalent algorithm. as feige 7 observes, the dist (p) 2(k gamma 1) bound is somewhat arbitrary in that this bound is not a lower bound for all networks (e.g., a star",NOTUTILIZE,MENTION
63354088,62471713,"age becomes a decision problem for the existence of holes. in ht03 , an algorithm for k-coverage that can be distributed is proposed. unfortunately, it requires precise coordinates for all nodes. in , holes are addressed with greedy geographic routing in mind: nodes where data packets can get stuck are identified using a fully local rule, allowing identification of the adjacent hole by using a di",NOTUTILIZE,MENTION
202100835,239819339,"lcm significantly. (for example,schanging the period 1035 to 1000 in table 2 reduces the lcm from 828,000 to 3,000.)shence, we have developed a heuristic algorithm to minimize the lcm of a prototype .sthe algorithm allows the user to specify the range of acceptable values for the period ofseach operator and tries to reduce the lcm by replacing the periods containing the primesfactors that was dri",UTILIZE,USE
46084387,45291381,ri ij). we can then invoke results on classical compression methods to compress the resulting state. the important difference here to other compression schemes with an extended memory source set is that by considering compression in the second quantisation we have a novel framework for implementation of variable length codes. we will first introduce our scheme through an example and then dis,NOTUTILIZE,NOTALGO
12185800,13048025,by first computing a fractional solution and rounding them in a second phase has been inspired by 17 . our algorithm combines these techniques with ideas from the centralized primal-dual approach in . at the heart of our algorithm is the distributed primaldual technique which deterministically approximates (lp) within a constant number of communication rounds. each facility and client executes al,UTILIZE,EXTEND
7870840,8248523,"r we evaluate our algorithm implemented in suif 15 on c programs from mediabench 8 and specint95 12 . bitvalue is implemented as a work-list based dataflow algorithm starting from def-use chains . both def-use and bitvalue are local analyses. information from alias analysis or an interprocedural bitvalue analysis would improve our results, at a cost of greater compilation time. table 1. perce",UTILIZE,USE
5430850,5614771,"ept. of math. sciences systems and practices lab. xerox parc loyola university xerox parc palo alto, ca 94304 chicago, il 60626 palo alto, ca 94304 (extended abstract) abstract we extend the model of to express strong time-outs (and pre-emption): if an event a does not happen through time t, cause event b to happen at time t. such constructs arise naturally in practice (e.g. in modeling transisto",UTILIZE,EXTEND
202906046,240973132,"interference among other devices. all these lead to unstable wi-fi coverage and inaccurate localization. in our previous work we used the orientation filter and the newton trust region (tr) algorithm to enhance the traditional lf by filtering the noisy signal. although the average distance error is 1.82 m, this was not completely effective because they still suffer from the poor wi-fi coverage re",UTILIZE,USE
59405197,58655373,p and q are prime. 1. algorithms whose running time depends mainly on the size of n. the most notable algorithms in this class are the quadratic sieve algorithm 42 and the general number eld sieve . 2. algorithms whose running time depends on the size of p and the size of q. these algorithms are particularly good at factoring numbers when one of p or q is small. the naive heuristic of trial div,NOTUTILIZE,MENTION
202541689,240446515,"as been met. the steps of the algorithm are as follows: step 0: initialize the search item pool as s(0) 1,., j and the input q-matrix as q(0). step 1: use the nonparametric classification method ( ) to estimate examinees",UTILIZE,USE
82192971,79702529,"e previous operators. this process is repeated until a termination criterion is not satisfied which correspond to a reaching a predefined time limit or number of generations or population convergence . figure 7 illustrates the architecture of the proposed global perceptual codes detectors using genetic algorithms. for each gpc a genetic algorithm is developed, which treats a matrix of elementary p",NOTUTILIZE,MENTION
202814626,240842990,"hm for multi-objective optimization of laminate composite structures. the proposed work is basically an extension of the single objective scatter search algorithm proposed earlier by the first author by adding features like pareto 2 a. r. m. rao and k. lakshmisat pennsylvania state univ on september 19, 2016jcm.sagepub.comdownloaded fromsdominance, external archive, and density estimation in orde",UTILIZE,EXTEND
202522158,240419980,"frame by frame basis. we could have achieved the same effect without changing the decoder, but this implementation was considered easiest. we use the approximately optimal ulp algorithm described in . we simulate rather than use an actual network to allow greater control over the packet loss conditions. finally, we compare the reconstructed video sequence both subjectively (by viewing the sequenc",UTILIZE,USE
34560662,34502285,"they provide a greedy algorithm for selecting a diverse path subset from a large, densely-sampled path set. we will refer to these as the green-kelly metric and green-kelly algorithm. branicky et al. introduce the term path diversity, defining it as the probability of the survival of paths, averaged over all possible obstacle environments. in this context, a path set survives when at least on",NOTUTILIZE,NOTALGO
7400532,7744013,"refinements and decompositions together, the control flow and connective extensions of prm supply the power to express control structures of conventional algorithmic languages. figures 4 and 5 (from ) show templates corresponding to selection and iteration statements of c , respectively. in each template, primitive processes are denoted with a white top, while the top of still undetermined proce",NOTUTILIZE,NOTALGO
7064275,7388463,"convenience. given a term, possibly not typable, we are interested in the problem of determining if it can be well typed modulo insertion of appropriate coercions. such a typing algorithm is given in in the context of simply typed -calculus with recursive types. a weaker rule is: (app ) gamma f : (x : u)v gamma t : t c t;u : tsu gamma (f (c t;u t)) : v x (c t;u t) the solution we wil",NOTUTILIZE,MENTION
16261184,17389970,"usually a deterministic routing function guaranteeing a escape route to every message if the adaptive options are not available 5 . vcs and adaptive routing have been extensively studied in the past . most of the research has been based on simulations using synthetic workloads, or at most traces of real applications. in addition, adaptive routing has seen a few actual implementations, like in the",NOTUTILIZE,NOTALGO
3785030,3908405,"on that it is likely to amplify any odometric or visual error when the change in the projection size p 1 gamma p 0 is small. one way to overcome this problem is to use tracking over multiple frames ( ), as we did, allowing for larger displacements. an error analysis of the looming algorithm is beyond the scope of this article but will appear in a later publication. we now turn to experimental resu",UTILIZE,USE
17520737,18694641,"e to odometry errors) or for localization (where the current image is matched to a database of reference images taken at known positions). for motion detection in omnidirectional images, some authors have proposed to use known ego-motion algorithms once the relationship between the spherical projection model and the catadioptric omnidirectional model has been established. others have matched poin",NOTUTILIZE,MENTION
16247314,17375859,"h analysis using logical effort technique to compare performance. the adders that were examined were: (a) static: kogge-stone (ks) radix-2 6 , mux-based carry-select 7 , and han-carlson (hc) radix2 (b) dynamic: ks radix-2, ling adder 10 , hc radix-2 and cla adder with 4-bit grouping. delay (no. of fo4) 16 14 12 10 8 6 4 2 0 static cmos logic implementation logical effort hspice dynamic cmos im",NOTUTILIZE,MENTION
202783972,240798432,"ls of the markerspositions or posterior marker positions 17,18 as a criterion of the map quality, is central to our method. to eva-sluate the stability of ordering, we employ re-samplingsprocedures .sthe previously mentioned formulation was possible tosimplement as a mapping algorithm for many markerss(i.e., hundreds per chromosome) because of a novel, hig-shly efficient method of discrete optim",UTILIZE,USE
3304092,3404492,"duces an efficient, and easy-to-use environment for hpsg systems. english and japanese hpsg grammars (xhpsg 8 and slung 2 ), an hpsg-based parser based on an advanced parsing algorithm (tnt-parser ), a disjunction packing algorithm 10 , and a parallel programming environment for tfss (pstfs 11 ) have all been developed on the old-lilfes system. however, it is still impossible to achieve our g",NOTUTILIZE,MENTION
85306084,82289243,"examples, this happens when applying proximal methods to image deblurring with total variation 12, 6, 26 , or to structured sparsity regularization problems in machine learning and inverse problems . in those cases, the proximity operator is usually computed using ad hoc algorithms, and therefore inexactly. see 17 for a list of possible approaches. in the end, the entire procedure for solving",NOTUTILIZE,NOTALGO
25693657,26464785,scribe the relevance of our model to current experimental work on the role of cross-reactive stimulation for the maintenance of immunological memory. our model extends the previous studies and models . these studies suggested that the longevity of memory is determined by the balance between two processes: the constraint introduced by a homeostatically regulated population of memory cells and the n,UTILIZE,EXTEND
41931697,40328698,"possible to apply a geometric algorithm for computing a joint spectral radius with a given relative accuracy. we now briefly describe this algorithm; for all technical details we refer the reader to . for the sake of simplicity, we consider the case of two matrices, the case of an arbitrary number of matrices is treated in the same way. the algorithm. suppose operators a0, a1 acting in d possess",NOTUTILIZE,MENTION
202268516,240058796,"by the value , which maximizes the conditional likelihood h(y x ; ) (equation (4)). 4. update x based on the current and using a combination of the icm algorithm and the viterbi algorithm . suppose that x is the current estimate of the true x ; 8 hosted by the berkeley electronic press our goal is to update the current des xg",UTILIZE,USE
31388371,31998815,"ange of its rank, a full svd can simplified to computing only a rank-r approximation to y k . specifically, the approximate svd is computed by a fast monte carlo algorithm developed by drineas et al. . for a given matrix a r m n and parameters ks, this algorithm returns an approximation to the largest ks singular values corresponding left singular vectors of the matrix a in a linear time. b. sto",NOTUTILIZE,MENTION
38018212,36689563,"ilure (ir7-dom). some extensions are also proposed for the specification of ft structures, such as the types of voting algorithms implemented within redundancy strategies (ir10). the approaches 16 , , 32 support the safety analysis of uml-based system models. pataricza et al. 32 use uml stereotypes to identify erroneous states and error correcting transitions in state machine diagrams (ir4-ip",NOTUTILIZE,MENTION
39409149,37963789,full behaviour of the vhdl 1079-1993 6 and an attempt has been made to extend this result using the concept of hybrid abstract state machines 7 to cover more general mixed-signal vhdl-ams systems . the latter work has demonstrated that a formalisation of vhdl-ams models may not only provide suitable methodologies for the semantic analysis phase of vhdl-ams elaboration but may also help to iden,NOTUTILIZE,NOTALGO
18948066,20145145,", (2) common middleware services tests that quantify the suitability of using different implementations of corba services, such as using real-time event 39 service against the notification services for delivering periodic trigger updates to the nav display component, and (3) domain-specific middleware tests that quantify the suitability of ccm implementations to meet the qos requirements of a p",NOTUTILIZE,NOTALGO
74745493,73385292,"an input and another that counts in binary 12 . similarly, rothemund et al. have demonstrated a dna implementation of a tile system that computes the xor function, resulting in a sierpinski triangle . these systems grow crystals using double-crossover complexes 28 as tiles. rothemund has demonstrated what is currently the state-of-the-art of dna nanostructure design and implementation with dna",NOTUTILIZE,NOTALGO
22093667,23167220,"m. 4 to apply these algorithms to actual imagery, of course, requires discretization. another alternative is to use discrete relaxation labeling methods; this has been done by many authors, including . in relaxation labeling, combinatorial optimization is converted into continuous optimization with linear constraints. then some form of gradient descent which gives the solution satisfying the const",NOTUTILIZE,NOTALGO
39666325,38217160,"et al. 4 address this problem by constructing a planar spanner using the gabriel test 9 . li et al. 11 present a local algorithm which computes a planar spanner with constant stretch factor. in li and wang introduce local algorithms which compute planar spanners with constant stretch factor and a constant maximum degree. however, the resulting maximum degree can be up to 20 and the weight o",NOTUTILIZE,MENTION
1636323,1730558,"roaches used for query optimization. systems addressing authorized integration of known databases can count on the availability of statistics on the databases (sources) being integrated. thus garlic ( , tsimmis (chawathe et al., 1994), hermes (adal et al., 1996) and disco (tomasic et al., 1997) systems attempt to use cost-based optimization algorithms for query planning. systems addressing inform",NOTUTILIZE,MENTION
12490644,13383405,"pam as hyperlinked pages on the world wide web that are created with the intention of misleading search engines. the authors present an algorithm named trustrank. similar in methodology to pagerank , a commonly used ranking algorithm in web search that propagates the popularity of a page using the link graph, trustrank works by propagating trust through the web graph by following links. the only",NOTUTILIZE,MENTION
66705989,65455433,".2 to appear in acm transactions on sensor networks numerical algorithms have been proposed shang et al. 2003; doherty et al. 2001; biswas et al. 2006; niculescu and nath 2003; eren et al. 2004; ; moore et al. 2004; singer 2008 . note that graph-embeddability saxe 1979 is np-hard, then (unless p np) there is no efficient algorithm for solving the corresponding search problem, graph realizat",NOTUTILIZE,MENTION
202549873,240459543,"em in our paratlel algorithms for computing maximum matchings among disjoint intervals is that of finding maximum matchings in convex bipartite graphs, which can be solved sequentially in linear time ; by using the optimal sequential algorithm for computing maximum matchings in convex bipartite graphs 15, 25 and by simulating sequentially the rest of our erew pram algorithm, a maximum matching a",UTILIZE,USE
84521783,81632024,"well when the relative weights for the two scores were appropriately chosen. details of the search algorithm and the relevance computation, along with a preliminary performance study can be found in . although a few other systems implement keyword search on databases (e.g., 5, 1, 6 ) banks differs from all prior work in several ways: notably, in the techniques for edge weight computation and pre",NOTUTILIZE,MENTION
213385244,183874429,"rules, beliefs, norms, and organizations that togethers2sother factors include industry culture (baucus and near, 1991), industry concentration (mckendall and wanger,s1997), environmental hostility ( ), environmental dynamism (baucus and near, 1991;swang et al., 2010), regulatory pressures (szwajkowski, 1985), board composition (agrawal and chadha, 2005),sand organization culture (mckendall and wa",NOTUTILIZE,NOTALGO
5852083,6060823,"per is to completely solve this question by characterizing those preference relations which can be generated by a distance dist. to do this we use (an adaptation of) an old algorithm, going back to , to determine whether a set of inequalities of sums has a solution. the plan of the paper is as follows. after introducing some additional terminology in section 2, we prove in section 3 a quite gene",UTILIZE,USE
18065613,19254210,"ating the balancing constraints. a class of local refinement algorithms that tend to produce very good results when the vertices have a single weight 8 , are those that are based on the fm algorithm . the fm algorithm starts by inserting all the vertices into two max-priority queues, one for each partition, according to their gains. initially all vertices are unlocked, i.e., they are free to move",NOTUTILIZE,MENTION
