contextID,citationID,clean__citation_context,UTILIZE_LABELS,USAGE_LABELS
18032745,19219398,"manceofthepb -tree on the itanium 2 processor, focusing on various implementation choices and their effect on performance. 1. introduction modern computers are based on the von neumann architecture , which separates the processing unit (cpu) and storage (main-memory). the trend in the last two decades has been that cpu speed is increasing at a rate of about 60 per year, whereas main-memory spee",NOTUTILIZE,NOTALGO
15881100,16996034,"lculus. for simplicity, we have presented our work in the context of a substitution semantics. we would like to extend this work to more realistic models of space consumption for functional languages . our preliminary results in this direction are promising. more work remains to demonstrate the applicability of this technique in the setting of more advanced type systems. in particular, recursive t",NOTUTILIZE,NOTALGO
33705697,33788028,1ma in twisted edwards coordinates and 1m 1s (k 6)m 5s 2ma in extended coordinates. 5.3 miller loop miller s algorithm loops over the bits in the representation of n. we follow hisil et al. and denote the system of projective edwards coordinates (x1 : y1 : z1) by e and the extended system (x1 : y1 : z1 : t1) by e e . if the whole computation is carried out in e e each addition step in t,NOTUTILIZE,NOTALGO
132266275,117978843,"we embark on this study with the pinney equation and show how such a discretisation procedure may be found. 2. the classical pinney equation the classical ermakov system, as extended by ray and reid adopts the form u (t)u f(v u) u3 ; v (t)v g(u v) v3 ; (1) where f , g, and are arbitrary functions of their indicated arguments, and the overdot denotes the derivative ddt . its general",NOTUTILIZE,NOTALGO
5845039,6053405,"gamma1 i q gamma p k gamma1 i 1 ff i q i j v k fi gamma1 i v gamma p k gamma1 i 1 ff i v i j return fig. 3. the classical gram-schmidt algorithm global communication. unfortunately, bjorck has shown that the classical gram-schmidt method is unstable with respect to rounding errors, so this method is rarely used. on the other hand, hoffmann 21 gives experimental evidence indicating th",NOTUTILIZE,MENTION
23083732,24063362,"ed by ff 21, 2, 17 1. for more details on the sparsest cut problem, its relation to embeddings, and its application to the design of a host of divide-and-conquer algorithms, see the survey by shmoys . equally important in algorithmic applications are certain special 1 embeddings known as embeddings into random (dominating) trees, whereby the given metric is approximated by a probability distribu",NOTUTILIZE,MENTION
32560353,32914669,"nct is a function on variables of at most two processes) in general. nonetheless, the problem can be solved efficiently for several useful classes of predicates such as stable 2, 1, 14 , conjunctive , linear and semi-linear 4 , and relational 18 predicates. several fast but exponential algorithms have also been developed for solving the general version of the problem 5, 11, 16 . stoller and s",NOTUTILIZE,MENTION
77057432,75282751,"mployed to develop vast bodies of parallel algorithms for many real life applications such as fourier transform 18 , matrix decomposition 5 and ascend descend-type of divide-and-conquer algorithms . the pipeline and grid frameworks for developing algorithms, which will be presented in this section, are important for at least three reasons. first, they fill the gap in algorithm development for t",NOTUTILIZE,MENTION
57513306,56808906,"sequences in sequence databases. the algorithm is designed to mine a less restrictive form of rule than the one discovered by the algorithms of lo et al. 14 , pitman and zanker 36 and zhao et al. . cmrules is based on association rule mining because it was observed that for some datasets, the number of association rules that are sequential rules is high (this was confirmed in the experiments).",NOTUTILIZE,MENTION
14592965,15650697,"w. the episodes were mined over a single event sequence and their statistical significance was measured as a percentage of windows containing the episode (frequency) or as a number of occurrences. in , an issue of incremental and interactive sequence mining was addressed. an algorithm was proposed for finding sequential patterns in the expanded database using the old frequent patterns. another con",NOTUTILIZE,MENTION
27009290,27721039,"tion integration based on the above observations, a number of researchers have suggested that direct data on protein interactions can be combined with indirect data in a supervised learning framework . studies using this approach all use a classification algorithm to integrate diverse biological datasets. a classifier is trained to distinguish between positive examples of truly interacting protein",NOTUTILIZE,MENTION
17799707,18981146,"able set. finally, we discuss extensions of these results to the general case of polyhedra described with limited accuracy. some of these ideas and the corresponding algorithms were first reported in , where more details and proofs can be found. a. planning in discrete reachable sets assume that (15) and (25) hold. hence, there exists a quantization angle , and is a 2d lattice generated over by a",NOTUTILIZE,NOTALGO
18809584,20003150,", for each group, starting at those with the largest weights, finding maximal matchings. each maximal matching can be found with one pass. further details and the proof of correctness can be found in . we propose a new algorithm that uses only one pass yet still manages to find of the optimal size. a matching which is at least 1 6 algorithm 4 (weighted matching). we maintain a matching m at all ti",NOTUTILIZE,MENTION
30750182,31456173,thematics buckley and qu 13 examine the problem of solving linear and quadratic equations and present the conditions governing the existence of a solution when using the -cut method. dong and wong used a combinatorial interval analysis scheme to account for multiple occurrences of a parameter as part of an algorithm for computing fuzzy weighted averages (fwa). inverses of functions can be dete,NOTUTILIZE,MENTION
9283540,9823764,"lmost identical to our trec 6 clustering approach. unlike in previous years, we only used one algorithm (no experimental algorithm this year ), and ran it on different topic lengths. our trec 6 paper gives the details and rationale for the approach. the basic algorithm is 1. retrieve 1000 documents using the initial query (using lnu.ltu weights). 2. generate cooccurrence information about the que",NOTUTILIZE,MENTION
22493314,23529596,"tives per day for cs.unm.edu, aya.org, i-pi.com, and explorenm.com respectively. in the 1999 darpa mit lincoln laboratories ids tests, they stated that above 10 false positives per day is a high rate . algorithm fp day mahalanobis distance 91,524 2 of icd length 6-grams 13 dfa 37 markov model (log transform) 39,824 linear combination table 1. false positive rate per day for the algorithms,",NOTUTILIZE,MENTION
7469420,7816239,"v 1 ; :::; v n gamma1 g, where v i 1 iff x i xm . then echx;zisb maxchx;zisb maxchv; f0; 1gisb xorhv; f0; 1gi b omega gamma n delta log n); the lower bound on the xor has been established in . 2 thus, the proposed algorithm has an optimal bit complexity. 7 extensions and remarks 7.1 bidirectional rings in the previous section, we have considered unidirectional rings; that is, rings where",NOTUTILIZE,MENTION
80860351,78558814,"tions and scienti c problems that suggest future research: hybrid intelligent systems. balance between interpretability and accuracy. sophisticated evolutionary algorithms. as david goldberg stated , the integration of single methods into hybrid intelligent systems goes beyond simple combinations. for him, the future of computational intelligence lies in the careful integration of the best cons",NOTUTILIZE,MENTION
202847597,240888060,"ned as in (6) a p 0 0 0 1 0 0 2 0 1 0 3 0 0 1 (24) a is a basis of l l(a). in order to find a vector m with small coefficients (in absolute value), we use the lll algorithm , which gives us the approximated reduced basis lll(a) 1332 1562 3497 9 1629 3191 306 297 3191 306 297 1629 306 297 1629 3191 (25) we remark that the first vector of lll(a) has",UTILIZE,USE
14842599,15916268,"avior. in figure 7(a) sum rate is plotted for the three iterative waterfilling algorithms (original, algorithm 1, and algorithm 2), the steepest descent method 13 , and the dual decomposition method , for a channel with k 10, m 10, and n 1. the three iterative waterfilling algorithms perform nearly identically for this channel, and three curves are in fact superimposed on one and other in t",NOTUTILIZE,MENTION
5970320,6189418,"n a non-local 2gb disk. we used different synthetic databases that have been used as benchmark databases for many association rules algorithms (agrawal, imielinski, swami 1993; agrawal et al. 1996; ; houtsma swami 1995; lin kedem 1998; lin dunham 1998; park, chen, yu 1995a; savasere, omiecinski, navathe 1995; zaki et al. 1997c). the dataset generation procedure is described in (agrawal",NOTUTILIZE,MENTION
202621795,240563977,"consideration, we can compute a splitting cycle on any surface m in o(n) time as follows. first we construct a simple non-contractible cycle, using a variant of an algorithm of erickson and har-peled , whichsnds the shortest non-contractible loop with a given basepoint in o(n log n) time. the running time is dominated by the computation of a shortest-path tree rooted at x using dijkstra s algorith",UTILIZE,USE
202621798,240563979,"gonal schema d has complexity o(gn), so the complexity of d is o(g3n). we then compute the shortest cycles in d that is freely homotopic to the boundaries of d, using an algorithm of frederickson ; see also 6, lemma 3.5(d) . given a combinatorial annulus of complexity n , frederickson s algorithmsnds a shortest generating cycle in o(n log n) time. thus, we computes in o(g3n log(g3n)) o(g3n",UTILIZE,USE
12470243,13360791,"ch and its even more elaborate successors have been responsible for the fastest known algorithms for almost all classes of finite groups, including the symmetric groups 29 and their wreath products . these are among the classes of groups for which o g log c g fourier transform algorithms are known. other examples include the supersolvable groups 3 , while the algorithms for finite matrix gro",NOTUTILIZE,MENTION
3313019,3413433,"variants of the experts algorithm and are (1 e) optimal with respect to the best static list. in this section we reapply the experts technique, this time using algorithm a (or b) and algorithm comb as the two experts. through this we can achieve both (l e) static optimality and (1.6 e) dynamic optimality simultaneously. the key idea is to use one of the experts for some number of accesses, and",UTILIZE,USE
27391232,28099513,"ightened formulations are considered as reformulations 96 . an effective and novel nlp solution algorithm based on blending two completely different formulations for the same problem is described in . the mathematical programming glossary 84 defines reformulation as obtaining a new formulation of a problem that is in some sense better, but equivalent to a given formulation. the main purpose",NOTUTILIZE,MENTION
8550121,9004204,"ifficult and time consuming. a possible solution is to embed the boundary cells in a regular space-subdivision grid garrity 90 . another major difficulty is that in order to efficiently perform step , neighborhood information is required. for unstructured grid, the algorithm must be preceded, therefore, by a process that associates with each cell information regarding its neighbors. quality of im",NOTUTILIZE,MENTION
17462893,18633817,"et of code vectors (the code book) that describes data in the most efficient way. a wide range of vector quantization algorithms exist, the most extensively used are k-means (macqueen, 1967) and lbg ( ). for other applications like visualization, a good code book is not enough. the code vectors , or processing elements (pe s), as they are often denoted in the self-organizing literature, must prese",NOTUTILIZE,MENTION
1687219,1785075,"fourth step takes time o(n k ), excluding the recursive call. the final step uses max-k-cut, which is a randomized algorithm and takes time o(n 2 nk2 o(1 ffl 03 ) ) (in the version inspired from ). overall, running the algorithm for ffl 0 (ffl k 4 ) 3k 1 k 2 , the algorithm thus becomes a (1 o(ffl))- approximation and has running time o(n k 2 k (n nk n k n 2 nk2 o(1 ffl 03 ) )",NOTUTILIZE,MENTION
232275901,196901097,"que. a recurrent theme in diffusion literature is the observation that in reality this sharp distinction between the new and the old does not exist see e.g. gold (1981), david and olsen (1986), dosi , silverberg (1991) . mostly a new technology is being developed further after its first launch on the market. the adopter who adopts first acquires something different than adopter who adopts last. m",NOTUTILIZE,NOTALGO
7847453,8223440,"je 0) ffp (a)h e (a); where ff is a normalizing constant. figure 3(b) shows a schematic trace of the algorithm. similar bucket-elimination algorithms were derived for finding an mpe, map, and meu . given a belief network (g; p ), and given a variable ordering x 1 ; :::; x n , the mpe task is to find mpe max x 1 . . . max xn y i p (x i jpa i ): (4) exploiting again the decomposed product form",NOTUTILIZE,MENTION
32436013,32816757,"license identification is used by fossology 12 . it uses an algorithm called the binary symbolic alignment matrix (bsam), traditionally used in protein alignment. all these tools are open source. in tuunanen et al. compared oslc, fossology and their own implementation, called asla (based on the regular expression method). their evaluation consisted in an empirical study that used 12 foss applica",NOTUTILIZE,MENTION
261415,279707,"). 655 bonifacio m., bouquet p., cuel r.: knowledge nodes: the building blocks ... figure 2: dkm architecture 4 knowledge nodes and dkm in this section, we extend the approach of dkm (as presented in ) with the concept of knowledge node, which provides a useful abstraction of organisational units from a designing perspective. dkm is based on two very general principles: 1. principle of autonomy: e",NOTUTILIZE,NOTALGO
7259453,7597513,"called inclusion functions. examples of application to robust stability and to parameter estimation of such domain-splitting algorithms which use methods from interval computations are given in 12 , , 14 . in 15 the mean value form, the optimal centered form presented by baumann 16 , and the taylor form are applied to robust performance problems and compared with bernstein expansion. the exam",NOTUTILIZE,MENTION
84393819,81522400,"ods are categorized differently in this paper. 6hal-00862706, version 1 - 17 sep 2013 2.3. classifier ensemble based methods ensemble methods have been poorly exploited for the design of occ methods . yet, ensemble methods offer more versatility to learn from the available data than a single algorithm and have been shown to outperform individual classifiers 47 . examples of ensembles of one clas",NOTUTILIZE,MENTION
51383187,51196713,"on, the messages exchanged between connected nodes of the graph represent probability distributions. in cycle-free graphs, belief propagation can be viewed as an instance of the sum-product algorithm , allowing one to obtain an exact posterior marginal distribution for each unobserved variable, given a collection of observed variables. when the factor graph contains cycles, the same rules that def",NOTUTILIZE,MENTION
8834013,9319199,"coarse discretized state-space representation. this compact representation 4 meant learning was fast, but favoured an rl algorithm that did not rely heavily on the markov assumption; in earlier work ( hown to be well-suited for this domain. the robot was given a set of primitive quot;reflexes quot; in the spirit of rodney brooks quot;subsumption quot; architecture (brooks 1991). a leg that is tr",NOTUTILIZE,NOTALGO
22095471,23168804,"dvantages are: i) it is simple as it does not actually require the nxn ip-latency matrix (therefore it can be completely distributed), and ii) it leads to connected topologies if the degree d log2n (see figure 4). we will refer to the centralized and distributed version of this algorithm as ran and dran respectively. 12sfig. 4. visualization of a random graph with n 332 nodes (average degree 2,",NOTUTILIZE,NOTALGO
66014303,64781072,"l across all iterations of the algorithm. this level of sparsity, coupled with the savings afforded by the linearization process, translates into a factor-of-3 4 savings relative to direct use of eq. , in terms of both the number of floating point-operations and the time to run each iteration of the algorithm.1552 j. opt. soc. am. a vol. 15, no. 6 june 1998 miller et al. 5. examples of thermal-wa",NOTUTILIZE,MENTION
22752414,23764105,"es that are played with positive probability) have been shown efficient on many games 40 , and efficient mixed integer programming algorithms that search in the space of supports have been developed . for more than two players, many algorithms have been proposed, but they currently only scale to very small games 19, 34, 40 . 4 there were also early techniques that capitalized in different ways o",NOTUTILIZE,MENTION
30183913,30900580,the assured forwarding 18 phb using three drop precedences. we use throughput and packet drop ratio as metrics to evaluate performance. the parameters for the simulation is shown in table 5.1. red parameters in the table are set to get the service differentiation among different types of packets. we use the software implementation of diffserv network developed at nortel networks 104 . the red,NOTUTILIZE,NOTALGO
8331782,8766798,"able for rendering from multiple viewpoints, is a more daunting task. pioneer s engine for mesh generation exploits shewchuk s triangle algorithm for the production of constrained delaunay triangles . the overal mesh processing in the mapping software consists of four separate stages: texturing, cleaning, smoothing, and resampling. texturing: application of texture gives reconstructed scenes a mo",NOTUTILIZE,MENTION
12537339,13435345,"holds. a similar analysis applies for nding a 3-cut (by lemma 4.3(1)), a separating edge, or a separating triple. in order to detect separating quadruples, we use an algorithm of chiba and nishizeki which implicitly lists all 4-cycles of g in o(m (g)) o(n) time. the algorithm produces a list of triples (ui;vi;si) with the following properties: 1. ui and vi are non-adjacent vertices of g. 2. si",UTILIZE,USE
16136421,17261250,"ng a resolution parameter, similar to the way we treat the definition of connectedness. there are already a number of algorithms for computing homological invariants, such as betti numbers, from data . we are currently investigating ways to formalize the relationship between the homology of a set and the homology of a finite point-set approximation to it. the ability to characterize the connectedn",NOTUTILIZE,MENTION
83664009,80893434,"where r has low rank. another line of work has been initiated by the generalized lanczos algorithm of elsner and ikramov 13 , which can be considered an extension of the hermitian lanczos algorithm to normal matrices, where aa a a, or, equivalently, a p(a) for some polynomial p (see 22 for numerous additional equivalent definitions). hence a normal matrix is i-normal(t) for some non",NOTUTILIZE,MENTION
13789519,14795447,"d services. together, these two protocols contribute to the scalable and decentralized features of the tuxedo system. 1 introduction peer-to-peer systems have increasingly become a hot research topic . however, in the context of peer-to-peer (p2p) computing, most of the research projects focused on routing algorithms and efficient query search mechanisms. currently, major applications of peer-to-p",NOTUTILIZE,MENTION
2584246,2705941,"n of claim 1. to test claim (1), we have designed a new language ilac (pronounced eye-lack-sharp, for instance level aspects for cgo. ilac is an instance level aspect oriented language extending c . we have implemented a prototype ilac compiler using the code document object model (codedom) 29 namespace which is part of the base class library of microsoft s .net framework. the codedom provid",NOTUTILIZE,NOTALGO
34835126,34740827,"sses vertices which do not contribute to the salient features of a shape and replace the holes thus created by new triangulations. some more elaborate algorithms, such as the one designed by varshney , have the ability to build surfaces wich are constrained to lie whitin some speci ed epsilon distance from the original surface. 5.2 culling methods clovis uses a general culling method which compute",NOTUTILIZE,MENTION
14792802,15863911,an analysis of the management of time-extended situations in case-based reasoning 12 and we have designed a framework for the representation and the retrieval of cases with time-extended situation . we first summarise the main features of this framework supported by our software library called cbr tools written in java. then we apply our framework to the representation of navigations and naviga,NOTUTILIZE,MENTION
8825052,9309696,"lot, forwards processor s 7 data in the second time-slot, and so on. contention for memory is avoided because a processor always accesses the same memory. this is the well-known daisy chain algorithm . 4 scheduling multicast communication neither of the solutions proposed in section 3 is adequate when data must be written into the memories of some but not all of the processors. if the set of proce",NOTUTILIZE,MENTION
1624622,1717733,"and as the logic we take an appropriate extension of the theory of real addition. a definition of semantics of algorithms of this type is given, without infinitesimals as compared to our previous one , however under a condition not too much restricting for applications. then we represent the semantics in the mentioned logic, and give a proof of correctness of a general railroad crossing controller",NOTUTILIZE,NOTALGO
78195696,76261010,"t based, pixel connectivity edge linking based and hough transform based algorithms. 3an example of a statistical based line detector is the hypothesize-andtest algorithm proposed by mansouri et al. . it hypothesizes the existence of line segments of specified lengths by the use of local information. to verify a hypothesis the statistical properties of a model of an ideal segment are explored. an",NOTUTILIZE,MENTION
96577469,91309066,"igh concentration of h sions to form stable oxonium ion h3o2 . ansoxonium ion makes peroxide electrophilic to enhancesits stability and presumably substantially reduces thesreactivity with fe2 ion . therefore, the initial phsvalue has to be in the acidic range (2-4) to generatesthe maximum amount of ohsto oxidize organicscompounds 39 . in this study, optimum ph valueswas determined for two aci",NOTUTILIZE,NOTALGO
16989492,18140561,"lism in the context of concurrent constraint programming (ccp). in particular, we are interested in implementing tools supporting use of scsp techniques in practical situations. we thus extend mozart , a ccp language, to give it a coherent set of scsp features. our extension offers an integrated view of hard and soft constraints thus allowing users of traditional ccp systems to easily construct sc",NOTUTILIZE,NOTALGO
202228473,240003324,23 . we will be using the find cliques() function of the networkx 24 python language software package. this implementation is based on the algorithm presented by 25 and the adaptions by 23 and . this function returns a list of all maximal cliques in as graph. from this list we then select all maximum cliques and collect them in set . cliques find maximum cliques candidates,UTILIZE,USE
202940231,241023589,"ts can be graphically compared with through a graphical user interface. integrating multiple programming paradigms on cm5 13 fig. 5. a graphical user interface of the integrated system we choose from sve numerical advection algorithms with dierent diusion, dispersion and monotonicity properties. they are donor-cell , partial donor-cell , van leer , hain and lax-wendro , named after the au",UTILIZE,USE
203032699,241156611,"l with trypsin according to the method of shevchenko et al. (37). in-house proteomics pipeline software (proline) was used to process data. briefly, spectra were searched using the x tandem algorithm against the uniprot database restricted to p. putida entries (downloaded 7 january 2007). only proteins (i) with an x tandem table 2. primers used in this studya primerb sequence (5 to 3)c fadd nde",UTILIZE,USE
12411399,13295835,"l edge weights are integers in the range 1 . . . n gabow and tarjan 13 presented an algorithm with running time o( n (m, n) log n m log(nn)), where is the inverse of ackermann s function . in the case that all edge weights are the same, the fastest known algorithm has a running time of o( nm) and is due to micali and vazirani 21, 25 . for planar graphs lipton and tarjan 17 have s",NOTUTILIZE,MENTION
21573332,22691003,"hat represents spatial data using recursive subdivision. they have wide application to many graphics and visualization problems for faster searching, data packing, and algorithmic optimization. levoy used a binary octree to skip transparent voxels for efficient volume ray casting. laur and hanrahan 6 implemented a hierarchical splatting renderer using octrees. wilhelms and van gelder 15 used",NOTUTILIZE,MENTION
