contextID,citationID,CLEAN_CITATION_CONTEXT,UTILIZE_LABELS,USAGE_LABELS
10035923,10653857,"hnique is indispensable in object-oriented database systems for utilizing both (multiple) path indexes and pointers simultaneously. oid join algorithm differs from previous relational join algorithms in that it uses not only simple indexes but also pointers and path indexes. the paper is organized as follows. in section 2, we review pointer-based join algorithms and point out their problems. in s",NOTUTILIZE,MENTION
85666390,82586579,"cessing in to remove undesirable small parts of the skeleton. smoothing and removing undesirable small parts of the skeleton is done using our distance step and is very similar to techniques shown in , where the scale is also an input in the algorithm. to conclude with the use of morphological techniques, the skeletal description we are looking for corresponds to the needed of an accurate basis fo",NOTUTILIZE,MENTION
79269172,77195975,"lower-dimensional space where a more meaningful distance interpretation or visualization is possible. examples of dimensionality reduction algorithms include principal component analysis 89 , isomap , locally linear embedding 130 , laplacian eigmenmap 8 , and maximum variance unfolding 163 . 2) clustering; the goal is to discover similarity between examples and group the inputs into clusters.",NOTUTILIZE,MENTION
10825586,11541669,"algorithms have not worked as well as methods using appropriate integers and real numbers. such approaches as differential evolution 24 , real-valued genetic algorithms 25 , extended pattern search , and scatter search 27 appear to find solutions more reliably and efficiently for parametric engineering design problems. this is likely to be a result of the fact that engineering design spaces ar",NOTUTILIZE,MENTION
27520594,28232239,". the same argument applies to dictionaries explicitly parameterized by their fractional-orders and frequencies. 4.2.3 resolution we propose to solve (4.18) using the iterative thresholding algorithm described in section 4.1.3. recall the iterative thresholding algorithm, whose solution is given by (1 arg min c 2 s ec 2 ) 2 e c 1 , (4.20) 441 waveforms with similar fractional order",UTILIZE,USE
38360750,37011925,"be part of multiple clusters in arbitrary subspaces 1, 2, 13 . as one of the most recent approaches in this area we have extended subspace clustering to the detection of orthogonal subspace clusters . aiming at the detection of knowledge in orthogonal subspaces, we reduce the exponential result set of traditional subspace clustering to only few but meaningful clusters. thus, for each object one d",UTILIZE,EXTEND
89670048,85872500,"ever, the analysis there is limited to a first order approximation, which cannot pick up the slight convexity of the observed equity implied volatility surface. in this paper we extend the results of to second order. this extension is non-trivial, as it requires a careful terminal layer analysis, which we approach probabilistically. for some related multiscale perturbation techniques in european",NOTUTILIZE,NOTALGO
24802622,25645576,"e, the remaining edge switches exchange mycall packets (label i1-i3 in table 2.3), elect a new master node, and the network of edge switches is reconfigured using the topology configuration algorithm (i4). the edge switch remote node operation is described by tables 2.3 and 2.4. the packet contents are shown in table 2.5. each remote node that becomes active obtains its position from its global p",NOTUTILIZE,MENTION
103368928,96513949,"compres-ssion by entropy coding of the mixed blocks. the 2 sdifferent possible bit patterns of the block can be con-ssidered as source messages and coded using a variableslength code such as huffman . by making n and msas large as possible better result can be obtained withshuffman coding i, 31. however for large alphabetssize the design and implementation of huffman codesis complicated as it",NOTUTILIZE,MENTION
4190012,4328803,"reduced state space. starke has defined algorithms for computing all symmetry mappings of a petri net, for partitioning the node set into equivalence classes, and for generating a reduced state space . starke s definitions provide an excellent theoretical foundation for reduced state space generation. however, a program containing symmetrical processes can have a very large number of symmetry mapp",NOTUTILIZE,MENTION
12733492,13649393,"us in total we have created at most 2 2 3 free vertices, each incident to a bridge. since the proof is constructive, we simply implement each step of the proof. we use the algorithm of biedl et al. for computing matchings in the branches and for the base case. we only need to make a linear number of cuts because 2 (n 2) 6 5 . after each cut we just add a constant number of vertices. since",UTILIZE,USE
12718998,13633293,"ch communication session. it is not sufficient to obtain a dsrc simply by calling random() without carefully initializing the state. one could use an algorithm like the one defined in appendix a.6 in to create a dsrc. depending on the choice of algorithm, there is a finite probability that two dsrcs from two different rdss may be the same. to further reduce the probability that two rdss pick the",NOTUTILIZE,MENTION
80160466,77981492,"n between states are unimportant, only the existence of a transition. we omit here the precise details of the precomputation algorithms to determine sets sno , syes . see, for example, section 4.1 of for an explanation. value iteration. for the remaining states s s is to use value iteration, an iterative numerical method which can approximate the values up to some desired accuracy. in practic",NOTUTILIZE,MENTION
19929110,21146862,"ere between 5 and 10. let us finally mention that for the purely existential case other algorithms have been developed. the interested reader will find a comparison of their different complexities in . the originators of the three principal constraint logic programming languages prolog iii 3 , clp(r) 9 and chip 5 were thus well guided in restricting themselves to the present research was ca",NOTUTILIZE,MENTION
7698152,8057161,"designed using algebraic semiotics, which combines algebraic specification with social semiotics in the sense of 10 . the present paper is an extension, revision and amalgamation of work reported in and other papers. although this particular paper focuses on system architecture and user interface issues, for the convenience of interested readers, the bibliography attempts to list most of the pap",NOTUTILIZE,NOTALGO
97571681,92092791,"n developing a single object model which can be drawn on a flat (two-dimensional) surface that explains an application. our work recognizes and extends concepts of early software engineering pioneers that software design techniques must be extended by another dimension in order to account for layering in hierarchical systems. where our work departs from known results are the concepts of realms, t",NOTUTILIZE,NOTALGO
59617061,58899275,"f the cgc formalism for the behavior of the ratio rha. to overcome this, we extend the model proposed in ref. 10 for pp collisions and compare with the recent star data for inclusive 0 production . it allows to determine the normalization of the pp cross section and, consequently, to obtain a parameter free prediction for rha at forward rapidities. a similar procedure is performed for charged",NOTUTILIZE,NOTALGO
257083,274776,"e integrated ontology. as we use the deductive features of dl systems we avoid defining new costly deductive algorithms to determine the immediate hyponyms and hypernyms of a term. rules described in are applied to determine whether the resulting terms of the integrated ontology are primitive or defined. apart from the complexity of the third step, which depends on the specific dl system, the com",UTILIZE,USE
33661329,33751368,"or finding representations of positive semidefinite polynomials as sums of squares. these algorithms have many applications in optimization, control theory, quadratic programming, and matrix analysis . for a noncommutative application of these techniques to a famous trace conjecture, see the papers 1, 8, 13, 16 which continue on the work of 9 . one major drawback with these algorithms is that t",NOTUTILIZE,MENTION
66209798,64975864,"mb(v ). the algorithm stops as soon as v is smaller or equal to the radius of mb(v ), i.e. when all balls are contained in mb(v ). this method, together with a suitably adapted updating-scheme from to efficiently and robustly solve the equations in the proof of lemma 3.1, handles degeneracies in a satisfying manner; numerical problems tend to only occur towards the end of the computation, when",NOTUTILIZE,MENTION
18941865,20138801,"stics, we can model the large disturbances together with the background noise as an outlier-contaminated stochastic process, based on which some robust variants of the adaptive algorithms are derived : 8s",NOTUTILIZE,MENTION
3381195,3483333,"a multilevel way analogous to multigrid techniques, 2, 8 , and in an adaptive way analogous to dynamic refinement techniques, 21 . several algorithms for carrying out the reduction can be found in . to create a coarser graph g 0 (v 0 ; e 0 ) from g(v; e) we use a variant of the edge contraction algorithm proposed by hendrickson leland, 8 , and improved by karypis kumar in 11 . the idea is",NOTUTILIZE,MENTION
57503431,56799981,g work: we are currently designing a prototype system based on the proposed architecture. we intend to adapt the architectural description language 17 and the componentbased development methodology in our implementation work. the implementation of algorithm cs will be tested with a large data set of services and examine all composition scenarios. to improve the effectiveness of this approach we,UTILIZE,USE
18845222,20039590,"ngth) by selecting departing packets. we obtain the upper bound for bsp by extending the technique for the restricted assignment model of the on-line load balancing problem 4 , unlike bar-noy et al. 5swho reduce the discrete problem to a simulation of the continuous problem. 2 problem statement 2.1 the balanced scheduling problem the balanced scheduling problem (bsp) is formally defined as follo",NOTUTILIZE,MENTION
147628218,129938559,"or countries thatshttp: www.fin.ee index.php id 3830). the tax rate on distributed corporate profits is 26 . however,sestonia also abolished its tax on reinvested corporate profits in january, 2000 ( : 106). finally,sestonia received a transition period that allows affiliates in estonia to distribute profits to their parentscompanies at a 0 tax rate until december 31, 2008 (european commission, 2",NOTUTILIZE,NOTALGO
9537378,10104984,"red instance, and use the nearest instance or instances to predict the output class of y (i.e., to classify y). some instance-based learning algorithms are referred to as nearest neighbor techniques ( ; hart, 1968; dasarathy, 1991), and memorybased reasoning methods (stanfill waltz, 1986; cost salzberg, 1993; rachlin et al., 1994) overlap significantly with the instance-based paradigm as well.",NOTUTILIZE,MENTION
58986584,58261151,"for the most part, be placed into two to a constraint set is an assignment to each variable from camps: extensions of either andersen s 6 or steensgaard s , such that all constraints are satisfied. algorithm. the former use inclusion constraints and are more precise but slower. the latter adopt unification systems and sacrifice precision in favour of speed. we will now examine each method in tu",NOTUTILIZE,MENTION
42094840,40478759,"research makes finding a portable method of provenance collection vital. to that end, we are exploring hypervisor-based provenance collection. in this paper, we propose an approach for extending xen to transparently collect operating system-level provenance from its guest vms, without requiring any modifications to the guest kernel. although we expect our approach to be implementable across a va",UTILIZE,EXTEND
57198154,56528678,"rs and b is a bound on the initial energy level of the nodes. we prove this approximation ratio, by extending to this problem the exponential-function technique, originally developed by aspnes et al. in the context of online machine scheduling and virtual circuit routing and later used by awerbuch et al. 4 in online virtual circuit routing. thus, our algorithm attains a provable guarantee which",UTILIZE,EXTEND
2028812,2147021,"is (d2m3n) 1 o(1) ring operations for the classical euclidean algorithm with fft-based power series arithmetic. for the latter, we employ a division-free fft-based polynomial multiplication algorithm step 4 of section 3 the determinant 11 . sof f l(z),y ( ) is to be computed division-free in trunctated power series arithx metic over r z, mod(zn 1 , n 1 ). for this last step",UTILIZE,USE
239431127,201832923,"nction.scriteria for subject selection were normal hearing level and intelligence (see appendix a forssubject details, adapted from gibbon et al., 1998).sthe reading epg3 system was used (hardcastle, ). speech dataswere recorded on a sony tcd-d3 digital (dat) tape recorder and an akg c525ssmicrophone. the assessment included the administration of the cantonese segmentalsphonology test (so, 1992) a",NOTUTILIZE,NOTALGO
41769777,40163142,"on 24 . our own experiments revealed this to be a major obstacle to proper scalability of our implementation of tile lu factorization with partial pivoting a result consistent with related efforts . aside from gaining high level formulation free of low level tuning parameters, recursive formulation permits to dispense of a higher level tuning parameter commonly called algorithmic blocking. ther",NOTUTILIZE,NOTALGO
5826270,6033696,"vertices of the two-dimensional intervals representing the cartesian products of fi-cuts for any fisff. this case still admits an effective calculation by a method which we call the vertex algorithm . the only problem remains with the 1-cuts; here the global search has to be performed. (for fuzzy numbers, the 1-cuts are singletons.) 4. when we need to evaluate constrained fuzzy arithmetic in its",NOTUTILIZE,MENTION
16639246,17780322,"ased on the statistical tools. wrappers assess subsets of features according to their usefulness to a given classifier. unfortunately, finding the optimum feature subset has been proved to be np-hard . many algorithms are, thus, proposed to find the suboptimum solutions in comparably smaller amount of time 9 . the branch and bound approaches (bb) 15 , the sequential forward backward search (sfs",NOTUTILIZE,MENTION
11679822,12491788,"11 . instead, we use an iterative expectationmaximization algorithm for learning the stochastic dynamic process 9 . 4.1 em with condensation to learn the arp, we rely on the condensation algorithm . the condensation algorithm is, in essence, a particle filter approach which approximates a multivariate distribution. in the context of learning an arp, the condensation algorithm was first applied",UTILIZE,USE
12919861,13849558,"abbir ahmed context of bounding and approximating stochastic programs 1, 7, 9 . a number of authors have proposed numerical methods for minimax stochastic programs. ermoliev, gaivoronski, and nedeva proposed a method based on the stochastic quasi-gradient algorithm and generalized linear programming. a similar approach along with computational experience is reported in 6 . breton and el hachem",NOTUTILIZE,MENTION
202281988,240077340,"solution to give some idea of the conservativeness of these bounds. these errors were obtained by simulating the guass-seidel algorithm at a precision of 24 bits using the multiple precision toolbox . in the figure, we observe that the higham iss bound is not reasonable for larger values of n for the case of 2 as diagonal entries. this is due to the fact that for the considered example the values",UTILIZE,USE
4581487,4735531,"description method 9 with local modifications to add timing facilities and optimize set operations. qhull is barber and huhdanpaa s implementation of the beneath and beyond algorithm, version 2.01 . qrs is avis implementation of reverse search 1 using edmonds q-pivoting, version 2.4. we compiled qhull to use double precision. cdd uses double precision by default and qrs uses arbitrary precis",UTILIZE,USE
41713644,40105071,"al or global information draw from the graph. agarwal 1 proposed to model the data by a weighted graph, and incorporated this graph structure into the ranking function as a regularizer. guan et al. proposed a graph-based ranking algorithm for interrelated multi-type resources to generate personalized tag recommendation. liu et al. 17 proposed an automatically tag ranking scheme by performing",NOTUTILIZE,MENTION
14685320,15748320,"harder in general as it is the case of the algorithms mentioned above, and other approaches proposed for this purpose such as the predictor-chooser algorithm 22 , or the best-fit extension problem . this problem has been recognized in the literature, and more efficient algorithms have been sought. in this sense, akutsu et al. designed an improved version of bool-1 that runs in o(mn k ) 1 , and",NOTUTILIZE,MENTION
27394602,28103247,"alid in every kripke model. 3 sequent calculi for ihml p in this section, we define a first sequent calculus sc 1 for ihmlp . it is obtained by extending a calculus for the fragment without and . axioms and structural rules are given in figure 1 and logical rules are given in figure 2. let s be a sequent ( ; p g at p) we write sc 1 s to express that s is derivable in sc 1 . theorem",NOTUTILIZE,NOTALGO
41011867,39490519,"sed image classical iterative algorithms 1 adjust the value of g comparing the target bit-per-pixel (bpp) with the partial bpp obtained in the previous compression loop. statistical algorithms 2 , evaluate the g value considering statistical relationships between the target bpp and the g. the jpeg rate control algorithms performances can be characterized in terms of constant precision or const",NOTUTILIZE,MENTION
57575838,56865170,"that transform these components to normal coordinates 3 . a system for performing image registration algorithms uses of machine vision, image processing, machine learning and artificial intelligence . in recent decades, imaging changes identification in remote sensing has been much attention 5, 6 . in radiographic, images automatically compare and match and in mammography, cancer cases is easily",NOTUTILIZE,MENTION
7627913,7980733,"s well with respect to the loss function of interest. this potential should also be amenable to analysis; most of the bounds on such algorithms are proved using an amortized analysis of the potential . this paper examines several potential functions for leveraging in the regression setting and proves performance bounds for the resulting gradient descent algorithms. second, to derive bounds, assump",NOTUTILIZE,MENTION
839820,898030,"he rules check to see if there are any post-secondary stress syllables in the word. since there are none in r da, the focal h - is assigned to the end of the secondary stressed syllable -da at 140 hz . the algorithm then proceeds to point (5) which assigns the word accent h at the beginning of the stressed vowel. subsequently, the rule at point (6) assigns a l at the end of the stressed vowel at",NOTUTILIZE,NOTALGO
1886706,1999548,"tency as a preprocessing step in order to strengthen the forward checking lower bound 42 , 21 . larger improvements of the lower bound can be obtained using either the russian doll search algorithm or the notion of reversible directed arc consistency introduced in 22 and later improved in 23 . another algorithmic approach of s,v csp which is worth considering, and which is also able to cope",NOTUTILIZE,MENTION
104774873,97535840,"by only one robot) calls for a robust estimation paradigm. we chose ransac 13 for binary registration because it has both this properties. our implementation follows from the algorithm presented in for a binary lidar scan registration and can be found in 15 . b. multiple registration at each step k, ri executes multireg on the set made by its own raw observation oi fi, ai and the raw obs",UTILIZE,USE
4739474,4898195,"doe lanl contract 03891-99-23 and nsf grant dms-9973339. (email: zhang caam.rice.edu). 1sin polynomial time. some early ideas related to such a relaxation can be found in a number of works, including . based on the sdp relaxation, goemans and williamson 14 proposed a randomized algorithm for the max-cut problem and established the celebrated 0.878 performance guarantee. since then, sdp relaxatio",NOTUTILIZE,MENTION
7754651,8120041,"opology and routing policies. 3 abstract model of bgp in this section, we present an abstract model of bgp that we in establishing the stability properties in section 5. the model extends the work in to include interior bgp (ibgp) and exterior bgp (ebgp), additional bgp attributes and operations (such as meds, community set, and as prepending), and the possibility that an as has multiple bgp spea",UTILIZE,EXTEND
41562729,39961953,"ndeed, the algorithm produces consistent points and homographies exactly as a bundle adjustement. a detailed desccription of the algorithm and of the comparison with bundle adjustment can be found in . 3.3 the super-e-collineation matrix let us define the super-e-collineation matrix in the euclidean space as: 2 3 h11 h1m 6 h . . . . . . 7 4 . 5 7 hm1 hmm with dim h 3m; 3m and rank h 3. t",NOTUTILIZE,MENTION
78673845,76672071,"o be linked to the organizational structure of a floss project are those associated with goal-setting (locke, 1996; locke and latham, 1990), self-determination (ryan and deci, 2000) and selfefficacy ( ). goal setting theory suggests that establishing challenging, yet achievable, goals increases the motivation of individuals to achieve them. this knowledge has been developed into the increasingly co",NOTUTILIZE,NOTALGO
12365925,13245455,"and variable size, we employ a learning method that uses a rst-order representation for its learned rules. speci cally, the algorithm we have developed for this task is 29sbased on the foil algorithm which we used for page classi cation in section 5.2. we discuss our algorithm in more detail below. the problem representation we use for this relation learning tasks consists of the following backgr",UTILIZE,USE
4343548,4489357,rs into the rbi-em algorithm and the block-iterative interior point algorithm (ipa) 6 . such penalized-likelihood methods are often viewed in the context of maximum a posteriori (map) reconstruction . one motivation for investigating these penalized algorithms comes from the results of our work with the osem and rbi-em algorithms. based on detection-performance metrics drawn from localization roc,NOTUTILIZE,MENTION
4737888,4896502,"the conflict set is a higher priority transaction, then the validating transaction is restarted. it is sacrificed in an effort to help the higher priority transactions make their deadlines. opt-wait algorithm incorporates a priority wait mechanism. when a transaction reaches its validation phase, if its priority is not the highest among the conflicting transactions, it waits for the conflicting",NOTUTILIZE,MENTION
17171682,18331665,up from a sitting position while manipulating a box. this simulation includes an extension of above algorithms address closed-chain branching mechanisms with a computational complexity of o(nm m 3 ) ( ). figure 4: the image shows intermediate snapshots of a motion during a dynamic simulation involving contacts and impulses between an articulated body and its environment. the sliding motion and subs,NOTUTILIZE,NOTALGO
17493449,18665685,"33 . long-lived adaptive protocols that assume some huge upper bound n on the number of processes, but require the complexity of the algorithm to be a function of the concurrency have been studied in . a shared object system where the base objects can fail was first investigated by 31 , which studies the implementability of fault-tolerant objects from objects that can fail and it considers both r",NOTUTILIZE,MENTION
201775479,239349767,"fig. 1 a for various values of the reduced parameters r, l, and d (see results). the stochastic simulations were performed using an implementation of the next reaction method (gibson-bruck algorithm ). the integration time used for numerical estimation of moments was chosen to ensure a relative error of the average gene activity estimator smaller than 104, by monitoring the convergence of the es",UTILIZE,USE
202633090,240579700,y detection algorithmsswe employ three unsupervised learning (clustering)salgorithms to perform anomaly detection. we alsosstudy how to effectively combine results given bysthese algorithms.sk-means. this method aims to find k clustersssuch that the average distance between a data point andsa cluster center is minimized. we determine a dataspoint as an anomaly if it does not belong to any cluster,UTILIZE,USE
40372245,38900237,"nnot be directly applied to pfg because it may contain cycles. some nodes will always stay idle if we use the same message passing scheme. one solution is a procedure known as junction tree algorithm for exact inference. the junction tree is a tree-structured undirected graph generated from arbitrary triangulated dependency graph, and can be solved by sum-product. nevertheless, the computational",NOTUTILIZE,MENTION
58239764,57487744,"maindering (aho et al. 1974) is immediate.cc 13 (2004) complexity of computing determinants 93 bit complexity (n3.5 log a ) 1 o(1) and again can be speeded with subcubic time matrix multiplication ( ). a detailed description of this algorithm, with an early termination strategy in case the determinant is small (cf. br nnimann et al. 1999; emiris 1998), is presented by kaltofen (2002). (iii) by co",NOTUTILIZE,MENTION
