contextID,citationID,CLEAN_CITATION_CONTEXT,UTILIZE_LABELS,USAGE_LABELS
10051273,10670656,"log n and hn log n that converge almost surely to two different constants. this kind of behavior was already observed in the faithful case (cf. 20, 21 ). our results extends those of wyner and ziv and szpankowski 20, 21 to lossy transmission. we observe, however, that in the lossless case the natural data structure around which practical schemes could be built is a suffix tree (cf. 20, 21 )",UTILIZE,EXTEND
111348528,102364126,"aliency measure in order to detect robust features, we use an extended version of the saliency-based model of visual attention 19 . the saliency-based model of attention has been firstly reported in and gave rise to numerous soft and hardware implementations. for more details on the saliency-based attention model, the reader is referred to 21, 17 . the model of attention computes a saliency map",UTILIZE,EXTEND
6132948,6362558,"vocated in 9, 89 , and this is one of the post-processing options in chaco 53 . bui and jones have implemented a multilevel kernighan-lin algorithm to improve the quality of the partitions computed . the kernighan-lin algorithm has been used to partition the coarsest level and to refine initial partitions within multilevel partitioning algorithms, as described in section 6. gilbert and zmijewski",NOTUTILIZE,MENTION
107822406,99766719,"at multiple levels, to theory, pedagogy, methodology, and practice. in the realm of theory, we have extended previous discussions of tpck (hughes, 2005; keating evans, 2001; lundeberg et al., 2003; ; zhao, 2003) and put them on firmer ground. in the area of pedagogy, we provide additional support to the use of authentic design-based activities for 1046 teachers college record teaching technology",NOTUTILIZE,NOTALGO
2054784,2174238,"and euthanasia, quot; which could just as accurately be interpreted as youth in asia. quot; there are many comprehensive works on speech recognition that describe the history of the eld rj93 jh9 , and i refer the interested reader to these works for a history. the basic speech recognition algorithm is a classi cation algorithm. the system must decide which phoneme is being spoken at any point",NOTUTILIZE,MENTION
202783669,240797886,"riance. we scaled the features by dividing with the maximal feature value in the data followed by pca reducing the dimension to 10. for the locally linear projection, we run the neural gas algorithm ( ; cottrell et al., 2006) with 14 prototypes to get a division of the data space into receptive fields. pca was applied to every receptive field to define local transformationssk. together with the res",UTILIZE,USE
2060589,2180213,"rsion algorithm. finally, hoppe 11 investigates memory versus memoryless simplification. 3. simplification and smoothing algorithm our algorithm follows the same basic steps as the qem algorithm in . the major differences are, however, that we do not use triangle normals but rather vertex orientation estimates 2 and we incorporate new quadrics to handle different types of orientations. 3.1. ro",NOTUTILIZE,MENTION
12654776,13562888,"sonable compromise would be to enforce a block diagonal structure for the covariance matrix to capture the most important dependencies. to train the model we use the expectation maximization algorithm . this involves introducing hidden variables h indicating that training document d dc , is in cluster c, and v indicating that item i of document dil ,, d was generated at level l. additional details",UTILIZE,USE
972908,1041341,"10, 2, 11, 1 ), and the systems processed symbolic data off-line. more recently, several beat tracking systems have been developed which work with audio input (e.g. 12, 4 ) or run in real time (e.g. ) or both (e.g. 5, 6 ). compared with the real time audio beat tracking work of 5, 6 , our tempo tracking algorithm performs a simpler task, that of finding the tempo but not necessarily the beat. h",NOTUTILIZE,NOTALGO
18342689,19530981,"we recall the higher-order and reflexive extensions of the action calculi, and extend the correspondence between action calculi and sharing theories to these settings. higher-order action calculi in milner extends action calculi to higher-order action calculi, which are intended to be a unified framework for higher-order concurrent computation. there have been many proposed applications of the c",NOTUTILIZE,MENTION
202792717,240810698,"et al., 2007a, b). in our analysis, we use the land and ocean aot retrievals from the modis aqua instrument, valid at 550 nm, from the collection 5 modis algorithm products (remer et al., 2005, 2008; ). the retrievals are made at a nominal 10 km",UTILIZE,USE
26703373,27396239,"gh-performance, largescale parallel computers. our algorithm research has led to the software package called superlu 4, 7 , which is widely used in research and industry. previously, williams et al. performed extensive study and optimization of sparse matrix-vector multiply (spmv) on several leading cmp systems. in spmv, the matrix a needs to be read only once, hence the ratio of flops to memory",NOTUTILIZE,MENTION
16275548,17404854,"o known efficient algorithm to generate random d-regular graphs with uniform distribution when d is greater than o(n 1 3 ). if d o(n 1 3 ), mckay and wormald showed an efficient algorithm, given in , which uses switching to eliminate loops and double edges. when d is a constant, we can apply the configuration model, also called the pairing model, which was first given by bollob s 5 . but usin",NOTUTILIZE,NOTALGO
16401701,17536011,"ector to know exactly where the pointers are cannot be used. 13sscheme- c a portable scheme-to-c compiler to solve this problem, a new garbage collection algorithm called quot;mostly-copying quot; was devised . instead of requiring that the root set be a known set of cells containing pointers which define all accessible storage, the new algorithm only requires that the root set include pointers or values d",NOTUTILIZE,MENTION
56479535,55819524,"ions.) for each candidate homotopy class, these algorithms construct and search a relevant finite portion of the (infinite) universal cover of the input surface, using planar shortest-path algorithms . for directed surface graphs, however, this approach appears doomed from the start. two directed shortest paths can cross arbitrarily many times; similarly, a shortest non-separating directed cycle c",NOTUTILIZE,MENTION
71439036,70556269,"follows a certain interesting trend, which itself can be generated automatically by a particular application 26 . in order to address this issue, a multi-resolution indexing scheme has been proposed . this work addresses off-line time series databases, and does not consider how well the proposed scheme extends to a real-time streaming algorithm. continuous queries that run indefinitely, unless a",NOTUTILIZE,MENTION
56929607,56257162,"ot predict well when the aircraft makes an unanticipated change of flight mode such as making a maneuver, accelerating, etc 7, 8, 9, 10 . many adaptive state estimation algorithms have been proposed . the interacting multiple model (imm) algorithm 15, 16 runs two or more kalman filters that are matched to different modes of the system in parallel. it uses a weighted sum of the estimates from th",NOTUTILIZE,MENTION
19502717,20711466,"ethernet segments. for this reason, the tpvp algorithm was implemented, having proven that it reduces the maximum delay and its variation, and causing losses tolerated by most multimedia applications . the following scenario considered is shown in figure 4, where an atm network is introduced and the atm communication architecture, on linux is used 3 . this architecture has been modified introduci",UTILIZE,USE
202474230,240350797,"178sfeatures 8 4 13sclasses 28 3 3sf-measure 18 is often used to measure the accuracy ratesof the data clustering algorithms. in these experiments, thestraditional k-means 16 , fast global k-means ,sfkcucd 20 , and bi-level k-means algorithms will besused to classify the data sets abalute, iris, and wine,srespectively and f-measure will be applied to evaluate theirsperformances. tables i to iv",UTILIZE,USE
12716109,13629665,its inherent robustness against failures and dynamical changes compared to deterministic schemes that either need substantially more time 15 or can tolerate only a relatively small number of faults . our intention is to develop time efficient randomized broadcasting algorithms which have the following properties: they can successfully handle restricted communication failures in the network.,NOTUTILIZE,MENTION
118046673,107262402,"ph (v,x r e) has a special structure, when (v,x) is a minimal 3-vertex connected subgraph. in section 2.3 we introduce a minimal forward a-b extensions generation problem and recall an algorithm from which solves it, then in section 2.4 we reduce the problem of generating elements of yx,e to solving the minimal forward a-b extensions problem. finally, in section 2.5 we analyze the complexity of t",NOTUTILIZE,MENTION
85266040,82255368,"rors while the edges might have substantially larger errors). improved registration is possible, as in our imagine ii object recognition system, which uses an adapted iterated closest point algorithm to provide fine alignment using the raw range data after the feature-based alignment provides an initial coarse registration. but, there is still the problem of merging the features. this is a rather",NOTUTILIZE,MENTION
201966591,239621321,"nd using a constrained optimization problem similar to the discounted case, derive an expression for the gradient of the lagrangian. we then develop an actor-critic algorithm with compatible features to estimate the gradient and to optimize the policy parameters.",UTILIZE,USE
201763361,239333088,"data at the same time. as for students at school, the order in which tasks are solved may crucially affect the overall performance of the learner. we study this question by using pac-bayesian theory to prove a generalization bound that depends on the data representation and algorithm used to solve the tasks. the bound quantifies the effectiveness of the order in which tasks are solved and theref",UTILIZE,USE
4788854,4949677,"lts on 50 processors may well be attributed to this fact since several constraints are active at a known solution. the analysis for pattern search suggests several algorithmic options we could pursue , but the challenge is to do so in a way that works eectively within the asynchronous framework we have devised. future work will explore robust extensions for handling constraints. acknowledgments.",NOTUTILIZE,NOTALGO
6339815,6591547,ication of occlusions make it essential. therefore our flow volume has to be depicted with sparsely but evenly distributed streamlines. to accomplish this we use an algorithm based on an extension of method to three dimensions. v u dx dt a b figure 6: switching texture resolution using the u-coordinate u v a b figure 7: textures used for level switching jobard places the streamlines based on pure,UTILIZE,USE
14855697,15930053,"mptions on the given polynomial restricting in this way its applicability. a di erent algorithm, considered for a di erent problem but which can be applied for polynomial optimization can be found in . here the problem of solving a system of polynomial equations over r n is considered and an algorithm which returns a point inevery connected component ofthe solution set is given. for solving a poly",NOTUTILIZE,MENTION
48386382,48054036,"he theory. our work is based on the covariant phase-space formalism 3 - 7 and extends the results of a previous paper 8 . the covariant formalism has already been applied to the cghs-model in ref. although their results are valid for the case of a closed space only. moreover, for lagrangians vanishing on-shell, the noether",NOTUTILIZE,NOTALGO
40336060,38866219,"(fcis), allow to find interesting subsets of association rules, e.g. informative association rules. this is why several algorithms are needed for mining data depending on specific applications (major ) 94 . among useful patterns extracted from a database, frequent itemsets are usually thought to unfold regularities in the data, i.e. they are the witnesses of recurrent phenomena and they are con",NOTUTILIZE,MENTION
7577121,7926760,"mulated in a combined manner. 3 hybrid simulation within the devsim framework for hybrid modeling and simulation, we employ the zeigler s devs formalism 8 . as shown in figure 4, we extend devsim by adding two schemes. the first scheme is a model transformer which transforms devs models analytic models simulation models selective model transformation hybrid simulation engine results extended",UTILIZE,EXTEND
201854831,239459788,"ty of the current gop and the bit amount of the previous intra-frames. our proposed algorithm also uses the update rule based on the least squares estimation and the linear model using intra-ebh 2 , with low computational complexity. to determine the intra-qp, we define a linear model between the bit rate and the intra-ebh as follows: (8) where is the bit rate assigned to the intra-frame, is the",UTILIZE,USE
28437527,29153583,to generate a decision tree denoted by ct. the tree can be derived using various inducers. we concentrate on top-down univariate inducers which are considered the most popular decision tree inducers and include the well-known algorithms c4.5 34 . topdown inducers are greedy by nature and construct the decision tree in a top-down recursive manner (also known as divide and conquer). univariate me,NOTUTILIZE,MENTION
2335645,2470266,"h deadlines on a processor have been studied extensively in the literature. a typical example is the earliest deadline first (edf) algorithm, which has been widely used in many real-time systems (see for a survey). from a theoretical viewpoint, edf is optimal for scheduling underloaded systems, i.e., whenever there exists a schedule meeting the deadlines of all jobs released, edf can always do so",NOTUTILIZE,MENTION
202178693,239932740,"ection of the ows r could produce dierent solutions, and we can select the randomised sequence of ows that delivers the best resulting spare capacity requirement. we present the ssr algorithm from in algorithm 4. the notation for the ssr algorithm is summarised in table 4.1. 4.1.4 a working example of ssr we now present a working example of the ssr algorithm using the ve-node network from 20",UTILIZE,USE
16812172,17956474,"controller designs will occur sufficiently often to render the proposed procedure viable. the group at accurate automation corporation has developed an adaptive dynamic programming (incidentally, in , the acronym adp is used for adaptive dynamic programming, whereas in the present book adp is used for approximate dynamic programming) algorithm with a continuous time stability proof, 30 . the al",NOTUTILIZE,MENTION
65770088,64541300,"tion, or computational time demand. our reformulation of mar models follows and extends in some parts earlier work, such as principal oscillation pattern analysis 32, 31 , singular spectrum analysis and the dynamic linear model approach of west and coworkers 36, 37, 38 ; while the latter authors have explored bayesian extensions, here we prefer to focus on developing a general methodology for s",NOTUTILIZE,NOTALGO
17652382,18830511,"aper, we point out basic weaknesses of vest components. the weaknesses can be used to create inner collisions in the algorithm, in a way similar to local collisions in hash function of the sha family . as a consequence we are able to mount a chosen iv attack against vest stream cipher that recovers 53 bits of the keyed state. this information enables us to reduce by 53 bits the complexity of an ex",NOTUTILIZE,NOTALGO
10133436,10762804,"as a good speed-up ratio for test problems of sizes larger than 12. for smaller size problems, the parallel algorithm is not as efficient. details and additional computational results can be found in , 45 . regarding computational results for solving more general problems such as the quadratic zeroone programming problem (using distributed and shared memory machines) can be found in 59 and 60",NOTUTILIZE,MENTION
86614767,83373275,"outer. suppose a downstream bottleneck router rb has a link l in the mon state. rb monitors l s congestion status using a load-based 46 or a lossbased algorithm such as random early detection (red) . if rb detects congestion between time t and t1, it will stamp the l feedback into all packets traversing l from time t until two control intervals after t1: t1 2ilim, even if it has considered t",NOTUTILIZE,MENTION
15324934,16420334,"ng is to identify and remove these duplicates. in the business world, this problem is called the merge purge problem 27 28 . some researches have been done in the field of data cleansing 43 48 45 31 . we propose two different data cleansing algorithms in this chapter. the rest 33sof the chapter is organized as follows: in section 2, we present some related works; in section 3, we give a",NOTUTILIZE,MENTION
2018397,2136203,"ng to the outputs. 28 chapter 1. parallel efficient algorithms bibliography 1 a. aggarwal, a. chandra, and m. snir. communication complexity of pram s. theoretical computer science, 71:3--28, 1990. a. aho, j. hopcroft, and j. ullman. the design and analysis of computer algorithms. addison-wesley, 1974. 3 d. bailey. extra high-speed matrix multiplication on the cray-2. siam j. sci. sta. comput",NOTUTILIZE,NOTALGO
5776666,5980373,"figure 1 can greatly over-estimate the true fill-in. in addition, the cost of this algorithm is similar to the cost of actually performing the qr factorization, so row-merge tree have been developed . note that if a has nonzeros on the diagonal, then the first line of figure 1 can be replaced by: for i 1, . . . , m : s(u i ) c j a ij 0 . non-zeros on the diagonal can usually be achiev",NOTUTILIZE,MENTION
20468433,21686727,"by moving the center of projection. 5.1.1 graph mapping onto the hemisphere laying out the hierarchy tree is done with a simple 2d algorithm which is similar to the algorithm of reingold and tilford . thus, we determine (x, y)-coordinates for each node of the hierarchy within a cartesian coordinate system. the graph is then mapped onto the surface of a hemisphere. each point on a sphere can be de",NOTUTILIZE,MENTION
5369926,5551253,"ly on the parallel version of gamess-us, since this is designed to run efficiently on distributed memory machines using standard mpi message passing libraries (for more information, see windus et al. and the documentation in the gamess-us distribution 9a ). the parallel implementation of gaussian has been targeted mainly at shared memory machines such as the sgi power challenge, and can only be",NOTUTILIZE,NOTALGO
5553863,5745610,"t at 1s(dd log 5 2e 1)t s 2 d t f (1 4 1 2 d )lt c : 3.2.2 phase 2: broadcasting in ddns next, we need to perform broadcasting in each ddn. we will use the extended dominating node (edn) scheme designed for broadcasting in an all-port torus. in graph theory, a dominating set d of a graph g is a set of vertices in g such that every vertex in g is either in d or adjacent to at least one verte",UTILIZE,USE
65967436,64735356,uracy by gradually augmenting the originally small training set with the ex-amples downloaded from the web. our algorithm for semi-supervised learning is an adaptation of a method proposed elsewhere . it mainly considers the following steps: 1. build a weak classifier (cl) using a specified learning method (l) and the training set available (t). 2. classify the downloaded examples (e) using the c,UTILIZE,EXTEND
13739570,14741532,"peared in 11 . the implementation is available at 14 . related work. our navigation-driven architecture extends the virtual view mediator approach as used, e.g., in tsimmis, yat, garlic, and hermes . the idea of on-demand evaluation is related to pipelined plan execution in relational 8 and object-relational 12 databases where child operators proceed just as much asto be able to satisfy thei",UTILIZE,EXTEND
202806989,240831783,"y (cartoon)sapproximation of i, and v represents the texture of i.simage inpaintingsfor the bounded variation image u, we use a method which inpaint image based on boundarysreconstruction, inspired by .sthe algorithm consists of three main steps:s1)segment image and obtain information about edges and regions.s2)reconstruct image structure based on edges repaired.s3)restore image based regions guide",UTILIZE,USE
84914970,81966001,subset of its clauses. a minimal unsatisfiable subformula (mus) is a us such that removal of any of its clauses renders it satisfiable. the problem of finding a mus is an active area of research 1 . the basic algorithm used in modern mus extractors such as muser2 7 and haifamuc 3 is as follows. in the initial approximation stage the algorithm finds a not-necessarilyminimal us s with one or,NOTUTILIZE,NOTALGO
48906977,48760384,"uppressed by requiring wx 50 gev. final state hadrons are reconstructed from deposits in the lar calorimeter in combination with tracking information. following the so-called democratic procedure , the photon candidate and the reconstructed hadrons in each event are combined into massless jets using the kt algorithm 44 . the algorithm is used with a ptweighted recombination scheme and with th",NOTUTILIZE,MENTION
17054717,18208510,"s an interesting question. unfortunately, traditional decision tree algorithms, such as c4.5, have been observed to produce poor estimates of probabilities 14, 16 . according to provost and domingos , the decision tree representation, however, is not (inherently) doomed to produce poor probability estimates, and a part of the problem is that modern decision tree algorithms are biased against buil",NOTUTILIZE,MENTION
63465598,62582509,"ch and uses a particular tree called tag tree patterns. in 4 , authors propose an algorithm called find-freq-trees which also uses an approach based on a search by level as in the algorithm a-priori and extends the proposal in order to discover sub-structures in long sequences. finally in 15 , author proposes two algorithms treeminerh and treeminerv for the search for frequent trees in a forest",NOTUTILIZE,MENTION
202862460,240910366,"1 , and we used equally spaced time points as initial designs. the following global search algorithm was used to find the bayesian d-optimal designs for a given prior distribution of the parameters: take samples from the prior distribution of the parameters using arms. (2) compute the bayesian d-optimal allocation of q time points, using q p equidistant time points as initial design, where p is",UTILIZE,USE
85000415,82041881,a novel simplified linear predictor is developed for this purpose. the objective of the scheme and algorithm is the removal of high-density salt and pepper noise in images. k. aiswarya et al. (2010) described a new algorithm to remove high-density salt and pepper noise using modified sheer sorting method. the new algorithm has lower computation time when compared to other standard algorithms. re,NOTUTILIZE,MENTION
83577668,80823536,"efficient constraint propagation algorithms used in artificial intelligence 5, 31, 17, 30 . such algorithms have also been studied for the phylogenetic reconstruction problem. it was asked by dekker whether there exists a set of rules for inferring rooted triples from a set of rooted triples such that a rooted triple can be derived by these rules if and only if it is logically implied by . th",NOTUTILIZE,NOTALGO
8692075,9162610,"documents, respectively. for indexing purposes, documents and queries have been stopped using the stop-list used in our trec-6 experiments. 1 single terms have been stemmed with the lovins algorithm . two-word phrases are indexed if they satisfy the following conditions: ffl individual words of the phrase occur at least 30 times in collection, and ffl the phrase occurs at least 10 times in collec",NOTUTILIZE,MENTION
20622784,21827823,"del. a model that is closer to our has been studied by 1if function is not strictly decreasing, we extend the definition of in the natural, obvious way. milchtaich . in a so-called unweighted crowding (congestion) game, every player has a player-specific payoff function that depends on the strategy he plays and on the number of players that choose the same strat",NOTUTILIZE,NOTALGO
14536619,15589676,"em. for example, li et al. 17 proposed an incremental placement algorithm which maintains the stability of a placement for gate sizing and buffer insertion, while luo et al. 20 and brenner et al. addressed this problem by designing legalizers that seek to preserve performance metrics. timing-driven placement also suffers similar stability problems. while published papers typically report timi",NOTUTILIZE,MENTION
169161721,150501144,"ugh casr mrna was not detected in this study, casr mrna and or protein and calcimimetic responses were demonstrated in rat and human smc by others farzaneh-far et al., 2000; smajilovic et al., 2006; ; ivanovski et al., 2009; alam et al., 2009 . farzaneh-far et al. showed that calcium and casr agonists induced mgp promoter reporter expression in rat aorta smcs. however, casr transcripts were not d",NOTUTILIZE,NOTALGO
16443596,17581229,") in general, however, a complete system specification would include hundreds of such axiomatic (or factual) and rule-based specification. we adapt and extend (by introducing de morgan s laws) wang s theorem-proving algorithm to illustrate the proof procedure.sthe design of an expert system for domain knowledge engineering and decision making: a case study in the criminal justice system extended",UTILIZE,EXTEND
