contextID,citationID,clean__citation_context,UTILIZE_LABELS,USAGE_LABELS
175162947,155876310,"ively addressed in the static setting. our setting, however, is dynamic and focuses on content extraction from streams of html documents in real time. we use the url tree content extraction algorithm , which is specialized for content extraction from streams of html documents. the algorithm is based on the observation that html documents from the same source normally share a common template. the c",UTILIZE,USE
1356608,1441722,"l is due to the lack of samples in both sides of the symmetry plane. while such holes are relatively small and could have been filled during the meshing process, all surface reconstruction algorithms assume that the surfaces to be restored have been appropriately sampled and, therefore, do not handle local variations in sampling density. the occurrence of such variations manifests itself as small",NOTUTILIZE,MENTION
82927743,80266579,"the field through the presented survey. though the quality of many works, results improvement is always required. for this, some works are oriented to analysis and or refining of existing algorithms . these works focus on finding out weaknesses of developed methods and the way they can be strengthen. in 12 for instance, some means are proposed to strengthen the overall performance of the securi",NOTUTILIZE,MENTION
5226465,5411058,"portable, graphical applications. 1 origins and goals over the past ten years, scheme 1 has become the most widely used functional programming language in introductory courses in the united states . when rice university implemented an introductory course using scheme, the instructors noticed three significant problems with its popular implementations. first, although scheme s parenthesized pref",NOTUTILIZE,NOTALGO
24446200,25320601,"sums to determine the centers of clusters for the next iteration. 4.2 expectation maximization clustering the second data mining algorithm we have used is the expectation maximization (em) algorithm , which is also a very popular clustering algorithm. em is a distance-based based algorithm that assumes the data set can be modeled as a linear combination of multivariate normal distributions. the g",UTILIZE,USE
10435912,11105184,"o algorithms presented above and the overhead of our protocol in terms of number of required messages and execution time. while an optimal algorithm for computing the connectivity tree is np-complete , algorithm 1 is simple and can be performed in polynomial time at the ap. our choice of the algorithm is motivated by the limited execution time available at the ap as seen in section 3.3. we define",NOTUTILIZE,MENTION
201961092,239614370,"race has its own set of parameters in terms of theirsnumbers and their coefficients values.s6.3.2sarima modeling using automatic approachswe used the automatic sarima estimation algorithm proposed in , which implements asunified approach to specify the model parameters using a step-wise procedure. it also takessinto consideration the seasonality of the trace to allow representing seasonal data ser",UTILIZE,USE
70483454,69660202,"approximation algorithm for any 0. under the same assumption, the uniform variant admits no o(log 1 4 n)-approximation algorithm for any constant 0. for the single sink case, chuzhoy et al. showed that the problem cannot be 3approximated better than (log log n) unless np dtime(n log log log n ). the buy-at-bulk k-steiner tree problem generalizes the classic steiner tree, k-mst, and",NOTUTILIZE,MENTION
12339652,13217421,"tive errors for the methods. 5.3 topological impact in this section, we investigate the impact of different topologies on the performance of the algorithm. we use the isp maps collected by rocketfuel . since we also need igp weights, we use the maps for three north american networks (sprint, abovenet, and exodus), for which the igp weights have been estimated by rocketfuel. note that these are not",NOTUTILIZE,NOTALGO
15727932,16839712,"ian duality for constrained optimization problems. from a numerical point of view, we point out that the dual problem (dv p ) has a special structure which allows to apply the algorithm introduced in for generalized variational inequalities. in section 2, we present the duality scheme and the connections between the primal and the dual problems through the generalized kuhn-tucker conditions. in s",UTILIZE,USE
86152226,82982967,"we focused on 52 overlapping, nuclear families of four or more genotyped offspring, as simulations suggested that our algorithm is highly reliable for families of more than three children (for k 5) . based on the total 576 meioses, we constructed the distribution of the number of crossovers in (male or female) gametes, for each chromosome. for female transmissions of chromosome 21, we supplement",NOTUTILIZE,NOTALGO
59394286,58643993,"demographic and preference information in their profiles, and make connections to friends and acquaintances. networkaware recommender algorithms and systems that leverage this information (e.g., 5 , ) are a promising route to improving the utility of cf-based information filtering. however, most of this work poses recommendation in social media as still doing collaborative filtering for individua",NOTUTILIZE,MENTION
202352286,240178513,"esian algorithm reports pvalues for rejecting the null-hypothesis for each roi. to correct for multiple testing, we estimated the false discovery rate (fdr) using two approaches: the q-value approach and a permutation-based approach whereby sample labels were permuted a large number of times (.1000). ld block methylation and sliding windows analysis linkage disequilibrium blocks around genotyped",UTILIZE,USE
58354949,57609625,"teral filter as a weighted sum of gaussians in a high-dimension domain, and evaluating the resulting summation using the fgt. this algorithm has linear complexity in the image elements. fattal et al. provided an acceleration scheme for the application of the bilateral filter at multiple scales for detail enhancement purposes. this scheme reuses computations at the j-th scale level for computing t",NOTUTILIZE,MENTION
23047038,24030660,-bit node mark content-specific encoding process. our algorithm does not require the original un-watermarked object in order to perform mark detection. published research results of this work include . further work is required in improving conte,NOTUTILIZE,NOTALGO
56712870,56036390,"ork 6 . they are: 1- nsga-ii: nondominated sorting genetic algorithm, version 2 5 . 2- spea2: strength pareto evolutionary algorithm, version 2 20 . 3- ibea: indicator-based evolutionary algorithm . 23d. ranking criteria in meoas all three meoas used in this study are based on genetic algorithms. they share some basic qualities, such as: singlepoint crossover, bit-flip mutation, binary tournam",NOTUTILIZE,MENTION
1722107,1822536,"m for the logic and an algorithm for bound computations. we illustrate the usefulness of the proposed formalism by an example of a dynamic voltage-scaling algorithm for real-time, power-aware systems 4 . in the example, we use resources to model the power-consuming processing unit which can be used at dierent power levels with dierent execution speeds. furthermore, we model the probabilistic natur",NOTUTILIZE,NOTALGO
17171682,18331665,up from a sitting position while manipulating a box. this simulation includes an extension of above algorithms address closed-chain branching mechanisms with a computational complexity of o(nm m 3 ) ( ). figure 4: the image shows intermediate snapshots of a motion during a dynamic simulation involving contacts and impulses between an articulated body and its environment. the sliding motion and subs,NOTUTILIZE,NOTALGO
85821217,82706478,tructure while classifying data instances. here we extend the latent learning framework due to chang et al. (2010) from a batch setting to an online setting that uses passive-aggressive (pa) updates ( ). 3.1 pa learning the latent structure classifier training uses a decision function that searches for the best structure z i z(xi) for each training sentence xi with a space of possible structures,UTILIZE,EXTEND
20430493,21651474,nation condition. the testing procedure for termination takes into consideration the possibility that the snapshot may not be consistent. examples of algorithms based on this approach can be found in . termination detection algorithms can also be classified based on two other attributes: (1) whether the distributed computation starts from a single process or from multiple processes: diffusing comp,NOTUTILIZE,MENTION
57981328,57239988,"to move from a pseudo-basis to another.as for z-lattices, the choice of the pseudo-basis is of utmost importance. however, a key di erence is that no analogue of lll is known, as repeatedly noted in . there have been attempts 10, 22, 11 but the algorithms are either limited to certain elds or give no guaranteed bounds on the output size. while every ok-module is also a z-lattice and can thus be",NOTUTILIZE,NOTALGO
48219638,47812533,"x0. thus, as expected, we found in 12 . recover the counterterm v ts to summarize, we have proven that dr extended to fermions does not require additional counterterms on top of those described in . in addition, supersymmetry requires that no counterterms should be added at all to the classical sigma model action. 2.1 periodic boundary conditions we present here some comments on the case of maj",NOTUTILIZE,NOTALGO
44704739,43595134,"il n . (for simplicity, we assume that elements of all columns are drawn from the same domain, even though our approach trivially extends to a general case of different domains.) as pointed out in , the natural way to define a joint distribution of two (or more) columns is given by the frequencies of all combinations of coordinates. similarly, the distribution of each column is defined by the c",NOTUTILIZE,NOTALGO
40264400,38801109,"e chosen an edge detection algorithm described in section v-a for its speed and precision. as will be seen, our edge-detection algorithm consists of smoothing and finding directional derivatives 24 - . search for features in frame a: we refer to an 8 x 8 block as a feature if it contains more than 8 edge pixels. this is done in order to prevent false matches in the next step. to avoid aperture",NOTUTILIZE,NOTALGO
16752295,17894545,"ion 2 we present a relation algebraic model to capture the semantics of point-free programs including laziness and call-time choice. extending the presented approach by the transformation proposed in , we gain a semantics for first order functional logic languages in general. section 3.1 presents the semantics of the examples concerning call-time choice. 2 the relation algebraic model we present b",UTILIZE,EXTEND
3171888,3273373,hitt 26 which require less computational effort. qbd (quasi-birth-and-death) chains are special cases of m g 1 type markov chains and include the map ph 1 queue as a subcase. latouche and ramaswami have presented a logarithmic reduction algorithm for finding the matrix-geometric rate matrix for qbd chains with a quadratic convergence rate. the extension of the n g 1 queueing model to the case o,NOTUTILIZE,MENTION
75102848,73681071,"eatly, mimicking contact inhibition of growth. we model the attractive and repulsive interactions utilizing an extended hertz-model that yields an appropriate description of the cell-cell interaction . this model approximates cells as homogeneous, isotropic, elastic and adhesive spheres. once cells get into contact, cell-cell adhesion initially leads to an increase of the interaction area accompan",UTILIZE,EXTEND
66403107,65170736,"802.11 wireless local area networks. detection techniques similar to the bell labs space-time (blast) algorithm are effective to achieve the mimo high throughput in rich scattering environments 4 , . these mimo systems sequentially detect the data transmitted from each antenna and use the available decisions to decrease the mimo co-channel interference and improve the estimate quality. the optim",NOTUTILIZE,MENTION
14630947,15690332,"results indicate that this gp algorithm leads to an efficient and stable implementation for solving our problem. 6.3 ggp condensation to solve the ggp problem, we implement the algorithm described in . this algorithm takes advantage of the arithmetic-geometric mean inequality and transforms the original non-convex ggp to a sequence of convex gps. the ggp algorithm first introduces a new variable.",UTILIZE,USE
57374581,56686855,"let q q1, q2, . . . , qt denote the (unknown) state sequence that the system passed through, i.e., qt denotes the state of the system when observation ot is made. we extend the forward algorithm to compute t(i, m) pr(o1, o2, . . . , ot, qt si, mt m h), i.e., the joint probability that the first t observations yield o1, o2, . . . , ot and that qt is si and that mt is m, given the mod",UTILIZE,EXTEND
7904444,8287293,timate state without the interference of an external agency. systems that reach a legitimate state starting from any illegitimate state in a finite number of steps are called self-stabilizing systems . recently there has been a spurt of research in designing self-stabilizing distributed graph algorithms for many applications; a good survey of self-stabilizing algorithms can be found in 14 . 2.2 m,NOTUTILIZE,NOTALGO
10891144,11619464,"play the ball (e.g. in the direction of a player of the own team). furthermore the algorithm was greatly simplified yielding a further performance improvement. a detailed description can be found in . 4 collision detection in the case that obstacle avoidance fails or is impossible (e.g. when walking sideways or while the robot is turning), detecting collisions is advantageous. collision detection",NOTUTILIZE,MENTION
61714477,60999437,"e text, but recordedseparately under two mismatched conditions. the two training utterances are aligned in time using the dtw algorithm prior to their use in deriving the transformation (or mapping) . in the parallel model combination method 79, 80 , a statistical model (e.g., hmm) of the background noise is constructed during the training phase. during the testing phase, the clean hmms x are c",UTILIZE,USE
29479399,30151518,"multiple forms of the word to their base root or stem. in our work, we removed the stop words according to two lists: the smart list 2 and onix list 3 . we used the standard porter stemming algorithm to produce the roots of the words. finally, each blog post is represented by a vector of terms and their corresponding frequencies in the post. in the next stage, the bow is utilized to produce the t",UTILIZE,USE
12484963,13376446,that the algorithm by schmidt-schauss and smolka was actually a re-invention of the tableau algorithm for k known from modal logics 34 . the first dl systems employing tableau-based algorithms (kris and crack 45 ) demonstrated that (in spite of the high worst-case complexity of the underlying dl alcn ) such algorithms can be implemented in a practical way. the complexity barrier has been pushed,NOTUTILIZE,MENTION
38727130,37329910,"n)-time algorithm for the complete edge splitting-off problem in unweighted graphs. these edge splitting-off algorithms can be used directly to improve the running time of various graph algorithms . for instance, using theorem 2 in gabow s local edge-connectivity augmentation algorithm 12 in unweighted graphs, the running time can be improved from (rmax 2n3 ) to (rmax 2n2 ) time. similarly,",NOTUTILIZE,MENTION
18622383,19813091,"orel stock phtograph data set and the news videos from trecvid2004 corpus. the corel data set consists of images annotated with 3-5 keywords. we segment the images using the normalized cuts algorithm and represent the 8 largest regions in each image with 30 features including the region size, position, color, texture and shape features. regions are then clustered into blobs using k-means. the tre",UTILIZE,USE
22878740,23880046,"and the experimental results. 6.1 implementation the algorithm described in section 5 is implemented in a vectorizing compiler that exploits slp. this compiler was developed by larsen and amarasinghe based on the suif compiler infrastructure 10 and subsequently extended by shin et al. 24, 26, 25 . the boxes representing the component algorithms in figure 4 also closely match the individual pas",NOTUTILIZE,NOTALGO
24060871,24963690,ata and others 35 present several transformations on untimed petri nets that preserve the safety properties of the original net. we have extended these transformations and developed others for tpns . two example safe transformations are shown in figures 2 and 3. more information on safe transformations can be found in 29 . if our method is working on a net and finds a portion of the net that,NOTUTILIZE,MENTION
74135492,72924620,number of processing cycles it requires before it can be successfully transmitted. our goal is to provide performance guarantees for various buffer management algorithms. we use competitive analysis when evaluating performance guarantees provided by our online algorithms. an algorithm alg is said to be -competitive (for some 1) if for any arrival sequence the number of packets successfull,UTILIZE,USE
12151775,13010343,"s. we present experimental results for a range of typical list-processing algorithms, as well as for code fragments from a windows device driver. 1 introduction existing shape analysis engines (e.g., ) require a precondition to be supplied in order to run. simply put, this means that they cannot be used automatically without either knowing the execution context (which might be an entire operating",NOTUTILIZE,MENTION
3202041,3302078,"modules fig. 2 proposed structure of the kdd package. output generation modules 3o9 mining algorithms with two possible output generation forms. the first one is cn2 system, by clark and niblett (see ), is a symbolic data mining tool designed to efficiently induce simple and comprehensible rules in domains where noisy data may be present. the input of cn2 consists usually of a file describing the",UTILIZE,USE
29972554,30673408,of the ambiguous word and include co-occurrence features as well as the pos of words in this window. these features are represented as local and topical bow and pos. 5 report accuracy of 87 while report accuracy of 84 . 3 proposed method the kora- algorithm is an extension of the widely used kora-3 2 in geosciences. this algorithm was used for supervised classification problems. the algorit,NOTUTILIZE,MENTION
9703949,10290965,"me markov process this algorithm can be used to approximate its rainaeow intensity. the concept of approximating a process by a markov chain of turning points has proved to be successful, see rychlik , frendahl and rychlik 5 . the algorithm for computing the expected rainaeow matrix will be extended to cover also a switching process with a markov chain of turning points within each regime. this a",NOTUTILIZE,MENTION
9719747,10308312,"s nor to parallel processed algorithm parts. in other words, to solve the key equation by bma we only can involve one mac even though we had more than one available. employing the euclidean algorithm chieve better results. this recursive algorithm of infinite length mainly performs polynomial division of two polynomials with coefficients from a galois field. the initial polynomial is the quot;syn",NOTUTILIZE,MENTION
42206718,40582205,"victim system. 5.3 secure infrastructure protocol (sip) to support global cat construction across multiple domains, we propose a new sip by extending from the internet control message protocol (icmp) . the sip is designed as an integral part of the ipv4 standard in a layer closer to the physical network. to provide a securechen et al.: collaborative detection of ddos attacks over multiple network",NOTUTILIZE,NOTALGO
18948065,20145144,"to the nav display component for a given domain, (2) common middleware services tests that quantify the suitability of using different implementations of corba services, such as using real-time event service against the notification services 40 for delivering periodic trigger updates to the nav display component, and (3) domain-specific middleware tests that quantify the suitability of ccm impl",NOTUTILIZE,NOTALGO
123883065,111650934,"d 8. finally, we present our conclusions and comment on future research directions in section 9. 2. mathematical model in this section we extend the mathematical model for vascular tumour growth from to include an equation for a blood-borne therapeutic drug with different modes of action. we recall that tumour growth, via invasion of the surrounding host cells and angiogenesis, is a multi-dimensi",NOTUTILIZE,NOTALGO
43959882,42678549,"2.2 we extend the line of thought in 11 and derive a variational formula for p from which theorem 1.3.1 will follow immediately. 92.1 large deviations for the occupation time of the origin kipnis , building on techniques developed by arratia 1 , proved that the occupation time of the origin up to time t, tt t 0 (0,s)ds, (2.1.1) satisfies a strong law of large numbers and a central limit",NOTUTILIZE,MENTION
34516082,34454057,y of svmc here; we refer the reader to 96 . we point out that the svm technique has first been proposed for binary pattern classification problems and then extended to the general regression problem . here our primary focus is regression and we consider classification as a special case of regression. svmc can be formulated as the problem of minimizing: h(f) 1 l l i 1 yif(xi) 1 2c f 2k,NOTUTILIZE,NOTALGO
34209454,34187159,"is represented as a log-transformed tf-idf (termfrequency inverse document-frequency) vector, as is typically done in the information retrieval community for comparing similarity between documents . methods compared. we compare pic against two well-known methods the standard k-means algorithm and normalized cuts 16 . k-means is an iterative algorithm with the objective of finding k cluster cen",NOTUTILIZE,NOTALGO
13095476,14044257,"terature, e.g., by sadowsky 1993 and dupuis and wang 2004 , and we extend the results of the latter authors. we then examine the robustness properties for an hrms model studied by several authors ; goyal et al. 1992; heidelberger 1995; lewis and b",UTILIZE,USE
58082130,57323081,"ported in the literature that compared to dct, conventional dwt has less computational cost. but in the case of an image having large size, it is still a problem when dwt applied to a whole image 7 . the issue becomes important as many algorithms in recent times demanded real time implementation for which hardware realization becomes a viable alternative. lifting scheme is an effective method to",NOTUTILIZE,MENTION
201655546,239178947,"rdinates of the ideal helix with random orientation. in the last phase, the algorithm refines the initial structure by optimizing the pseudo-energy function using local moves and simulating annealing . the moves we adopt displace a single residue at a time, and keep its distances to its neighbours constant. the pseudo-energy function used here is shaped to encode the constraints represented by the",UTILIZE,USE
63306109,62424124,"). this theoretical progress enables us to match but still not to beat the bgy mba cost bound. to yield further progress, we extend the approach of pan p87 , pan p88 , abbott, bronstein and mulders , and eberly, giesbrecht and villard egv00 , which relates p-adic lifting to the computation of smith",UTILIZE,EXTEND
15963308,17080741,ming small multiplicative constant factors in runtime are important. it can be shown that the automatic mode achieves optimality within constant factors 2sby simulating say pram algorithms on the bsp . the term slack in the context of algorithm design refers to the ratio of the problem size over the processor number of the bsp machine. the question is whether the direct mode can be beneficial in c,NOTUTILIZE,MENTION
28369195,29081517,"one could start with the longer ones.7 related work the algorithm that compiles propositional constraints to a feature graph, which is used as an oracle in sect. 5.2, originates in our previous work . the present paper really completes the agenda of loc. cit. our work shares many goals with 24,11,22,20 . still it differs significantly in several respects. first, they mostly focus on algorithms f",NOTUTILIZE,MENTION
7357511,7699406,"produce a nice drawing. the first two phases of the sugiyama algorithm have been examined intensively. for phase one we refer to sug84 , gknv93 , or el91 . considering phase two, garey and johnson showed that the problem of minimizing the number of edge crossings is npcomplete for k-level graphs, even if k 2. according to eades et al. emw86 , the problem remains np-complete even if the orde",NOTUTILIZE,MENTION
18597194,19787146,"translates the trellis diagrams into closed analytic forms. the calderbank-mazo algorithm 50 , is applied to sttc to create the generator matrix of the code using simple linear algebra computations . using this generator matrix representation, an extensive computer search can be performed to find the best space-time trellis codes according to the rank determinant criteria 52 . it is noted, howe",NOTUTILIZE,MENTION
102748506,96043167,"infection (49). however, the biological plasticity of viruses may find ways to overcome this strategy and, thus, targeting a cellular factor may not guarantee complete protection from viral infection . hence, it is possible that the genetic variability of rna viruses may render targeting a single cellular factor ineffective. therefore, targeting several host cell factors involved in viral replicat",NOTUTILIZE,NOTALGO
