contextID,citationID,clean__citation_context,UTILIZE_LABELS,USAGE_LABELS
202976044,241075405,abel of node i in the cm ordering to (n-1-i).sthe efficiency of this algorithm depends on the starting cell. in this paper we will use thespseudo-peripheral cell approach to improve the rcm algorithm .spseudo-peripheral cell approachspseudo-peripheral cell approach to determine a starting cell for rcm is based on the idea ofsfinding a pair of cells which are at maximum,UTILIZE,EXTEND
5119765,5298124,"ace-domain technique produces non-numeric and graphic representations. shape analysis programs can also be dissected in other ways: global features vs. local features and single-scale vs. multi-scale . algorithms based on global features tend to be simple, but they may be unstable as a small change in the input shape may drastically alter the analysis output 22, 95 . the instability may be allevi",NOTUTILIZE,NOTALGO
1809173,1915365,"minates, a new seed is placed within the bundle and a new ber is advected. as de ned in equation 2, the advection method for the bers is accomplished using a simple fourth-order runge-kutta algorithm . to maintain the coherence of the bers, they must be advected in lock-step. this is important because as bers die o , they have to be re-seeded according to the distribution of the other bers in the",NOTUTILIZE,MENTION
21916850,23006472,"ng the factorization from scratch). finally, ininterior point methods, the variables are essentially rescaled so as to always remain inside the feasible region. an example is the loqo quot; algorithm of ( a vanderbei, 1994b), which is a primal-dual path following algorithm. this last method is likely to be useful for problems where the number of support vectors as a fraction of training sample size is",NOTUTILIZE,MENTION
80739045,78455505,"d in g t . then the contracted graph is partitioned, in a way that maintains the balance between the subgraph weights, and minimizes the cut cost. any of the well known graph partitoning algorithms , that decompose a connected graph into two connected subgraphs and satisfy the above criteria can be used. in the cases where the partitioner gives non-connected subgraphs, a connectivity check step",NOTUTILIZE,MENTION
80522539,78303774,"inear equations (assuming there is no noise in the data). in general, this problem is np-hard and the currently best-known approximation factor depends on the norm of the pseudo-inverse of the matrix . thus, some assumption on the distribution seems necessary. our evolution based on optimization algorithm (section 3.2) is essentially the greedy orthogonal matching pursuit algorithm of tropp 27 a",NOTUTILIZE,MENTION
46652908,45836484,"7 descriptor terms and 24.525 non-descriptor terms. we used both alternative and preferred terms in our experiments. the matching process performed by using strategy s1 (see implementation details in ) resulted in a total of 6687 mappings (2330 subclass, 3710 superclass and 647 disjoint relations) obtained by dynamically selecting, exploring and combining 226 online ontologies. fig. 1 shows the co",UTILIZE,USE
40776207,39304769,"del that consists of three elements: a resource model, a scheduling algorithm, and a workload model. in real-time scheduling, there has been a growing attention to a hierarchical scheduling framework that supports hierarchical resource sharing under different scheduling algorithms for different scheduling services. a hierarchical scheduling framework can be generally represented as a tree, or a h",NOTUTILIZE,MENTION
30736489,31443208,"obal correspondence. indeed, the demons algorithm requires having at least a partial overlap of the corresponding patient and atlas structures in order to match them. as proposed by cuisenaire et al. , the global transformation from the patient cortical surface to the atlas cortical surface is modeled by a linear combination of elementary scalar functions for each coordinate of . these functions a",NOTUTILIZE,MENTION
4508654,4659036,"he case of multiprocessors, where data and cache line sharing between processors represents an additional source of cache misses. we have developed several algorithms to enhance the cache performance . our techniques include (1) changing the instruction execution order to increase a program s locality of reference (this technique is commonly known as blocking), (2) intelligently assigning computat",NOTUTILIZE,MENTION
14749190,15816915,"for convenience, we use as both a relation and a set. in this paper we do not associate feature vectors with nodes, but the model we use has been extended to incorporate node features such as text ( ). g has an associated fixed v",UTILIZE,EXTEND
57120013,56455557,"rameterized constraints that can be invoked from within facts or other predicates. a snapshot transition model is transformed to an alloy model using the following transforming algorithm described in . each class that is part of the snapshot class in the class model is transformed to a signature in alloy. for example, class role in fig. 3 is transformed to a signature sig role . if a class has at",NOTUTILIZE,MENTION
79938731,77793352,"d all rights reserved 1175structure simulating conformational transitions using tee-rex 2007), incorporating the idea of essential dynamics (amadei et al., 1993) into the replica exchange framework ( ). tested extensively on two small molecular systems, the algorithm was shown to considerably enhance conformational sampling as compared to conventional md. here we employed tee-rex to facilitate the",NOTUTILIZE,MENTION
223037110,190621918,"ormed with linear activation functions.spreliminary backpropagation training of the several mlps was accomplishedsusing both ordinary gradient descent and the levenberg marquardt (lm) approxi-smation ; they produced similar results. however, for the actual mlp trainingsordinary gradient descent with momentum was chosen over the ordinarily faster lmsalgorithm due to implementation problems explaine",NOTUTILIZE,MENTION
12424320,13310612,"that of mining at the client s site, mining at the service provider s site and using both sites. we have modelled cost formulae and estimation algorithms to estimate the individual cost components in . the analysis of the cost matrices to determine the minimum response time reduces to the well-known generalised allocation problem (gap) 10 . we apply an approximate technique that has two phases to",UTILIZE,USE
41096942,39568706,"segmentation and clustering are performed hand-inhand in one loop. such a method was initially proposed by icsi for a bottom-up system 31 and has subsequently been adopted by many others 9 , 41 , , 84 86 . for topdown algorithms it was initially proposed by lia 14 as used in their latest system 16 . in all cases the different acoustic classes are represented using hmm gmm models. em trai",NOTUTILIZE,MENTION
6122876,6351389,"ics in order to handle dynamic semantics (condition (6), no dynamic rule). a first condition is to store all attributes outside the tree: we think of using a technique similar to the one presented in s quot;, or quot;cactus stacks quot;, to store non-temporary attributes. in this context, the current implementation does support successive assignments of a given attribute instance, thanks to an at",NOTUTILIZE,NOTALGO
14338371,15377974,"vity constitute a nontrivial network topology that is often encountered in grid systems. considering the significant importance of such systems and the fact that older studies have been based on them , we also included these structures in our ngce tool. we implemented a custom algorithm for the creation of random graphs with fixed connectivity. in our approach, the user chooses the number of nodes",UTILIZE,EXTEND
6835904,7144983,"they do not give a solution to atomic broadcast, we think that it will be straightforward to extend their solution of consensus to prefix agreement and thus to atomic broadcast. f. cristian et al. in propose an atomic broadcast algorithm, called on-demand atomic broadcast. their algorithm tolerates crash, omission and performance failures and has good performance with bursts of messages. their sy",NOTUTILIZE,MENTION
18898792,20093975,"elongs to the tracking area. as a result, we can reduce the number of working sensor nodes in each tracking area called the minimal contour for the energy efficiency. while the tracking algorithms in , 2 focus on the optimization of the reconfiguration of data collection tree for target tracking, this optimization for tree reconfiguration is out of scope in our paper. their tracking algorithms c",NOTUTILIZE,MENTION
78970653,76935769,"ridization networks from so-called agreement forests. such forests are frequently used to model reticulate evolution for when two rooted binary phylogenetic trees t and t are given, see for example . our analysis centers around a new algorithm, called temporalhybrid, which reconstructs a temporal hybridization network for t and t if one exists. two applications of the algorithm are given at th",NOTUTILIZE,MENTION
92309231,87994925,"iented product strategies that would have been unthinkable in the past. thus, the internet may drive marketing to a new paradigm, where differentiated products would be sold to differentiated markets . indeed, firms interested in marketing within a hypermedia computer-mediated environment probably should adopt a market orientation 8 . similarly, rayport and sviokla 17 argue that the virtual wor",NOTUTILIZE,NOTALGO
68575998,67208045,"t step to prove the strong cosmic censorship. for (q1), to construct solutions satisfying the initial condition of paradigm-a, we will use the fuchsian algorithm developed by kichenassamy and rendall . it is interpreted that the class of solutions we are looking for here is a subclass of asymptotically velocity-terms dominated (avtd) singular solutions since potential terms are neglected near the",UTILIZE,USE
34300373,34274166,"ign using florian s method. evolutions have been conducted using parameters presented in tab. 2. all experiments have been implemented using the open beagle c framework for evolutionary computation . the results of the first set of experiments, constructing the nolh with an evolutionay algorithm and without using florian s method (nolh-ea) are shown in tab. 3. tab. 4 presents the results of the",UTILIZE,USE
141335085,125210523,"p experiments are usually conducted at major accelerator sites where experimentalists perform detector design and construction, signal processing, data acquisition, and data analysis on a large scale . the size of a collaboration is 100 2000 physicists. hep requires a particularly well-developed e-science infrastructure due to its need for adequate computing facilities for the analysis of result",NOTUTILIZE,NOTALGO
48511642,48232164,"s are derived. it is shown that the mass terms destroy gauge independence of the s-matrix. in section v we consider massive theories with closed gauge algebra, thereby extending the solution given in . in section vi, restricting the foregoing result to the case m 0, we construct a solution of the quantum master equation in the sp(2)-approach which is not sp(2)-symmetric. ii. general structure of",NOTUTILIZE,NOTALGO
38309959,36969995,"atos 13 proposes a method using a combination of existing techniques. these are also the cases of shi 14 and yan 15 applied to some historical documents from the us library of congress. leydier works with colored document images and implements a serialization of the k-means algorithm. some of the above methods, apart from the basic binarization algorithm, have also used pre-processing or po",NOTUTILIZE,MENTION
79454442,77359809,"gmm, we use svms for classification. for svms to work on these gmms, we need a kernel function which measures the similarity between two gmms. we use kernelized versions of the bhattacharyya distance for this purpose. we begin the description of our approach by first presenting in section 2 the low-level segmentation based image representation we use, and the classification algorithm. then in sec",UTILIZE,USE
34536824,34476052,e problem of xing things that aren t broken. using the blame assignment algorithm: detecting dictionary problems: similar work involving the use of phoneonly decodings and reference forced alignments to detect dictionary pronunciation problems is under way. initial results indicate that the slightly more sophisticated approach to detecting transcript dictionary problems in the blame assignment al,NOTUTILIZE,MENTION
4951290,5116793,"ndition (2a), which requires the learner to converge to the target grammar under plausibly psychological assumptions. formal results (e.g. convergence) can be obtained for some classes of algorithms ( a). however, the language development condition still poses a problem (and in fact is rarely if ever discussed). since the state of the learner is identified with a particular hypothesis grammar in tr",NOTUTILIZE,MENTION
58885453,58164747,".;3 : - - - , ) -. figure 6: cumulative purecore size distribution for real-world graphs. as 8. the second is the barabasi-albert preferential attachment model , which follows a power law for the vertex degree distributions. we configure it such that each new vertex added by the generation algorithm creates 11 edges. the third model, generated with snap s r-",NOTUTILIZE,MENTION
9617097,10193883,"as it is not clear that this is possible for these problems. o(1) communication rounds would imply optimal linear work. such algorithms have been presented for various computational geometry problems graph problems studied in this paper have considerably less quot;internal structure quot; which could be exploited to obtain such solutions. note that, in practice, the number of processors is usuall",NOTUTILIZE,MENTION
202733847,240721858,"se it will not access. unfortunately, the binary constraint is a non-convex constraint. this problem can be relaxed into the following program which can also be solved using the algorithm proposed in : max p,a wp(1 p1)(1 p2) nx i 1 i(a p) 2(1 i(a p)) subject to pi pimax 1, i 0, . . . , n a i(ith i(p)) 1, i 1, . . . , n a i 1 i 1, . . . , n pr prmax 1, (29) where a is",UTILIZE,USE
8026738,8428792,"h a fixed fraction fi 0 is computed, and the next iterate x k 1 is determined by x k 1 x k d k , wheres1 is a constant which depends on the curvature of the objective function. as in his paper ergence result of 36 is restrictive in the sense that the step-length has to be small, namely o( quot;), to insure that the algorithm finds an quot;-optimal solution. gonzaga 13 studies a trust r",NOTUTILIZE,MENTION
45560836,44648634,"e top level of the main recursion, running in memory o(n). a related problem of tracing back the actual lis in every substring of a fixed size has been studied by albert et al. 6 and by chen et al. . in particular, work 20 gives an algorithm that runs in time proportional to the size of the output (i.e. the combined lengths of all the output subsequences). in the same work, the algorithm is al",NOTUTILIZE,MENTION
41725993,40117282,", we illustrate how case based decisions can be supported. finally, we draw our conclusions, point to issues of future work and mention some related work. this paper is an extended version of 2 and and presents the formal details of the generation, model transformation and evaluation. 2 laws, regulations, rules laws, regulations and rules determine the degree of freedom and possible boundaries",NOTUTILIZE,NOTALGO
6835595,7144654,"i.e. the same as the time for the forward-backward algorithm. in addition, with a simple extension to the algorithm, the most probable path itself can be found using the usual backtracking technique ( ). this is the method we use to obtain our multiple alignments: each sequence is aligned to the model by the viterbi algorithm, after which the mutual alignment of the sequences among themselves is th",UTILIZE,USE
409728,438496,"ogical studies, we need to continue to perform user studies that adapt or extend prior results on attention and memory from cognitive psychology to real-world computing and communication applications . we shall first describe several principles and methodologies at the heart of research on integrating models of attention into human-computer interaction and communications. then, we shall reviewsrep",NOTUTILIZE,NOTALGO
56120872,55504713,"that the diameter of a set of n points in the plane can be computed in time o(n log n). the algorithm of agarwal et ai. -1 can be modified to compute the diameter as well. recently, chazelle et al. presented an o(n )-time algorithm to compute the diameter of a set of points in 3. supowit 36 presented a data structure that could update the diameter of a set of n points in the plane in o(x",NOTUTILIZE,MENTION
1670398,1767024,"g problem was first posed by blum in 1994, little progress has been made. the first improvement over the trivial n k time bound of which we are aware is a recent algorithm due to a. kalai and mansour which runs in time roughly n k- k 1 4 ) . mansour 18 later improved this to n k- k 1 2 ) . (in recent work fischer et al. have studied the problem of testing k-juntas 8 , but the learning and te",NOTUTILIZE,MENTION
86165294,82994872,"asurements d(s,t),forsome range of s and t,givenct , rc and rn. 3. image formation in the presence of noise and clutter in this paper, we extend reconstruction techniques based on microlocal analysis to a statistical setting. such an approach is not only applicable to sar, but can also benefit sonar, ultrasound and geophysical imaging problems. the microlocal-analysis-based reconstruction method",UTILIZE,EXTEND
203032641,241156529,"by 10 ), thessuggestion algorithm provides the optimal recommendationsfor the change of the environment f (e.g. increase thestempo).swe use a mixture-of-experts based dynamic decision networks(ddn) for prediction and suggestion. we train ddn mixturessper patient, per session. the questions are answered through ansoptimality criterion based search on ddnsmodels trained in previous sessions.s5.6",UTILIZE,USE
63016443,62159368,"ministic constructive. for example, many cad algorithms are based on the forced directed paradigm or use dynamic programming. in the last three decades, deterministic iterative improvement algorithms were proposed for many problems and were able to produce the best results. in particular, deterministic iterative improvement algorithms are widely and frequently used for partitioning 2 . since the",NOTUTILIZE,MENTION
201715650,239263112,"rimental settings we implemented our algorithms in c and ran them on a pc with a 3ghz intel p4 processor, 1gb ram, and a 80gb hard drive running red hat linux enterprise 4. we used the cplex solver to solve the integer-programming models. for comparative purposes we also independently developed computer programs for two other algorithms, which we refer to as acn and ghru. we coded these algorit",UTILIZE,USE
31467360,32069586,"filter algorithm minimizes this error in a mean square sense. although we will not present the actual derivation of the other equations in the extended kalman filter algorithm brown and hwang, 1997; ; gelb, 1974 , we now describe the method. step 1. we begin with initial values of x 0 and p0 ( e (x0 t x 0 )(x0 x 0 ) ) where the superscript plus indicates that all measurements up",NOTUTILIZE,MENTION
26638326,27330681,"the rest of this section will be devoted to step 2 of the above procedure. recall that we are trying to solve the congruence y m (mod n) where n p p p. we apply the extended euclidean algorithm to n and m as follows. set n0 n, n1 m, and perform the euclid s algorithm for calculating gcd(n, m): n0 q1n1 n2 n1 q2n2 n3 . . nr 1 qrnr nr 1 nr qr 1nr 1 0 for each 2 i r 1",UTILIZE,EXTEND
861336,921265,this operation advects state stored in a texture using the gl offset texture 2d nv dependent texture addressing mode of the geforce 3 and 4. a description of this method of advection can be found in ( ). my 2d convection implementation (figure 4.14) requires 10 passes per iteration. i did not implemented a 3d convection simulation because geforce 3 and 4 do not have a 3d equivalent of the offset te,NOTUTILIZE,MENTION
112743501,103397401,"to temporal or resource constraints.s2.1.saspen plannersall of our architectures require a planner scheduler to turnsabstract science goals into concrete activity schedules, ands we extend the aspen ( ) applications framework to satisfy this requirement.susing aspens involved generating models of the lander and rovers in thesextended version of paper appearing in proceedings of the fourth internation",UTILIZE,EXTEND
18853639,20048262,"easons 2 . some of the other important ideas include a class of online clustering algorithms on data streams with performance guarantees 37 , and extensions to kmeans to work on binary data streams . the literature on online models for unsupervised text analysis and topic modeling is surprisingly small, which was part of the motivation for our present study. one of the earliest ideas was an exte",NOTUTILIZE,NOTALGO
202040712,239730604,"paper, in addition to the constructive and improving algorithms 1 and 2, we adopt asconstructive dispatching rule called etp v2 and an improving procedure called 3sw fromsthe study by valente et al. . these two methods are the most effective ones among thesseveral alternatives investigated in 18 . for the sake of brevity, we signify the constructives(12)salgorithm 1 and etp v2 by heu1 and heu4,",UTILIZE,USE
14090891,15114531,"ithms that are exposed as web services on remote machines. to achieve interoperability with standard grid environments, weka4ws has been developed by using the web services resource framework (wsrf ) as enabling technology. as wsrf implementations are recent, to the best of our knowledge, weka4ws is the first data mining framework exploiting wsrf grid services. the paper describes the design, imp",NOTUTILIZE,MENTION
23359428,24320004,"n amounts to finding the winner class and assigning it to the query point q. many researchers have done work to make variations of k-nn algorithms improve their performance for different applications or to combine it with other methods 57 . we will not go into detail on all these variants of k-nn methods, since it is not the focus of this work. 1.2 speedup nearest-neighbor nearest-neighbor searc",NOTUTILIZE,MENTION
9639142,10217601,"-phase method is not specific to any particular machine, file system, or architecture; it can be easily implemented by using any file-system interface, or by using portable interfaces, such as mpi-io , resulting in portable implementations. it can also be easily modified and tuned for any particular system",NOTUTILIZE,NOTALGO
33235925,33417573,". signet s are of three basic types: hashed, direct, and flag. a hashed signet consists of the prefix octet, some additional data, and a 20 bit hash of the data covered using the secure hash standard . since this hash algorithm is not invertible, the data, such as rrs, covered by a hashed signet must also be included in the reply to a query if it was requested. a direct signet includes all of the",NOTUTILIZE,MENTION
13505817,14491866,"stance between the feature vectors and the prototypes. this minimization problem is actually a reformulation of the problem of determining fuzzy -partitions that was solved by fuzzy -means algorithms , 6 . pal et al. 20 suggested that lvq can be performed through an unsupervised learning process using a competitive neural network whose weight vectors represent the prototypes. according to their",NOTUTILIZE,MENTION
40888566,39391098,"hm identifies blocks as moved, added, unchanged, removed, and modified. it also includes a name matching algorithm to capture renaming of program variables that is based on the work of neamtiu et al. . a similar approach is also applied by the ast comparison algorithm to capture renaming of methods. one of the challenges of matching java anonymous and inner classes is the absence of unique names.",NOTUTILIZE,MENTION
76194192,74558486,"elevant to remove p observations by finding the transition points as t decreases from 1 to 0. update the regularization parameter the computation of the regularization path is detailed in 66 and in for the elastic net. as done in the previous step of the algorithm (add p observations), it is necessary to define the non-regularized indices and set vai 0 for these indices to solve (8.4). the en",NOTUTILIZE,MENTION
25693657,26464785,scribe the relevance of our model to current experimental work on the role of cross-reactive stimulation for the maintenance of immunological memory. our model extends the previous studies and models . these studies suggested that the longevity of memory is determined by the balance between two processes: the constraint introduced by a homeostatically regulated population of memory cells and the n,UTILIZE,EXTEND
77503811,75685432,ases to 5 . 4.3 running time and convergence the experiments were run on a linux machine with 4 intel xeon cpus with 2.67ghz each. the code was implemented in java. kmeans 16 implementation of weka was used for initialization of the hk and wk matrices. figure 3 shows the execution time for cdo algorithm for different number of object types. note that the algorithm is linear in the number of obj,UTILIZE,USE
19499356,20707809,"low the last approach described, and consider a wsn with sensor nodes grouped in cooperative clusters. to efficiently group sensor nodes into clusters, any of the distributed clustering algorithms in 24 may be adopted. such clustering algorithms assume no centralized control and consider that every sensor node decides to join a cluster based only on local information. mostly, they are based on",NOTUTILIZE,MENTION
