contextID,citationID,clean__citation_context,UTILIZE_LABELS,USAGE_LABELS
202268085,240058384,"solution we propose in this paper. the solution relies on distributed stream processing middleware storm 5 for processing updates and maintaining the aggregate profile clusters in memory, and hbase for partial fault tolerance and for facilitating the migration. we use this system to study the impact of various workload, system and algorithmic parameters on the performance and accuracy of our re",UTILIZE,USE
8482504,8929208,"buses of cmos vlsi circuits can severely degrade both design reliability and performance. maximum current estimates are needed in the circuit to accurately determine the impact of these problems. in , a pattern-independent, linear time algorithm (imax) is described that is very effective in estimating the maximum current waveforms at various contact points in the circuit. in 1 , the algorithm wa",NOTUTILIZE,MENTION
61093890,60444367,represent another important development in statistics and machine learning. these models are widely used in the engineering and science communities. (see lauritzen 1996 for a systematic treatment and for a recent review from the algorithmic stand point and graphical model applications.) graphical models are effective in dealing with intricate dependencies and structures in the thousands or more v,NOTUTILIZE,NOTALGO
25991742,26733790,"rocedures such as forward or backward eliminations are employed due to their computational attractiveness. more complex procedures such as floating searches and genetic algorithms can also be applied . concerning the evaluation of the criterion, selection techniques are either univariate or multivariate. univariate approaches are simple and fast. multivariate approaches evaluate the relevance of f",NOTUTILIZE,MENTION
61431118,60745980,"tions. poor initial parameters may lead em to converge to a local minimum. em for motif finding was introduced by lawrence and reilly 28 and was an extension of the greedy algorithm of hertz et al. . it was primarily intended for searching motifs in related proteins, but the described method could also be applied to dna sequences. the basic models assumption is that each sequence contains exactl",NOTUTILIZE,MENTION
972908,1041341,"10, 2, 11, 1 ), and the systems processed symbolic data off-line. more recently, several beat tracking systems have been developed which work with audio input (e.g. 12, 4 ) or run in real time (e.g. ) or both (e.g. 5, 6 ). compared with the real time audio beat tracking work of 5, 6 , our tempo tracking algorithm performs a simpler task, that of finding the tempo but not necessarily the beat. h",NOTUTILIZE,NOTALGO
97584914,92103618,"on or inhibition, the effects spreading downward from complex stimuli toscomplex patterns of response like a cascade, leading to feelings of well-being: the ultimatesreward (cascade theory of reward) . although the neurotransmitter system is tooscomplex and still not completely understood, the main central reward areas in the human brain ssmeso-limbic system are summarized in figure 4a and 4b.sfun",NOTUTILIZE,NOTALGO
201687187,239221679,"ence of brucellosis. to account for the lack of information from neighbouring countries, we used a kernel smoothing algorithm that included a correction term for edge effects in the package spatstat ( ) in the statistical software r, version 2.9.1.sin parallel, areas of significantly greater risk of reporting serological evidence of brucellosis were identified by quantifying the amount of spatial c",UTILIZE,USE
87529357,84144011,"gn job allocated m computational cores, each evaluation of p k for node k with structure sk is performed using m cores for some m 1, ..., m selected to approximately minimize run time based on sk ). more implementation and infrastructure details are given in appendix a. 2.4 computational design studies our primary test scenario is rna sequence design at 37 c for target structures in the engine",NOTUTILIZE,NOTALGO
5970333,6189430,"disk. we used different synthetic databases that have been used as benchmark databases for many association rules algorithms (agrawal, imielinski, swami 1993; agrawal et al. 1996; brin et al. 1997; ; lin kedem 1998; lin dunham 1998; park, chen, yu 1995a; savasere, omiecinski, navathe 1995; zaki et al. 1997c). the dataset generation procedure is described in (agrawal et al. 1996), and the",UTILIZE,USE
68440898,67031631,"responding supercharge, which is found to agree with an expression derived earlier by a somewhat different method 14 . next, we investigate the extended n 4 supergravity 15 in a scalar reduction in which besides the gravity multiplet only the scalar multiplet is kept.3 the scalar fields have a mass m 2 2, which is within the breitenlohner-freedman range 17, 18 . the reduced theory has a",NOTUTILIZE,NOTALGO
42568522,40915202,our safmdl work differs from their work on not only providing mechanisms for validating feature model constraints but also extending feature model for semantic annotation of the features. peng et al developed an owl ontology for feature modeling which helps in validating and tailoring feature models. the proposed ontology categorized features according to underlying business model. in their appr,NOTUTILIZE,MENTION
8390289,8831889,"e manifolds. fig. 8 demonstrates that this property also holds for the 5-dof spatial manipulator considered in this example. the critical value manifolds are computed using the algorithm described in and are depicted in a solid line. the bold part of the critical value manifolds is the boundary of the ftws. as a second example, consider an 8-dof manipulator, with d-h parameters listed in table 4.",UTILIZE,USE
9363484,9910925,"ally in the context of parallel numerical algorithms 5, 7 . broadcasting is an essential operation in almost every parallel algorithm. multinode broadcasting arises naturally in iterative algorithms . total exchange is a communication pattern occurring for example in fft algorithms and is usually identified with matrix transposition. saad and schultz 12 , johnson and ho 8 and bertsekas et al",NOTUTILIZE,MENTION
12520191,13416190,"at evaluates in uence diagrams directly (shachter 1986), the two phase approachwas largely abandoned. none of the recent algorithms (cooper 1988, shachter and peot 1992, zhang at al. 1993a, zhang and b) needs a secondary representation. one reason for abandoning the two phase approach might be that people believe that direct evaluation is more e cient. however, all those algorithms that evaluate i",NOTUTILIZE,NOTALGO
27109577,27830743,"t scenario and our solution has been extended with a fully-fledged rule-based data mediation 6 . in order to address the sws challenge requirements, we base our solution on the specifications of wsmo , wsml 9 and wsmx 12 providing a conceptual framework, ontology language and architecture for semantic web services. the overall contribution of our work is to show: (1) how flat xml schema of roset",NOTUTILIZE,NOTALGO
83402266,80687299,"d substring problems have been proved to be np-hard 9 , 12 . this has motivated researchers to come up with heuristics without performance guarantee 15 , 19 , 20 , parameterized algorithms 11 , , 23 , 26 , and polynomial-time approximation algorithms 1 , 2 , 5 , 12 , 14 for these problems. we here design parameterized algorithms for them. z.-z. chen is with the department of mathem",NOTUTILIZE,MENTION
57591337,56879538,"ent with a semi-supervised approach using vision and prerecorded robot actions. we extend this idea to outdoor, remove any supervision, and predict vehicle actions in an on-line fashion. meyer et al. predicted traffic situations using hidden markov models (hmm). they however restricted their situations space by modeling states with respect to surrounding vehicles (distance, speed, bearing) and ma",NOTUTILIZE,NOTALGO
10229671,10870436,"ammars (without left-corner or unit production recursion) . the parser now uses the method described here to provide exact scfg prefix and next-word probabilities to a tightly-coupled speech decoder ( ). an essential idea in the probabilistic formulation of earley s algorithm is the collapsing of recursive predictions and unit completion chains, replacing both with lookups in precomputed matrices.",NOTUTILIZE,NOTALGO
12470243,13360791,"ch and its even more elaborate successors have been responsible for the fastest known algorithms for almost all classes of finite groups, including the symmetric groups 29 and their wreath products . these are among the classes of groups for which o g log c g fourier transform algorithms are known. other examples include the supersolvable groups 3 , while the algorithms for finite matrix gro",NOTUTILIZE,MENTION
26581086,27275952,"lo and mohar 11 to develop the first subquadratic algorithms for shortest non-contractible and non-separating cycles; their arguments are the foundation of all later improvements of their algorithm . our proof is quite similar to the argument of chambers et al. 13 that the shortest splitting cycle crosses any shortest path o(g b) times. however, our new proof is simpler, because the structur",NOTUTILIZE,MENTION
13778566,14783493,"ength 53 . watermarking. audio watermarking can be achieved by time-scale modification if it is used to change the length of the intervals between relevant points of the audio signal to embed data . this algorithm has been shown to be robust to common audio processing operations like mp3 compression, low pass filtering and time-scale modification. with an appropriate time-scale algorithm the wa",NOTUTILIZE,MENTION
42094840,40478759,"research makes finding a portable method of provenance collection vital. to that end, we are exploring hypervisor-based provenance collection. in this paper, we propose an approach for extending xen to transparently collect operating system-level provenance from its guest vms, without requiring any modifications to the guest kernel. although we expect our approach to be implementable across a va",UTILIZE,EXTEND
27656413,28368433,"ng text) classifier 10 as the classification algorithm in our passage detection approach. fact is a statistical text classifier that uses a feature selection algorithm called ambiguity measure (am) . formally, ambiguity measure (am) is defined as the probability that a term falls into a particular figure 1: block diagram of passage detection method figure 2: algorithm for passage detection input",NOTUTILIZE,MENTION
13243046,14204631,algorithms. we also discuss the relationship between the incorrectness of this algorithm and two extensions of the inverse compositional algorithm to fit (what we would classify as) 2.5d head models . 1s2 background: 2d image alignment algorithms 2.1 the lucas-kanade algorithm the goal of the lucas-kanade algorithm 13 is to align a 2d template,NOTUTILIZE,MENTION
