contextID,citationID,CLEAN_CITATION_CONTEXT,UTILIZE_LABELS,USAGE_LABELS
14697928,15761820,". general terms algorithms, documentation. keywords version control, program slicing, program slice encoding. 1. introduction software configuration management (scm) tools such as cvs 1 , subversion , and clearcase 3 are intensively used to perform version control and manage source code changes in modern software development projects. when submitting source code changes using these tools, best",NOTUTILIZE,NOTALGO
32535839,32892515,"orithms and storage approaches. flat files net-fli archive dataset raw gzip lzo lzo lzo olsh he 6.9 gb 2.5 gb 3.5 gb 3.7 gb 2.6 gb pn 37 gb 8.1 gb 13.2 gb 13.8 gb 8.2 gb which provides us the lzo1x-1 algorithm implementation used for compressing data columns. among the algorithms belonging to the lzo family, lzo1x-1 does not offer the best compression rates but it has instead been designed for ac",NOTUTILIZE,MENTION
9741374,10332508,"esh. in this section we review the key elements of the algorithm and comment on standard presentations thereof. the unfamiliar reader is referred to any standard parallel algorithms text (for example ) for more ce ce ce ce 8 1 1 8 2 4 6 7 5 3 2 4 3 7 5 6 figure 1: bitonic merge step detailed discussion. as is customary, we will assume that the number of items to be sorted is an exact power of two.",NOTUTILIZE,MENTION
201687224,239221860,".sthe final results in physical space are obtained by taking an inverse transform, usingsa fast fourier transform algorithm. in the work described here, we have used singleton s mixed radix algorithm . this algorithm is easily adapted to multidimensionalsproblems and does not require that the number of transform points be a power",UTILIZE,USE
75145126,73717123,"this is in part because the classical homology algorithms are based on smith diagonalization of integer matrices, which is super cubical. however, the recently developed reduction homology algorithms (with implementations available from 21 , see also 5, 4 ) offer speed comparable to the speed of the algorithms constructing connected components. moreover, these algorithms offer not only homology",NOTUTILIZE,MENTION
21583956,22701414,"ation algorithm that computes the solution up to any desired accuracy quot;) used the ellipsoid method 50 but faster interiorpoint methods were later given by alizadeh 5 , and nesterov and nemirovskii . the running time of these interior point algorithms is o(pm(m n3)l) where l is an input size parameter. in this chapter, the o notation is used to suppress polylog( mn quot; ) factors. in addition to",NOTUTILIZE,MENTION
1791787,1896333,"algorithms are close to convergence. it should be noted that the ii2 algorithm is the extended batch version of the family of equivariant adaptive algorithms proposed originally by cichocki et al. in for blind source separation. also, many existing algorithms for bss can be derived from the ii2 algorithm as explained in section 4. 5 3.1 practical considerations the iterative inversion algorithms",NOTUTILIZE,MENTION
22491597,23528080,s are scaled as a function of the number of processors. the system operates on loop-level parallelism. rivera et al. approach performance prediction and analysis for parallel iterative solver methods . a library of commonly used algorithms is developed and included with a toolset for visually analyzing the estimated performance of a program. the goals of performance characterization are largely or,NOTUTILIZE,MENTION
5366575,5547164,"the image registration; this improves the long-term robustness and precision of the ssd tracker considerably. a similar approach to estimating affine image motions and changes of view is proposed by . their approach employed an interesting analogy with parameterized optical flow estimation; however, their iterative algorithm is unsuitable for real-time operation. some of the ideas presented in th",NOTUTILIZE,MENTION
12854005,13777667,"page. many algorithms based on such assumptions are possible. there is no mathematical theory of adaptive thresholding, and as a consequence, there is also no standard or optimal method for doing it (p. 597). instead, there are several ad hoc methods, some of which are more popular than others. because the methods are ad hoc, it would be useful to be able to measure their performance. for this,",NOTUTILIZE,NOTALGO
22266498,23327359,"f this algorithm makes its execution time very slow and hence restricts its utilization. many solutions and approaches have been proposed to speedup the execution time of the dtw algorithm 1 , 13 , , 6 , 14 , 7 , 15 , 8 , 27 . in this paper, we show how grid computing 26 , 16 can further speedup the dtw algorithm. more specifically, we present experimental results of the data distributi",NOTUTILIZE,MENTION
8543335,8996450,"blocks are taken equal to the state outputs of the previous block. directed and semi-directed algorithms can be used only if all state variables have desired values, as is the case for narmax models . if some, but not all, state inputs do not have desired values, hybrid versions of the above algorithms can be used: those state inputs for which no desired values are available are taken equal to th",NOTUTILIZE,MENTION
202846305,240886219,"to the em algorithm should provide equivalent diffusion regularization. in this study, the penalty was implemented with the one-step-late method combined to the ordered subset acceleration technique . the penalty term was computed at each subiteration, and the normalization matrix p was computed for each subset as a simple backprojection over the subset of the measurement weights. in the case of",UTILIZE,USE
3250356,3350058,"ent interacts. 6. related work our work builds on numerous previous results in the area of highly available distributed systems and algorithms, including general replication techniques such as voting and the primary copy method 1, 27, 26 . our work is also related to gossip schemes 12, 10, 34 . in this section, we focus on the most closely related work, namely providing high availability for ap",NOTUTILIZE,MENTION
80558096,78328903,"ng pr configured to perform knearest neighbours (k-nn) classification using an implementation from weka 4 . whilst space constraints preclude full details of the implementation (which can be found in ) the algorithm is configured to use the following features for learning: pos tags both 1-gram and 2-gram, emoticons, hashtags and the language of the tweet. whilst it may seem strange that the words",NOTUTILIZE,MENTION
4300942,4445504,"ty of a connection at connection set up time, and thus all cells belonging to the same connection will have the same priority thereafter upon arrival. examples of sp algorithms include rate monotonic , a rate controlled version of rate monotonic called tcrm 9 , and rcsp 19 . algorithms in the sp class have the following properties: ffl only a fixed number of delay bounds can be provided. ffl all",NOTUTILIZE,MENTION
63306127,62424157,"nstead of choosing a random p), then some complications arise where det m is even, but for the average input matrix m, we handle the problem by extending the techniques of algorithms 5.1 and 5.3 (see ).can we optimize toeplitz hankel computations 261 6 initialization of hensel",UTILIZE,EXTEND
85392362,82361648,"d. fuzzy clustering algorithms fuzzy c-means and gustafson-kessel are described in detail. then section explains the concept of cluster validity measurement indexes. 2.1 fuzzy systems fuzzy logic 1 , , 5 is a form of many-valued logic 1444 p a g eneha jain, seema shukla international journal of engineering research and applications (ijera) issn: 2248-9622 www.ijera.com vol. 2, issue 3, may-j",NOTUTILIZE,MENTION
72925453,71919762,"n some important information about the relationship and interaction among nodes. to detect the underlying community structure in complex networks, many successful algorithms have been proposed so far . however, the community detection in networks is a nondeterministic polynomial (np) hard problem. most of current community detection algorithms based on greedy algorithms perform poorly on large com",NOTUTILIZE,MENTION
80890387,78585755,"s shortest path computation, hba , cell manager, openstreetmap, relational databases 1. introduction although many previous publications introduced fast algorithms for shortest-path (sp) computation ( ), most authors assume that the entire road network graph resides in main memory. additionally, many preprocessing algorithms, such as the alt 9 , highway hierarchies 30 or arcflags 21 require th",NOTUTILIZE,MENTION
10712079,11409286,"45 log 2(1 ) o(log log log n) such that there exists a binary search tree of height at most l whose cost is at most u . third, we use the dynamic programming algorithm due to itai 7 and wessner to obtain an optimal binary search tree of height h and its cost, for each h such that log 2 n h l. finally, from among the resulting trees whose costs are at most u , we choose one with smal",UTILIZE,USE
58810422,58093555,"manner, especially within the context of femtocells. however, performance optimization using swarm intelligence is carried in video communication over a mesh network in the decentralized environment . beside this, the number of proposed heuristic algorithms focuses only on centralized optimization. contrariwise, game theory algorithms have been investigated for decentralized cases. however, this",NOTUTILIZE,MENTION
82267243,79767111,"atly depends on the mobile power control function. while an open-loop power control can solve the near-far and shadowing problems 16 , 17 , the closedloop power control can combat multi path fading . the inherent problem in a closed-loop power control algorithm is feedback delay. the utility optimization and target sinr tracking can be achieved at the same time by using the adaptive algorithm th",NOTUTILIZE,NOTALGO
29412647,30078444,"in a target document that correspond to the layout model with the highest probability. for this purpose, first a whitespace cover of the page background is extracted using the algorithm described in . then, each layout component in the structural mixture model is considered as a candidate that can explain the layout of the target document. we are interested in finding the layout model that best e",UTILIZE,USE
58674830,57961512,"sisted in choosing temporary windows 20 in which the electrocardiogram ecg signal didn t exist. this method fails in case of highly electrocardiogram rhythm. the use of adaptive algorithms type lms requires an additional channel to record the ecg signal for use as a reference input for the noise canceller. in order to avoid these supplementary electrodes a widrow adaptable structure, was sugges",NOTUTILIZE,MENTION
14245875,15279684,"ression queries. our search scheme, being index-based, is indifferent to the compression and encryption algorithm used on the documents. extending the techniques in this paper, chang and mitzenmacher later developed two secure index constructions using pre-built dictionaries. their main contribution is an index blinding technique, enabling them to prove security in the stronger ind2-ckamodel. the",NOTUTILIZE,MENTION
78930234,76901133,"design can then be mapped to hardware automatically. a number of these platforms that are based on simulink 1 have been successful, targeting either fpga s, such as in system generator 2 from xilinx , or asic s 1,4 . fig. 1 shows such an algorithm description in both algebraic form and structural form that is implemented using system generator blocks. if 32-bit word-lengths are specified through",NOTUTILIZE,MENTION
1880163,1992660,"ry d that has the largest inner product with the signal is equivalent to the farthest neighbors problem, which faces the same quot;dimensionality bottleneck quot; as the nearest neighbors problem 14 . designing efficient algorithms for this problem is still an open challenge, in particular, since the local search heuristics rely on finding the optimal such oe s. this is a serious drawback because",NOTUTILIZE,NOTALGO
83830565,81043375,"nel span sparsification method described in 22 to reduce the computational complexity and make the algorithm tractable. this method can be elegantly incorporated into the on-line gp-sarsa algorithm . to apply gp policy optimisation, a kernel function must be defined on both the summary state space c and the summary action space a. since the summary space typically consists of both continuous and",NOTUTILIZE,MENTION
202315566,240126827,"ly on the perception, loops are identified andsclosed with the help of the localization techniques. in order tosaccomplish consistency of the topological map, a methodssimilar to the one described in is used. in this work thesmethod employed is a non-explicit loop closing algorithm.sour loop closing method is based on the localizer (i.e. thespomdp). the robot is moving through the environment and",UTILIZE,USE
15702680,16814449,"m simulated annealing is a very popular approach for module placement due to its high quality solutions and flexibility in handling various constraints. we extend the existing 2d sequence pair scheme to represent our 3d module placement solutions. simulated annealing procedure starts with an initial multi-layer placement along with its cost in terms of area, wirelength, and maximum temperature. w",UTILIZE,EXTEND
16632125,17772804,"nsiderable interest, during the past decade, in an alternative class of algebraic preconditioning techniques called sparse approximate inverses. these methods were first introduced in the early 1970s , but it is only in the past few years that efficient algorithms and implementations have become available. some of these techniques will be reviewed in section 5. the lack of scalability, on the othe",NOTUTILIZE,MENTION
74219183,72992471,"strategies there exist several multipath, full-message strategies in which each node on the path sends a full message to several neighbors that are best choices for all possible destination positions . there is significant communication overhead, and lack of guaranteed delivery can make this approach inferior to even a simple flooding algorithm. clever flooding algorithms may use about half of the",NOTUTILIZE,MENTION
25797009,26557018,"wledge of the run-time application behavior, it is possible to use them. these two strategies for assigning priorities to tasks have been traditionally used in a variety of task scheduling algorithms . the two employed processor mapping schemes are: round robin (rr): circular processor selection, which is the default for the mlca. best-fit (bf) selection proposed by zhang et al. 46 : among th",NOTUTILIZE,MENTION
68944072,67688912,"gth, and in addition ik k s and jk k s for every k 1, . . .,m. b consists of the elements in f, whose normal form does not contain any of the generators x0, x1, . . .,xs (or their inverses) . in both cases, the conditions are straightforward to check. following is an algorithm for solving problem 1. algorithm 2 (alternative solution search). (1) execute algorithm 1 (with any of the intro",NOTUTILIZE,MENTION
1847279,1957040,"cenario). fourth, a distributed klt is presented in the shape of an iterative algorithm. some evidence of the convergence of this algorithm is presented. a more detailed analysis will be presented in . this distributed transform has potential applications in sensor networks, distributed databases, surveillance systems and hyper-spectral imagery. a proof of theorem 4 proof of theorem 4. for the con",NOTUTILIZE,MENTION
72259608,71313346,-degree was calculated by the number of enzymes using the products of the considered enzyme as substrates. the between-ness was calculated by the breathfirst tree based algorithm as following steps . (a) the calculation was initialized by d,NOTUTILIZE,MENTION
5312413,5489440,"se we extend a technique called trace-driven simulation. this is a simulation technique that has been applied extensively for memory system simulation in the field of general-purpose processor design . the workload of an application is captured in one or more traces. a trace contains symbols, called trace entries, that represent the computation and communication operations performed by an applicat",NOTUTILIZE,NOTALGO
97571705,92092826,"s paper and is the subject of ongoing work 10 . our work affirms and extends basic insights of many pioneers in software engineering: the software families and abstract interface concepts of parnas , parametrized types of goguen 281, hierarchical system designs of habermann 34 , object-orientation of goldberg 28 , and the frameworks concept of deutsch 25 . acm transactions on software engmee",NOTUTILIZE,NOTALGO
46245726,45485270,"that if one could efficiently solve the hsp for the symmetric group (or for the wreath product group, sn s2) then one would immediately have an efficient algorithm for the graph isomorphism problem . there is no known efficient algorithm for the graph isomorphism problem despite a considerable amount of effort to solve this problem classically 35 . adding considerably to the interest in the non-",NOTUTILIZE,NOTALGO
11828522,12656295,"cted backjumping 6 , in which pruning of the search tree is achieved through look-back techniques. this provided a great improvement in both run-time and branching rate. learning was then introduced . this had much less impact than occurred in sat. while improvements were seen on some problems, the algorithms actually performed worse on others. recently, it has been shown that solution learning f",NOTUTILIZE,MENTION
11292104,12063796,"he ring structures that are created in graph generation. these rings are too wide and more hops are needed in order to correctly detect if a link or node is critical. in an upcoming companion article , we applied, with suitable modifications and additional criteria, the proposed localized algorithms for detection of critical links and nodes for service replication. in this scenario, a particular r",UTILIZE,USE
32369887,32765441,"ippage. the force-based hydraulic erosion algorithm is based on the forces that are caused by the running water on the terrain surface. this algorithm was first introduced by cmf98 , then revised by , and recently implemented on the gpu in mdh07 . we extend this algorithm by an unconditionally stable solution with the second-order accuracy called semi-lagrangian maccormack method sfk 07 . thi",NOTUTILIZE,MENTION
6808824,7114945,"true image. the main disadvantage is that the em algorithm mightconverge to a local optima of the cost function. 2samultichannel extension of the algorithm for multispectral images has been proposed . it has been shown to result in a more reliable restoration. the most probable applications for the algorithm is photography, medical imaging and multispectral image processing. 3 other recent develo",NOTUTILIZE,MENTION
37052885,36125950,"and proceeds to the next task adaptation period. to assign deadlines to subtasks and messages of a task from the end-to-end task deadline, drba uses the equal flexibility (eqf) algorithm presented in . now, to determine the number of replicas that are needed for a subtask, drba at a host first analyzes the subtask response time on the host and determines the largest possible workload that the subt",NOTUTILIZE,MENTION
68613095,67256620,". the history of this problem and related works are summarized in 8 and will not be repeated here. our reasons to extend this work to the lattice case are: (i) to show that the methods initiated in , and later developed in 8, 9 for longer time scales, can be applied to a lattice setting as well; (ii) to make a connection with the extended state conjecture of the anderson model. 2anderson (de)",NOTUTILIZE,NOTALGO
66368321,65135148,"log with traditional bayesian network approaches. by eliminating variables in p-log modules we may reduce the space and time necessary to make inference in p-log, in contrast with previous algorithms which require always enumeration of the full possible worlds (which are exponential on the number of random variables) and repeat calculations. as expected, it turns out that the general case of exac",NOTUTILIZE,MENTION
30273253,30997093,"the smallest bit rate such that ds(rs) sec, where ds(rs) represents the minimum preroll delay under streaming rate rs. for each video stream s, ds(rs) can be computed using the algorithm given in as we show in figure 2.9. for example, rvbr3 sets rs at the minimal streaming rate so that the preroll delay incurred by the rate regulation is less than 3 sec. once the rs is determined, t and bs c",NOTUTILIZE,MENTION
19502717,20711466,"ethernet segments. for this reason, the tpvp algorithm was implemented, having proven that it reduces the maximum delay and its variation, and causing losses tolerated by most multimedia applications . the following scenario considered is shown in figure 4, where an atm network is introduced and the atm communication architecture, on linux is used 3 . this architecture has been modified introduci",UTILIZE,USE
16835877,17980216,"om the lowest wavelet level and moves through the higher wavelet levels. all the coding processes are finished during a single backward coding pass, which makes the algorithm extremely efficient 6 , . figure 3.1: wavelet tree structure in the bcwt algorithm. the bcwt algorithm uses the same offspring and descendant notations as the spiht algorithm 9 . if ci,j represents a wavelet coefficient at",NOTUTILIZE,MENTION
31907859,32414290,"h algorithms and can also improve the success rate in finding solutions for the local search algorithms. keywords: combinatorial optimisation, search algorithms 11. introduction guided local search ( ) has been applied to a number of real life problems, including bt s workforce scheduling problem (tsang voudouris 1997), the travelling salesman problem (voudouris tsang 1998), the vehicle routin",NOTUTILIZE,MENTION
202519532,240416293,"ic signal. bottom the two mixtures. following the mixing of the temperature and volcanic signal, ica was applied to the mixtures to separate out the original signals. we used the fastica algorithm ( - hyv",UTILIZE,USE
1938650,2054672,"conventional v-blast. it has been shown that different detection stages have different diversity orders in the vblast detection algorithm based on the nulling and successive interference cancellation . a diversity order for an earlier detection stage is less than that for a later one 2 , 4 , 9 . therefore, improving the performance or compensating for low diversity orders at early detection sta",NOTUTILIZE,MENTION
22519240,23553237,"l solution provides a lower bound on the optimum maximum relative congestion. due to the computational expense of global routing, some have explored the use of probability-based congestion prediction in an effort to help placement algorithms anticipate which regions of the chip will present the most difficult areas for routability. although recent work has cast doubt on the usefulness of this tec",NOTUTILIZE,MENTION
3059300,3174779,"ottleneck in the computation. until recently most research, both theoretical and practical, have concentrated on finding small obdd-representations of boolean functions appearing in specific problems , or on finding alternative succinct representations while maintaining the e cient manipulation algorithms 10 . very recently however, researchers have begun to consider i o-issues arising when the o",NOTUTILIZE,MENTION
25019702,25847742,"0 the qr algorithm is applied to the upper left 2n 2n of the pvl form (35). in kressner, 2003b it was shown that this is equivalent to applying the periodic qr algorithm bojanczyk et al., 1992; ; van loan, 1975 to the matrix product r22 r11, which constructs orthogonal matrices q1 and q2 so that qt 1 r22q2 is reduced to real schur form while qt 2 r11q1 stays upper triangular. the periodi",NOTUTILIZE,MENTION
23385498,24343781,"raph requires to explicitly deal with massive graphs stored in secondary (slow) memory. a survey of algorithms for (general) graph stored in secondary memory can be found in the work of chiang et al. ; we distinguish between semi-external algorithms, that use a small constant amount of memory for each node of the graph, therefore limiting the size of the input, and the pure external ones, that i",NOTUTILIZE,MENTION
41640343,40035579,"ar segment class. to address this idea, we extend the model by employing a probit stick-breaking process (psbp), with this a generalization of the dirichlet process (dp) stick-breaking representation . related clustering techniques have proven successful in image processing 27 . the model clusters the image patches, with each cluster corresponding to a segment type; the psbp encourages proximate",NOTUTILIZE,MENTION
129978457,116269978,"ged attraction which, together with the screened electrostatic repulsion, yields a minimum in the pair potential roughly 0.5 kbt deep at a separation of about 3 diameters. neu 45 and sader and chan (nsc) recently proved that these observations cannot be explained by mean-field theory. the nsc proof holds for constant potential boundary conditions, at least some variants of constant charge bound",NOTUTILIZE,NOTALGO
84217557,81375379,"language to implement and evaluate the performance of dijkstra s shortest route algorithm. comparative analysis of all the algorithms that solve the shortest route problem were made by the authors in , while in 13 , the authors surveyed the various applications of shortest path routing, which include, transportation gis, network analysis, operations research, artificial intelligence and robotics.",NOTUTILIZE,MENTION
