contextID,citationID,CLEAN_CITATION_CONTEXT,UTILIZE_LABELS,USAGE_LABELS
96713464,91414296,ce we do not assume any specific application. the greedy algorithm used in 16 is similar to algorithm 1. our work is also related to document retrieving and ranking problem in information retrieval . the formulation of mms is a generalization of maximal marginal rele 20s40s60s80s100s120s140s160s180s200s100 80 60 40 20 10 r un ni ngst im e(s ec ) top-k mmssmmsb figure 8: computation time w.r.t to,NOTUTILIZE,NOTALGO
2503831,2633016,"us work on association mining has utilized the traditional horizontal transactional database format. however, a number of vertical mining algorithms have been proposed recently for association mining (as well as other mining tasks like classification 19 ). in a vertical database each item is associated with its corresponding tidset, the set of all transactions (or tids) where it appears. mining",NOTUTILIZE,MENTION
42160473,40539687,"ll balanced (technically, the aim is to minimize the largest sum of the elements of any interval). several algorithms and heuristics have been proposed to solve this load-balancing problem, including . we refer the reader to the survey paper by pinar and aykanat 102 for a detailed overview and comparison of the literature. it amounts to load-balance n computations whose ordering must be preserve",NOTUTILIZE,MENTION
22380978,23428428,"performs at least as well as a with respect to the relative worst order ratio (for minimization problems). it is obvious that the relative worst order ratio is reflexive and transitivity is shown in . hence, we have the following lemma. lemma 3 the relation wr defines a preorder on the set of on-line algorithms for an on-line problem. it follows that it is not necessary to compare a new on-line",NOTUTILIZE,NOTALGO
6679728,6977510,"for this bias by assigning weights to individual sequences, usually based upon the level of sequence similarity. such schemes may signi cantly improve the performance of homology detection algorithms ; however, heniko and heniko 21 2 procedure average score (query set, database) for i 1to size(database) target database i sum of scores 0.0 for j 1to size(query set) query query set j (evalue,",NOTUTILIZE,MENTION
4493285,4644273,"weighted roundrobins(wrr) algorithm 9 , as the basic dispatching policy. it is widely adopted in real web clusters as it has been demonstrated to be the best compromise between simplicity and ecacy . wrr is a dynamic algorithm based on server information but it does not use any content information, thus avoiding the overhead of a layer-7 switch at least for dispatching goals. in this paper, we w",NOTUTILIZE,MENTION
10994052,11739392,"antages over the others in particular situations, but in general it may be said that from a practical point of view all are equivalent 6, 7 . in this paper, we have preferred to use the algorithm in , for the following reasons: it does not impose restrictions on the sequence to be analyzed. it provides a dense estimation of the optical flow. it is designed to respect discontinuities in the",UTILIZE,USE
13730529,14731888,"curately predicted. these algorithms should be replaced with more distributed versions, instead. 6. related work research has been done on automatic parallelization 1 13 and speculation 4 17 18 26 at various universities. however, this research primarily focuses on developing methods to automatically parallelize applications. we instead investigate two other areas. first, we use manual par",NOTUTILIZE,MENTION
71448966,70565927,"there exists 0 such that for any 0 the mstm algorithm converges to a fixed unique solution w when initial feature weights w (0) are nonnegative. the proof is following a similar schema as in . details are omitted for lack of space. the complexity of the mstm algorithm is o(tn 2 m) where t is the total number of iterations, n is the number of instances, and m is the number of features. our",NOTUTILIZE,NOTALGO
44151856,42917364,"l. this allows one to implement memory operations in these films at room temperature using a coulomb blockade effect. different implementations of these ideas have been discussed, for example, in 1 - . to satisfy both above mentioned conditions, the boundaries between the nanocrystalline grains in these films play an important role. for example, one of the most important characteristics of the ele",NOTUTILIZE,NOTALGO
492859,525888,"35 later used this algorithm to derive a polynomial time approximation scheme for the latter problem. thus our results extend indyk s result to the case of arbitrarysxed k. bartal, charikar, and raz gave a polynomial time approximation algorithm with polylogarithmic performance guarantees for metric min-sum all-pairs k-clustering where k is arbitrary (i.e., part of the input). as mentioned above",NOTUTILIZE,NOTALGO
273566,256096,"image brightness and i x , i y and i t are the partial derivatives of i with respect to x, y and t, and v v x ; v y is the image velocity. we use a standard local weighted least square algorithm to calculate values for v based on minimizing e x w i (i x v x i y v y i t ) 2 for the pixels in the current window w i . we do not apply an affine flow assumption because of the increased comp",UTILIZE,USE
28667840,29368024,"tion of minimum spanning trees 17, 18 . in the case of np-hard problems, results have been obtained for a scheduling problem on two machines 26 and the multiobjective minimum spanning tree problem . especially, in the case of well-known np-hard combinatorial optimization problems often the initial solution is computed by an approximation algorithm and later on improved by a heuristic method. no",NOTUTILIZE,MENTION
20014630,21235019,".2. real data using gal4 as an example, we know from section 2 that once we remove several sequences containing multiple binding sites, both meme and alignace cannot find the motif pattern cggn11ccg ( ; bram et al., 1986; magdolen et al., 1990). in this section, we test whether our algorithm can discover the correct pattern in a similar situation. from the mircoarray experiment (data from ren et al",NOTUTILIZE,NOTALGO
19142323,20341203,of automata in the system and every (n) (log 2 (n)). (by a standard algorithm o(n 3 2 ) messages are sufficient.) 3stheorem 5 can be derived from the results on two-party communication complexity through simulating a system of finite automata in a two-party communication model (see the forthcoming full version of the paper). here we give a relatively simple and direct proof based on kolmogoro,NOTUTILIZE,MENTION
7217558,7551171,a and the first eight of these are shown in figure 15. 6.2. learned deformations we learn a domain-specific model for the deformation component of the appearance change in much the same way using pca . we first compute image motion for each training sequence using the brightness constancy assumption and a robust optical flow algorithm 8 . the training set consists of a set of p optical flow field,UTILIZE,USE
17070004,18224397,"of sprecher and drexl 27 . we do so for two reasons: first, the authors have suggested to employ their exact algorithm as a heuristic by imposing a time limit. second, as shown by hartmann and drexl , their approach is the currently most efficient exact method for solving the mrcpsp. for the tests, we have used the reimplementation of the branch-and-bound approach that was done for the study of h",NOTUTILIZE,MENTION
14589877,15647644,"straints c(s) such that c(s) p q if and only if d sd p q. inthis case the extraction algorithm produces the same result for u-index(s) as for index(s). in a second part we use the 1-index . we prove that, for any set s of data, u-index(s) and 1-index(s) model an inclusion constraint if and only if this constraint is satisfied by any datum of s. moreover, we prove that 1-index(s) is alw",UTILIZE,USE
13539673,14528207,"ontext) is considered as a data block, we can view the multi-context fpga as a general cache and apply standard cache algorithms. there is an existing optimal replacement algorithm, called the belady algorithm for the multi-context fpga. the belady algorithm is well known in the operating systems and computer architecture fields. it states that the fewest number of replacements can be achieved pr",NOTUTILIZE,MENTION
201785094,239363294,"e these update equations in the algorithm below, where we have replaced the expectation operator by . finally, we use an extension analogous to incremental training of the relevance vector machine to iteratively add local models at new, greedily selected locations cm 1. starting with one local model, each iteration adds one local model in the variational step, and prunes out existing local mod",UTILIZE,EXTEND
202385114,240224808,"ion p (xi b) (1 b) for various values of , while table 5 uses tail distribution of form p (xi b) (1 b 2) 2.15 log(2 b) log2. for the wdht algorithm we use the parameters used in the paper . for our algorithm (described in section 4), we must choose (a0, a1, k). for a given 0, we set a0 ( 1 2 ) 1 , a1 1 (1 )1 2 and k bmax loga, 2 2 1c, where 1 log 1 a",UTILIZE,USE
2773426,2887439,"g situations (koperski and han 1995). effective spatial data mining methods need to be coupled with efficient algorithms that schedule the processing of very large, possibly distributed data sources ( ). 4 . 5 gis and database systems modern database technology is essential for the efficient handling of geographic data. for the necessary integration of gis and modern database technology, there are",NOTUTILIZE,MENTION
27037216,27751944,"(resp. k ) in any state before j send m h , , then query-cmap( )( ) c (resp. h 1 prop-cmap( )( ) c) for some k . 6atomicity. we show atomicity using the framework of lemma 13.16 in . recall that is an arbitrary, good execution of the algorithm. we need to show that in if all the read and write operations that are invoked complete, then the read and the write operations can b",NOTUTILIZE,MENTION
29965783,30665787,"ative. figure 4 represents the policy inferred from f1 by using the (finite-time version of the) fitted q iteration algorithm (fqi) combined with extremely randomized trees as function approximators ( ). the trajectories computed by the cgrl and fqi algorithms are very similar and so are the sums of rewards obtained by following these two trajectories. however, by using f2 rather that f1, the cgrl",NOTUTILIZE,MENTION
24914171,25748587,"ared references) in time and space logarithmic, rather than linear, in the order of the structure. the cost in space becomes irrelevant, however, when storage management on acyclic structures is free . moreover, as we shall see, many of the necessary algorithms distribute naturally across the tree so that any reconstruction is local to a substructure, rather than global over the aggregate. section",NOTUTILIZE,MENTION
81991649,79531198,"wered in time o(m log log occ). 3.2 using balanced search trees if the choice of implementation is to use a balanced search tree for the navigation data, one can use the results of dietz et.al. so that each update will cost an additional o(log ) time, and the traversal will suffer from an o(log ) time worst-case overhead per node. thus, the query time would be o(m log occ) time.",NOTUTILIZE,NOTALGO
76109774,74493125,"s to be mentioned first by jordan and jacobs 13 . they provide an algorithm similar to ours, based on em and irls, for hierarchical mixtures of experts but no theoretical analysis. chamroukhi et al. consider the case of piecewise polynomial regression model with affine logistic weights. in our setting, this corresponds to a specific choice for k and wk: a collection of piecewise polynomial and",NOTUTILIZE,MENTION
34045666,34046727,"a, which may make the encrypted image intelligible. for compressed images, the algorithms based on dct and wavelet codecs attract more researchers, such as jpeg or jpeg2000. the algorithm proposed in encrypts only some significant bit-planes of dct coefficients, which obtains high perception security and encryption efficiency. the algorithm proposed in 23 encrypts only the significant streams i",NOTUTILIZE,MENTION
18521446,19711766,"ed states. this formulation assumes that the corruptions are independent. in bursty channels, corruptions often occur in a sequence. for example, a common burst noise model is the two-state hmm model . the proposed algorithm above can easily be modified to handle this case. the burstiness can be incorporated in the transition probability between the skip-states. furthermore, if information about t",NOTUTILIZE,MENTION
74432661,73158643,"m hff modified to consider demands for the items, see 19 . we observe that the algorithm m-hff can be implemented to run in polynomial time. as its asymptotic performance bound is at most 2.077 (see ), we may expect that using m-hff we produce solutions of good quality. since in each iteration either part of the demand is fulfilled or we go to step 4, it follows that after a finite number of iter",NOTUTILIZE,MENTION
202296772,240099777,"est possible rectangle was fitted according to the intensity shifts, see figure 5.6. the result of bounding a midsection can be seen in figure 6.19. the graph cut algorithms used, were from matlabbgl , which is a package of graph algorithms designed to work with large sparse matrices. it utilizes the c library called boost graph library (bgl) 27 . this means that a graph had to be represented a",UTILIZE,USE
67497392,66146542,"st studied np hard problems (garey, johnson, 1979) since it involves wide practical applications, e.g. crew scheduling (caprara et al,. 1996), bioinformatics (rampone, 1998), artificial intelligence ( ). one of the best polynomial time algorithms for approximating set cover is the greedy algorithm (johnson, 1974; asano et al., 2000). johnson (1974) and lovasz (1975) showed that the performance rati",NOTUTILIZE,MENTION
8971202,9471495,"h of the data. there is incentive to explore on-line (sequential) algorithms to seek improvements in terms of memory and computational speed. in earlier work, sequential algorithms have been proposed for estimating finite-state markov chains in white gaussian noise (wgn). these recursive kullback-leibler (rkl) algorithms are sequential em schemes and are derived using stochastic approximations to",NOTUTILIZE,MENTION
231239168,196192586,"ive (brooker,s2000). thus, in the context of a democratic transition, in which a supposedly free and fair election is often the first institution of democratic governance that the public experiences ( ), the judgments thatspeople make about this election may have a significant effect on levels ofssupport for democracy. in addition, elections in new or emerging democracies are likely to besparticula",NOTUTILIZE,NOTALGO
100904118,94633273,"epth (a sevenfold increase at 60m), and therefore to some extent offsets this shunt. this would enable gas exchange throughout most fur seal dives (more than 90 of dives are to less than 100m depth ( )). however, in addition to increased oxygen uptake, this behaviour would also increase blood nitrogen uptake (although the diffusion rate of nitrogen is much lower than that of oxygen or carbon dioxi",NOTUTILIZE,NOTALGO
85043188,82081116,"ext section, the background knowledge about the network model, the weight noise model and the regularization technique will be presented. the objective function for training a functional link network to tolerate multiplicative weight noise is derived in section 3. by minimizing the objective function, a training algorithm is also presented. based on the objective function being derived, a formula",NOTUTILIZE,MENTION
54222765,53756500,"in the i th phase bin of n (typically 36 bins, corresponding to 10 degrees per bin). isi distributions were expressed as probability density distributions using a kernel density estimation algorithm allowing grouping of datasets and normalisation for idiosyncratic frequencies of individual cells. spike triggered averages of lfp (sta-lfp) hi were constructed by taking epochs of lfp, typically 100",UTILIZE,USE
57375875,56687828,"o form a dedicated storage space for checkpoint data. our work differs in that we implement a user-level filesystem that can coalesce concurrent write accesses for better io performance. the study in proposes a cll algorithm to reduce checkpoint over9head. it s a user-level optimization, and its buffer management incurs significant overhead to synchronize the copier thread and application thread",NOTUTILIZE,MENTION
86197408,83022638,"350 350 350 voxel grid. in order to extract the watermark from this discrete volumetric representation, we transform it back to a mesh representation by using the well-known marching cubes algorithm . the watermark extraction is then carried out on this reconstructed mesh. table 9 presents the robustness results under this attack. for venus, horse and bunny, the robustness is quite satisfactory (",UTILIZE,USE
16058007,17179632,"nked lists in the java collections framework, a part of the standard java libraries. this implementation uses doubly-linked, circular lists that have a size field and a header node as a sentinel node . (linked lists also provide methods that allow them to be used as stacks and queues.) treemap implements the map interface using red-black trees 9 . this implementation uses binary trees with parent",NOTUTILIZE,NOTALGO
10332110,10987358,"ult. nevertheless, statistical properties derived from both methods agree, in both smooth and rough energy landscapes (i.e. respectively the regimes of replica symmetry and replica symmetry breaking) . in this paper we study the issue of optimal pruning using the cavity method. pruning is useful when one seeks to increase the information per weight in neural network implementations. it is often us",NOTUTILIZE,MENTION
39982215,38516245,", t , v t, v patinfo, visit ) 4.2 translation into owl the translation of the relational integrated schema into an equivalent owl representation is undertaken using an algorithm based on , which describes the representation of relational databases in rdf. similarly to 13 , our translation of relational schemas into owl can support both single-attribute and composite primary and forei",NOTUTILIZE,MENTION
1366825,1452082,contrast is an important factor in the subjective quality of radiographic images. a comprehensive survey of algorithms for contrast enhancement is presented in 15 . histogram modification techniques have been attractive due to their simplicity and speed. a transformation function is first derived from a desired histogram and the histogram of an input image. the transformation function is usually,NOTUTILIZE,MENTION
2193856,2321450,"of regions using the split algorithm. 2. the bottom-up approach 5, 15 begins with an over-partition of the image and decreases the number of regions using the merge algorithm. 3. the mixed approach introduced by pavlidis and horowitz 19, 20 modifies the partition combining the split and merge algorithms. the region-based methods require different information about regions: the set of pixels c",NOTUTILIZE,MENTION
32832559,33127662,"apt to the new data immediately for topic tracking, and it is impractical to prepare sufficient memory capacity to store all past data. online inference algorithms for topic models have been proposed . singular value decomposition (svd) is used for analyzing multiscale patterns in streaming data 15 as well as topic models. however, since svd assumes gaussian noise, it is inappropriate for discre",NOTUTILIZE,MENTION
75961178,74373526,"rists, we have notfoundit in theliterature. pleasenotethatdevelopinganefficientalgorithmtofindanumbernsuchthat0 n m and n 2 1 (mod m) is not trivial. for more details on this topic, we recommend and bw08 , where the authors discuss different algorithms that can be used to find such a number n. finally, the algorithm shown above can be generalised. in a private communication, wagon told us t",NOTUTILIZE,MENTION
42411081,40769146,"ces with new marketplace features in both disciplines. the majority of them aims at providing technical support to facilitate the finding of suitable services, e.g. by introducing cataloging schemas ( ), service description techniques (cardoso et al., 2010), or semantic search algorithms (mu oz frutos, 2009). usually, however, these initiatives each focus on developing and improving a specific mark",NOTUTILIZE,MENTION
59701640,59004508,"f this theorem. an ingredient is the proof of the transcendence of the generating function of the sequence g. while this may be proven from results found with difficultly in the literature (see fatou ), for completeness and ease of reading, we offer a direct and elementary proof of this. in fact, one can prove transcendence of various functions using the following beautiful result. theorem 4 (fato",NOTUTILIZE,NOTALGO
201655546,239178947,"rdinates of the ideal helix with random orientation. in the last phase, the algorithm refines the initial structure by optimizing the pseudo-energy function using local moves and simulating annealing . the moves we adopt displace a single residue at a time, and keep its distances to its neighbours constant. the pseudo-energy function used here is shaped to encode the constraints represented by the",UTILIZE,USE
7064275,7388463,"convenience. given a term, possibly not typable, we are interested in the problem of determining if it can be well typed modulo insertion of appropriate coercions. such a typing algorithm is given in in the context of simply typed -calculus with recursive types. a weaker rule is: (app ) gamma f : (x : u)v gamma t : t c t;u : tsu gamma (f (c t;u t)) : v x (c t;u t) the solution we wil",NOTUTILIZE,MENTION
5872850,6082963,"ches are possible 22 and these may also use sub-cycling algorithms.) the technical details of the amr algorithm as it applies to hyperbolic systems can be found in articles by berger and co-workers and are not discussed in any depth here. the main aim of the present work is to apply the amr method to the hydrodynamical semiconductor models of section 2, a process which is not straightforward si",NOTUTILIZE,MENTION
46002777,45186342,"eir intersection curve e q1 q2 is either a smooth elliptic curve or the union of two conics c1, c2 meeting in two distinct points. we fix rulings r1 on q1 and r2 on q2. (1.1) theorem ( 12 p. 28, p. 13). suppose that there exists a closed sequence of distinct lines l1, . . .,l2n, l2n 1 l1 such that the line li belongs to r1 resp. r2, if i is odd resp. even, and such that consecutive lines l",NOTUTILIZE,NOTALGO
4685312,4840474,"t does, and how we use it. dsa: authentication digital signature algorithm (dsa) is part of the digital signature standard (dss), proposed by the national institute of standards and technology (nist) . nist has made the algorithm publicly available, royalty-free. it is a public-key signature and verification algorithm based on discrete logarithms. an important feature of this algorithm is that eac",NOTUTILIZE,MENTION
4517714,4668044,"ons occurring in w (k is a given constant). our algorithm extends, on the one hand, the one for exact maximal repetitions mai89, kk99a and on the other hand, generalizes the one of ls93 (see also 7 ) by using a special factorization of the word to speed-up the algorithm. to proceed, we need more denitions. consider a globally-dened repetitionsr w i::j of period p in a word w 1 : n . w i::i",UTILIZE,EXTEND
20198780,21421366,"ection the number of state transitions p is equal to the number of the messages exchanged by the main computation (in the worst case). under similar hypotheses on the system, algorithms from 18 and require pe and pn messages, respectively, and have a time complexity of o(e) and o(n), where e is the number of communication channels ( 18 doesn t tolerate message desequencing). among algorithms f",NOTUTILIZE,MENTION
5388106,5569781,"g of the edges and not about k or hk . we overcome this problem as follows. given the ordering of the edges according to their weights, we can use the minimum spanning tree algorithm of gabow et. al. to compute a minimum spanning tree with respect to the hk -weights, without actually knowing these weights. the ordering su ces for this purpose. recall from section 5 that, given a tree and a budget",UTILIZE,USE
7562911,7911626,"by parallelizing it to run on the buddy nodes having some surplus time less than the execution time of the path, during the interval (t p;t q). this is where we extend the approaches taken in 7 and . the intuition behind parallelizing the path is that the scheme adopted in both 7 and 9 will succeed only upon nding a buddy node (or any other node for that matter) which has some surplus time i",UTILIZE,EXTEND
14063464,15085632,"s for solving ilps the idea of solving ilps using a propositional satisfiability (sat) algorithm was originally proposed in 1 . however, the algorithm described in 1 is based on the davis-putnam sat procedure, which has been shown to be particularly inefficient for a large number of instances of sat 14 . in 15 , instead of the davis-putnam procedure, the grasp sat algorithm 14 is used wi",NOTUTILIZE,MENTION
817209,873161,"space resources within reasonable limits, unlike the case of the grobner basis solving where the space requirements are exponential. some pspace results on elimination theory have been announced in (see also 2 ). however, in those papers the authors do not prove the membership of their algorithms to pspace. in particular, the related aspects of uniformity of their algorithms are not considered",NOTUTILIZE,MENTION
13095488,14044265,"dowsky 1993 and dupuis and wang 2004 , and we extend the results of the latter authors. we then examine the robustness properties for an hrms model studied by several authors cancela et al. 2002; ; heidelberger 1995; lewis and b",UTILIZE,USE
