contextID,citationID,clean__citation_context,UTILIZE_LABELS,USAGE_LABELS
3829242,3955107,"gs in this section we describe and analyze a new approximation algorithm for the two-layer crossing problem. in particular, in section 2.1 we analyze the penalty minimization technique for solving cp and we prove that any approximation algorithm for the minimum feedback arc set problem (fas) can be used for approximating cp by the same ratio. therefore, in section 2.2 we focus on fas and we devis",UTILIZE,USE
81934512,79475827,"k running on multi-hfe with embedding. table 4. comparison of each step of our attack on embedding variant on multi-hfe with parameters q 31, n 3, d 8, d 2 ( 120 bits security) using a magma (v2.16-10) implementation on a 2.93 ghz intel r xeon r cpu. mr time mr dreg finding u finding w no variant (ref. time) 23.3 s 3 0.01 s 7.29 s embedding (r 1) 788 s 3 0.01 s 6.14 s embedding (r",UTILIZE,USE
78712134,76707061,"a three-dimensional poisson equation showed a performance improvement of 34 by applying nonblocking collective operations 5 . the runtime of a strong-scaling medical image reconstruction algorithm could be improved up to 8 . however, a nonblocking interface does not mean that the operations are actually performed asynchronously in the background. asynchronous execution of collective operations",NOTUTILIZE,MENTION
23963414,24875119,"ed, and universally available collection of natural photographic images has not yet developed. the image collections published by corel form the current de facto standard, and are cited in many works . unfortunately, there are over 60,000 corel images ins59 table 3.5: overall classification results by category on second test set for algorithms with fine color quantization. category stairs hist. co",NOTUTILIZE,MENTION
84343741,81478416,"s used for each patient within this class. the four mr images were plotted together with a segmented image in which voxels were clustered using a model-based clustering algorithm 28 as described in . the clustering provides an objective segmentation based on similarities obtained from the mr images as well as mr spectroscopic features, and thus is considered to be helpful in the selection of vox",UTILIZE,USE
68031435,66628069,"ting the measures of fit under measurement uncertainty: formulation of the problem. in general, we have an algorithm q(x (1) 1 , . . . , x(1) d which transforms the values x (1) 1 , . . . , x(1) d , x 1 , x(2) 1 , . . . , x(2) d , . . . , x(2) d of the corresponding quantities into the value y q(x (1) 1 , . . . , x(1) d , x(2) 1 , . . . , x(2) d , . . . , x(n) 1 , . . . , x(n) 1 , . . . , x(n) 1",NOTUTILIZE,NOTALGO
25646570,26422451,"ov approach. in 37 , a broyden jacobian estimator is applied for jacobian estimation and a nonlinear least-square optimization method is used for the visual servo controller development. in 39 and a recursive least-squares algorithm is implemented for jacobian estimation, and a dynamic gaussnewton method is used to minimize the squared error in the image plane to get the controller. let the ro",NOTUTILIZE,MENTION
72944437,71934437,"the journal of systems and software 82 (2009) 144 154 147 fig. 3. an ncsp-idi schedule. greedy scheduler of rate-monotonic scheduling algorithm with non-preemptible critical section protocol (ncsp) ( ) is demonstrated. 1 4.1. anomaly prevention passive resources in this section, we first discuss the handling of passive resources and present two naive rules for anomaly prevention. 4.1.1. insertio",NOTUTILIZE,MENTION
16058007,17179632,"nked lists in the java collections framework, a part of the standard java libraries. this implementation uses doubly-linked, circular lists that have a size field and a header node as a sentinel node . (linked lists also provide methods that allow them to be used as stacks and queues.) treemap implements the map interface using red-black trees 9 . this implementation uses binary trees with parent",NOTUTILIZE,NOTALGO
9894759,10499910,"ted by profile pseudolikelihood. this version of the estimation algorithm was first applied to the data yielding ( fi;sfl;sr) (1:9781; 0:2131; 0:7). a metropolishastings birth-death-shift algorithm was used to generate 500 simulated realisations from the strauss process with the same parameter values. the bootstrap covariance matrix, based on 500 parametric bootstrap replicates, wassc 2 4 0:1",UTILIZE,USE
17574141,18749690,each of the 12 dag sizes corresponding to a number of tasks n ranging from 10 to 32 by increment of 2. optimal solutions for these small examples were determined by using an a enumeration algorithm . the heuristic results reported in 20 for scheduling these task graphs on a 2-processor system displayed 1 to 8 deviations from the optimum. the results obtained using the heuristics we selected,UTILIZE,USE
77839413,75977419,"ile. furthermore, when a document is created, it is difficult to foresee all constraints, in particular those introduced by futures devices. 2 our proposed classification extends the one presented in , especially the static and dynamic adaptation cases.semantic adaptation of multimedia documents 7 3.1.2 using transformation rules hal-00781024, version 1 - 25 jan 2013 to avoid the specification of",NOTUTILIZE,NOTALGO
201740297,239300215,"st free energy, or shortest length. in order to classify mirnas into families, all predicted mature mirnas were compared with themselves using the ssearch35 program in the fasta package (version 3.5) . using a single-linkage algorithm, mature mirnas with up to two mismatches were included in same clusters. mature mirnas were then compared with the mature mirnas in the mirbase (release 16) 37 usi",UTILIZE,USE
45430520,44490054,"sensitivity annotations with the essential difference that they are polynomials over natural numbers, while we consider polynomials over the reals augmented with . this approach has been extended in by constrained universal and existential quantifiers, providing mechanisms for polymorphism and abstraction over polynomial expressions similar to the ones made available by our quantifiers over size",NOTUTILIZE,MENTION
20827406,22008721,"for different initial conditions. we will discuss this point in more detail in section 3.2. we conclude this section by comparing the algorithm described above with the related algorithm invented in . remark 2.4 instead of the systematic scan through all types in step csw 1 above, one could also use a random scan by resampling only the positions of a random (or, by type symmetry, a fixed) type. c",NOTUTILIZE,MENTION
2246959,2377625,ved bandwidth. as a result the excess resources granted to user1 is taken back and user1 reverts to using its original alloted bandwidth. experiments with routing: mobile ip implementation on freebsd is installed on the testbed. the interaction between the mobile ip route information and routing table changes are being worked on. performance of the routing protocol in terms of latency will also,NOTUTILIZE,NOTALGO
15552966,16658257,"e voronoi paths are longer than the optimal visibility graph-based paths, especially in sparse environments. aiming to improve the quality of generated paths, another composite algorithm is proposed ( ) where three methods of voronoi diagram, visibility graph, and potential fields are integrated in a single architecture, called v-v-p compound model. the compound model provides a parametric tradeoff",NOTUTILIZE,MENTION
58051469,57301529,"s motivates hardness amplification, which is the problem of transforming a mildly average-case hard function into a strongly average-case hard function. a classic result in this area is the xor lemma , which states that the xor of sufficiently many independent copies of a mildly average-case hard function is strongly average-case hard, provided the model of efficient algorithms is small circuits.",NOTUTILIZE,MENTION
32100489,32565776,"problem. some existing face routing algorithms have been developed to bypass routing holes using georouting algorithms. another way to avoid routing holes is to jump over the hole as proposed in . iii. definitions given a homogeneous wsn deployed in a building with n sensors and m sinks. each sensor can adjust its transmission range to one of the k levels: r0, r1, , rk-1 rmax using different",NOTUTILIZE,MENTION
1616154,1708287,"a circular trajectory it implies that a higher resolution can be achieved by placing the object so that the full detector is within the support of the roi. there have been interesting investigations for 3d roi tomography. however, these algorithms start from the grangeatformalism which is a full 3d algorithm. we start with the (fdk)-algorithm 1 , which is a modified 2d-algorithm. although it ha",NOTUTILIZE,MENTION
11379445,12160254,"ntiated variables allow us to follow a leastcommitment approach. most partial-order planning algorithms search through the space of all possible plans to nd one solution that is guaranteed to succeed . the exibility gained from the partially ordered plan representation allows a planning agent to handle quite complicated domains, which is useful in intrusion detection. a partial order representatio",NOTUTILIZE,MENTION
30103232,30816089,"d according to how well the local measurements match the environment map at the hypothesized location. algorithms that use random sampling of the configuration space, such as monte carlo localization , and those that use grid sampling, such as markov localization 2 , 3 , belong to this category. if the environment map is represented as an occupancy grid, the computational complexity of these alg",NOTUTILIZE,MENTION
46161223,45384417,"fts have been calculated. our recursive solution only employs 2 2 transfer matrices and their ordered products and provides a fast and reliable algorithm which can easily be implemented numerically . in the present article, the theory developed in ref. 12 will be applied to nanomatryoshka structures of prodan et al 22 , i.e., multilayered spheres consisting of alternating silica and gold co",NOTUTILIZE,MENTION
304565,326545,"port we present the details of 100 experiments (of totally 1000 used in the technical report prip-tr-74 hk02 ) of stochastically building irregular graph pyramids with four different algorithms: mis , mies, mides hk02 and d3p jol03 . for details on theoretical background of these algorithm see the technical report prip-tr-74. this report is an appendix to prip-tr-74. we generated 100 graphs, b",NOTUTILIZE,MENTION
10372270,11032198,"rage throughput (t ) of: t b rtt (1) where rtt is the dynamic estimate of the round-trip time. when the window size is changing due to the congestion avoidance algorithm 17, 18 , mahdavi and floyd , mathis et.al. 20 have derived expressions relating tcp throughput to the packet loss rate (p): t k mss rtt theta p p (2) where mss, the maximum segment size, is the amount that the tcp sending",NOTUTILIZE,MENTION
24731951,25578881,"per. statefull algorithms. in centralized or distributed setting, efficient primal-dual algorithms in the statefull model have been widely studied in the past, both for general packing covering lps and for network flows 13, 12, 26, 6, 4 . most of these algorithms share features like exponential dual variables with our algorithms. however, these algorithms crucially depend on maintaining a stat",NOTUTILIZE,MENTION
23568058,24509326,"the dct coefficients signs are encrypted in dct transformed blocks 17 , the data blocks are permuted in frequency domain 18,19 , and both the coefficients signs and block positions are encrypted . these algorithms encrypt only some parameters in the image, reduce the encrypted data volumes, and thus, improve the encryption efficiency. the key problem is how to select the parameters. consideri",NOTUTILIZE,MENTION
125036872,112544561,"speed-ups for testing classical properties were derived from earlier improvements in query complexity: they rely on quantum algorithms such as those of (in chronological order) bernstein and vazirani , simon 134 , shor 133 , grover 72 , and ambainis 13 . in section 2.1 we describe these quantum property testers and the improvements they achieve over classical testers. some of the properties co",NOTUTILIZE,MENTION
10229671,10870436,"ammars (without left-corner or unit production recursion) . the parser now uses the method described here to provide exact scfg prefix and next-word probabilities to a tightly-coupled speech decoder ( ). an essential idea in the probabilistic formulation of earley s algorithm is the collapsing of recursive predictions and unit completion chains, replacing both with lookups in precomputed matrices.",NOTUTILIZE,NOTALGO
22389238,23435700,"used such pairwise constraints to improve clustering results. extensions have also been made to model-based clustering based on the expectation-maximization (em) algorithm for gaussian mixture models . however, these methods do not incorporate metric learning into the clustering algorithms. recently, some methods have been proposed for learning global mahalanobis metrics and related distance funct",UTILIZE,EXTEND
721637,771703,"ut, where is the label assigned to example . we pay particular attention to learning algorithms that attempt to minimize a margin-based loss function, called margin-based learning a . this includes a large family of well-studied algorithms with different loss functions and minimization algorithms, such as decision trees, logistic regression, support vector machines(svms) and adab",NOTUTILIZE,MENTION
31376573,31989495,"ty, a possible strategy would be to reduce enough the size of the step. since the gradient is supposed to be continuous, k 1 goes to zero with k. such an approach has been used by grippo and lucidi . they proposed line search conditions that accept short steps and proved a strong convergence result for the resulting prp algorithm. from a practical point of view, the computation of short steps is",NOTUTILIZE,MENTION
7486057,7832921,"even bk is intractable: ff will always take o(tnq f 1 ) time, whereas bk can take more, depending on the graph. in section 4, we show how both ff and bk are related to loopy belief propagation (lbp) , which is the method of applying pearl s message passing algorithm 15 to a bayes net even if it contains (undirected) cycles or loops. in section 5, we experimentally compare all four algorithms",NOTUTILIZE,MENTION
9888572,10493335,"physics (they are not symmetric), their corrected versions icg86 lew93 are preferred in global illumination algorithms. the first model that has physical base was proposed by torrance and sparrow , which was applied in rendering algorithms in ct81 . later, he, torrance et. al. htsg91 introduced another model that even more accurately represented the underlying physical phenomena bs63 . the",NOTUTILIZE,MENTION
15327383,16422726,"ltipliers and gave delay and area comparisons of them in 55 . wu, hasan and blake proposed parallel multipliers in 218,219 . lee and lim defined a new dual basis called circular dual basis (cdb) in . they gave the algorithms for multiplication, squaring, conversion and inversion in 114 . gollmann reported some results about esp and dual basis in 68 . 4.3.4 works for comparison of different bas",NOTUTILIZE,MENTION
1695163,1793543,"een a large number of outstanding papers improving the proof systems and getting stronger hardness of approximation results. hastad has97 gets tight results for some approximation problems. arora a after failing to achieve lower bounds for traveling salesman in the plane, has developed a polynomial-time approximation algorithm for this and related problems. a series of results due to cai, condo",NOTUTILIZE,NOTALGO
14589877,15647644,"straints c(s) such that c(s) p q if and only if d sd p q. inthis case the extraction algorithm produces the same result for u-index(s) as for index(s). in a second part we use the 1-index . we prove that, for any set s of data, u-index(s) and 1-index(s) model an inclusion constraint if and only if this constraint is satisfied by any datum of s. moreover, we prove that 1-index(s) is alw",UTILIZE,USE
9622377,10199592,"ource vector have approximately the same sensitivity to channel errors. we are now investigating the use of two-stage source codes like the weighted universal vector quantizer in our design algorithm . since the codebook index (1st stage), which is very sensitive to channel errors, is sent along with the codewords (2nd stage), we expect multiresolution channel coding to have more of an impact for",NOTUTILIZE,MENTION
64627494,63557980,"ultyaev et al., 1995). an advantage of the genetic algorithm is the possibility to predict rna pseudoknot structures, which influence translation initiation by frame-shifting or ribosome readthrough ( ). the secondary structures predicted in this way are analysed by comparison with homologous sequences, in order to find support for the proposed secondary structures from co-variations or compensated",NOTUTILIZE,MENTION
1421729,1507514,"er approach 4 - 6 . in this investigation we are going to extend a recent modern thomasfermi approach of myers and swiatecki 7 - 10 to the equation of state at finite temperatures (see also ref. ). furthermore we will briefly discuss the question of neutron star matter and the equation of state for higher asymmetries, respectively. the paper is organized as follows: first, we recapitulate for",NOTUTILIZE,NOTALGO
202538274,240441504,"the model parameters. for parameter estimation, we use the combination of the nelder-mead simplex method and the quasi-newton method (the bfgs algorithm), both provided in the gnu scientific library . we alternate the two optimization methods until the solutions converge (as defined by the respective criterion of the two methods) or a specified number of alternations are reached. this approach is",UTILIZE,USE
33235925,33417573,". signet s are of three basic types: hashed, direct, and flag. a hashed signet consists of the prefix octet, some additional data, and a 20 bit hash of the data covered using the secure hash standard . since this hash algorithm is not invertible, the data, such as rrs, covered by a hashed signet must also be included in the reply to a query if it was requested. a direct signet includes all of the",NOTUTILIZE,MENTION
84549567,81656177,"l frequency on the reconstruction we use both the lfi and hfi as probing waves. the mcf is defined on d3 (l 110 for lfi and l 92 for hfi). the minimization is realized by a quasi-newton algorithm . because a local minimization algorithm is used, 15 initial guesses, equally distributed on the estimation domain 3;10 mm, are used. both lfi and hfi provide satisfactory reconstructions (see fig.1",UTILIZE,USE
19772605,20987794,"in their approaches, e.g., brill et al. have to prede ne distitutes as brute force to eliminate some unlikely phrases, e.g., noun prep and prep dt , that are favoured by their criteria. de marcken has an in-depth discussion on this kind of issues involved in pure distribution analysis and on the disadvantages of the inside-outside algorithm for grammar induction. recent work in language modell",NOTUTILIZE,MENTION
9283540,9823764,"lmost identical to our trec 6 clustering approach. unlike in previous years, we only used one algorithm (no experimental algorithm this year ), and ran it on different topic lengths. our trec 6 paper gives the details and rationale for the approach. the basic algorithm is 1. retrieve 1000 documents using the initial query (using lnu.ltu weights). 2. generate cooccurrence information about the que",NOTUTILIZE,MENTION
22060513,23137035,"prepare data build model(s) figure 1. the data mining process algorithms without a careful data preparation and data understanding process, which may often dominate the actual data mining activities . it is also rarely feasible to use off-the-shelf data mining software and expect useful results without a substantial amount of data insight. in addition, data miners working as consultants are often",NOTUTILIZE,MENTION
40100085,38631661,"ons are typically applied to modify an image. popecu and farid propose a runtime efficient algorithm to detect duplicated image regions by calculating the similarity of overlapping blocks of an image . figure 25 shows the result of an analysis of an image showing an iranian rocket test, which was distributed by the government of iran. the white areas in the generated map indicate duplicated image",NOTUTILIZE,MENTION
40641727,39179861,"several polygonal obstacles in the plane. similar results with algorithmic consequences have been established for fat objects mps94 , ags00 , pss03 , ez08 , es07 and round objects arek06 , in the plane and in higher dimensions. the aim of this paper is to derive a new upper bound on the number of tangencies in an arrangement of convex bodies in the plane. two nonoverlapping jordan regi",NOTUTILIZE,NOTALGO
112743501,103397401,"to temporal or resource constraints.s2.1.saspen plannersall of our architectures require a planner scheduler to turnsabstract science goals into concrete activity schedules, ands we extend the aspen ( ) applications framework to satisfy this requirement.susing aspens involved generating models of the lander and rovers in thesextended version of paper appearing in proceedings of the fourth internation",UTILIZE,EXTEND
15324934,16420334,"ng is to identify and remove these duplicates. in the business world, this problem is called the merge purge problem 27 28 . some researches have been done in the field of data cleansing 43 48 45 31 . we propose two different data cleansing algorithms in this chapter. the rest 33sof the chapter is organized as follows: in section 2, we present some related works; in section 3, we give a",NOTUTILIZE,MENTION
28258734,28966988,"for subsampling experiments, as we will describe in sections 8.5 and 8.6. algorithms compared we evaluate the following five algorithms: (1) reservoir (res): the original reservoir sampling algorithm . (2) adapted reservoir (a-res): the adapted reservoir algorithm described in section 3.3. (3) geometric file (geofile): the original geometric file based sampling algorithm 15 . however, to reduce i",UTILIZE,USE
58931908,58209821,"al influenza is still under discussion. a study on deaths from pneumonia and influenza from the 1950s to the 1990s demonstrated mortality of the elderly decreased when school children were vaccinated . when children were mass-vaccinated against seasonal influenza, not only did the number of infected children decrease, but also that of infected adults 6 . mass vaccination of children is therefore",NOTUTILIZE,NOTALGO
213270463,183794304,"point and e is the energy of the saddle point, as compared to the reactant state. for comparison between the present hqtst sticking coefficient and the quantum wave packet propagation (qd) from ref. , refer to fig. (3.15). in obtaining the qd data, olsen et al. ran wave packet propagation with kinetic energy as low as 0.3 ev, which is still about an order of an magnitude larger than what would be",NOTUTILIZE,NOTALGO
17906082,19088556,"us in particular for k o(log n) the number of mistakes is polynomially bounded. it is unknown whether it is possible to learn this class in polynomial time in the uronline model even for k (1) . the online learning algorithm rvl( ), shown in figure 1, receives an example x (t) at each trial t 1, 2, 3, ... from the teacher, and makes a prediction for f(x (t) ). 4.1.1 complexity of rvl( ) i",NOTUTILIZE,MENTION
13030248,13971591,"nstances. various authors, including moore 43 and skelboe 65 , hansen ( 17 , 18 and 19 ), ichida 21 , ratschek and rokne 52 , jansson and kn ppel ( 23 and 24 ), caprani, godthaab and madsen have contributed to the knowledge of such algorithms. see 52 for a coherent explanation of this type of algorithm, as well as for the requisite introduction to interval arithmetic 1 . the basic ide",NOTUTILIZE,NOTALGO
23167248,24138222,"discussed. in addition, we will also discuss a sequential access-based web recommender system that has incorporated the csb-mine algorithm for web recommendations. 1s1. introduction web usage mining , also known as web log mining, aims to discover interesting and frequent user access patterns from the data derived from the interactions of users while surfing the web. the web browsing data can be",NOTUTILIZE,MENTION
20055641,21274920,"ified. for the case when x i 0, the fitness function can i be modified to i 1 xi 4.3. selection method 1 1 p . we consider four selection schemes commonly used in genetic algorithms . the following four methods are considered and compared.s1) remainder stochastic without replacement get expected count by the strings fitness divided by population fitness average, and put strings a",NOTUTILIZE,MENTION
40326042,38857666,"all the criteria under consideration are iteratively improved. this phase relies on a general result of convex analysis yielding to the definition of the so-called multiple-gradient descent algorithm . in the second phase, said to be competitive , viable trade-offs are identified as particular nash equilibrium points in the smooth continuation of the termination point of the mgda phase 31 . 6.2.",NOTUTILIZE,MENTION
38230309,36895995,"plied to optimize vectorization of strided data access in a general purpose compiler, in an application similar to the approach in 5 . reference 6 served as inspiration for our approach. reference derives the number of block transfers and 8 an optimal algorithm for transpositions on multi-level memories. both index computation time and i o time are considered in 9 , and 10 optimizes matri",NOTUTILIZE,MENTION
