contextID,citationID,clean__citation_context,UTILIZE_LABELS,USAGE_LABELS
57664503,56946343,"largest improvements are achieved on models with several queues and many classes which are infeasible in mom. our idea consists in integrating the recursive equation used in the convolution algorithm within the mom approach. mom jointly considers in a linear system of equations the exact recursive formulas for normalizing constants used in recal 12 and lbanc 9 , but not those used inconvoluti",UTILIZE,USE
44428123,43247260,"th an i.i.d. noise source. therefore the original data (fig. 1) may not be modelled as a simple random walk. it would be logical to continue this analysis with more sophisticated surrogate algorithms , 10 . however, for this short time series results of more sophisticated algorithms are not conclusive. furthermore, as we have already noted, it would not be possible to apply the covariance as a dis",NOTUTILIZE,MENTION
902646,966027,"or research than hybrid formulations. however, recent research has seen the proposal of several new algorithms that incorporate additional features. see for example the work of basu, hirsh, and cohen , melville, mooney, and nagarajan 39 , as well as schein, popescul, and ungar 51 . the hybrid approach purportedly reduces the eect of two well known problems with collaborativesltering systems: th",NOTUTILIZE,MENTION
14912119,15989864,"plements cpu frequency changes and data recording. the client is a modified version of an earlier tool used to understand user comfort with resource borrowing 1 and implement user-driven scheduling . in the client, the user can express discomfort at any time by pressing the f11 key. these events drive the udfs algorithm which then uses the windows api to control cpu frequency. we monitor the cpu",NOTUTILIZE,MENTION
74745493,73385292,"an input and another that counts in binary 12 . similarly, rothemund et al. have demonstrated a dna implementation of a tile system that computes the xor function, resulting in a sierpinski triangle . these systems grow crystals using double-crossover complexes 28 as tiles. rothemund has demonstrated what is currently the state-of-the-art of dna nanostructure design and implementation with dna",NOTUTILIZE,NOTALGO
202316892,240128401,"en proven by yedidia and coworkers to be mathematically equivalent to the bethe approximation, a mean field model, and is what we apply in our code to approximate the bivariate marginals in our system . 5.2.8 the algorithm in detail 1. initialization: set all ij(ai, aj) 0 and all i(ai) ci lnpi(ai), where ci is a normalization constant for the gauge constraints which were described earlier.",UTILIZE,USE
56580691,55912251,"or spatial join. faloutsos et al. 33 use power laws to estimate the selectivity of spatial joins. ravada et al. 6 take a graph partitioning approach to scheduling spatial joins. fagin s algorithm and the threshold algorithm 35 are top-k algorithms for joins, and several top-k algorithms have been proposed for probabilistic data under different models and assumptions 36 , 37 , 16 . these",NOTUTILIZE,MENTION
75384295,73914043,"smaller dynamic problems. the elaborate details of this step can be found in section 5. note that this leaves us with an o(n (d 2) 3) algorithm for c-kmp. for differentiating between our approach and or 1 , one has to point out that our base case is a static problem, while the mentioned algorithms solve a dynamic one. furthermore, the identification and solution of our reduced base case is compl",NOTUTILIZE,MENTION
30004475,30708717,"t(i1, i2) asso(i1, v ) cut(i1, i2) . (4) asso(i2, v ) let us now present the complete algorithm, which is outlined in algorithm 1. the algorithm first generates n different wide-aperture renderings by placing the focal planes uniformly between the maximum depth (zmax) and minimum depth (zmin), and one at the optimal depth zopt 5 from plenoptic sampling. the maximum and minimum depths are assu",NOTUTILIZE,MENTION
25297659,26102523,"extra computing resources to purchase computing time from other computer owners. typical uses of computing resources include pharmaceutical research 8 , indexing algorithms 2 , and machine learning . organizations involved in this type of research could benefit from a need-based computing grid 8 . unlike other grid computing initiatives, aspen enables any computer owner to make his or her compu",NOTUTILIZE,MENTION
184629145,163782991,"9sat penn state u niversity (paterno lib) on february 21, 2016 http: nar.oxfordjournals.org d ow nloaded from nucleic acids research bond distances and bond angles in the imidazole ring of (a) cgmf , (b) 5 -gmp (13), and (c) neutral guanine base (mean values of the two structures, see table). the similarity of the geometrical parameters of (b) to (a) indicates that the base of 5 -imf is also pro",NOTUTILIZE,NOTALGO
77512267,75692574,"in the desired result. 7. counting elliptic curves whose reductions are isomorphic over fp in this section, we will prove the estimates of lemma 1 by extending standard character sum techniques as in or 14 . the main difference is that we have to extend the domain of our characters to ok . since we are representing ok as an n k -dimensional z-module, it is necessary to adapt their proof to higher",UTILIZE,EXTEND
63016443,62159368,"ministic constructive. for example, many cad algorithms are based on the forced directed paradigm or use dynamic programming. in the last three decades, deterministic iterative improvement algorithms were proposed for many problems and were able to produce the best results. in particular, deterministic iterative improvement algorithms are widely and frequently used for partitioning 2 . since the",NOTUTILIZE,MENTION
25413486,26207206,here n is the number of vertices in the graph. the algorithm also maintains the connected components and supports connectivity queries in o(log n) time. the algorithm is simpler than the algorithm in and it matches its running time for edge updates and connectivity queries. 1 introduction 1.1 dynamic graph algorithms a dynamic graph algorithm maintains a solution to a graph problem as the graph u,NOTUTILIZE,MENTION
6384465,6640171,"d ji . also, the graph need not be fully connected. if it is not, it su ces to add the missing arcs giving them a very high length. 11 3.1.1.1 ant system (as) ant system (as) was the first (1991) aco algorithm. its importance resides mainly in being the prototype of a number of ant algorithms which have found many interesting and successful applications. in as artificial ants build solutions",NOTUTILIZE,MENTION
38155255,36823057,"ample, by a recent workshop on this topic 11 . existing algorithms can be subdivided into batch and online techniques. the former provide sophisticated techniques to cope with perceptual ambiguities , but they can only generate maps after extensive batch processing. online techniques are specifically suited to acquire maps as the robot navigates 6, 27 , which is of great practical importance in",NOTUTILIZE,MENTION
58119103,57365964,"he lu factorization of a matrix a has the form a p lu, where l is a unit lower triangular matrix, u is an upper triangular matrix and p is a permutation matrix. the block lu factorization algorithm proceeds in the following steps: initially, a set of nb columns (the panel) is factored and a pivoting pattern is produced. then the elementary transformations, resulting from the panel factorization",NOTUTILIZE,MENTION
2054784,2174238,"and euthanasia, quot; which could just as accurately be interpreted as youth in asia. quot; there are many comprehensive works on speech recognition that describe the history of the eld rj93 jh9 , and i refer the interested reader to these works for a history. the basic speech recognition algorithm is a classi cation algorithm. the system must decide which phoneme is being spoken at any point",NOTUTILIZE,MENTION
8606122,9066977,"s powers-of-two buddy algorithm as an alternative to a more conventional first-fit algorithm, chris kingsley implemented a very fast buddy algorithm that was distributed with the 4.2 bsd unix release . kingsley s algorithm allocates objects in a limited number of different size classes, namely powers of two minus a constant. allocation requests are rounded up to the nearest size class and a free l",NOTUTILIZE,MENTION
23047038,24030660,-bit node mark content-specific encoding process. our algorithm does not require the original un-watermarked object in order to perform mark detection. published research results of this work include . further work is required in improving conte,NOTUTILIZE,NOTALGO
2406792,2542242,"llowing potentially simpler and more efficient motion tracking and object occlusion detection. a number of segmentation algorithms for building a hierarchical image representations have been proposed . although these hierarchical segmentation algorithms perform well in some specific areas, all of them suffer from various drawbacks. nacken 50 and hen et al. 65 employ methods similar to ours of",NOTUTILIZE,MENTION
34972746,34848647,"processing random-order stream and adversarial streams. in particular, streaming algorithms to find the median using polylog space require exponentially fewer passes if the stream is ordered randomly . in this paper, we use robust lower bounds on communication complexity in order to deduce robust data stream lower bounds. once the communication bounds have been shown, the data stream bounds follow",NOTUTILIZE,MENTION
9592747,10166832,"s more reasonable to use this as our base-line. the worse the base-line comparison algorithm chosen, the better other algorithms appear to be. by choosing negascout enhanced with aspiration searching iration negascout) as our performance metric, and giving it a transposition table big enough to contain all re-search information, we are emphasizing that it is possible to do better than the quot;be",NOTUTILIZE,MENTION
26175691,26904772,"large latency variations for a large set of destination nodes 31 . therefore, to further improve the s-torus algorithm, robinson et al. proposed the multi-phase multicast routing algorithm: m-torus . the idea was to shorten the path lengths of the multi-destination worms to stabilize the latency variations and to achieve better performance by partitioning the multicast group. they introduced two",NOTUTILIZE,MENTION
9159130,9685724,"tions between terms is unifiable, then there exists a unifier ae 0 for e such that each unifier for e is also a unifier for ae 0 . this result follows from the well-known martelli-montanari algorithm . see 1 for the basic definitions and for an introduction to the field of logic programming and unification. in fokkink 6 , this theorem is generalized to the case where e may be infinite. the firs",NOTUTILIZE,MENTION
30707029,31415288,"problem la can be rewritten as follows: la : maximize score(a) s.t. a av 76.3 fractional programming anla algorithms using length-normalized scores in local alignment is suggested by arslan et al. to cope with the mosaic and shadow effects. the objective of the nlat problem 2 is nlat (x, y ) max s (i, j ) ( i j ) i x, j y, i j t (76.5) 2007 by taylor francis group, l",NOTUTILIZE,MENTION
11150084,11903983,"ample provider that implements the naive bayes algorithm. netz 18,19 presents an useful overview that describes the ole db for dm technology. siedman brings out an excellent reference to sql for dm . however, the task of creating a provider and implementing an algorithm remains complex due to the lack of discussion about experiences in doing this work. the main objective of this paper is to desc",NOTUTILIZE,MENTION
11002917,11749957,r results agree with both husmeier (who used an ensemble of bayesian neural networks trained using an expectation-maximisation (em) algorithm and incorporating automatic relevance determination (ard) ) and gunn (who used supanova 1 ). the quality of prediction of our implementation of supanova methods matched other advanced machine learning such as kpls kernels 6 . our implementation selected on,NOTUTILIZE,MENTION
13789519,14795447,"d services. together, these two protocols contribute to the scalable and decentralized features of the tuxedo system. 1 introduction peer-to-peer systems have increasingly become a hot research topic . however, in the context of peer-to-peer (p2p) computing, most of the research projects focused on routing algorithms and efficient query search mechanisms. currently, major applications of peer-to-p",NOTUTILIZE,MENTION
34569953,34512790,"in o( a z s b ( s b )), which is polynomial time, compared to exponential time for exact approaches. different algorithms have been developed using the point-based approach: pbvi 57 , perseus , hsvi 69, 70 are some of the most recent methods. these methods differ slightly in how they choose belief states and how they update the value function at these chosen belief states. the nice prope",NOTUTILIZE,MENTION
9275905,9815406,"uzzy knowledge bases because fuzzy logic offers this work has been supported by the cicyt under project tic95-0453 many advantages when dealing with the uncertainty and vagueness of the robot sensors . the two fusion algorithms are demonstrated with a mobile robot, nomad 200, performing navigation tasks, first in simulated environments and later in an office-like environment in the real world. the",NOTUTILIZE,MENTION
23285314,24253848,"ties of mobile devices, we extended them to include a much richer set of context information. 2.2 ontology-based profile data initially, in our framework we modeled all contextual data by using cc pp . however, cc pp has many shortcomings when it comes to model non-shallow profile data like e.g., user activities. indeed, cc pp vocabularies define both the semantics of each attribute and the list o",NOTUTILIZE,NOTALGO
121250441,109669497,"thods 18, 31 , methods based an topological viewpoint 3, 33 and the origin of spurious solutions. in this paper, we review these results and extend this approach to equations of magnetic diffusion b t curl e , e 1curl",NOTUTILIZE,NOTALGO
202911163,240979984,"ermining the optimal mapping is thus a matter of selecting the set of pairs which are overall most similar. this is an instance of the assignment problem and we use the well known hungarian algorithm to solve it. scoring once the optimal mapping is established, we merge the two input graphs and score the merged graph. there are a number of scoring methods one could use. one might use the scores a",UTILIZE,USE
56521174,55855336,"d instead of signed permutations, as well as operations like insertions and deletions of gene segments. extending the so-called hannenhalli-pevzner theory for sorting signed permutations by reversals , el-mabrouk proposed some algorithms allowing to consider some restricted cases of insertions and deletions 4 . based on el-mabrouk s work, marron, swenson and moret proposed approximation algorithm",NOTUTILIZE,MENTION
11679819,12491785,"sing a maximum-likelihood approach to estimate the parameters is not directly possible 11 . instead, we use an iterative expectation maximization algorithm for learning the stochastic dynamic process . 4.1 em with condensation to learn the arp, we rely on the condensation algorithm 12 . the condensation algorithm is, in essence, a particle filter approach which approximates a multivariate distrib",UTILIZE,USE
9717012,10305381,"ccepted characterizations of genetic algorithm or genetic programming. the population of the proposed algorithm is the set of cluster representatives, each individual is a color representative in the 3 real subspace that defines a cluster in the color space of the image pixels via the voronoi tesselation induced by the whole population. the main evolutive operator is mutation. the mutation operat",NOTUTILIZE,NOTALGO
202714461,240694802,"lated in terms of conditions about hosts that trigger executions on other hosts and flexible assembly of such (basic) algorithms over topologies expressed using groups of hosts. we have employed awed , a language and execution system for aop of distributed applications, to implement such grid algorithms. in the following we first introduce the main concepts of the awed language followed by a descr",UTILIZE,USE
27391232,28099513,"ightened formulations are considered as reformulations 96 . an effective and novel nlp solution algorithm based on blending two completely different formulations for the same problem is described in . the mathematical programming glossary 84 defines reformulation as obtaining a new formulation of a problem that is in some sense better, but equivalent to a given formulation. the main purpose",NOTUTILIZE,MENTION
8332452,8767674,"as the multiresolution preprocessor and tree-structured-vectorquantization (tsvq) as the clustering postprocessor. we have applied the resulting wtsvq algorithm to various atr problems based on radar 5 6 , isar and face recognition problems 7 . we have established similar results on atr based on flir using polygonization of object silhouettes 8 9 as the multiresolution preprocessor. incor",NOTUTILIZE,MENTION
30412887,31134065,"the open racing car simulator (torcs) 1 . in section 3, we present neuroevolution with augmenting topology (neat), the off-line neuroevolution approach that has been extended for on-line learning in . in section 4, we overview on-line neat, on-line rtneat and the four evaluation selection strategies we compared. in section 5, we discuss the published work that relates to our study. in section 6,",UTILIZE,EXTEND
5736885,5937258,"e time of o(n 3 ), if implemented properly. in the case where the underlying bipartite graph is sparse and has m edges the most ecient algorithms achieve a running time of o(n 2 log n mn), see e.g. . an up-to-date review on the linear assignment problem can be found in 4 . a discussion of further interesting topics related to the linear assignment problem and its variants can be found in 3 . i",NOTUTILIZE,MENTION
14486814,15535491,"enable open dre systems to adapt to dynamic changes in resource availability and demand. in earlier work we developed adaptive resource management algorithms (such as eucon 9 , deucon 10 , hysucon , and fmuf 12 ) and architectures, such as hidra 13 based on control-theoretic techniques. we then developed fcorb 14 , which is a qos-enabled adaptive middleware that implements the eucon algorit",NOTUTILIZE,MENTION
84756332,81827824,"96; overton, 1988). we further show that the above novel optimization formulation can also be extended to lmnn (weinberger et al., 2005) and low-rank matrix factorization for collaborative filtering ( ). secondly, in contrast to the full eigen-decomposition used in many existing approaches to metric learning, we will develop novel approximate semi-definite programming (sdp) algorithms for dml-eig a",NOTUTILIZE,NOTALGO
14446547,15492552,"the one introduced in 27 . related prior work for region based segmentation using curve evolution implementation is by l. cohen 12 , 13 , paragios-deriche 21 , 22 , 23 , tsai, yezzi and willsky , among other work mentioned in 27 . we also mention the segmentation model by zhu-yuille, in a probabilistic energy minimization approach 30 . 2 description of the proposed models 2.1 the case of o",NOTUTILIZE,MENTION
84442617,81565034,"should not be constructed deterministically furthermore, it should be independent of the noise. in our experiments we use the hutchinson method, because its trace estimator has the smallest variance . 4 adaptive selection of sample size in this section we describe two algorithms for determining the sample size sn in the nth stabilized gn iteration. algorithm 1 adapts sn in a brute force manner. a",UTILIZE,USE
28525403,29245271,"and stack space required for execution. in the context of a call-by-value language, minamide 1999 showed that a cps transformation is space-efficient using a cost semantics. sansom and peyton jones used a cost semantics in the design of their profiler. cost semantics are also used to describe provably efficient implementations of speculative parallelism greiner and blelloch, 1999 and explicit",NOTUTILIZE,NOTALGO
25850508,26605657,". we present a method to set a priori preferences for certain objective functions that bias the optimization process to the desired objective space regions extending the adaptive hypercube repository . the adaptive hypercube strategy for real objective values is based on the histogram technique. the objective space occupied by individuals in the repository is separated in hypercubes n h i ,",NOTUTILIZE,NOTALGO
23713847,24645862,"nd processing power in small mobile devices call for different approaches. in that respect, 1smany fast algorithms specifically designed for encrypting a particular multimedia data have been proposed . however, a number of these algorithms have been shown to be insecure 6, 7, 8 . many encryption algorithms for digital images and videos are based on encrypting only certain parts of the bitstream i",NOTUTILIZE,MENTION
5022782,5190553,"yield a bias-optimal policy. we note that our algorithm uses a successive approximation method for solving nested equations, similar to those that have been theoretically studied in the or literature . also, convergence proofs are known for related gain-optimal algorithms 8 . we are currently working on extending these results to our algorithm. ffl scale-up test on more realistic problems: in thi",UTILIZE,USE
52250194,51857153,"an tatonnement style price updates lead to convergence accordingly, in this paper we propose a simple market model in which the market extends over 1 of the referenced papers, only one formalization is a discrete algorithm, and, as we make more specific later, it may not converge quickly. 2time and trading occurs out of equilibrium (as well as at equilibrium). we call this the ongoing market. h",NOTUTILIZE,MENTION
462251,494432,"is to o(n ). another notable predecessor to our work is the celebrated computation of millions of zeros of the riemann zeta function near z 1 2 i10 20 by odlyzko, using an algorithm of schonhage , which formed the basis of a careful comparison of the spacings of riemann zeros with those of eigenvalues of random matrices. this algorithm was not precisely a multipole algorithm, but it made use",NOTUTILIZE,MENTION
108364935,100168140,"pulsed discharge which is able to produce a compressedsdense plasma at the end of its coaxial electrodes. this device has been found to be an intense source ofsneutrons, x-ray, ion and electron beams . the radiation output from the plasma focus device can besused in many applications including x-ray imaging, lithography and surface modification of materials. onesof the factors that dictates the fi",NOTUTILIZE,NOTALGO
27844403,28556061,". the consideration of all possible options at each stage of the interpretation process is computationally intractable. scusi uses two computational devices to generate interpretations in real time: an anytime algorithm 6 , and (2) a processing threshold. the anytime algorithm ensures that the system can return a list of ranked interpretations at any point after completing an expansion. in each",NOTUTILIZE,MENTION
58785294,58069802,"ons. for this reason, we have chosen to solve the segmentation problem using a graph partition greedy algorithm with superlinear time complexity. the proof of the time complexity can be found in ref. . nevertheless, after the analysis and implementation of this algorithm, two types of problems arose: the existence of hard-constraints which produce inadequate segmentations, and high-variability reg",NOTUTILIZE,NOTALGO
5931207,6146723,algorithm is more efficient than previous algorithms. we have implemented this algorithm and used it to find tree decompositions of graphs used in the hpkb project 14 and in the cyc knowledge base . one of those graphs had 570 vertices and treewidth greater than 23 (the width achieved by our decomposition was 70; we do not know the actual treewidth). there was no way to treat this size of graph,NOTUTILIZE,NOTALGO
39132005,37712435,"architecture like tpsn that increases the energy requirements of the network and has much lower precision than the tpsn itself. other algorithms like the lightweight tree based synchronization (lts) algorithm offer very lowcost synchronization, but with very limited accuracy and thus limited applicability. most of these algorithms have been tested only on simulation platforms or in laboratory ex",NOTUTILIZE,NOTALGO
5055958,5227503,"tions are reported to a central processor which also discards duplicates. linear algebra. for c62, c93, and c124, we used our unoptimized implementation of wiedemann s algorithm 42 as described in to compute a vector in the kernel of the matrix modulo the large prime divisor r of the group order. for c155, it will be necessary to optimize our implementation and most likely add structured gauss",UTILIZE,USE
83793028,81008084,"forming problem, a combination between the finite element method and the response surface method is proposed. the response surface methods have been widely developed in nonlinear reliability analysis . several authors have proposed solutions to improve the accuracy of results, to decrease the number of necessary numerical calculations on fem codes and to increase the robustness of the algorithms.",NOTUTILIZE,NOTALGO
202575785,240497088,"ad of an axial ascan. the jones matrix of the sample is obtained from the spatial frequencies of the b-scan. fiber-induced birefringence is compensated by using the algorithm developed by park et al. although this system requires highly dense transversal scan, we can measure various biological samples with high speed and high sensitivity. chapter 3 is focused on the application of the pssd-oct fo",UTILIZE,USE
