contextID,citationID,clean__citation_context,UTILIZE_LABELS,USAGE_LABELS
83320789,80618629,"onvex objective over convex regions, the class of scaled gradient projection algorithms 16 is appropriate for providing a distributed solution with fast convergence rates. a. routing algorithm (rt) consider node i d(w). omit the session index w for brevity. at the kth iteration, the routing algorithm in 2 updates the current routing vector k i by k 1 i rt ( k i ) k i (m k i )",NOTUTILIZE,MENTION
23653519,24590035,"raphs 18 . however, these algorithms tend to be impractical1. the following simpler procedure will work for us, causing only a small constant 1we could use the o(n2 log n) approximation algorithm in to get fi 2 and ff 2. here, n is the total number of nodes in the graph. 3sloss in our approximation ratio. we will find the cheapest pair of nodes to connect (minimum ki(u; v)) and match them. w",UTILIZE,USE
18581326,19771443,"ations before evaluating the selection condition in sql queries. dyreson and snodgrass 18 also describe efficient data structures and query processing algorithms for their approach. dekhtyar et al. extend the relational data model and algebra with probabilistic temporal indeterminacy. they define a theoretical annotated temporal algebra on large annotated relations, and a temporal probabilistic",NOTUTILIZE,NOTALGO
8280822,8708873,aper we used 2 0.15 . the value of 1 is determined by the fact that 1 2 1. a.4 rewriting to presence weighting algorithm similar to the probabilistic model of robertson and sparck-jones probability measures for ranking documents can be rewritten into a format that is easy to implement. a presence weighting scheme (as opposed to a presence absence weighting scheme) assigns a zero wei,NOTUTILIZE,NOTALGO
202621798,240563979,"gonal schema d has complexity o(gn), so the complexity of d is o(g3n). we then compute the shortest cycles in d that is freely homotopic to the boundaries of d, using an algorithm of frederickson ; see also 6, lemma 3.5(d) . given a combinatorial annulus of complexity n , frederickson s algorithmsnds a shortest generating cycle in o(n log n) time. thus, we computes in o(g3n log(g3n)) o(g3n",UTILIZE,USE
14107233,15132415,y projection map computed from an image sequence. the paths used by the vesicles appear as bright filaments. the maximum intensity projection imap has been simplified using the algorithm described in .,NOTUTILIZE,MENTION
43669065,42299252,"given by explicit positive combinatorial formulas which we will not reproduce here; see 4 for details. in 4 , the theory of an 1 schubert polynomials 24 was extended to types bn, cn and dn (see for an alternative approach). in each case, the corresponding generalized flag variety of order n naturally projects into the one of order n 1. this yields maps on the corresponding cohomology rings",NOTUTILIZE,NOTALGO
71744502,70816119,"mages to results obtained on the same images when artificial gaussian noise is added. this is (the common way) to simulate increased noisy data. abutaleb s higher-order entropy binarisation algorithm is used to assist the comparison between the three operators. section 2 introduces the basic concepts of our paper, including a summary of the edge detectors used. section 3 covers which data we use",UTILIZE,USE
19338095,20541630,described as follows: 1. find a spanning tree t of g with (t) 1. 2. find an optimal edge ranking of t . in the first step we use a 1-absolute approximation polynomial-time algorithm given in . the problem of finding an optimal edge ranking of a tree is polynomially solvable 7 . in the following is used to denote the maximum degree of a spanning tree of g whose maximum degree is as sm,UTILIZE,USE
76116072,74497243,"from a practical point of view, our algorithm is very simple to implement and runs very fast. its performances compare very favorably to alternative deconvolution algorithms in the literature such as over a large set of test images. 1.3. paper organization the paper is organized as follows. section 2 briefly reviews wavelets and besov balls. section 3 describes the block thresholding-based deconv",NOTUTILIZE,MENTION
30394004,31117190,"systems. along one line, this research has focused on the design of better peer-to-peer algorithms, especially in the area of structured peer-to-peer overlay networks or distributed hash tables (e.g. ), which we will simply call dhts. these systems map a large identifier space onto the set of nodes in the system in a deterministic and distributed fashion, a function we alternately call routing or",NOTUTILIZE,MENTION
19487043,20695093,"or bw0. preprint submitted to elsevier science 27 october 2006skey words: text compression, burrows-wheeler transform, distance coding, worst-case analysis 1 introduction in 1994, burrows and wheeler introduced the burrows-wheeler transform (bwt), and two new lossless text-compression algorithms that are based on this transform. following 20 , we refer to these algorithms as bw0 and bw0rl. a wel",NOTUTILIZE,MENTION
43449194,42007660,"rithms proceed by a reduction to a few factorizations of polynomials with coefficients in some finite field fq (with q a prime power): see the books by berlekamp, knuth, or von zur gathen and gerhard . several of the algorithms for factoring polynomials over finite fields involve what is known as the distinct degree factorization. to wit, let fq x be completely factored as nj j , wher",NOTUTILIZE,MENTION
34610025,34551539,"cluding real-world instances. the results show that the proposed algorithm is able to solve to optimality the small-sized instances in a reasonable computing time. two heuristics are also proposed in . the first one, h1, is an adaptation of the algorithm proposed by baldacci and dell amico 4 for the multi-depot cmrsp and is executed at the root node of the enumeration tree. the second heuristic,",NOTUTILIZE,MENTION
12184309,13046339,"ude the following. (apart from the relevant papers, a detailed summary of this work can be found in the survey article 14 which will appear shortly in the ams contemporary mathematics series.) in , i obtain the first single exponential time algorithm for computing the first betti numbers of semi-algebraic sets, where is allowed to be any fixed constant. we describe an algorithm that takes",NOTUTILIZE,MENTION
66221022,64986677,"as an algorithm for approximating the mb(t) using only v variables. unlike iamb, the iamb variants, and gs, the ks algorithm does not provide any theoretical guarantees of discovering the mb(t). pc ( ) is a prototypical bn learning algorithm that is sound given the stated set of assumptions. pc learns the whole network (and so it does not scale-up well) from which the mb(t) can be easily extracted",NOTUTILIZE,MENTION
202847597,240888060,"ned as in (6) a p 0 0 0 1 0 0 2 0 1 0 3 0 0 1 (24) a is a basis of l l(a). in order to find a vector m with small coefficients (in absolute value), we use the lll algorithm , which gives us the approximated reduced basis lll(a) 1332 1562 3497 9 1629 3191 306 297 3191 306 297 1629 306 297 1629 3191 (25) we remark that the first vector of lll(a) has",UTILIZE,USE
202919146,240990853,"lusterings are not available. in addition to eac-al, we also list the results obtained with three well-known graph-based cluster ensemble algorithms: hbgf 26 , cspa 21 , and mcla 21 . we use metis as the method that partitions the graph into final clusters. among the three, only cspa is based on coassociation matrices. the computational complexities of hbgf and mcla are both linear with respec",UTILIZE,USE
14974537,16055442,"ther complete or approximate algorithms. complete algorithms are guaranteed to find for every finite size instance of a co problem an optimal solution in bounded time (see papadimitriou and steiglitz , nemhauser and wolsey 73 ). yet, for co problems that are np-hard 41 , no polynomial time algorithm exists, assuming that p np. therefore, complete methods might need exponential computation tim",NOTUTILIZE,MENTION
21365111,22503003,"ted or decreased. the coherence overhead is classified by means of an extension of an existing algorithm 14 to the case of passive sharing, finite size caches, and process migration. this algorithm is based on the analysis of access patterns to data.s3 methodology and workload the methodology that we used is based on trace-driven simulation 20 , 15 , 27 and on the simulation of the three ke",NOTUTILIZE,MENTION
57037864,56368827,"cenario presented in this chapter uses a combinatorial approach, and its main originality w.r.t. the other combinatorial algorithms, which allow to extract patterns from several datasets (e.g., spexs or drim 9 ), is that the maximal support threshold is set explicitly. this is particularly interesting, when there is a clear semantic cut between a positive and negative datasets, i.e., the negativ",NOTUTILIZE,MENTION
27888366,28601139,"d by at least the desired precision ). if such a separation oracle exists and can be computed in polynomial time, op 1 and algorithm 1 have three theoretical guarantees (tsochantaridis et al., 2004; ): polynomial time termination: algorithm 1 terminates in a polynomial number of iterations, and thus overall polynomial time. algorithm 1 cutting plane algorithm to solve op 1. 1: input: (x1, y1), .",NOTUTILIZE,MENTION
202792717,240810698,"et al., 2007a, b). in our analysis, we use the land and ocean aot retrievals from the modis aqua instrument, valid at 550 nm, from the collection 5 modis algorithm products (remer et al., 2005, 2008; ). the retrievals are made at a nominal 10 km",UTILIZE,USE
2433542,2567223,"vs. the key) and a precision error (number of wrong coreference links, i.e. present in the response but absent from the key). the muc scoring method isn t always meaningful. we have shown elsewhere ( ) that it is too indulgent, and have proposed new algorithms which seem to us more relevant, named here core-mr and exclusive-core-mr . 4 results and comments the three heuristics h1, h2, h3 have b",NOTUTILIZE,MENTION
1238558,1318457,"ence of a large number of hidden variables --- g:r(t) for every g; t, as well as a:acluster for every a. the main technique we use to address this issue is the expectation maximization (em) algorithm . however, in applying em in this setting, we have to deal with the large scale of our model. as we discussed, although our prm model of fig. 1(a) is compact, it induces a complex set of interactions.",UTILIZE,USE
17787182,18967486,"p of the framework is not affected by the size of the dataset. hence, it may be worthwhile to apply more sophisticated graph-based balanced partitioning algorithms in step 2 (karypis and kumar, 1998; ). further, the populate and refine stages are quite efficient and provide the guarantee that each cluster will eventually have the pre-specified minimum number of points. as seen from the experimenta",NOTUTILIZE,MENTION
6517441,6803614,"ote states in the composed machine. 1.1.1 algorithms for the supervisor synthesis problem. two algorithms for the original supervisor synthesis problem specified by ramadge and wonham can be found in . an algorithm for the supervisor synthesis problem for restricted ctl specifications is described in ant95 . this last algorithm is based on a labeling scheme, which was used for the model checking",NOTUTILIZE,MENTION
223037110,190621918,"ormed with linear activation functions.spreliminary backpropagation training of the several mlps was accomplishedsusing both ordinary gradient descent and the levenberg marquardt (lm) approxi-smation ; they produced similar results. however, for the actual mlp trainingsordinary gradient descent with momentum was chosen over the ordinarily faster lmsalgorithm due to implementation problems explaine",NOTUTILIZE,MENTION
111348528,102364126,"aliency measure in order to detect robust features, we use an extended version of the saliency-based model of visual attention 19 . the saliency-based model of attention has been firstly reported in and gave rise to numerous soft and hardware implementations. for more details on the saliency-based attention model, the reader is referred to 21, 17 . the model of attention computes a saliency map",UTILIZE,EXTEND
5730314,5930658,"n be as low as 10 k for single ropes. other authors have suggested that this upturn may signal a condensation of the system to form a collective charge- or spin- density wave ground state in the tube , 9 . however, the observed dependence of this crossover on the sample morphology and quality suggests that disorder or other three-dimensional effects may actually control this low-temperature behav",NOTUTILIZE,NOTALGO
81191312,78852614,"les et d attraction entre les ressorts jusqu obtention d un quilibre permet d obtenir un dessin de graphe o les sommets ne se chevauchent pas et o les ar tes ont une taille relativement uniforme . l algorithme 1 pr sente une version g n rique de cette approche. dans la version pr sent e ici, tous les sommets se d placent simultan ment, mais d autres variantes incluent le d placement du sommet",NOTUTILIZE,NOTALGO
8862249,9350635,"citly use domain knowledge during feature construction (e.g., miro). this paper describes two methods for using domain knowledge in feature construction, and outlines their implementations in citre , matheus, 1989 . experimental results are presented that demonstrate the successful application of these methods on a tic-tac-toe classification problem. citre citre is a decision-tree-based learni",NOTUTILIZE,MENTION
29147102,29825651,"undle adjustment. it exploits the sparse structure of the jacobian and every iteration of the algorithm involves solving a sparse linear system. a detailed description of the algorithm is provided in , and forms the basis of the implementation used in this thesis. b-3 the min-cut max-flow problem a flow network g(v, e), is defined as a fully connected directed graph where each edge (u, v) e has",NOTUTILIZE,MENTION
202435059,240295897,"e example of fig. 2, whichssolution is better among the two found and presented on fig. 3 and fig. 4. solution presented insfig. 3 is obtained by using a partitioning tool based on a heuristic method . solution in fig. 4sis obtained by using our algorithm. our idea is that after the partitioning of the dsm, the remainingsupper diagonal elements of the matrix, which represent the remaining iteratio",UTILIZE,USE
5118534,5296862,"e convex program, and transformation to a constrained nonlinear program which wassrst proposed by homer and peinado 13 and further developed by burer and monteiro 7 and burer, monteiro, and zhang 9 . details concerning the convergence of the feasible start dual scaling algorithm and its advantages over primal-dual methods can be found in 3 and 21 . the advantages of the algorithm are as fo",NOTUTILIZE,MENTION
25955793,26701932,"in) num. pts. femur 2 939 golf club 12 16864 foot 15 20021 bunny 23 35947 the running time is dominated by the time required to compute the delaunay triangulations. hull uses an incremental algorithm , so the running time is sensitive to the input order of the vertices. the triangulation algorithm builds a search structure concurrently with the triangulation itself; the process is analogous to sor",NOTUTILIZE,MENTION
8746893,9223421,"mance results in support for our recursive approach are also presented. 1 introduction today block-based algorithms are the standard in state-of-the-art software for dense linear algebra computations . these algorithms perform most of their computations in calls to high-performance level 3 blas 3, 10 . the level 3 blas obtain most of their performance by data rearrangements and the use of high-pe",NOTUTILIZE,MENTION
118046672,107262400,"k2m3) time, where n and m are the number of vertices and edges of the input graph, respectively. this is an improvement over the o(k3nm3 k2n4m5) guaranteed by the general algorithm applied for k 3 and it is the same running time as for the minimal 2-vertex connected spanning subgraphs generation problem. 1.2. the x e y method in this section we recall a technique from 10 , which is a varia",NOTUTILIZE,NOTALGO
86233918,83053456,"ults are compared with the results obtained for potential field-based algorithm given in 15 referred to as pf hereafter, dssa and idca algorithms given in 19 , and the basic vec algorithm given in . the algorithms are compared with respect to three criteria: coverage, node separation, and distance. - coverage: fraction of the area which is covered by the deployed network. coverage is specified",NOTUTILIZE,MENTION
27109577,27830743,"t scenario and our solution has been extended with a fully-fledged rule-based data mediation 6 . in order to address the sws challenge requirements, we base our solution on the specifications of wsmo , wsml 9 and wsmx 12 providing a conceptual framework, ontology language and architecture for semantic web services. the overall contribution of our work is to show: (1) how flat xml schema of roset",NOTUTILIZE,NOTALGO
4643007,4797426,") special case of the problem is max cut problem with given sizes of parts where for some psn 2 , x 1 delta delta delta x p 0 and x p 1 delta delta delta x n 1. ageev and sviridenko applied a novel method of rounding linear programming relaxations and developed a 1 2 -approximation algorithm for this problem. they also obtained a similar result for a more general max k-cut probl",NOTUTILIZE,MENTION
34612352,34554163,"aints. after showing that the problem falls in the class of capacitated multi-commodity flow problems, and therefore it is npcomplete, they proposed some heuristic algorithms to solve it. neri et al. applied their approach to an actual isp network topology, similar to the one adopted by one of the largest isps in italy, by estimating the power consumption of nodes and links with realistic figures",NOTUTILIZE,MENTION
202414478,240267162,"ing from models of dendrites and axons. we began by generating the dendrites and axons of both msns and fsis using stochastic models (figure 2a). for the dendritic trees we used an existing algorithm that has been successfully applied elsewhere. however, some key parameters for this algorithm require data that are typically unavailable for most neuron types. we overcame this problem by finding th",UTILIZE,USE
15991111,17109181,"8 . it is not clear, whether we can apply the technique of the randomized associative algorithm by rajagopalan and schulman rs00 in connection with the quantum walk search schema of magniez et al. . some quantum query lower bound remain open. are we able to prove a nontrivial lower bound for the group problem. our upper bound for this problem is",NOTUTILIZE,MENTION
17840095,19021485,"11 and gaston 33 2 . as free tree databases are graph databases, we also include graph mining algorithms in our experimental results; more precisely, we consider the breadth-first graph miners fsg and acgm 21 , and the depth-first graph miner gspan 45 . here we also use two metrics: the total running time and the memory usage. except when stated otherwise, experiments were done on a 2.8ghz i",UTILIZE,USE
29449337,30114848,ive feature models 4 : for each feature model we simulated 1000 random manual configuration processes (scenario m). at each step we enumerated minimal models. (algorithmic details can be found online .) we also counted how many times there was exactly one minimal model: at those steps the configuration process would have been completed if the user invoked the shopping principle function. the resul,NOTUTILIZE,MENTION
42086967,40471561,"to the objective of comparison, it won t be addressed in this document. instead, we recognize tree comparison visualizations in this section, for surveys of single tree visualizations please refer to . this related work has been categorized in three areas according to each project s focus: topological comparisons, node value comparisons and algorithmically oriented approaches. 2.1 topological comp",NOTUTILIZE,MENTION
2092373,2213692,"n s fully-interpretive javainjava virtual jvm 17 , but is some way from matching the approaches discussed earlier based on the jdi virtualmachine.redefineclasses() feature 13 and using breakpoints . veneer is at an early stage of its development, and we expect to improve its performance substantially. the implementation whose performance is reported here suers a substantial overhead at each fr",NOTUTILIZE,NOTALGO
138585,140789,"within clusters, i.e. only our extended ipet can be used within clusters, but is planned for future work. the extended ipet and clustered calculation method both rely on the mixed ilp solver lp solve to solve generated constraint systems. all measurements were performed on a amdathlon 1800 with 512 mb ram. since the v850e processor used does not have a cache, cache analysis was not included in t",NOTUTILIZE,MENTION
2342851,2477883,"o send ahead large frames which need to be displayed later when there is enough buffer space at the client. there has been considerable research in this area resulting in several smoothing algorithms . these differ in the optimality condition achieved, and whether they assume that the rate is constrained or the client buffer size is limited. a good comparison of bandwidth smoothing algorithm is gi",NOTUTILIZE,MENTION
7651871,8007322,"query processing algorithm. since the inquery system uses an inverted file index, and we are not interested in changing the query processing algorithm, we do not discuss signature files. zobel et al. investigate the efficient implementation of an inverted file index for a full-text database system. their focus is on compression techniques to limit the size of the inverted file index. they also ad",NOTUTILIZE,MENTION
42094840,40478759,"research makes finding a portable method of provenance collection vital. to that end, we are exploring hypervisor-based provenance collection. in this paper, we propose an approach for extending xen to transparently collect operating system-level provenance from its guest vms, without requiring any modifications to the guest kernel. although we expect our approach to be implementable across a va",UTILIZE,EXTEND
1763237,1867190,"on with the incremental rank estimation technique proposed in 20 . reliable software for both decompositions as well as auxiliary routines for the incremental rank estimation, are provided in lapack . notice that in contrast with alternative algorithms 8, 12, 11 , a single rank determination is performed involving e. in all subsequent computations the preservation of the triangular form and of t",NOTUTILIZE,MENTION
4237936,4380682,"interesting. mimd algorithms are ecient at rapidlysnding the amount of available bandwidth, but it is believed that they lead to instability as well as unfair sharing of resources; see chiu and jain the other hand, it has been observed for some time ( 5 , 10 , 11 ) that if most hosts follow aimd ( are altruistic quot;) then aggressive individual hosts are able to subvert aimd congestion control i",NOTUTILIZE,MENTION
24922869,25756603,"n section 3.sas a solution to this problem, we present sns in section 4. we also discuss the requirements, and design sns, and define the interface of it using the interface definition language (idl) . section 5 describes the implementation architecture, and in section 6, we present the performance evaluation of our implementation. finally, we drew a conclusion in section 7. 2. corba-based tmn fra",NOTUTILIZE,NOTALGO
10081694,10703966,"bly improved (51 savings in space and 36 savings in execution time, on average). fig. 1 shows how the cdfg of the runge-kutta program was mapped onto the basic array by the simple mapping algorithm , and then refined by sa. however, sa is often too slow for realistic applications. to improve its convergence, one can make additional use of the problem-specific information. another possibility is",NOTUTILIZE,MENTION
42319375,40682339,"ranking constraints) plotted against the number of weak learners. as a final test, we ran our boosting algorithms on several multiclass classification tasks from the uci machine learning repository ( ), using the connect4 , letter , pendigits and satimage datasets. all experiments used the multiclass extension to the hinge loss (crammer singer, 2002), along with multiclass decision stumps",NOTUTILIZE,MENTION
43678418,42310969,"ion, the lower dimensional cases were discovered in the physics literature. the case n 2 is the eguchihanson metric eh and the case n 3 (the deformed conifold) is due to candelas and de la ossa . in what follows we will first describe the cotangent bundle of the sphere as a complex affine quadric following sz",NOTUTILIZE,NOTALGO
9014360,9520722,"load is about equally distributed among processors. this paper is organized as follows. in section 2, we describe the fast multipole algorithm. for mathematical foundation of this algorithm, refer to . section 3 describes the implementation of mpifma in details. partial results are also presented. the possible enhancements of mpifma and the goal of this project is listed in the last section. 2 fas",NOTUTILIZE,MENTION
85179424,82181580,"ion to execute in a given state. more recent planners to employ determinization that are, in contrast to ff-replan, successful at dealing with probabilistically interesting problems include rff-rg bg . at the same time, the latter kind of algorithms typically invokes a deterministic planner many117 more times than our techniques do. this forces them to avoid the all-outcomes determinization, as t",NOTUTILIZE,NOTALGO
