contextID,citationID,clean__citation_context,UTILIZE_LABELS,USAGE_LABELS
174134989,154951860,"s study at our institution using pre- and postbundle implementation measures found no effect, but that study was an ecological design and was not able to evaluate individual patient bundle compliance . with these signatures, we will be able to give a higher resolution evaluation of the effect of the ventilator bundle. we can also work towards developing real time compliance monitoring of the venti",NOTUTILIZE,MENTION
155194091,136458437,"f the localizing network took on average 1 day for 10,000 epochs using the fann library. the runtime speed of the complete pipeline on one cpu core is on average 0.008 seconds per image. whelan et al achieved a run-time speed of 0.03 seconds using a cuda implementation of visual odometry for dense rgbd mapping on an intel core i7-3960x cpu at 3.30 ghz, and an nvidia 680gtx with the approximate pr",NOTUTILIZE,NOTALGO
83450675,80724567,"gorithm (4) converges to a neighborhood of f . we can force the algorithm to converge exactly to f by letting the function ( ) and the step size in (8) to be time varying. this is considered in . we finish the section by detailing the choice of parameters and . as required by the nesterov gradient algorithm, the step size apple 1 l , where l is a lipschitz constant of the gradient of (",NOTUTILIZE,MENTION
9912471,10519003,"we show the impact of some of our design choices using some example programs as well as some benchmark programs from the splash-2 suite 25 . though similar work has been demonstrated with softflash , our implementation is completely in user space and thus more portable. some other research has studied the effect of clustering in smps using simulations 11 . we have shown results from runs on an",NOTUTILIZE,NOTALGO
25616237,26393974,"m the task allocation and the schedulability analysis some assumption about the underlying scheduling strategy must be made. in this paper tasks are scheduled by a preemptive, fixed priority algorithm . tasks can be activated either periodicly with a certain period or sporadicly with a minimal inter-arrival time. a task may send messages at the end of each computation to one or more other tasks. th",UTILIZE,USE
15409887,16508208,"edom. therefore, different approaches have been introduced to avoid dense matrices: for rotational invariant geometries, the matrix k is likely to have toeplitz structure, which can be exploited (cf. ) by algorithms based on the fast fourier transformation. if the underlying geometry can be described by a small number of smooth maps, wavelet techniques can be used for compressing the resulting mat",NOTUTILIZE,MENTION
500659,534092,"liptic curves. condition c2 is meant for preventing that j(c; f q n) could be imbedded into asniteseld f (q n ) k with a small k. condition c3 is intended to resist the adleman-demarrais-huang method . their method is a heuristic, subexponential algorithm for discrete logarithm in a certain subgroup of jacobians where the jacobian is dened over a large genus hyperelliptic curve. therefore the gen",NOTUTILIZE,MENTION
14486816,15535497,"n resource availability and demand. in earlier work we developed adaptive resource management algorithms (such as eucon 9 , deucon 10 , hysucon 11 , and fmuf 12 ) and architectures, such as hidra based on control-theoretic techniques. we then developed fcorb 14 , which is a qos-enabled adaptive middleware that implements the eucon algorithm to handle fluctuations in application workload and",NOTUTILIZE,MENTION
57988993,57246943,"sms using lrc. it reads the input frames given by the user and converts into a framing sequence. the arm processor is configured to act as a error detection and correction unit for the physical layer . the hardware (figure 3) functions as a self-healing physical layer implementation in future embedded web server. the receiver receives the information, detects and corrects errors and retransmits it",NOTUTILIZE,NOTALGO
65750824,64522602,"natural change of the sun position. the improvement we propose is based on varying the pe threshold as a function of the number of edges of a background image, using the boninsegna-bozzoli algorithm for background extraction and updating. the threshold varying rule is: pe if pedge pe pe (16) fs pe if pedge pe where pedge is computed on the background image, and fs is a factor great",UTILIZE,EXTEND
1130215,1205201,ur own implementation of kruskal s algorithm. we used the default divide-and-conquer delaunay triangulation algorithm based on exact arithmetic. concorde: the mst algorithm from the concorde package (release 99.12.15). it is based on an algorithm from bentley 1992 using k-d trees and is a variant of prim s mst algorithm. the current release of concorde only provides an implementation for 2-d.,NOTUTILIZE,MENTION
120690960,109243931,"es in flooding between experimental areas, herbivory manipulations and site contributions to changes in population growth rate,s , we extended life table response experiment (ltre) analysis methods ( ) to include nested designs. using both ltre analysis and stochastic demographic analyses, we estimated the separate and interacting impacts of changes in herbivore community and flooding probability",UTILIZE,EXTEND
12648784,13556302,"oncern of piazza 2 . concessions to the completeness of query results are mentioned, but not discussed in detail. new algorithms usable for safe pruning during query reformulation are contributed in . however, they are independent from information quality, which according to the authors remains an open challenge. additionally, this pruning approach involves non-local coordination between peers, w",NOTUTILIZE,MENTION
6262556,6506291,"s encourage the application of nsga-ii to more complex and real-world multi-objective optimization problems. 2 elitist multi-objective evolutionary algorithms in the study of zitzler, deb, and theile , it was clearly shown that elitism helps in achieving better convergence in moeas. among the existing elitist moeas, zitzler and thiele s 13 strength pareto ea (spea), knowles and corne s pareto-ar",NOTUTILIZE,MENTION
13918582,14932363,re the relationship with knapsack problems or consider the applicability of k-shortest paths algorithms 21 . k-shortest paths the literature on k-shortest paths algorithms is extensive; see eppstein for an introduction. much of the literature is motivated by applications involving multi-criteria or constrained optimization: the algorithms are used to generate a large number of solutions that are,NOTUTILIZE,MENTION
26819500,27522776,"t variable models, including hidden markov models and linear or non-linear state space models (ssms) for time-series. the algorithm can be re-formulated as a variational optimisation of a free-energy . consider observations collected into a set y , that depend on latent variables x and parameters . we seek to maximise log p(y ) with respect to . by introducing a new distribution over the laten",NOTUTILIZE,MENTION
1418513,1504383,"of the mstp also. another independent discovery of jarn k s algorithm appeared in the article kru56 written by j. b. kruskal in 1956. loberman and weinberger proposed the same algorithm in 1957 too . in 1957 r. c. prim published this algorithm of the mstp in the article pri57 . in 1959 e. w. dijkstra published this algorithm in the article dij59 . in that time the it was improved, so the last",NOTUTILIZE,MENTION
86044154,82885464,"rol of homogeneous azeotropic distillation columns. we consider three azeotropic sequences: conventional direct, side stream and petlyuk (figure 1), which are designed with short design methodologies ; while a multiobjective genetic algorithm coupled to aspen plus 4 is used to perform the optimization task. theoretical control properties are evaluated with singular value decomposition technique,",NOTUTILIZE,MENTION
110479866,101724103,"b-l panel. positions of protein standards are shown in kilodaltons. 1096 flaspohler et al. mol. cell. biol. glycosomal proteins, including the two integral membrane proteins characterized previously , gim1 is very basic, with an isoelectric point of 9.67. as shown in fig. 5, gim1 has significant homology with the human peroxisomal integral membrane protein pex2 (paf1) (44), with 27 identity and",NOTUTILIZE,NOTALGO
29949839,30648385,"malgorithm, with o(nn 2 b n2 h ) complexity, where n denotes the block length and nbnh 65the number of be coefficients. taking a different approach, we then show that the bayesian em (emb) algorithm can also be used to design practical near-optimal be-based soft noncoherent equalizers. for this, we first derive the emb iteration, which alternates between soft coherent map equalization and a part",UTILIZE,USE
14090292,15113814,"le problem. b.1 dependence cost for the smallest enclosing circle for the computation of the smallest enclosing circle, we have used the iterative version of the original recursive algorithm by welzl . the algorithm is shown in fig. 10. even though this algorithm runs in expected o",UTILIZE,USE
53529081,53028898,"he same is true for the o(a) counterterms of the operators. in other words the o(a) cutoff effects, if any, are tree level cutoff effects. for the simulations we used the hybrid monte carlo algorithm with a leapfrog integration scheme. observables are constructed from the correlation functions (we set a 1 and write x (x0,x)) cxy(x0) 1 12l 3 x,y,z with x and y a or p and y 1 (0,x) u1(",UTILIZE,USE
40921081,39415338,"sifiers for this dataset. among these algorithms, the one which provided the best results was chosen as the algorithm for the final classifier. in this case, the sequential minimal optimization (smo) learning algorithm for training a support vector machine classifier was chosen. using leave-one-out cross validation, the precision (percentage of correct predictions) and recall (coverage percentage",UTILIZE,USE
246833,263418,"oach makes intensive use of a restructuring compiler which generates an hpf-conforming code expressing the opus semantics. thus, our approach is very different from runtime based approaches like kelp or hpf mpi 14 where a runtime library is used to coordinate different tasks. by using a restructuring compiler our implementation is open for future extensions or modifications of the opus language",NOTUTILIZE,MENTION
77492918,75675766,"epresent the value function of state-action pair (st, at). there are a variety of neural networks that are applicable to function approximation, and we consider back propagation neural network (bpnn) , one of the most prevailing neural algorithms in dealing with function approximation. as shown in fig. 4, there are three layers in the used neural network, namely, input, hidden, and output layers,",NOTUTILIZE,MENTION
4564055,4716675,"efined. if all its flaws can be removed without adding any actions and the resulting plan pn has a higher quality value than p i then it is returned, otherwise p i is returned. as ambite and knoblock point out, the performance of a rule-rewriting system depends on a number of factors: (1) the algorithm used to produce the initial plan, (2) the search algorithm used for plan-rewriting. two search",NOTUTILIZE,MENTION
22095471,23168804,"dvantages are: i) it is simple as it does not actually require the nxn ip-latency matrix (therefore it can be completely distributed), and ii) it leads to connected topologies if the degree d log2n (see figure 4). we will refer to the centralized and distributed version of this algorithm as ran and dran respectively. 12sfig. 4. visualization of a random graph with n 332 nodes (average degree 2,",NOTUTILIZE,NOTALGO
48351341,48003493,"bvious flaw that they broke space-time symmetries 104, 105, 106, 107, 108 . nevertheless the quest is not completely hopeless. with some reflection it is realised that a simulation of an ising model with 10a metropolis algorithm is a cellular automaton if the definition is relaxed to allow probabilistic transitions. the ising model has a continuum limit in which rotational symmetry is restored.",NOTUTILIZE,MENTION
201860427,239468339,"resulting from the execution of loops and nested loops. in this case, we keep one instance of a method call in a loop and omit the rest. to perform this, we use a string repetition finder algorithm ( ) and a cascading mechanism to consequently reduce all repetitive subtrees. algorithm 1 presents a pseudo code for cascading iteration reduction. given a dynamic call tree t, this algorithm produces t",UTILIZE,USE
202133759,239868857,"e the observed (noisy) phase spectrum or to replace it with an enhanced estimated phase. in order to recover phase information for abe, we use the iterative algorithm proposed by griffin and lim (gl) . let j 2 f0; : : : ; jg be an iteration index, and c (j) be a complex valued matrix generated in the j th iteration. for j 0, we have c (0)(t; f) c(t; f) 1 f f es (t;f) o.w. (2) where c",UTILIZE,USE
41101278,39572733,e will address these issues in this paper to provide better data replication. some other researchers address data access issues in manets considering network partitions. jorgic and stojmenovic et al. introduced several localized algorithms to detect critical nodes and links for connectivity in manets. huang and chen 10 addressed the problem of replica allocation in a manet by exploring group mo,NOTUTILIZE,MENTION
5081613,5255866,"be reduced, but it almost never goes away. hence, the more memory one has the larger the programs that canbechecked. in section 3 we extend the distributed model checking algorithm rst used for spin , that exploits the memory of a number of workstations, to work in the dynamic context of java. section 4 contains conclusions and directions for future work. 2 complexity of the state one of the rst",UTILIZE,EXTEND
97768337,92245534,"viours1. introductionspage 4sas a result of the systematic literature review, we extend the measurement framework of itsservice quality (illustrated in section 5) that was initiated in lepmets et al. . thesframework will be validated in industry through case studies in the next stage of the project.s2.1 previous work - measurement framework for it service qualitysin previous work we described a qu",UTILIZE,EXTEND
56137159,55520229,"erforms accurate alignment of cortical as well as subcortical anatomy. a similar method is now distributed with the widely-used freesurfer software and we expect a similar performance to their method sample registration results with all three registration methods are shown in figure 1. there are two mains steps in our algorithm. first, we extend the surface-based registration to the enclosed 3d v",NOTUTILIZE,MENTION
4945393,5111795,"ect-detection technique to apply under various conditions 2, 5, 21 . to contribute to this base of evidence, we replicated and extended an experiment that evaluates three defect-detection techniques , specifically code reading by stepwise abstraction 14 , functional (black-box) testing 9, 17 , and structural (white-box) testing 8, 15, 17 . there is, of course, no silver-bullet technique, but 1",NOTUTILIZE,NOTALGO
44847711,43771707,"our maps have stacky structure only at the nodes and marked points. to allow for the above correspondence, one needs to extend the notion of the space of twisted stable maps as defined in av02 and so that our twisted curves have generic stabilizers. we approach this problem in three steps: (1) construct the stack gx of",NOTUTILIZE,MENTION
46652908,45836484,"7 descriptor terms and 24.525 non-descriptor terms. we used both alternative and preferred terms in our experiments. the matching process performed by using strategy s1 (see implementation details in ) resulted in a total of 6687 mappings (2330 subclass, 3710 superclass and 647 disjoint relations) obtained by dynamically selecting, exploring and combining 226 online ontologies. fig. 1 shows the co",UTILIZE,USE
39799876,38342725,"paper. ii. ekf slam algorithm the ekf slam algorithm (see algorithm 1) has been widely used for mapping and localization. several authors have described the computational complexity of this algorithm , 10 . with the purpose of comparing ekf slam with the proposed d c slam algorithm, in this section, we briefly analyze the computational complexity of ekf slam. a. computational complexity of ekf sl",NOTUTILIZE,MENTION
83291439,80594595,"reduce the power consumption. in the following section, we first review the principles of distributed arithmetic using offset binary coding and show how it can be used to realize a complex multiplier . then in section 3, we discuss the pipelined complex multiplier. in section 4, the detailed implementation is presented. finally, conclusions are given in section 5. 2. distributed arithmetic distrib",NOTUTILIZE,MENTION
66388117,65155473,"ts revisions of only the paths affected by any previous revision and thus it significantly improves performance. both pc-1 and pc-2 algorithms are described in 15 and their complexity is studied in . mohr and henderson attempt to apply the ac-4 principle to a path consistency algorithm and in 17 they proposed the pc-3 algorithm. visibly, this algorithm is not sound because it can remove consis",NOTUTILIZE,MENTION
66549946,65307863,"quivalent to a smallest enclosing ball problem. the improved version of the cvm 28 uses panigrahy s algorithm 22 to obtain a coreset of size o(1 2 ) in the same number of steps. in another work also proved the existence of coresets of size o(1 2 ) for the problem of separating two polytopes by a hyperplane that goes through the origin, which is a special case of svm variant 1c) and also e",NOTUTILIZE,MENTION
60253384,59653486,"the murayama-pierce model 3 which achieves this goal. for non-supersymmetric models for dirac leptogenesis, see ref. 5 . our spectrum extends from that of the minimal supersymmetric standard model only in the sector that is a singlet under the standard model gauge group. this extension is in the spirit of the nearly minimal supersymmetric standard model nmssm 7 . in the latter, one adds to th",NOTUTILIZE,NOTALGO
63306118,62424144,"reas the computational precision would stay bounded to o(l log p) bits. this argument is a simplification of the routine error analysis of the iterative improvement algorithm (see skeel s80 , higham ); in our simplified case q is in a very special form of p l i. now to ensure correct recovery of z with using rational roundoff, it is sufficient to approximate z by zh within the error norm less th",NOTUTILIZE,NOTALGO
165488504,147007680,"the predictions of non-relativistic quantum mechanics at this unphysical value of . this value of also allows a direct comparison to the discretized light-cone quantization (dlcq) results of ref. . the numerical results were obtained using the hopper cray xe6 at nersc. scalapack software 23 was used for the diagonalization. in this particular implementation of blfq, the resulting matrix is q",NOTUTILIZE,NOTALGO
61093890,60444367,represent another important development in statistics and machine learning. these models are widely used in the engineering and science communities. (see lauritzen 1996 for a systematic treatment and for a recent review from the algorithmic stand point and graphical model applications.) graphical models are effective in dealing with intricate dependencies and structures in the thousands or more v,NOTUTILIZE,NOTALGO
29613195,30290637,"solution of this qp solves the lcp, 1 2 zt mz b t z. (5.20) mz b 0, z 0, (z ) t (mz b) 0. (5.21)16 v. m. zavala and m. anitescu consider the following psor algorithm adapted from : psor algorithm. given z0 , compute for k 0,1,...,niter, z k 1 i (1 )zk i mii where is the relaxation factor. j i mijz k 1 j j i mijz k j bi z k 1 i max ( z k 1 ) i , i",NOTUTILIZE,MENTION
33319475,33480893,"very interesting but they have two main drawbacks. first, they lack generality; indeed, the fixed point results are always obtained starting from very special initial sandpiles (just one column). in , we tried to solve this problem by giving a fast algorithm for finding the fixed point starting from any possible initial condition. second, the model lacks symmetry; in fact, grains either stay or m",NOTUTILIZE,MENTION
14912120,15989865,"scaling algorithm should dynamically adjust to the user s needs. 2) udfs1 algorithm: udfs1 is an adaptive algorithm that can be viewed as an extension variant of the tcp congestion control algorithm , 5 . udfs1 has two state variables: f, the current control value (cpu frequency) and ft (the current threshold). adaptation is controlled by three constant parameters: , the rate of decrease, f",NOTUTILIZE,MENTION
14718833,15783985,"f networks by relaxing strong connection assumptions. a number of algorithms are proposed to relax the strong assumption of nb 18, 25, 12, 20, 19, 28, 32 . similarly, in relaxing the clt, malvestuto used acyclic hypergraph and brought out a local heuristic method to search the structure. the similar work to learning hypergraph 1 from data was presented by srebro et al in 29, 15 . they aimed to",NOTUTILIZE,MENTION
65646092,64420223,"ole-genome expression dataset. interestingly, new algorithms are being developed for reverse engineering of biological networks in human cell lines (11, 13) and in response to an inflammatory stimuli . a recent computational and experimental analysis of protein networks by sachs et al. (41) employed a perturbation approach in which simultaneous measurements of multiple phosphorylated proteins and",NOTUTILIZE,NOTALGO
13561803,14552188,"others were not constrained by any such separation of functionality, and different examples seemed to achieve the same functionality by using different classes from the framework hierarchy. as others have pointed out, learning how to implement functionality from existing applications is difficult because the rationales for design choices, which explain why the finished implementation looks the wa",NOTUTILIZE,MENTION
30593166,31305195,"talearning might play a role. we present an adaptation of the incremental delta-bar-delta (idbd) algorithm, an online meta-learning algorithm that uses gradient descent to learn step-size parameters ( a, 1992b). here we use a version of idbd customized for the log loss we use in this paper. our derivation of the idbd algorithm for log loss directly parallels that presented by sutton (1992a) for squ",UTILIZE,USE
8073192,8482905,ch is infeasible without learning all of the bits of both products. what practical hash functions h are available for use in an implementation of our scheme two possible candidates for h are the md4 and md5 18 message digest algorithms. these were designed specifically for securely preprocessing a document before being signed with a public-key cryptosystem. they are also fast (11.6 mbit sec on,NOTUTILIZE,MENTION
29395729,30062069,"aced by another randomly generated individual. when all individuals in the initial population are non-falling, evolution begins. the particular ea that we use is a steady-state evolutionary algorithm with a population of thirty individuals. a steady-state ea works by iteratively selecting individuals from the population to act as parents and then using them to create a new individual. the number",UTILIZE,USE
7816217,8189327,"ing mrr 53 and introduced for solving problems in the area of combinatorial optimisation skv83 . we present one version of the sa algorithm in pccp (table 5,) which follows the general schema of . prove( ). prove( true---moregoals ) :- prove( moregoals ). prove( tell(constr)---moregoals ) :- call( constr ), prove( moregoals ). prove( guardedgoals---moregoals ) :- islist( guardedgoals",NOTUTILIZE,NOTALGO
107822405,99766718,"r work as contributing, at multiple levels, to theory, pedagogy, methodology, and practice. in the realm of theory, we have extended previous discussions of tpck (hughes, 2005; keating evans, 2001; ; margerum-leys marx, 2002; zhao, 2003) and put them on firmer ground. in the area of pedagogy, we provide additional support to the use of authentic design-based activities for 1046 teachers colleg",NOTUTILIZE,NOTALGO
24446200,25320601,"sums to determine the centers of clusters for the next iteration. 4.2 expectation maximization clustering the second data mining algorithm we have used is the expectation maximization (em) algorithm , which is also a very popular clustering algorithm. em is a distance-based based algorithm that assumes the data set can be modeled as a linear combination of multivariate normal distributions. the g",UTILIZE,USE
11113704,11862445,"displacement expert to provide long-term reliability. recently, work such as 28 has provided highly efficient face detection algorithms and for face tracking applications of this system floatboost was used. experiments were carried out to measure both the cpu demand and accuracy of floatboost alone 7 and the hybrid tracker of section 4 using floatboost as the validator and detector. fig. 19 sh",NOTUTILIZE,MENTION
13773444,14777836,"pixuq ps. fig. 3. pseudocode of the fast path algorithm. solution. besides the capacitance and delay , we also record the node and the buffer insertion on it. the algorithm uses a priority queue to sort the partial solutions and it is initialized with the first partial solution on sink with capacitance g, delay 0, and no buffer. each time, a partial solution with minimum delay is extracted",UTILIZE,USE
85671397,82590689,"uccs x r , x001b ( 0 x) 14: function dfs r start 15: while ( s. stack s cond ( s)) (dfs-step r) (dfs-start r start) though reasoning about imperative algorithms is possible in isabelle hol , reasoning about functional programs is preferred. hence, the imperative dfs algorithm is rewritten as functions (see alg. 3), where we encapsulate each step of the search into an explicit dfs-state",NOTUTILIZE,MENTION
