contextID,citationID,clean__citation_context,UTILIZE_LABELS,USAGE_LABELS
202847597,240888060,"ned as in (6) a p 0 0 0 1 0 0 2 0 1 0 3 0 0 1 (24) a is a basis of l l(a). in order to find a vector m with small coefficients (in absolute value), we use the lll algorithm , which gives us the approximated reduced basis lll(a) 1332 1562 3497 9 1629 3191 306 297 3191 306 297 1629 306 297 1629 3191 (25) we remark that the first vector of lll(a) has",UTILIZE,USE
1824644,1931975,"tly for learning situations where no noise exists, that is the bayes error of the best classifier would be 0. though there has been much interesting work studying the behavior of iterative algorithms 8 this work is typically for a fixed data set. the field of active learning attempts to determine what type of data to add to the initial training data set 9 (the third approach in the paper) 10",NOTUTILIZE,MENTION
19499356,20707809,"low the last approach described, and consider a wsn with sensor nodes grouped in cooperative clusters. to efficiently group sensor nodes into clusters, any of the distributed clustering algorithms in 24 may be adopted. such clustering algorithms assume no centralized control and consider that every sensor node decides to join a cluster based only on local information. mostly, they are based on",NOTUTILIZE,MENTION
81960001,79500107,"utation of 0, . . . , p 1 . thanks to that, the ideal algorithm r-fce is proven to be info-cpa-db, a new type of security against chosen plaintext attack based on the notion of entropy, defined in by ge and zdonik. but the authors stress out that the relationship between this notion and the resources in both time and space required to actually break the scheme remains unknown. obviously, our a",NOTUTILIZE,MENTION
57862909,57137178,"rther extended to a multi-model approach in 16 . mallick et al. describe an extension to the algorithm presented in 13 toward a multi-lag, single-model and a one-lag, multi-model approach 17 . in , mallick et al. present a multi-lag, single-model algorithm that includes data association, likelihood computation and hypothesis management. after presenting a particle filter for oosm processing in",NOTUTILIZE,MENTION
24741991,25588744,"y too many technicalities. in the following we will present ant system, a paradigmatic example of how aco algorithms can be applied to the tsp. extensions of ant system can be found, for example, in ( b; dorigo gambardella, 1997; st tzle hoos, 1998b). ant system (as) can be informally described as follows. a number m of ants is positioned in parallel on m cities. the ants start state, that is,",NOTUTILIZE,MENTION
73852087,72692324,"set of free generators consists in building a schreier system for h from the set x. this amounts to applying an algorithm now known as the todd coxeter algorithm, proposed by todd and coxeter in 1936 . this algorithm gives no information on the possible overlaps among the words of x. in this sense it gives less information and the later developments of combinatorial group theory, like the theory o",NOTUTILIZE,MENTION
12570159,13471044,"tion and and are one. as a result, whenever local static cache is available, the algorithm always makes use of it to the fullest. iv. simulation we use simulations conducted in ns-2 version 2.1b2 to evaluate the effectiveness of the various techniques for streaming media. helpers can be configured to perform proxy caching, hierarchical caching, or dynamic cooperative caching, using any combin",UTILIZE,USE
9112814,9633715,) of the (complete) grid graphs p k theta pn for 5sks10 and ns1. jacobson and kinch 7 established fl k;n for k 1; 2; 3; 4 for all ns1. beyond k 4 the problem becomes more difficult. e. o. hare developed an algorithm to compute fl k;n and using the output of an implementation of her algorithm she found simple formulas for fl k;n when 1sks10 agreeing with her data. chang and clark 1 prove,NOTUTILIZE,MENTION
3888520,4015508,"mbined into a single volumetric grid, a surface must be extracted to visualize the data. we use a variation of the popular marching cubes algorithm that was originally developed by cline and lorensen to visualize medical data. the super-bayesian combination formula that we use for the fusion step tends to push the voxel values toward 1 or 0. this leads to large quantization errors if we simply in",UTILIZE,USE
52282479,51889138,"ve myofibrils separated by clusters of mitochondria (m) and glycogen. e, endothelial layer. x 13,000. ventricular cardiac muscle. this tubular system which is so prominent in mammalian cardiac muscle appears to be absent from the cardiac muscle of the frog. furthermore, the sarcoplasmic reticulum, the longitudinal system of membranebounded tubules surrounding each myofibril in frog skeletal and m",NOTUTILIZE,NOTALGO
12695948,13607732,"online learning of objects using a short-term memory and similarity-based incremental collection of templates using the intermediate level feature representation of the proposed visual hierarchy from . after a short introduction to our processing and memory model in sect. 2, we demonstrate its effectiveness for an implementation of real-time online object learning in sect. 3, and give our conclusi",NOTUTILIZE,MENTION
28258734,28966988,"for subsampling experiments, as we will describe in sections 8.5 and 8.6. algorithms compared we evaluate the following five algorithms: (1) reservoir (res): the original reservoir sampling algorithm . (2) adapted reservoir (a-res): the adapted reservoir algorithm described in section 3.3. (3) geometric file (geofile): the original geometric file based sampling algorithm 15 . however, to reduce i",UTILIZE,USE
11573360,12373420,structed by subset construction has an exponential number of states; but the min-state dfa equivalent tomr has only a linear number of states. dfa minimization algorithms currently in use are o -line . we have to constructschapter 7. conclusion 114 the whole dfa before minimization. it seems that an on-line version of min-state dfa construction algorithm uses less auxiliary space; but unfortunatel,NOTUTILIZE,MENTION
11251997,12019011,"near duration invariant of a timed automata can be done automatically. in fact, this problem has attracted a great deal of attention during last decade, since the introduction of duration calculus in . many algorithms have been proposed in the literatures, but all of them have high complexity and do not work for the general case. some restrictions are needed either on timed automata, or on linear",NOTUTILIZE,MENTION
27109577,27830743,"t scenario and our solution has been extended with a fully-fledged rule-based data mediation 6 . in order to address the sws challenge requirements, we base our solution on the specifications of wsmo , wsml 9 and wsmx 12 providing a conceptual framework, ontology language and architecture for semantic web services. the overall contribution of our work is to show: (1) how flat xml schema of roset",NOTUTILIZE,NOTALGO
96367369,91143100,"dissimilar. we will use the results obtained in tst., thus defining the control algorithm as the best-performing algorithm (which obtains the lowest value of ranking, computed through a friedman test ). in order to test whether significant differences exist among all the mean values, we use iman and davenport",NOTUTILIZE,NOTALGO
14850795,15924865,"ed by various classes of groups. in the quest for a language of star-height 1, the next level of complexity was nilpotent groups of class 2, and such candidates were actually proposed in brzozowski . the combinatorial structure of the languages recognized by nilpotent groups is related to the generalized binomial coefficients introduced by eilenberg 3 , which count the number of times that a wo",NOTUTILIZE,NOTALGO
23963291,24874996,"ence of alternate blocking parameters on the performance behavior observed. we also intend to extend the scope of the underlying principles to other algorithms, such as parallel multi-frontal methods . to further enhance the automatic capabilities of our tool, we will investigate ways to recognize the algorithm in advance so that appropriate analysis patterns can be selected. options to be conside",NOTUTILIZE,MENTION
27109574,27830739,"to the previously developed mediation solution 3,4 we have provided a support for a new electronic payment scenario and our solution has been extended with a fully-fledged rule-based data mediation . in order to address the sws challenge requirements, we base our solution on the specifications of wsmo 9 , wsml 9 and wsmx 12 providing a conceptual framework, ontology language and architecture f",NOTUTILIZE,NOTALGO
3018095,3138934,"s such that no component is larger than cn where c is some constant, then we can always find a nested dissection ordering that gives an elimination tree of height o(slogn) (bodlander et. al 1 ). in leiserson and lewis give experimental results from applying a nested dissection algorithm to a collection of matrices from the harwell-boeing collection 2 . however, as we shall see no nested dissec",NOTUTILIZE,MENTION
11828522,12656295,"cted backjumping 6 , in which pruning of the search tree is achieved through look-back techniques. this provided a great improvement in both run-time and branching rate. learning was then introduced . this had much less impact than occurred in sat. while improvements were seen on some problems, the algorithms actually performed worse on others. recently, it has been shown that solution learning f",NOTUTILIZE,MENTION
76902020,75148490,"ause it is known that the expected number of singleton attractors in a bn is 1 6, 9 . next, we present algorithms for computing singleton and small attractors by extending the techniques proposed in . we show that the average case time complexity is o(2 n ) in many cases, which suggests that computation of singleton attractors in pbns is easier than computation of steady-state distributions in pb",UTILIZE,EXTEND
20377240,21601586,"tic (fixed size) windowing approach used by cvfdt. 3. the ifn algorithm many learning methods use information theory to induce classification rules. one of the methods, developed by last maimon 6 is the ifn algorithm. ifn, or info-fuzzy network, is an oblivious tree-like classification model, which is designed to minimize the total number of predicting attributes. the underlying principle of",NOTUTILIZE,MENTION
25687753,26459831,"satisfies v 3( x(t) ) k u(t) p where 3 k and k 0, then for any l p input u there exists solutions x of (1) for all t 0 and the state x converges to zero. we extend the result of 13 and in the following way: we use a technique from infinite-dimensional linear system theory to show that for an l p input there exists a unique solution of x for all t 0 and we show that x(t) 0as t",NOTUTILIZE,NOTALGO
